source,id,observed_on_string,observed_on,time_observed_at_split,year,month,day,time_observed_at_split2,time_observed_at_split3,time_zone,user_id,user_login,created_at,updated_at,quality_grade,license,url,image_url,sound_url,tag_list,description,num_identification_agreements,num_identification_disagreements,captive_cultivated,oauth_application_id,place_guess,island,latitude,longitude,positional_accuracy,public_positional_accuracy,geoprivacy,taxon_geoprivacy,coordinates_obscured,positioning_method,positioning_device,place_town_name,place_county_name,place_state_name,place_country_name,place_admin1_name,place_admin2_name,species_guess,scientific_name,common_name,iconic_taxon_name,taxon_id,taxon_phylum_name,taxon_class_name,acceptedOrder,acceptedFamily,acceptedGenus,acceptedName
iNaturalist,20155408,Tue Feb 05 2019 15:55:48 GMT-0800 (PST),2/5/2019 0:00,2/6/2019,2019,2,6,2:55:48,300,Pacific Time (US & Canada),213838,vireolanius,2019-02-06 18:15:13 +0300,2019-05-04 02:34:38 +0300,needs_id,CC-BY-NC,https://www.inaturalist.org/observations/20155408,https://inaturalist-open-data.s3.amazonaws.com/photos/31090900/medium.jpg?1549466127,,,,4,0,FALSE,3,"San Clemente Island Underwater Range, , CA, US",San Clemente,33.00157581,-118.5545521,94,94,,,FALSE,,,,Los Angeles,California,United States,California,Los Angeles,Ambigolimax,Ambigolimax,Threeband Slugs,Mollusca,448395,Mollusca,Gastropoda,Stylommatophora,Limacidae,,
iNaturalist,20375203,Fri Feb 15 2019 10:20:50 GMT-0800 (PST),2/15/2019 0:00,2/15/2019,2019,2,15,21:20:50,300,Pacific Time (US & Canada),266196,shrike2,2019-02-16 03:39:43 +0300,2019-02-21 21:56:03 +0300,needs_id,CC-BY-NC-ND,https://www.inaturalist.org/observations/20375203,https://static.inaturalist.org/photos/31465138/medium.jpg?1550277705,,,,2,0,FALSE,3,"San Clemente Island Underwater Range, , CA, US",San Clemente,33.00235085,-118.5560432,15,15,,,FALSE,,,,Los Angeles,California,United States,California,Los Angeles,Ambigolimax,Ambigolimax,Threeband Slugs,Mollusca,448395,Mollusca,Gastropoda,Stylommatophora,Limacidae,,
iNaturalist,20858352,Thu Feb 28 2019 09:20:55 GMT-0800 (PST),2/28/2019 0:00,2/28/2019,2019,2,28,20:20:55,300,Pacific Time (US & Canada),266196,shrike2,2019-03-01 22:53:15 +0300,2019-03-06 08:21:52 +0300,research,CC-BY-NC-ND,https://www.inaturalist.org/observations/20858352,https://static.inaturalist.org/photos/32179007/medium.jpg?1551469997,,,,2,0,FALSE,3,"San Clemente Island Underwater Range, , CA, US",San Clemente,33.00536203,-118.5538006,5,5,,,FALSE,,,,Los Angeles,California,United States,California,Los Angeles,Ambigolimax,Ambigolimax,Threeband Slugs,Mollusca,448395,Mollusca,Gastropoda,Stylommatophora,Limacidae,,
iNaturalist,20858369,Thu Feb 28 2019 09:21:03 GMT-0800 (PST),2/28/2019 0:00,2/28/2019,2019,2,28,20:21:03,300,Pacific Time (US & Canada),266196,shrike2,2019-03-01 22:54:03 +0300,2019-03-04 22:53:56 +0300,needs_id,CC-BY-NC-ND,https://www.inaturalist.org/observations/20858369,https://static.inaturalist.org/photos/32179042/medium.jpg?1551470045,,,,2,0,FALSE,3,"San Clemente Island Underwater Range, , CA, US",San Clemente,33.00536203,-118.5538006,1414,1414,,,FALSE,,,,Los Angeles,California,United States,California,Los Angeles,Ambigolimax,Ambigolimax,Threeband Slugs,Mollusca,448395,Mollusca,Gastropoda,Stylommatophora,Limacidae,,
iNaturalist,21230923,2019-03-06 1:35:57 PM PST,3/6/2019 0:00,3/7/2019,2019,3,7,0:35:57,300,Pacific Time (US & Canada),34488,pileated,2019-03-14 18:26:56 +0300,2020-04-23 21:20:49 +0300,needs_id,CC-BY,https://www.inaturalist.org/observations/21230923,https://inaturalist-open-data.s3.amazonaws.com/photos/32820654/medium.jpg?1552577217,,,,2,0,FALSE,2,"Los Angeles County, US-CA, US",San Clemente,32.99945987,-118.5530921,57,57,,,FALSE,,,,Los Angeles,California,United States,California,Los Angeles,Ambigolimax,Ambigolimax,Threeband Slugs,Mollusca,448395,Mollusca,Gastropoda,Stylommatophora,Limacidae,,
iNaturalist,21230934,2019-03-06 2:59:40 PM PST,3/6/2019 0:00,3/7/2019,2019,3,7,1:59:40,300,Pacific Time (US & Canada),34488,pileated,2019-03-14 18:27:19 +0300,2021-01-30 10:17:06 +0300,needs_id,CC-BY,https://www.inaturalist.org/observations/21230934,https://inaturalist-open-data.s3.amazonaws.com/photos/32820671/medium.jpeg?1552577241,,,,2,0,FALSE,2,"Los Angeles County, US-CA, US",San Clemente,32.99835968,-118.5529099,,,,,FALSE,gps,gps,,Los Angeles,California,United States,California,Los Angeles,Ambigolimax,Ambigolimax,Threeband Slugs,Mollusca,448395,Mollusca,Gastropoda,Stylommatophora,Limacidae,,
iNaturalist,21230935,2019-03-06 2:59:46 PM PST,3/6/2019 0:00,3/7/2019,2019,3,7,1:59:46,300,Pacific Time (US & Canada),34488,pileated,2019-03-14 18:27:25 +0300,2021-01-30 10:16:56 +0300,needs_id,CC-BY,https://www.inaturalist.org/observations/21230935,https://inaturalist-open-data.s3.amazonaws.com/photos/32820677/medium.jpeg?1552577246,,,,2,0,FALSE,2,"Los Angeles County, US-CA, US",San Clemente,32.99835968,-118.5529099,,,,,FALSE,gps,gps,,Los Angeles,California,United States,California,Los Angeles,Ambigolimax,Ambigolimax,Threeband Slugs,Mollusca,448395,Mollusca,Gastropoda,Stylommatophora,Limacidae,,
iNaturalist,21231061,2019-03-06 3:37:07 PM PST,3/6/2019 0:00,3/7/2019,2019,3,7,2:37:07,300,Pacific Time (US & Canada),34488,pileated,2019-03-14 18:32:09 +0300,2020-04-23 21:20:57 +0300,needs_id,CC-BY,https://www.inaturalist.org/observations/21231061,https://inaturalist-open-data.s3.amazonaws.com/photos/32820852/medium.jpg?1552577531,,,,2,0,FALSE,2,"Los Angeles County, US-CA, US",San Clemente,32.99835968,-118.5529099,,,,,FALSE,gps,gps,,Los Angeles,California,United States,California,Los Angeles,Ambigolimax,Ambigolimax,Threeband Slugs,Mollusca,448395,Mollusca,Gastropoda,Stylommatophora,Limacidae,,
iNaturalist,24082908,Mon Apr 29 2019 16:19:01 GMT-0700 (PDT),4/29/2019 0:00,4/30/2019,2019,4,30,2:19:01,300,Pacific Time (US & Canada),266196,shrike2,2019-04-30 03:38:41 +0300,2019-06-25 00:35:54 +0300,needs_id,CC-BY-NC-ND,https://www.inaturalist.org/observations/24082908,https://static.inaturalist.org/photos/37246213/medium.jpg?1556585017,,,,3,0,FALSE,3,"San Clemente Island Underwater Range, , CA, US",San Clemente,33.00205621,-118.5561811,10,10,,,FALSE,,,,Los Angeles,California,United States,California,Los Angeles,Ambigolimax,Ambigolimax,Threeband Slugs,Mollusca,448395,Mollusca,Gastropoda,Stylommatophora,Limacidae,,
iNaturalist,24840394,Thu May 09 2019 08:42:01 GMT-0700 (PDT),5/9/2019 0:00,5/9/2019,2019,5,9,18:42:01,300,Pacific Time (US & Canada),266196,shrike2,2019-05-09 18:54:45 +0300,2019-08-02 08:51:27 +0300,needs_id,CC-BY-NC-ND,https://www.inaturalist.org/observations/24840394,https://static.inaturalist.org/photos/38419929/medium.jpg?1557417302,,,,5,0,FALSE,3,"San Clemente Island Underwater Range, , CA, US",San Clemente,32.99601226,-118.5523109,19,19,,,FALSE,,,,Los Angeles,California,United States,California,Los Angeles,Ambigolimax,Ambigolimax,Threeband Slugs,Mollusca,448395,Mollusca,Gastropoda,Stylommatophora,Limacidae,,
iNaturalist,37081984,Sun Dec 29 2019 16:22:20 GMT-0800 (PST),12/29/2019 0:00,12/30/2019,2019,12,30,3:22:20,300,Pacific Time (US & Canada),266196,shrike2,2019-12-30 03:22:49 +0300,2019-12-30 10:30:33 +0300,needs_id,CC-BY-NC-ND,https://www.inaturalist.org/observations/37081984,https://static.inaturalist.org/photos/58727084/medium.jpg?1577665376,,,,2,0,FALSE,3,"San Clemente Island Underwater Range, CA, US",San Clemente,33.00215843,-118.5551008,5,5,,,FALSE,,,,Los Angeles,California,United States,California,Los Angeles,Threeband Slugs,Ambigolimax,Threeband Slugs,Mollusca,448395,Mollusca,Gastropoda,Stylommatophora,Limacidae,,
iNaturalist,37438309,Thu Jan 09 2020 11:36:34 GMT-0800 (PST),1/9/2020 0:00,1/9/2020,2020,1,9,22:36:34,300,Pacific Time (US & Canada),266196,shrike2,2020-01-10 00:56:47 +0300,2020-01-10 04:14:20 +0300,needs_id,CC-BY-NC-ND,https://www.inaturalist.org/observations/37438309,https://static.inaturalist.org/photos/59355974/medium.jpg?1578615472,,,,1,0,FALSE,3,"Los Angeles County, US-CA, US",San Clemente,32.94545527,-118.5349104,10,10,,,FALSE,,,,Los Angeles,California,United States,California,Los Angeles,Threeband Slugs,Ambigolimax,Threeband Slugs,Mollusca,448395,Mollusca,Gastropoda,Stylommatophora,Limacidae,,
iNaturalist,37465809,Fri Jan 10 2020 09:53:04 GMT-0800 (PST),1/10/2020 0:00,1/10/2020,2020,1,10,20:53:04,300,Pacific Time (US & Canada),266196,shrike2,2020-01-11 00:27:27 +0300,2020-01-11 00:45:20 +0300,needs_id,CC-BY-NC-ND,https://www.inaturalist.org/observations/37465809,https://static.inaturalist.org/photos/59398470/medium.jpg?1578691683,,,,1,0,FALSE,3,"Los Angeles County, US-CA, US",San Clemente,32.94364432,-118.5331541,5,5,,,FALSE,,,,Los Angeles,California,United States,California,Los Angeles,Threeband Slugs,Ambigolimax,Threeband Slugs,Mollusca,448395,Mollusca,Gastropoda,Stylommatophora,Limacidae,,
iNaturalist,37504529,Sat Jan 11 2020 12:48:47 GMT-0800 (PST),1/11/2020 0:00,1/11/2020,2020,1,11,23:48:47,300,Pacific Time (US & Canada),266196,shrike2,2020-01-12 03:30:23 +0300,2020-01-12 03:55:39 +0300,needs_id,CC-BY-NC-ND,https://www.inaturalist.org/observations/37504529,https://static.inaturalist.org/photos/59466550/medium.jpg?1578789052,,,,1,0,FALSE,3,"Los Angeles County, US-CA, US",San Clemente,32.99135985,-118.5546523,5,5,,,FALSE,,,,Los Angeles,California,United States,California,Los Angeles,Threeband Slugs,Ambigolimax,Threeband Slugs,Mollusca,448395,Mollusca,Gastropoda,Stylommatophora,Limacidae,,
iNaturalist,37504542,Sat Jan 11 2020 12:49:48 GMT-0800 (PST),1/11/2020 0:00,1/11/2020,2020,1,11,23:49:48,300,Pacific Time (US & Canada),266196,shrike2,2020-01-12 03:30:58 +0300,2020-01-12 03:45:46 +0300,needs_id,CC-BY-NC-ND,https://www.inaturalist.org/observations/37504542,https://static.inaturalist.org/photos/59466605/medium.jpg?1578789101,,,,1,0,FALSE,3,"Los Angeles County, US-CA, US",San Clemente,32.9913912,-118.5546755,5,5,,,FALSE,,,,Los Angeles,California,United States,California,Los Angeles,Threeband Slugs,Ambigolimax,Threeband Slugs,Mollusca,448395,Mollusca,Gastropoda,Stylommatophora,Limacidae,,
iNaturalist,37507645,Sat Jan 11 2020 13:03:08 GMT-0800 (PST),1/11/2020 0:00,1/12/2020,2020,1,12,0:03:08,300,Pacific Time (US & Canada),12809,cedric_lee,2020-01-12 05:08:24 +0300,2020-01-12 05:28:30 +0300,needs_id,CC-BY-NC,https://www.inaturalist.org/observations/37507645,https://inaturalist-open-data.s3.amazonaws.com/photos/59472257/medium.jpg?1578794959,,,,1,0,FALSE,3,"Los Angeles County, US-CA, US",San Clemente,32.99137848,-118.5546106,48,48,,,FALSE,,,,Los Angeles,California,United States,California,Los Angeles,,Ambigolimax,Threeband Slugs,Mollusca,448395,Mollusca,Gastropoda,Stylommatophora,Limacidae,,
iNaturalist,37621302,Wed Jan 15 2020 10:34:04 GMT-0800 (PST),1/15/2020 0:00,1/15/2020,2020,1,15,21:34:04,300,Pacific Time (US & Canada),266196,shrike2,2020-01-15 21:34:23 +0300,2020-01-16 02:36:27 +0300,needs_id,CC-BY-NC-ND,https://www.inaturalist.org/observations/37621302,https://static.inaturalist.org/photos/59679425/medium.jpg?1579117890,,,,1,0,FALSE,3,"San Clemente Island Underwater Range, CA, US",San Clemente,32.99760508,-118.5556448,5,5,,,FALSE,,,,Los Angeles,California,United States,California,Los Angeles,Threeband Slugs,Ambigolimax,Threeband Slugs,Mollusca,448395,Mollusca,Gastropoda,Stylommatophora,Limacidae,,
iNaturalist,37636465,Wed Jan 15 2020 09:51:18 GMT-0800 (PST),1/15/2020 0:00,1/15/2020,2020,1,15,20:51:18,300,Pacific Time (US & Canada),12809,cedric_lee,2020-01-16 05:12:46 +0300,2020-01-16 05:49:53 +0300,needs_id,CC-BY-NC,https://www.inaturalist.org/observations/37636465,https://inaturalist-open-data.s3.amazonaws.com/photos/59701487/medium.jpg?1579140810,,,,2,0,FALSE,3,"Los Angeles County, US-CA, US",San Clemente,32.99802808,-118.5543049,12,12,,,FALSE,,,,Los Angeles,California,United States,California,Los Angeles,,Ambigolimax,Threeband Slugs,Mollusca,448395,Mollusca,Gastropoda,Stylommatophora,Limacidae,,
iNaturalist,37652116,Thu Jan 16 2020 07:43:43 GMT-0800 (PST),1/16/2020 0:00,1/16/2020,2020,1,16,18:43:43,300,Pacific Time (US & Canada),266196,shrike2,2020-01-16 18:43:51 +0300,2020-01-16 18:44:01 +0300,needs_id,CC-BY-NC-ND,https://www.inaturalist.org/observations/37652116,https://static.inaturalist.org/photos/59734836/medium.jpg?1579189437,,,,0,0,FALSE,3,"San Clemente Island Underwater Range, CA, US",San Clemente,33.00475447,-118.5529343,5,5,,,FALSE,,,,Los Angeles,California,United States,California,Los Angeles,,Ambigolimax,Threeband Slugs,Mollusca,448395,Mollusca,Gastropoda,Stylommatophora,Limacidae,,
iNaturalist,38491249,Tue Feb 04 2020 16:57:53 GMT-0800 (PST),2/4/2020 0:00,2/5/2020,2020,2,5,3:57:53,300,Pacific Time (US & Canada),12809,cedric_lee,2020-02-10 05:26:15 +0300,2021-03-22 15:31:51 +0300,needs_id,CC-BY-NC,https://www.inaturalist.org/observations/38491249,https://inaturalist-open-data.s3.amazonaws.com/photos/61182213/medium.jpg?1581301626,,,,1,0,FALSE,3,"Los Angeles County, US-CA, US",San Clemente,32.99884936,-118.5535322,9,9,,,FALSE,,,,Los Angeles,California,United States,California,Los Angeles,,Ambigolimax,Threeband Slugs,Mollusca,448395,Mollusca,Gastropoda,Stylommatophora,Limacidae,,
iNaturalist,38555000,Sun Feb 09 2020 08:48:56 GMT-0800 (PST),2/9/2020 0:00,2/9/2020,2020,2,9,19:48:56,300,Pacific Time (US & Canada),12809,cedric_lee,2020-02-12 04:07:34 +0300,2021-03-22 15:31:55 +0300,needs_id,CC-BY-NC,https://www.inaturalist.org/observations/38555000,https://inaturalist-open-data.s3.amazonaws.com/photos/61293478/medium.jpg?1581469705,,,,1,0,FALSE,3,"Los Angeles County, US-CA, US",San Clemente,33.00229124,-118.5551117,8,8,,,FALSE,,,,Los Angeles,California,United States,California,Los Angeles,,Ambigolimax,Threeband Slugs,Mollusca,448395,Mollusca,Gastropoda,Stylommatophora,Limacidae,,
iNaturalist,38869719,Wed Feb 19 2020 09:39:16 GMT-0800 (PST),2/19/2020 0:00,2/19/2020,2020,2,19,20:39:16,300,Pacific Time (US & Canada),12809,cedric_lee,2020-02-20 04:56:42 +0300,2021-03-22 15:32:13 +0300,needs_id,CC-BY-NC,https://www.inaturalist.org/observations/38869719,https://inaturalist-open-data.s3.amazonaws.com/photos/61811053/medium.jpg?1582163829,,,,1,0,FALSE,3,"Los Angeles County, US-CA, US",San Clemente,33.0269305,-118.584895,9,9,,,FALSE,,,,Los Angeles,California,United States,California,Los Angeles,,Ambigolimax,Threeband Slugs,Mollusca,448395,Mollusca,Gastropoda,Stylommatophora,Limacidae,,
iNaturalist,38947671,Wed Feb 19 2020 11:03:34 GMT-0800 (PST),2/19/2020 0:00,2/19/2020,2020,2,19,22:03:34,300,Pacific Time (US & Canada),12809,cedric_lee,2020-02-21 06:49:51 +0300,2021-03-22 15:32:15 +0300,needs_id,CC-BY-NC,https://www.inaturalist.org/observations/38947671,https://inaturalist-open-data.s3.amazonaws.com/photos/61874802/medium.jpg?1582257032,,,,1,0,FALSE,3,"Los Angeles County, US-CA, US",San Clemente,33.02646478,-118.5869418,9,9,,,FALSE,,,,Los Angeles,California,United States,California,Los Angeles,,Ambigolimax,Threeband Slugs,Mollusca,448395,Mollusca,Gastropoda,Stylommatophora,Limacidae,,
iNaturalist,39827040,Tue Mar 10 2020 16:16:05 GMT-0700 (PDT),3/10/2020 0:00,3/11/2020,2020,3,11,2:16:05,300,Pacific Time (US & Canada),266196,shrike2,2020-03-11 06:15:42 +0300,2020-05-22 08:42:01 +0300,research,CC-BY-NC-ND,https://www.inaturalist.org/observations/39827040,https://static.inaturalist.org/photos/63226165/medium.jpg?1583896616,,,,1,0,FALSE,3,"San Clemente Island Underwater Range, CA, US",San Clemente,33.00198055,-118.554795,,,,,FALSE,,,,Los Angeles,California,United States,California,Los Angeles,Threeband Slugs,Ambigolimax,Threeband Slugs,Mollusca,448395,Mollusca,Gastropoda,Stylommatophora,Limacidae,,
iNaturalist,1472534,7/19/2014 14:00,7/19/2014 0:00,7/20/2014,2014,7,20,1:00:00,400,Pacific Time (US & Canada),95810,kiloueka,2015-05-10 10:50:13 +0300,2020-07-10 18:52:24 +0300,research,CC-BY-NC,http://www.inaturalist.org/observations/1472534,https://inaturalist-open-data.s3.amazonaws.com/photos/1825556/medium.png?1431244218,,,,3,0,FALSE,,"Avalon, Ca",Santa Catalina,33.342819,-118.328228,3273,3273,,,FALSE,,,,Los Angeles,California,United States,California,Los Angeles,Ambigolimax,Ambigolimax,Threeband Slugs,Mollusca,448395,Mollusca,Gastropoda,Stylommatophora,Limacidae,,
iNaturalist,24907282,Fri May 10 2019 07:48:46 GMT-0700 (PDT),5/10/2019 0:00,5/10/2019,2019,5,10,17:48:46,300,Pacific Time (US & Canada),1512775,parisrebl,2019-05-11 03:06:34 +0300,2019-08-02 08:51:11 +0300,needs_id,CC-BY-NC,https://www.inaturalist.org/observations/24907282,https://inaturalist-open-data.s3.amazonaws.com/photos/38528765/medium.jpg?1557533208,,,,3,1,FALSE,3,"Los Angeles County, US-CA, US",Santa Catalina,33.35565815,-118.4375909,5,5,,,FALSE,,,,Los Angeles,California,United States,California,Los Angeles,Ambigolimax,Ambigolimax,Threeband Slugs,Mollusca,448395,Mollusca,Gastropoda,Stylommatophora,Limacidae,,
iNaturalist,8683202,Fri Nov 03 2017 21:17:45 GMT-0700 (PDT),11/3/2017 0:00,11/4/2017,2017,11,4,7:17:45,300,Pacific Time (US & Canada),682364,lwind54,2017-11-04 23:27:55 +0300,2017-11-11 05:22:47 +0300,needs_id,,https://www.inaturalist.org/observations/8683202,https://static.inaturalist.org/photos/11635803/medium.jpg?1509827282,,,,3,1,FALSE,3,"Channel Islands National Park, Channel Islands National Pk, CA, US",Santa Cruz,34.04995283,-119.5618967,5,5,,,FALSE,,,,Santa Barbara,California,United States,California,Santa Barbara,Ambigolimax,Ambigolimax,Threeband Slugs,Mollusca,448395,Mollusca,Gastropoda,Stylommatophora,Limacidae,,
iNaturalist,37623539,Wed Jan 15 2020 10:55:42 GMT-0800 (PST),1/15/2020 0:00,1/15/2020,2020,1,15,21:55:42,300,Pacific Time (US & Canada),266196,shrike2,2020-01-15 22:45:03 +0300,2020-07-25 07:23:00 +0300,research,CC-BY-NC-ND,https://www.inaturalist.org/observations/37623539,https://static.inaturalist.org/photos/59679089/medium.jpg?1579117520,,,With Xerarionta intercisa.,2,0,FALSE,3,"San Clemente Island Underwater Range, CA, US",San Clemente,32.99802988,-118.5560639,5,5,,,FALSE,,,,Los Angeles,California,United States,California,Los Angeles,Balkan Threeband Slug,Ambigolimax nyctelius,Balkan Threeband Slug,Mollusca,452407,Mollusca,Gastropoda,Stylommatophora,Limacidae,,
iNaturalist,37635018,Wed Jan 15 2020 07:55:11 GMT-0800 (PST),1/15/2020 0:00,1/15/2020,2020,1,15,18:55:11,300,Pacific Time (US & Canada),12809,cedric_lee,2020-01-16 04:27:29 +0300,2020-05-08 22:44:58 +0300,research,CC-BY-NC,https://www.inaturalist.org/observations/37635018,https://inaturalist-open-data.s3.amazonaws.com/photos/59698622/medium.jpg?1579138087,,,,2,0,FALSE,3,"Los Angeles County, US-CA, US",San Clemente,32.99590768,-118.5537351,9,9,,,FALSE,,,,Los Angeles,California,United States,California,Los Angeles,Striped Greenhouse Slug,Ambigolimax valentianus,Striped Greenhouse Slug,Mollusca,448331,Mollusca,Gastropoda,Stylommatophora,Limacidae,,
iNaturalist,15146835,Tue Jul 24 2018 23:06:19 GMT-0700 (PDT),7/24/2018 0:00,7/25/2018,2018,7,25,9:06:19,300,Pacific Time (US & Canada),151342,joeycurti3,2018-08-05 23:46:44 +0300,2020-04-14 05:09:33 +0300,needs_id,,https://www.inaturalist.org/observations/15146835,https://static.inaturalist.org/photos/22641496/medium.jpg?1533502034,,,,4,0,FALSE,3,"Channel Islands National Park, , CA, US",Santa Cruz,34.01891383,-119.68135,22,22,,open,FALSE,,,,Santa Barbara,California,United States,California,Santa Barbara,Banana Slugs,Ariolimax,Banana Slugs,Mollusca,47777,Mollusca,Gastropoda,,Ariolimacidae,,
iNaturalist,15171515,Tue Jul 24 2018 23:07:34 GMT-0700 (PDT),7/24/2018 0:00,7/25/2018,2018,7,25,9:07:34,300,Pacific Time (US & Canada),151342,joeycurti3,2018-08-06 19:35:53 +0300,2020-04-14 05:09:29 +0300,needs_id,,https://www.inaturalist.org/observations/15171515,https://static.inaturalist.org/photos/22686639/medium.jpg?1533573359,,,,3,0,FALSE,3,"Channel Islands National Park, , CA, US",Santa Cruz,34.0188445,-119.6811667,5,5,,open,FALSE,,,,Santa Barbara,California,United States,California,Santa Barbara,Banana Slugs,Ariolimax,Banana Slugs,Mollusca,47777,Mollusca,Gastropoda,,Ariolimacidae,,
iNaturalist,10122087,4/23/2012 18:17,4/23/2012 0:00,4/24/2012,2012,4,24,5:17:34,400,Pacific Time (US & Canada),2616,alice_abela,2018-03-07 07:01:22 +0300,2020-04-14 05:07:27 +0300,research,,https://www.inaturalist.org/observations/10122087,https://static.inaturalist.org/photos/13956758/medium.jpg?1520395248,,"california, gastropoda, Pacific banana slug, Santa Barbara County, CA, Mollusca, Ariolimax, Channel Islands, Santa Cruz Island, columbianus, Ariolimacidae, Arionoidea, vis_everyone, Ariolimacinae, Ariolimax columbianus stramineus, stramineus, Pacific Banana Slug (Ariolimax columbianus stramineus)","Pacific banana slug from Santa Cruz Island, California",3,0,FALSE,,"California, United States",Santa Cruz,33.997422,-119.717225,,,,,FALSE,,,,Santa Barbara,California,United States,California,Santa Barbara,Ariolimax stramineus,Ariolimax stramineus,Southern Pacific Banana Slug,Mollusca,560098,Mollusca,Gastropoda,,Ariolimacidae,,
iNaturalist,10122129,4/22/2012 18:37,4/22/2012 0:00,4/23/2012,2012,4,23,5:37:37,400,Pacific Time (US & Canada),2616,alice_abela,2018-03-07 07:05:15 +0300,2020-04-14 05:07:18 +0300,research,,https://www.inaturalist.org/observations/10122129,https://static.inaturalist.org/photos/13956847/medium.jpg?1520395476,,"mollusca, california, gastropoda, Pacific banana slug, Santa Barbara County, CA, Ariolimax, Channel Islands, Santa Cruz Island, columbianus, Ariolimacidae, Arionoidea, vis_everyone, loc_public, Ariolimacinae, Ariolimax columbianus stramineus, stramineus, Pacific Banana Slug (Ariolimax columbianus stramineus)","Pacific banana slug from Santa Cruz Island, California",2,1,FALSE,,"California, United States",Santa Cruz,33.997422,-119.717225,,,,open,FALSE,,,,Santa Barbara,California,United States,California,Santa Barbara,Ariolimax stramineus,Ariolimax stramineus,Southern Pacific Banana Slug,Mollusca,560098,Mollusca,Gastropoda,,Ariolimacidae,,
iNaturalist,20841785,Thu Feb 28 2019 17:51:43 GMT-0800 (PST),2/28/2019 0:00,3/1/2019,2019,3,1,4:51:43,300,Pacific Time (US & Canada),765954,joey36,2019-03-01 04:54:44 +0300,2020-05-15 23:49:02 +0300,research,,https://www.inaturalist.org/observations/20841785,https://static.inaturalist.org/photos/32151528/medium.jpg?1551405287,,,,2,1,FALSE,3,"Channel Islands National Park, , CA, US",Santa Cruz,33.99902437,-119.7342411,20,20,,open,FALSE,,,,Santa Barbara,California,United States,California,Santa Barbara,Southern Pacific Banana Slug,Ariolimax stramineus,Southern Pacific Banana Slug,Mollusca,560098,Mollusca,Gastropoda,,Ariolimacidae,,
iNaturalist,41761213,Wed Apr 08 2020 16:38:30 GMT-0700 (PDT),4/8/2020 0:00,4/9/2020,2020,4,9,2:38:30,300,Pacific Time (US & Canada),2135101,zccas,2020-04-09 18:14:24 +0300,2020-04-14 05:04:58 +0300,research,CC-BY-NC,https://www.inaturalist.org/observations/41761213,https://inaturalist-open-data.s3.amazonaws.com/photos/66263361/medium.jpg?1586447825,,,,3,0,FALSE,3,"Channel Islands National Park, CA, US",Santa Cruz,34.00483588,-119.7118485,4219,4219,,,FALSE,,,,Santa Barbara,California,United States,California,Santa Barbara,Southern Pacific Banana Slug,Ariolimax stramineus,Southern Pacific Banana Slug,Mollusca,560098,Mollusca,Gastropoda,,Ariolimacidae,,
iNaturalist,497600,4/19/2003,4/19/2003 0:00,,,,,,,Quito,2179,charlie,2014-01-10 05:51:30 +0400,2020-04-14 05:09:50 +0300,research,CC0,http://www.inaturalist.org/observations/497600,https://inaturalist-open-data.s3.amazonaws.com/photos/630223/medium.JPG?1389318701,,,I think it was in Lobo Canyon.,3,0,FALSE,,santa rosa island,Santa Rosa,34.006093,-120.092278,2385,2385,,,FALSE,,,,Santa Barbara,California,United States,California,Santa Barbara,Southern Pacific Banana Slug,Ariolimax stramineus,Southern Pacific Banana Slug,Mollusca,560098,Mollusca,Gastropoda,,Ariolimacidae,,
iNaturalist,3138650,Thu May 05 2016 07:52:32 GMT-0700 (PDT),5/5/2016 0:00,5/5/2016,2016,5,5,17:52:32,300,Pacific Time (US & Canada),5179,leptonia,2016-05-10 17:44:35 +0300,2020-04-14 05:07:47 +0300,research,CC-BY-NC,http://www.inaturalist.org/observations/3138650,https://inaturalist-open-data.s3.amazonaws.com/photos/3631919/medium.jpg?1462891491,,,,3,0,FALSE,3,"Channel Islands National Park, Channel Islands National Pk, CA, US",Santa Rosa,34.01093333,-120.0940167,,,,,FALSE,,,,Santa Barbara,California,United States,California,Santa Barbara,Southern Pacific Banana Slug,Ariolimax stramineus,Southern Pacific Banana Slug,Mollusca,560098,Mollusca,Gastropoda,,Ariolimacidae,,
iNaturalist,13196590,2018-05-26 10:57:35 AM PDT,5/26/2018 0:00,5/26/2018,2018,5,26,20:57:35,300,Pacific Time (US & Canada),589171,hufflite,2018-06-07 06:27:34 +0300,2020-04-14 05:07:06 +0300,research,CC-BY-NC,https://www.inaturalist.org/observations/13196590,https://inaturalist-open-data.s3.amazonaws.com/photos/19292389/medium.jpeg?1528342228,,,,3,0,FALSE,2,"Santa Barbara-Santa Maria-Goleta, CA, CA, USA",Santa Rosa,34.01264191,-120.0966187,,,,,FALSE,gps,gps,,Santa Barbara,California,United States,California,Santa Barbara,Southern Pacific Banana Slug,Ariolimax stramineus,Southern Pacific Banana Slug,Mollusca,560098,Mollusca,Gastropoda,,Ariolimacidae,,
iNaturalist,17911354,Sat Oct 13 2018 11:53:27 GMT-0700 (PDT),10/13/2018 0:00,10/13/2018,2018,10,13,21:53:27,300,Pacific Time (US & Canada),143297,bgfelder,2018-10-28 22:35:32 +0300,2020-04-14 05:07:01 +0300,research,,https://www.inaturalist.org/observations/17911354,https://static.inaturalist.org/photos/27358693/medium.jpg?1540755343,,,,5,0,FALSE,3,"Channel Islands National Park, , CA, US",Santa Rosa,34.00515,-120.0915222,10,10,,,FALSE,,,,Santa Barbara,California,United States,California,Santa Barbara,Southern Pacific Banana Slug,Ariolimax stramineus,Southern Pacific Banana Slug,Mollusca,560098,Mollusca,Gastropoda,,Ariolimacidae,,
iNaturalist,25860413,2019-05-25 4:15:09 PM PDT,5/25/2019 0:00,5/26/2019,2019,5,26,2:15:09,300,Pacific Time (US & Canada),75776,upandadam,2019-05-27 08:31:51 +0300,2020-04-14 05:06:17 +0300,research,,https://www.inaturalist.org/observations/25860413,https://static.inaturalist.org/photos/40102728/medium.jpg?1558935114,,,,3,0,FALSE,2,"Santa Barbara County, CA, USA",Santa Rosa,33.96677399,-120.1227493,,,,,FALSE,gps,gps,,Santa Barbara,California,United States,California,Santa Barbara,Southern Pacific Banana Slug,Ariolimax stramineus,Southern Pacific Banana Slug,Mollusca,560098,Mollusca,Gastropoda,,Ariolimacidae,,
iNaturalist,52717130,2020-06-18 10:44:36 AM PDT,6/18/2020 0:00,6/18/2020,2020,6,18,20:44:36,300,Pacific Time (US & Canada),231807,nickdertavitian,2020-07-11 22:46:47 +0300,2020-07-17 03:48:15 +0300,needs_id,,https://www.inaturalist.org/observations/52717130,https://static.inaturalist.org/photos/83819610/medium.jpeg?1594496809,,,"Banana slug, but what species?",1,0,FALSE,2,"Santa Barbara County, CA, USA",Santa Rosa,34.01501577,-120.0978636,253,253,,,FALSE,gps,gps,,Santa Barbara,California,United States,California,Santa Barbara,Southern Pacific Banana Slug,Ariolimax stramineus,Southern Pacific Banana Slug,Mollusca,560098,Mollusca,Gastropoda,,Ariolimacidae,,
iNaturalist,68092521,2017/06/16 8:28 AM HST,6/16/2017 0:00,6/16/2017,2017,6,16,21:28:00,300,Hawaii,1885728,marivillasol,2021-01-15 08:57:45 +0300,2021-07-02 20:01:44 +0300,research,CC-BY-NC,https://www.inaturalist.org/observations/68092521,https://inaturalist-open-data.s3.amazonaws.com/photos/110172077/medium.jpeg?1610690198,,,lobo canyon,3,0,FALSE,,"Santa Barbara County, CA, USA",Santa Rosa,34.01079145,-120.0966904,402,402,,,FALSE,,,,Santa Barbara,California,United States,California,Santa Barbara,蓬蒿香蕉蛞蝓,Ariolimax stramineus,Southern Pacific Banana Slug,Mollusca,560098,Mollusca,Gastropoda,,Ariolimacidae,,
iNaturalist,71136908,2018/04/07 7:14 AM PDT,4/7/2018 0:00,4/7/2018,2018,4,7,17:14:00,300,Pacific Time (US & Canada),173183,serpophaga,2021-03-13 19:21:14 +0300,2021-03-15 00:45:21 +0300,research,CC-BY-NC,https://www.inaturalist.org/observations/71136908,https://inaturalist-open-data.s3.amazonaws.com/photos/115768024/medium.jpg?1615651813,,,,2,0,FALSE,,"Channel Islands National Park, Channel Islands, Santa Barbara, California, United States",Santa Rosa,34.00468889,-120.0913083,5,5,,,FALSE,,,,Santa Barbara,California,United States,California,Santa Barbara,Southern Pacific Banana Slug,Ariolimax stramineus,Southern Pacific Banana Slug,Mollusca,560098,Mollusca,Gastropoda,,Ariolimacidae,,
iNaturalist,71136913,2018/04/07 8:33 AM PDT,4/7/2018 0:00,4/7/2018,2018,4,7,18:33:00,300,Pacific Time (US & Canada),173183,serpophaga,2021-03-13 19:21:16 +0300,2021-03-15 00:45:18 +0300,research,CC-BY-NC,https://www.inaturalist.org/observations/71136913,https://inaturalist-open-data.s3.amazonaws.com/photos/115768079/medium.jpg?1615651843,,,,2,0,FALSE,,"Channel Islands National Park, Channel Islands, Santa Barbara, California, United States",Santa Rosa,34.01080833,-120.095475,30,30,,,FALSE,,,,Santa Barbara,California,United States,California,Santa Barbara,Southern Pacific Banana Slug,Ariolimax stramineus,Southern Pacific Banana Slug,Mollusca,560098,Mollusca,Gastropoda,,Ariolimacidae,,
iNaturalist,74169301,Tue Apr 13 2021 15:19:55 GMT-0700 (PDT),4/13/2021 0:00,4/14/2021,2021,4,14,1:19:55,300,Pacific Time (US & Canada),11007,lhaktong,2021-04-16 22:51:23 +0300,2021-04-18 21:35:30 +0300,research,,https://www.inaturalist.org/observations/74169301,https://static.inaturalist.org/photos/121187391/medium.jpg?1618602685,,,,2,0,FALSE,3,"Channel Islands National Park, CA, US",Santa Rosa,34.00751945,-120.0918972,4,4,,,FALSE,,,,Santa Barbara,California,United States,California,Santa Barbara,蓬蒿香蕉蛞蝓,Ariolimax stramineus,Southern Pacific Banana Slug,Mollusca,560098,Mollusca,Gastropoda,,Ariolimacidae,,
iNaturalist,78319659,Mon May 10 2021 14:14:07 GMT-0700 (PDT),5/10/2021 0:00,5/11/2021,2021,5,11,0:14:07,300,Pacific Time (US & Canada),481431,megakylie,2021-05-11 08:56:25 +0300,2021-05-11 18:08:42 +0300,needs_id,CC-BY,https://www.inaturalist.org/observations/78319659,https://inaturalist-open-data.s3.amazonaws.com/photos/128160489/medium.jpg?1620712589,,,,1,0,FALSE,3,"Channel Islands National Park, CA, US",Santa Rosa,34.00831112,-120.0919583,10,10,,,FALSE,,,,Santa Barbara,California,United States,California,Santa Barbara,Southern Pacific Banana Slug,Ariolimax stramineus,Southern Pacific Banana Slug,Mollusca,560098,Mollusca,Gastropoda,,Ariolimacidae,,
iNaturalist,35298332,Sat Nov 02 2019 10:34:18 GMT-0700 (PDT),11/2/2019 0:00,11/2/2019,2019,11,2,20:34:18,300,Pacific Time (US & Canada),464542,william_hoyer,2019-11-04 22:51:35 +0300,2020-01-20 21:17:01 +0300,research,CC-BY-NC,https://www.inaturalist.org/observations/35298332,https://inaturalist-open-data.s3.amazonaws.com/photos/55645895/medium.jpg?1572897133,,,Fossil shell found in sediment layers about 2.5 feet below surface in dry erosional channel. ,1,0,FALSE,3,"California, US",San Nicolas,33.20384565,-119.5377939,342,28984,,obscured,TRUE,,,,Ventura,California,United States,California,Ventura,Santa Barbara Shelled Slug,Binneya notabilis,Santa Barbara Shelled Slug,Mollusca,95761,Mollusca,Gastropoda,,Binneyidae,,
iNaturalist,37390901,Fri Jan 03 2020 12:00:04 GMT-0800 (PST),1/3/2020 0:00,1/4/2020,2020,1,4,1:00:04,300,Hawaii,464542,william_hoyer,2020-01-08 08:19:04 +0300,2021-01-16 20:46:35 +0300,research,CC-BY-NC,https://www.inaturalist.org/observations/37390901,https://inaturalist-open-data.s3.amazonaws.com/photos/59267675/medium.jpg?1578460757,,,In thatch of old grass and new seedlings of Claytonia. ,4,0,FALSE,3,"California, US",Santa Barbara,33.44081303,-119.1060969,181,28957,obscured,obscured,TRUE,,,,Santa Barbara,California,United States,California,Santa Barbara,Santa Barbara Shelled Slug,Binneya notabilis,Santa Barbara Shelled Slug,Mollusca,95761,Mollusca,Gastropoda,,Binneyidae,,
iNaturalist,20859865,2019/02/28 1:54 PM PST,2/28/2019 0:00,3/1/2019,2019,3,1,0:54:00,300,Pacific Time (US & Canada),173183,serpophaga,2019-03-02 00:07:30 +0300,2021-06-21 19:51:48 +0300,needs_id,CC-BY-NC,https://www.inaturalist.org/observations/20859865,https://inaturalist-open-data.s3.amazonaws.com/photos/32181672/medium.jpg?1551474262,,,,2,1,FALSE,,"Ventura, California, United States",San Nicolas,33.24993611,-119.4588611,10,10,,,FALSE,,,,Ventura,California,United States,California,Ventura,Catinella,Catinella,,Mollusca,87260,Mollusca,Gastropoda,Stylommatophora,Succineidae,,
iNaturalist,20103047,2014/08/29 4:16 PM MST,8/29/2014 0:00,8/30/2014,2014,8,30,3:16:00,400,Arizona,19215,tsirtalis,2019-02-05 08:05:59 +0300,2021-06-21 19:52:14 +0300,needs_id,CC-BY-NC-ND,https://www.inaturalist.org/observations/20103047,https://static.inaturalist.org/photos/31032915/medium.jpeg?1549343135,,,,2,0,FALSE,,"Ventura County, CA, USA",San Nicolas,33.261912,-119.49128,,,,,FALSE,,,,Ventura,California,United States,California,Ventura,Catinellinae,Catinellinae,,Mollusca,1228358,Mollusca,Gastropoda,Stylommatophora,Succineidae,,
iNaturalist,20822129,Wed Feb 27 2019 10:08:23 GMT-0800 (PST),2/27/2019 0:00,2/27/2019,2019,2,27,21:08:23,300,Pacific Time (US & Canada),5179,leptonia,2019-02-28 07:43:18 +0300,2021-06-21 19:51:52 +0300,needs_id,CC-BY-NC,https://www.inaturalist.org/observations/20822129,https://inaturalist-open-data.s3.amazonaws.com/photos/32116813/medium.jpg?1551329019,,,,3,0,FALSE,3,"San Nicolas Naval Facility, , CA, US",San Nicolas,33.217755,-119.4643033,12,12,,,FALSE,,,,Ventura,California,United States,California,Ventura,Catinellinae,Catinellinae,,Mollusca,1228358,Mollusca,Gastropoda,Stylommatophora,Succineidae,,
iNaturalist,26983746,2019-06-13 11:42:43 AM PDT,6/13/2019 0:00,6/13/2019,2019,6,13,21:42:43,300,Pacific Time (US & Canada),34488,pileated,2019-06-14 23:37:34 +0300,2021-06-21 20:33:31 +0300,needs_id,CC-BY,https://www.inaturalist.org/observations/26983746,https://inaturalist-open-data.s3.amazonaws.com/photos/41937192/medium.jpg?1560544656,,,,2,0,FALSE,2,"San Nicolas Island, California 93042, USA",San Nicolas,33.22125244,-119.4497375,,,,,FALSE,gps,gps,,Ventura,California,United States,California,Ventura,Amber Snails,Catinellinae,,Mollusca,1228358,Mollusca,Gastropoda,Stylommatophora,Succineidae,,
iNaturalist,27099999,2019/06/13 11:43 AM PDT,6/13/2019 0:00,6/13/2019,2019,6,13,21:43:00,300,Pacific Time (US & Canada),195291,stephanomeria,2019-06-16 20:39:26 +0300,2021-06-21 19:51:32 +0300,needs_id,CC-BY-NC,https://www.inaturalist.org/observations/27099999,https://inaturalist-open-data.s3.amazonaws.com/photos/42127708/medium.jpeg?1560706184,,,,3,0,FALSE,,"Ventura County, CA, USA",San Nicolas,33.24750868,-119.5064415,8072,8072,,,FALSE,,,,Ventura,California,United States,California,Ventura,Catinellinae,Catinellinae,,Mollusca,1228358,Mollusca,Gastropoda,Stylommatophora,Succineidae,,
iNaturalist,35595476,2019-11-05 1:59:00 PM PST,11/5/2019 0:00,11/6/2019,2019,11,6,0:59:00,300,Pacific Time (US & Canada),34488,pileated,2019-11-12 05:53:57 +0300,2021-06-21 20:33:48 +0300,needs_id,CC-BY,https://www.inaturalist.org/observations/35595476,https://inaturalist-open-data.s3.amazonaws.com/photos/56145736/medium.jpg?1573527240,,,,2,0,FALSE,2,"San Nicolas Island, California 93042, USA",San Nicolas,33.24545288,-119.4510117,,,,,FALSE,gps,gps,,Ventura,California,United States,California,Ventura,Amber Snails,Catinellinae,,Mollusca,1228358,Mollusca,Gastropoda,Stylommatophora,Succineidae,,
iNaturalist,35595487,2019-11-05 3:46:38 PM PST,11/5/2019 0:00,11/6/2019,2019,11,6,2:46:38,300,Pacific Time (US & Canada),34488,pileated,2019-11-12 05:54:24 +0300,2021-06-21 20:34:00 +0300,needs_id,CC-BY,https://www.inaturalist.org/observations/35595487,https://inaturalist-open-data.s3.amazonaws.com/photos/56145752/medium.jpg?1573527265,,,,2,0,FALSE,2,"San Nicolas Island, California 93042, USA",San Nicolas,33.22774887,-119.4364853,,,,,FALSE,gps,gps,,Ventura,California,United States,California,Ventura,Amber Snails,Catinellinae,,Mollusca,1228358,Mollusca,Gastropoda,Stylommatophora,Succineidae,,
iNaturalist,5047947,2017/01/23 2:40 PM PST,1/23/2017 0:00,1/24/2017,2017,1,24,1:40:00,300,Pacific Time (US & Canada),195291,stephanomeria,2017-02-03 23:44:04 +0300,2018-09-05 05:50:11 +0300,research,CC-BY-NC,https://www.inaturalist.org/observations/5047947,https://inaturalist-open-data.s3.amazonaws.com/photos/6186084/medium.jpeg?1486154319,,,,3,0,FALSE,,"Los Angeles, California, United States",San Clemente,33.01553056,-118.5772028,,,,,FALSE,,,,Los Angeles,California,United States,California,Los Angeles,Garden Snail,Cornu aspersum,Garden Snail,Mollusca,480298,Mollusca,Gastropoda,Stylommatophora,Helicidae,,
iNaturalist,5052433,2017/01/27 7:46 AM PST,1/27/2017 0:00,1/27/2017,2017,1,27,18:46:00,300,Pacific Time (US & Canada),173183,serpophaga,2017-02-04 23:14:54 +0300,2018-04-25 21:08:58 +0300,research,CC-BY-NC,https://www.inaturalist.org/observations/5052433,https://inaturalist-open-data.s3.amazonaws.com/photos/6193057/medium.jpg?1486238849,,,,4,0,FALSE,,"Los Angeles County, CA, USA",San Clemente,33.01611667,-118.5931917,,,,,FALSE,,,,Los Angeles,California,United States,California,Los Angeles,Garden Snail,Cornu aspersum,Garden Snail,Mollusca,480298,Mollusca,Gastropoda,Stylommatophora,Helicidae,,
iNaturalist,5522233,Fri Mar 31 2017 15:43:39 GMT-0700 (PDT),3/31/2017 0:00,4/1/2017,2017,4,1,1:43:39,300,Pacific Time (US & Canada),213838,vireolanius,2017-04-01 02:51:42 +0300,2018-04-25 21:08:45 +0300,research,CC-BY-NC,https://www.inaturalist.org/observations/5522233,https://inaturalist-open-data.s3.amazonaws.com/photos/6811794/medium.jpg?1491004310,,,,3,0,FALSE,3,"San Clemente Island Underwater Range, Avalon, CA, US",San Clemente,33.00217089,-118.5550444,17,17,,,FALSE,,,,Los Angeles,California,United States,California,Los Angeles,Garden Snail,Cornu aspersum,Garden Snail,Mollusca,480298,Mollusca,Gastropoda,Stylommatophora,Helicidae,,
iNaturalist,19155611,Sat Dec 22 2018 08:06:19 GMT-0800 (PST),12/22/2018 0:00,12/22/2018,2018,12,22,19:06:19,300,Pacific Time (US & Canada),266196,shrike2,2018-12-22 21:13:22 +0300,2019-03-07 11:55:51 +0300,research,CC-BY-NC-ND,https://www.inaturalist.org/observations/19155611,https://inaturalist-open-data.s3.amazonaws.com/photos/29412442/medium.jpg?1545502426,,,,3,0,FALSE,3,"San Clemente Island Underwater Range, , CA, US",San Clemente,33.02398859,-118.5900881,5,5,,,FALSE,,,,Los Angeles,California,United States,California,Los Angeles,Garden Snail,Cornu aspersum,Garden Snail,Mollusca,480298,Mollusca,Gastropoda,Stylommatophora,Helicidae,,
iNaturalist,20335214,Wed Feb 13 2019 09:51:09 GMT-0800 (PST),2/13/2019 0:00,2/13/2019,2019,2,13,20:51:09,300,Pacific Time (US & Canada),266196,shrike2,2019-02-14 05:55:00 +0300,2019-04-02 17:00:59 +0300,research,CC-BY-NC-ND,https://www.inaturalist.org/observations/20335214,https://static.inaturalist.org/photos/31400919/medium.jpg?1550114216,,,,2,1,FALSE,3,"California, US",San Clemente,32.8928564,-118.4848759,143,29039,,obscured,TRUE,,,,Los Angeles,California,United States,California,Los Angeles,Garden Snail,Cornu aspersum,Garden Snail,Mollusca,480298,Mollusca,Gastropoda,Stylommatophora,Helicidae,,
iNaturalist,20368406,Fri Feb 15 2019 10:58:49 GMT-0800 (PST),2/15/2019 0:00,2/15/2019,2019,2,15,21:58:49,300,Pacific Time (US & Canada),266196,shrike2,2019-02-15 22:02:18 +0300,2019-05-26 09:25:22 +0300,research,CC-BY-NC-ND,https://www.inaturalist.org/observations/20368406,https://static.inaturalist.org/photos/31452668/medium.jpg?1550257347,,,,3,0,FALSE,3,"Los Angeles County, US-CA, US",San Clemente,33.0023991,-118.5560132,19,19,,,FALSE,,,,Los Angeles,California,United States,California,Los Angeles,Garden Snail,Cornu aspersum,Garden Snail,Mollusca,480298,Mollusca,Gastropoda,Stylommatophora,Helicidae,,
iNaturalist,20370868,Fri Feb 15 2019 12:08:32 GMT-0800 (PST),2/15/2019 0:00,2/15/2019,2019,2,15,23:08:32,300,Pacific Time (US & Canada),266196,shrike2,2019-02-16 00:08:12 +0300,2019-12-30 20:03:30 +0300,research,CC-BY-NC-ND,https://www.inaturalist.org/observations/20370868,https://static.inaturalist.org/photos/31456960/medium.jpg?1550265053,,,,3,0,FALSE,3,"Los Angeles County, US-CA, US",San Clemente,32.94546998,-118.5292019,5,5,,,FALSE,,,,Los Angeles,California,United States,California,Los Angeles,Garden Snail,Cornu aspersum,Garden Snail,Mollusca,480298,Mollusca,Gastropoda,Stylommatophora,Helicidae,,
iNaturalist,20858305,Tue Feb 26 2019 15:42:15 GMT-0800 (PST),2/26/2019 0:00,2/27/2019,2019,2,27,2:42:15,300,Pacific Time (US & Canada),266196,shrike2,2019-03-01 22:50:43 +0300,2019-12-30 20:01:04 +0300,research,CC-BY-NC-ND,https://www.inaturalist.org/observations/20858305,https://static.inaturalist.org/photos/32178883/medium.jpg?1551469845,,,,4,0,FALSE,3,"San Clemente Island Underwater Range, , CA, US",San Clemente,33.01646126,-118.5963036,5,5,,,FALSE,,,,Los Angeles,California,United States,California,Los Angeles,Garden Snail,Cornu aspersum,Garden Snail,Mollusca,480298,Mollusca,Gastropoda,Stylommatophora,Helicidae,,
iNaturalist,20858317,Tue Feb 26 2019 15:44:39 GMT-0800 (PST),2/26/2019 0:00,2/27/2019,2019,2,27,2:44:39,300,Pacific Time (US & Canada),266196,shrike2,2019-03-01 22:51:23 +0300,2019-12-31 08:31:29 +0300,research,CC-BY-NC-ND,https://www.inaturalist.org/observations/20858317,https://static.inaturalist.org/photos/32178904/medium.jpg?1551469887,,,,4,0,FALSE,3,"San Clemente Island Underwater Range, , CA, US",San Clemente,33.01645003,-118.5964672,5,5,,,FALSE,,,,Los Angeles,California,United States,California,Los Angeles,Garden Snail,Cornu aspersum,Garden Snail,Mollusca,480298,Mollusca,Gastropoda,Stylommatophora,Helicidae,,
iNaturalist,21068833,Thu Mar 07 2019 06:20:59 GMT-0800 (PST),3/7/2019 0:00,3/7/2019,2019,3,7,17:20:59,300,Pacific Time (US & Canada),266196,shrike2,2019-03-09 04:38:06 +0300,2019-12-31 10:57:43 +0300,research,CC-BY-NC-ND,https://www.inaturalist.org/observations/21068833,https://static.inaturalist.org/photos/32553133/medium.jpg?1552095526,,,,3,0,FALSE,3,"Los Angeles County, US-CA, US",San Clemente,32.99664146,-118.5566181,10,10,,,FALSE,,,,Los Angeles,California,United States,California,Los Angeles,Garden Snail,Cornu aspersum,Garden Snail,Mollusca,480298,Mollusca,Gastropoda,Stylommatophora,Helicidae,,
iNaturalist,21260466,2019/02/21 1:57 PM PST,2/21/2019 0:00,,,,,,,Pacific Time (US & Canada),266196,shrike2,2019-03-15 19:40:06 +0300,2019-03-22 23:27:33 +0300,research,CC-BY-NC-ND,https://www.inaturalist.org/observations/21260466,https://static.inaturalist.org/photos/32869768/medium.jpg?1552666777,,,"young snail under cover board with Xerarionta, and Rumina, but no adult Cornu",2,0,FALSE,,"Los Angeles County, CA, USA",San Clemente,33.00229939,-118.5553397,15,15,,,FALSE,,,,Los Angeles,California,United States,California,Los Angeles,Garden Snail,Cornu aspersum,Garden Snail,Mollusca,480298,Mollusca,Gastropoda,Stylommatophora,Helicidae,,
iNaturalist,21810195,2019/03/25 5:40 AM PDT,3/25/2019 0:00,3/25/2019,2019,3,25,15:40:00,300,Pacific Time (US & Canada),12809,cedric_lee,2019-03-31 05:10:12 +0300,2021-01-30 09:44:26 +0300,research,CC-BY-NC,https://www.inaturalist.org/observations/21810195,https://inaturalist-open-data.s3.amazonaws.com/photos/33776258/medium.jpeg?1553990709,,,,3,0,FALSE,,"Los Angeles County, CA, USA",San Clemente,32.99871193,-118.5545322,15,15,,,FALSE,,,,Los Angeles,California,United States,California,Los Angeles,Garden Snail,Cornu aspersum,Garden Snail,Mollusca,480298,Mollusca,Gastropoda,Stylommatophora,Helicidae,,
iNaturalist,22334732,Thu Apr 11 2019 10:29:30 GMT-0700 (PDT),4/11/2019 0:00,4/11/2019,2019,4,11,20:29:30,300,Pacific Time (US & Canada),266196,shrike2,2019-04-11 21:18:16 +0300,2019-12-30 19:27:11 +0300,research,CC-BY-NC-ND,https://www.inaturalist.org/observations/22334732,https://static.inaturalist.org/photos/34591965/medium.jpg?1555006706,,,,2,0,FALSE,3,"Los Angeles County, US-CA, US",San Clemente,32.9441337,-118.5297317,5,5,,,FALSE,,,,Los Angeles,California,United States,California,Los Angeles,Garden Snail,Cornu aspersum,Garden Snail,Mollusca,480298,Mollusca,Gastropoda,Stylommatophora,Helicidae,,
iNaturalist,22334745,Thu Apr 11 2019 10:34:28 GMT-0700 (PDT),4/11/2019 0:00,4/11/2019,2019,4,11,20:34:28,300,Pacific Time (US & Canada),266196,shrike2,2019-04-11 21:18:35 +0300,2019-12-30 19:27:08 +0300,research,CC-BY-NC-ND,https://www.inaturalist.org/observations/22334745,https://static.inaturalist.org/photos/34592034/medium.jpg?1555006749,,,,3,0,FALSE,3,"Los Angeles County, US-CA, US",San Clemente,32.94422694,-118.5291382,5,5,,,FALSE,,,,Los Angeles,California,United States,California,Los Angeles,Garden Snail,Cornu aspersum,Garden Snail,Mollusca,480298,Mollusca,Gastropoda,Stylommatophora,Helicidae,,
iNaturalist,22334796,Thu Apr 11 2019 10:34:49 GMT-0700 (PDT),4/11/2019 0:00,4/11/2019,2019,4,11,20:34:49,300,Pacific Time (US & Canada),266196,shrike2,2019-04-11 21:19:39 +0300,2019-12-30 19:27:07 +0300,research,CC-BY-NC-ND,https://www.inaturalist.org/observations/22334796,https://static.inaturalist.org/photos/34592097/medium.jpg?1555006795,,,,2,0,FALSE,3,"Los Angeles County, US-CA, US",San Clemente,32.94422694,-118.5291382,5,5,,,FALSE,,,,Los Angeles,California,United States,California,Los Angeles,Garden Snail,Cornu aspersum,Garden Snail,Mollusca,480298,Mollusca,Gastropoda,Stylommatophora,Helicidae,,
iNaturalist,23054372,Thu Apr 25 2019 08:30:19 GMT-0700 (PDT),4/25/2019 0:00,4/25/2019,2019,4,25,18:30:19,300,Pacific Time (US & Canada),266196,shrike2,2019-04-25 18:38:02 +0300,2019-12-30 19:26:32 +0300,research,CC-BY-NC-ND,https://www.inaturalist.org/observations/23054372,https://static.inaturalist.org/photos/35741512/medium.jpg?1556206876,,,,2,0,FALSE,3,"San Clemente Island Underwater Range, , CA, US",San Clemente,33.02819408,-118.5896392,5,5,,,FALSE,,,,Los Angeles,California,United States,California,Los Angeles,Garden Snail,Cornu aspersum,Garden Snail,Mollusca,480298,Mollusca,Gastropoda,Stylommatophora,Helicidae,,
iNaturalist,25094737,2019-05-09 7:33:04 AM PDT,5/9/2019 0:00,5/9/2019,2019,5,9,17:33:04,300,Pacific Time (US & Canada),34488,pileated,2019-05-14 07:08:38 +0300,2020-04-23 21:06:31 +0300,research,CC-BY,https://www.inaturalist.org/observations/25094737,https://inaturalist-open-data.s3.amazonaws.com/photos/38838396/medium.jpeg?1557806920,,,,3,0,FALSE,2,"Los Angeles County, US-CA, US",San Clemente,33.0015426,-118.5545871,30,30,,,FALSE,,,,Los Angeles,California,United States,California,Los Angeles,Garden Snail,Cornu aspersum,Garden Snail,Mollusca,480298,Mollusca,Gastropoda,Stylommatophora,Helicidae,,
iNaturalist,25094739,2019-05-09 6:52:32 AM PDT,5/9/2019 0:00,5/9/2019,2019,5,9,16:52:32,300,Pacific Time (US & Canada),34488,pileated,2019-05-14 07:08:45 +0300,2020-04-23 21:06:31 +0300,research,CC-BY,https://www.inaturalist.org/observations/25094739,https://inaturalist-open-data.s3.amazonaws.com/photos/38838402/medium.jpeg?1557806928,,,,3,0,FALSE,2,"Unnamed Road, California, USA",San Clemente,32.99864215,-118.5544854,22,22,,,FALSE,gps,gps,,Los Angeles,California,United States,California,Los Angeles,Garden Snail,Cornu aspersum,Garden Snail,Mollusca,480298,Mollusca,Gastropoda,Stylommatophora,Helicidae,,
iNaturalist,26536070,2019-06-04 2:15:51 PM PDT,6/4/2019 0:00,6/5/2019,2019,6,5,0:15:51,300,Pacific Time (US & Canada),34488,pileated,2019-06-07 08:14:25 +0300,2020-04-23 21:06:29 +0300,research,CC-BY,https://www.inaturalist.org/observations/26536070,https://inaturalist-open-data.s3.amazonaws.com/photos/41213304/medium.jpeg?1559884468,,,,2,0,FALSE,2,"Los Angeles County, US-CA, US",San Clemente,33.0153923,-118.5953522,,,,,FALSE,gps,gps,,Los Angeles,California,United States,California,Los Angeles,Garden Snail,Cornu aspersum,Garden Snail,Mollusca,480298,Mollusca,Gastropoda,Stylommatophora,Helicidae,,
iNaturalist,27938217,Sun Jun 30 2019 07:39:38 GMT-0700 (PDT),6/30/2019 0:00,6/30/2019,2019,6,30,17:39:38,300,Pacific Time (US & Canada),266196,shrike2,2019-06-30 19:26:34 +0300,2019-12-30 10:40:04 +0300,research,CC-BY-NC-ND,https://www.inaturalist.org/observations/27938217,https://static.inaturalist.org/photos/43515854/medium.jpg?1561912009,,,,2,0,FALSE,3,"Los Angeles County, US-CA, US",San Clemente,32.94529568,-118.5298861,5,5,,,FALSE,,,,Los Angeles,California,United States,California,Los Angeles,Garden Snail,Cornu aspersum,Garden Snail,Mollusca,480298,Mollusca,Gastropoda,Stylommatophora,Helicidae,,
iNaturalist,27938247,Sun Jun 30 2019 07:44:33 GMT-0700 (PDT),6/30/2019 0:00,6/30/2019,2019,6,30,17:44:33,300,Pacific Time (US & Canada),266196,shrike2,2019-06-30 19:27:11 +0300,2019-12-30 10:40:06 +0300,research,CC-BY-NC-ND,https://www.inaturalist.org/observations/27938247,https://static.inaturalist.org/photos/43515903/medium.jpg?1561912040,,,,2,0,FALSE,3,"Los Angeles County, US-CA, US",San Clemente,32.94494275,-118.529851,5,5,,,FALSE,,,,Los Angeles,California,United States,California,Los Angeles,Garden Snail,Cornu aspersum,Garden Snail,Mollusca,480298,Mollusca,Gastropoda,Stylommatophora,Helicidae,,
iNaturalist,28237155,Fri Jul 05 2019 09:29:07 GMT-0700 (PDT),7/5/2019 0:00,7/5/2019,2019,7,5,19:29:07,300,Pacific Time (US & Canada),1474963,stephlbartlett,2019-07-05 19:30:41 +0300,2019-12-30 10:40:02 +0300,research,CC-BY-NC,https://www.inaturalist.org/observations/28237155,https://inaturalist-open-data.s3.amazonaws.com/photos/44003344/medium.jpg?1562344244,,,,4,0,FALSE,3,"San Clemente Island Underwater Range, , CA, US",San Clemente,33.01724167,-118.581405,5,5,,,FALSE,,,,Los Angeles,California,United States,California,Los Angeles,Garden Snail,Cornu aspersum,Garden Snail,Mollusca,480298,Mollusca,Gastropoda,Stylommatophora,Helicidae,,
iNaturalist,28237300,Fri Jul 05 2019 09:32:29 GMT-0700 (PDT),7/5/2019 0:00,7/5/2019,2019,7,5,19:32:29,300,Pacific Time (US & Canada),1474963,stephlbartlett,2019-07-05 19:32:56 +0300,2019-12-30 10:40:00 +0300,research,CC-BY-NC,https://www.inaturalist.org/observations/28237300,https://inaturalist-open-data.s3.amazonaws.com/photos/44003590/medium.jpg?1562344379,,,,3,0,FALSE,3,"San Clemente Island Underwater Range, , CA, US",San Clemente,33.0172,-118.581345,5,5,,,FALSE,,,,Los Angeles,California,United States,California,Los Angeles,Garden Snail,Cornu aspersum,Garden Snail,Mollusca,480298,Mollusca,Gastropoda,Stylommatophora,Helicidae,,
iNaturalist,30552853,2019/08/03 12:27 PM PDT,8/3/2019 0:00,8/3/2019,2019,8,3,22:27:00,300,Pacific Time (US & Canada),23091,sue_meiman,2019-08-10 20:41:56 +0300,2019-12-30 19:22:12 +0300,research,CC-BY-NC,https://www.inaturalist.org/observations/30552853,https://inaturalist-open-data.s3.amazonaws.com/photos/47737410/medium.jpg?1565458820,,,,4,0,FALSE,,"Los Angeles County, CA, USA",San Clemente,32.99593226,-118.5520275,61,61,,,FALSE,,,,Los Angeles,California,United States,California,Los Angeles,Garden Snail,Cornu aspersum,Garden Snail,Mollusca,480298,Mollusca,Gastropoda,Stylommatophora,Helicidae,,
iNaturalist,30820101,Wed Aug 14 2019 08:16:47 GMT-0700 (PDT),8/14/2019 0:00,8/14/2019,2019,8,14,18:16:47,300,Pacific Time (US & Canada),266196,shrike2,2019-08-14 20:18:56 +0300,2019-12-30 19:22:10 +0300,research,CC-BY-NC-ND,https://www.inaturalist.org/observations/30820101,https://static.inaturalist.org/photos/48174507/medium.jpg?1565803154,,,,2,0,FALSE,3,"Los Angeles County, US-CA, US",San Clemente,33.03102629,-118.5771721,5,5,,,FALSE,,,,Los Angeles,California,United States,California,Los Angeles,Garden Snail,Cornu aspersum,Garden Snail,Mollusca,480298,Mollusca,Gastropoda,Stylommatophora,Helicidae,,
iNaturalist,30820124,Wed Aug 14 2019 08:17:08 GMT-0700 (PDT),8/14/2019 0:00,8/14/2019,2019,8,14,18:17:08,300,Pacific Time (US & Canada),266196,shrike2,2019-08-14 20:19:41 +0300,2019-12-30 19:22:08 +0300,research,CC-BY-NC-ND,https://www.inaturalist.org/observations/30820124,https://static.inaturalist.org/photos/48174578/medium.jpg?1565803209,,,,2,0,FALSE,3,"Los Angeles County, US-CA, US",San Clemente,33.0310003,-118.5771804,5,5,,,FALSE,,,,Los Angeles,California,United States,California,Los Angeles,Garden Snail,Cornu aspersum,Garden Snail,Mollusca,480298,Mollusca,Gastropoda,Stylommatophora,Helicidae,,
iNaturalist,36829196,Sat Dec 21 2019 09:18:59 GMT-0800 (PST),12/21/2019 0:00,12/21/2019,2019,12,21,20:18:59,300,Pacific Time (US & Canada),266196,shrike2,2019-12-21 21:26:46 +0300,2020-02-01 04:45:40 +0300,research,CC-BY-NC-ND,https://www.inaturalist.org/observations/36829196,https://static.inaturalist.org/photos/58282766/medium.jpg?1576952810,,,,3,0,FALSE,3,"San Clemente Island Underwater Range, CA, US",San Clemente,33.02776003,-118.5890724,5,5,,,FALSE,,,,Los Angeles,California,United States,California,Los Angeles,ヒメリンゴマイマイ,Cornu aspersum,Garden Snail,Mollusca,480298,Mollusca,Gastropoda,Stylommatophora,Helicidae,,
iNaturalist,37442272,Thu Jan 09 2020 12:16:28 GMT-0800 (PST),1/9/2020 0:00,1/9/2020,2020,1,9,23:16:28,300,Pacific Time (US & Canada),12809,cedric_lee,2020-01-10 03:44:57 +0300,2020-01-19 22:39:14 +0300,research,CC-BY-NC,https://www.inaturalist.org/observations/37442272,https://inaturalist-open-data.s3.amazonaws.com/photos/59357098/medium.jpg?1578617181,,,,1,0,FALSE,3,"Los Angeles County, US-CA, US",San Clemente,32.94422961,-118.5288624,37,37,,,FALSE,,,,Los Angeles,California,United States,California,Los Angeles,,Cornu aspersum,Garden Snail,Mollusca,480298,Mollusca,Gastropoda,Stylommatophora,Helicidae,,
iNaturalist,37568308,Mon Jan 13 2020 10:00:40 GMT-0800 (PST),1/13/2020 0:00,1/13/2020,2020,1,13,21:00:40,300,Pacific Time (US & Canada),266196,shrike2,2020-01-14 01:13:12 +0300,2020-01-14 01:14:03 +0300,research,CC-BY-NC-ND,https://www.inaturalist.org/observations/37568308,https://static.inaturalist.org/photos/59581094/medium.jpg?1578953613,,,,1,0,FALSE,3,"Los Angeles County, US-CA, US",San Clemente,32.96533719,-118.5389375,5,5,,,FALSE,,,,Los Angeles,California,United States,California,Los Angeles,Garden Snail,Cornu aspersum,Garden Snail,Mollusca,480298,Mollusca,Gastropoda,Stylommatophora,Helicidae,,
iNaturalist,37568348,Mon Jan 13 2020 10:30:39 GMT-0800 (PST),1/13/2020 0:00,1/13/2020,2020,1,13,21:30:39,300,Pacific Time (US & Canada),266196,shrike2,2020-01-14 01:14:39 +0300,2020-01-27 04:35:56 +0300,research,CC-BY-NC-ND,https://www.inaturalist.org/observations/37568348,https://static.inaturalist.org/photos/59581212/medium.jpg?1578953713,,,,2,0,FALSE,3,"Los Angeles County, US-CA, US",San Clemente,32.96545835,-118.5404324,5,5,,,FALSE,,,,Los Angeles,California,United States,California,Los Angeles,ヒメリンゴマイマイ,Cornu aspersum,Garden Snail,Mollusca,480298,Mollusca,Gastropoda,Stylommatophora,Helicidae,,
iNaturalist,37593283,Tue Jan 14 2020 08:44:11 GMT-0800 (PST),1/14/2020 0:00,1/14/2020,2020,1,14,19:44:11,300,Pacific Time (US & Canada),266196,shrike2,2020-01-14 22:33:32 +0300,2020-01-19 22:23:44 +0300,research,CC-BY-NC-ND,https://www.inaturalist.org/observations/37593283,https://static.inaturalist.org/photos/59625226/medium.jpg?1579030433,,,,2,0,FALSE,3,"Los Angeles County, US-CA, US",San Clemente,33.01628977,-118.5973449,5,5,,,FALSE,,,,Los Angeles,California,United States,California,Los Angeles,Caracol europeo de jardín,Cornu aspersum,Garden Snail,Mollusca,480298,Mollusca,Gastropoda,Stylommatophora,Helicidae,,
iNaturalist,37596632,Tue Jan 14 2020 13:53:11 GMT-0800 (PST),1/14/2020 0:00,1/15/2020,2020,1,15,0:53:11,300,Pacific Time (US & Canada),266196,shrike2,2020-01-15 00:54:19 +0300,2020-02-05 17:21:22 +0300,research,CC-BY-NC-ND,https://www.inaturalist.org/observations/37596632,https://static.inaturalist.org/photos/59631066/medium.jpg?1579038872,,,,1,0,FALSE,3,"San Clemente Island Underwater Range, CA, US",San Clemente,33.01620323,-118.5925347,5,5,,,FALSE,,,,Los Angeles,California,United States,California,Los Angeles,Garden Snail,Cornu aspersum,Garden Snail,Mollusca,480298,Mollusca,Gastropoda,Stylommatophora,Helicidae,,
iNaturalist,37600808,Tue Jan 14 2020 08:46:10 GMT-0800 (PST),1/14/2020 0:00,1/14/2020,2020,1,14,19:46:10,300,Pacific Time (US & Canada),12809,cedric_lee,2020-01-15 03:36:31 +0300,2020-01-15 04:07:44 +0300,research,CC-BY-NC,https://www.inaturalist.org/observations/37600808,https://inaturalist-open-data.s3.amazonaws.com/photos/59638542/medium.jpg?1579048623,,,,1,0,FALSE,3,"Los Angeles County, US-CA, US",San Clemente,33.01737522,-118.5965736,8,8,,,FALSE,,,,Los Angeles,California,United States,California,Los Angeles,,Cornu aspersum,Garden Snail,Mollusca,480298,Mollusca,Gastropoda,Stylommatophora,Helicidae,,
iNaturalist,37600879,Tue Jan 14 2020 08:51:02 GMT-0800 (PST),1/14/2020 0:00,1/14/2020,2020,1,14,19:51:02,300,Pacific Time (US & Canada),12809,cedric_lee,2020-01-15 03:38:49 +0300,2020-02-05 17:34:20 +0300,research,CC-BY-NC,https://www.inaturalist.org/observations/37600879,https://inaturalist-open-data.s3.amazonaws.com/photos/59638650/medium.jpg?1579048754,,,,1,0,FALSE,3,"Los Angeles County, US-CA, US",San Clemente,33.01744503,-118.5969888,7,7,,,FALSE,,,,Los Angeles,California,United States,California,Los Angeles,,Cornu aspersum,Garden Snail,Mollusca,480298,Mollusca,Gastropoda,Stylommatophora,Helicidae,,
iNaturalist,37600887,Tue Jan 14 2020 08:51:45 GMT-0800 (PST),1/14/2020 0:00,1/14/2020,2020,1,14,19:51:45,300,Pacific Time (US & Canada),12809,cedric_lee,2020-01-15 03:39:21 +0300,2020-03-11 04:09:37 +0300,research,CC-BY-NC,https://www.inaturalist.org/observations/37600887,https://inaturalist-open-data.s3.amazonaws.com/photos/59638683/medium.jpg?1579048793,,,,1,0,FALSE,3,"Los Angeles County, US-CA, US",San Clemente,33.01749688,-118.5970529,8,8,,,FALSE,,,,Los Angeles,California,United States,California,Los Angeles,,Cornu aspersum,Garden Snail,Mollusca,480298,Mollusca,Gastropoda,Stylommatophora,Helicidae,,
iNaturalist,37600932,Tue Jan 14 2020 08:59:11 GMT-0800 (PST),1/14/2020 0:00,1/14/2020,2020,1,14,19:59:11,300,Pacific Time (US & Canada),12809,cedric_lee,2020-01-15 03:41:06 +0300,2020-03-11 04:08:42 +0300,research,CC-BY-NC,https://www.inaturalist.org/observations/37600932,https://inaturalist-open-data.s3.amazonaws.com/photos/59638787/medium.jpg?1579048963,,,,2,0,FALSE,3,"Los Angeles County, US-CA, US",San Clemente,33.01754072,-118.5971193,8,8,,,FALSE,,,,Los Angeles,California,United States,California,Los Angeles,,Cornu aspersum,Garden Snail,Mollusca,480298,Mollusca,Gastropoda,Stylommatophora,Helicidae,,
iNaturalist,37600996,Tue Jan 14 2020 09:10:40 GMT-0800 (PST),1/14/2020 0:00,1/14/2020,2020,1,14,20:10:40,300,Pacific Time (US & Canada),12809,cedric_lee,2020-01-15 03:42:50 +0300,2020-01-19 22:36:26 +0300,research,CC-BY-NC,https://www.inaturalist.org/observations/37600996,https://inaturalist-open-data.s3.amazonaws.com/photos/59638818/medium.jpg?1579049006,,,,2,0,FALSE,3,"Los Angeles County, US-CA, US",San Clemente,33.01714692,-118.5972158,8,8,,,FALSE,,,,Los Angeles,California,United States,California,Los Angeles,,Cornu aspersum,Garden Snail,Mollusca,480298,Mollusca,Gastropoda,Stylommatophora,Helicidae,,
iNaturalist,37601045,Tue Jan 14 2020 09:19:46 GMT-0800 (PST),1/14/2020 0:00,1/14/2020,2020,1,14,20:19:46,300,Pacific Time (US & Canada),12809,cedric_lee,2020-01-15 03:43:34 +0300,2020-01-15 04:07:58 +0300,research,CC-BY-NC,https://www.inaturalist.org/observations/37601045,https://inaturalist-open-data.s3.amazonaws.com/photos/59638858/medium.jpg?1579049065,,,,1,0,FALSE,3,"Los Angeles County, US-CA, US",San Clemente,33.01672538,-118.5975186,8,8,,,FALSE,,,,Los Angeles,California,United States,California,Los Angeles,,Cornu aspersum,Garden Snail,Mollusca,480298,Mollusca,Gastropoda,Stylommatophora,Helicidae,,
iNaturalist,37601068,Tue Jan 14 2020 09:26:30 GMT-0800 (PST),1/14/2020 0:00,1/14/2020,2020,1,14,20:26:30,300,Pacific Time (US & Canada),12809,cedric_lee,2020-01-15 03:44:31 +0300,2020-02-05 18:08:49 +0300,research,CC-BY-NC,https://www.inaturalist.org/observations/37601068,https://inaturalist-open-data.s3.amazonaws.com/photos/59638891/medium.jpg?1579049122,,,,1,0,FALSE,3,"Los Angeles County, US-CA, US",San Clemente,33.01666719,-118.5978067,19,19,,,FALSE,,,,Los Angeles,California,United States,California,Los Angeles,,Cornu aspersum,Garden Snail,Mollusca,480298,Mollusca,Gastropoda,Stylommatophora,Helicidae,,
iNaturalist,37601080,Tue Jan 14 2020 09:30:27 GMT-0800 (PST),1/14/2020 0:00,1/14/2020,2020,1,14,20:30:27,300,Pacific Time (US & Canada),12809,cedric_lee,2020-01-15 03:45:29 +0300,2020-02-01 04:43:58 +0300,research,CC-BY-NC,https://www.inaturalist.org/observations/37601080,https://inaturalist-open-data.s3.amazonaws.com/photos/59638926/medium.jpg?1579049199,,,,1,0,FALSE,3,"Los Angeles County, US-CA, US",San Clemente,33.01677959,-118.5982974,7,7,,,FALSE,,,,Los Angeles,California,United States,California,Los Angeles,,Cornu aspersum,Garden Snail,Mollusca,480298,Mollusca,Gastropoda,Stylommatophora,Helicidae,,
iNaturalist,37601143,Tue Jan 14 2020 09:36:55 GMT-0800 (PST),1/14/2020 0:00,1/14/2020,2020,1,14,20:36:55,300,Pacific Time (US & Canada),12809,cedric_lee,2020-01-15 03:48:42 +0300,2020-02-01 04:43:57 +0300,research,CC-BY-NC,https://www.inaturalist.org/observations/37601143,https://inaturalist-open-data.s3.amazonaws.com/photos/59639083/medium.jpg?1579049380,,,,1,0,FALSE,3,"Los Angeles County, US-CA, US",San Clemente,33.01669465,-118.5984167,8,8,,,FALSE,,,,Los Angeles,California,United States,California,Los Angeles,,Cornu aspersum,Garden Snail,Mollusca,480298,Mollusca,Gastropoda,Stylommatophora,Helicidae,,
iNaturalist,37601243,Tue Jan 14 2020 13:23:00 GMT-0800 (PST),1/14/2020 0:00,1/15/2020,2020,1,15,0:23:00,300,Pacific Time (US & Canada),12809,cedric_lee,2020-01-15 03:53:38 +0300,2020-02-01 04:43:54 +0300,research,CC-BY-NC,https://www.inaturalist.org/observations/37601243,https://inaturalist-open-data.s3.amazonaws.com/photos/59639389/medium.jpg?1579049696,,,,3,0,FALSE,3,"Los Angeles County, US-CA, US",San Clemente,33.0173989,-118.5887076,8,8,,,FALSE,,,,Los Angeles,California,United States,California,Los Angeles,,Cornu aspersum,Garden Snail,Mollusca,480298,Mollusca,Gastropoda,Stylommatophora,Helicidae,,
iNaturalist,37626393,Wed Jan 15 2020 12:47:01 GMT-0800 (PST),1/15/2020 0:00,1/15/2020,2020,1,15,23:47:01,300,Pacific Time (US & Canada),266196,shrike2,2020-01-16 00:09:26 +0300,2020-01-27 04:35:37 +0300,research,CC-BY-NC-ND,https://www.inaturalist.org/observations/37626393,https://static.inaturalist.org/photos/59683633/medium.jpg?1579122573,,,,3,0,FALSE,3,"San Clemente Island Underwater Range, CA, US",San Clemente,32.99802372,-118.5549163,10,10,,,FALSE,,,,Los Angeles,California,United States,California,Los Angeles,ヒメリンゴマイマイ,Cornu aspersum,Garden Snail,Mollusca,480298,Mollusca,Gastropoda,Stylommatophora,Helicidae,,
iNaturalist,37634931,Tue Jan 14 2020 08:16:36 GMT-0800 (PST),1/14/2020 0:00,1/14/2020,2020,1,14,19:16:36,300,Pacific Time (US & Canada),12809,cedric_lee,2020-01-16 04:23:38 +0300,2020-01-16 04:26:23 +0300,research,CC-BY-NC,https://www.inaturalist.org/observations/37634931,https://inaturalist-open-data.s3.amazonaws.com/photos/59698409/medium.jpg?1579137868,,,,1,0,FALSE,3,"Los Angeles County, US-CA, US",San Clemente,33.01727366,-118.5956546,8,8,,,FALSE,,,,Los Angeles,California,United States,California,Los Angeles,Corny aspersum,Cornu aspersum,Garden Snail,Mollusca,480298,Mollusca,Gastropoda,Stylommatophora,Helicidae,,
iNaturalist,37672184,Thu Jan 16 2020 10:26:16 GMT-0800 (PST),1/16/2020 0:00,1/16/2020,2020,1,16,21:26:16,300,Pacific Time (US & Canada),12809,cedric_lee,2020-01-17 07:31:52 +0300,2020-02-01 04:43:44 +0300,research,CC-BY-NC,https://www.inaturalist.org/observations/37672184,https://inaturalist-open-data.s3.amazonaws.com/photos/59770857/medium.jpg?1579235519,,,,4,0,FALSE,3,"Los Angeles County, US-CA, US",San Clemente,33.00437209,-118.5562866,9,9,,,FALSE,,,,Los Angeles,California,United States,California,Los Angeles,,Cornu aspersum,Garden Snail,Mollusca,480298,Mollusca,Gastropoda,Stylommatophora,Helicidae,,
iNaturalist,37672188,Thu Jan 16 2020 13:35:02 GMT-0800 (PST),1/16/2020 0:00,1/17/2020,2020,1,17,0:35:02,300,Pacific Time (US & Canada),12809,cedric_lee,2020-01-17 07:32:05 +0300,2020-01-27 04:35:24 +0300,research,CC-BY-NC,https://www.inaturalist.org/observations/37672188,https://inaturalist-open-data.s3.amazonaws.com/photos/59770869/medium.jpg?1579235529,,,,2,0,FALSE,3,"Los Angeles County, US-CA, US",San Clemente,33.01932368,-118.5834408,9,9,,,FALSE,,,,Los Angeles,California,United States,California,Los Angeles,,Cornu aspersum,Garden Snail,Mollusca,480298,Mollusca,Gastropoda,Stylommatophora,Helicidae,,
iNaturalist,37672208,Thu Jan 16 2020 13:47:32 GMT-0800 (PST),1/16/2020 0:00,1/17/2020,2020,1,17,0:47:32,300,Pacific Time (US & Canada),12809,cedric_lee,2020-01-17 07:32:44 +0300,2020-01-27 04:35:24 +0300,research,CC-BY-NC,https://www.inaturalist.org/observations/37672208,https://inaturalist-open-data.s3.amazonaws.com/photos/59770975/medium.jpg?1579235651,,,,1,0,FALSE,3,"Los Angeles County, US-CA, US",San Clemente,33.01877745,-118.5828287,11,11,,,FALSE,,,,Los Angeles,California,United States,California,Los Angeles,,Cornu aspersum,Garden Snail,Mollusca,480298,Mollusca,Gastropoda,Stylommatophora,Helicidae,,
iNaturalist,37672217,Thu Jan 16 2020 13:56:59 GMT-0800 (PST),1/16/2020 0:00,1/17/2020,2020,1,17,0:56:59,300,Pacific Time (US & Canada),12809,cedric_lee,2020-01-17 07:33:09 +0300,2020-01-27 04:35:22 +0300,research,CC-BY-NC,https://www.inaturalist.org/observations/37672217,https://inaturalist-open-data.s3.amazonaws.com/photos/59770917/medium.jpg?1579235595,,,,2,0,FALSE,3,"Los Angeles County, US-CA, US",San Clemente,33.01906859,-118.5835226,9,9,,,FALSE,,,,Los Angeles,California,United States,California,Los Angeles,,Cornu aspersum,Garden Snail,Mollusca,480298,Mollusca,Gastropoda,Stylommatophora,Helicidae,,
iNaturalist,37915318,Thu Jan 23 2020 16:41:48 GMT-0800 (PST),1/23/2020 0:00,1/24/2020,2020,1,24,3:41:48,300,Pacific Time (US & Canada),12809,cedric_lee,2020-01-24 17:13:50 +0300,2020-02-03 19:17:18 +0300,research,CC-BY-NC,https://www.inaturalist.org/observations/37915318,https://inaturalist-open-data.s3.amazonaws.com/photos/60180814/medium.jpg?1579875293,,,,2,0,FALSE,3,"Los Angeles County, US-CA, US",San Clemente,32.99654568,-118.5570241,9,9,,,FALSE,,,,Los Angeles,California,United States,California,Los Angeles,,Cornu aspersum,Garden Snail,Mollusca,480298,Mollusca,Gastropoda,Stylommatophora,Helicidae,,
iNaturalist,37967947,Sat Jan 25 2020 13:02:09 GMT-0800 (PST),1/25/2020 0:00,1/26/2020,2020,1,26,0:02:09,300,Pacific Time (US & Canada),12809,cedric_lee,2020-01-26 03:26:23 +0300,2020-02-05 17:32:11 +0300,research,CC-BY-NC,https://www.inaturalist.org/observations/37967947,https://inaturalist-open-data.s3.amazonaws.com/photos/60271368/medium.jpg?1579998440,,,,2,0,FALSE,3,"Los Angeles County, US-CA, US",San Clemente,33.02133974,-118.5861949,7,7,,,FALSE,,,,Los Angeles,California,United States,California,Los Angeles,,Cornu aspersum,Garden Snail,Mollusca,480298,Mollusca,Gastropoda,Stylommatophora,Helicidae,,
iNaturalist,37968259,Sat Jan 25 2020 13:18:17 GMT-0800 (PST),1/25/2020 0:00,1/26/2020,2020,1,26,0:18:17,300,Pacific Time (US & Canada),12809,cedric_lee,2020-01-26 03:37:01 +0300,2020-01-27 04:34:08 +0300,research,CC-BY-NC,https://www.inaturalist.org/observations/37968259,https://inaturalist-open-data.s3.amazonaws.com/photos/60271983/medium.jpg?1579999091,,,With one Micrarionta gabbi ,1,0,FALSE,3,"Los Angeles County, US-CA, US",San Clemente,33.02198442,-118.5856714,9,9,,,FALSE,,,,Los Angeles,California,United States,California,Los Angeles,,Cornu aspersum,Garden Snail,Mollusca,480298,Mollusca,Gastropoda,Stylommatophora,Helicidae,,
iNaturalist,37968338,Sat Jan 25 2020 13:06:13 GMT-0800 (PST),1/25/2020 0:00,1/26/2020,2020,1,26,0:06:13,300,Pacific Time (US & Canada),12809,cedric_lee,2020-01-26 03:39:29 +0300,2020-02-05 17:32:06 +0300,research,CC-BY-NC,https://www.inaturalist.org/observations/37968338,https://inaturalist-open-data.s3.amazonaws.com/photos/60272075/medium.jpg?1579999197,,,,2,0,FALSE,3,"Los Angeles County, US-CA, US",San Clemente,33.0215148,-118.5855694,10,10,,,FALSE,,,,Los Angeles,California,United States,California,Los Angeles,,Cornu aspersum,Garden Snail,Mollusca,480298,Mollusca,Gastropoda,Stylommatophora,Helicidae,,
iNaturalist,37986227,Sat Jan 25 2020 12:55:48 GMT-0800 (PST),1/25/2020 0:00,1/25/2020,2020,1,25,23:55:48,300,Pacific Time (US & Canada),12809,cedric_lee,2020-01-26 17:18:24 +0300,2020-01-26 20:10:02 +0300,research,CC-BY-NC,https://www.inaturalist.org/observations/37986227,https://inaturalist-open-data.s3.amazonaws.com/photos/60305092/medium.jpg?1580048366,,,,1,0,FALSE,3,"Los Angeles County, US-CA, US",San Clemente,33.02087579,-118.5868809,18,18,,,FALSE,,,,Los Angeles,California,United States,California,Los Angeles,,Cornu aspersum,Garden Snail,Mollusca,480298,Mollusca,Gastropoda,Stylommatophora,Helicidae,,
iNaturalist,37986561,Sat Jan 25 2020 12:29:44 GMT-0800 (PST),1/25/2020 0:00,1/25/2020,2020,1,25,23:29:44,300,Pacific Time (US & Canada),12809,cedric_lee,2020-01-26 17:35:29 +0300,2020-01-28 05:50:21 +0300,research,CC-BY-NC,https://www.inaturalist.org/observations/37986561,https://inaturalist-open-data.s3.amazonaws.com/photos/60305726/medium.jpg?1580049381,,,,3,0,FALSE,3,"Los Angeles County, US-CA, US",San Clemente,33.01879346,-118.5867653,9,9,,,FALSE,,,,Los Angeles,California,United States,California,Los Angeles,,Cornu aspersum,Garden Snail,Mollusca,480298,Mollusca,Gastropoda,Stylommatophora,Helicidae,,
iNaturalist,38009385,Sat Jan 25 2020 09:56:31 GMT-0800 (PST),1/25/2020 0:00,1/25/2020,2020,1,25,20:56:31,300,Pacific Time (US & Canada),12809,cedric_lee,2020-01-27 04:05:53 +0300,2020-02-03 19:16:32 +0300,research,CC-BY-NC,https://www.inaturalist.org/observations/38009385,https://inaturalist-open-data.s3.amazonaws.com/photos/60345198/medium.jpg?1580134345,,,,3,0,FALSE,3,"Los Angeles County, US-CA, US",San Clemente,33.01693129,-118.6000415,10,10,,,FALSE,,,,Los Angeles,California,United States,California,Los Angeles,,Cornu aspersum,Garden Snail,Mollusca,480298,Mollusca,Gastropoda,Stylommatophora,Helicidae,,
iNaturalist,38590505,Wed Feb 12 2020 17:25:53 GMT-0800 (PST),2/12/2020 0:00,2/13/2020,2020,2,13,4:25:53,300,Pacific Time (US & Canada),12809,cedric_lee,2020-02-13 04:57:12 +0300,2020-02-14 17:10:00 +0300,research,CC-BY-NC,https://www.inaturalist.org/observations/38590505,https://inaturalist-open-data.s3.amazonaws.com/photos/61352300/medium.jpg?1581559071,,,,1,0,FALSE,3,"Los Angeles County, US-CA, US",San Clemente,32.9968706,-118.5559288,24,24,,,FALSE,,,,Los Angeles,California,United States,California,Los Angeles,,Cornu aspersum,Garden Snail,Mollusca,480298,Mollusca,Gastropoda,Stylommatophora,Helicidae,,
iNaturalist,38590684,Wed Feb 12 2020 11:01:47 GMT-0800 (PST),2/12/2020 0:00,2/12/2020,2020,2,12,22:01:47,300,Pacific Time (US & Canada),12809,cedric_lee,2020-02-13 05:00:52 +0300,2020-02-14 17:09:49 +0300,research,CC-BY-NC,https://www.inaturalist.org/observations/38590684,https://inaturalist-open-data.s3.amazonaws.com/photos/61352459/medium.jpg?1581559282,,,,2,0,FALSE,3,"Los Angeles County, US-CA, US",San Clemente,33.01505818,-118.5848348,13,13,,,FALSE,,,,Los Angeles,California,United States,California,Los Angeles,,Cornu aspersum,Garden Snail,Mollusca,480298,Mollusca,Gastropoda,Stylommatophora,Helicidae,,
iNaturalist,38652177,Sat Feb 08 2020 08:09:52 GMT-0800 (PST),2/8/2020 0:00,2/8/2020,2020,2,8,19:09:52,300,Pacific Time (US & Canada),12809,cedric_lee,2020-02-15 03:02:21 +0300,2020-02-15 05:40:56 +0300,research,CC-BY-NC,https://www.inaturalist.org/observations/38652177,https://inaturalist-open-data.s3.amazonaws.com/photos/61462074/medium.jpg?1581724950,,,,1,0,FALSE,3,"Los Angeles County, US-CA, US",San Clemente,33.01638724,-118.5796525,10,10,,,FALSE,,,,Los Angeles,California,United States,California,Los Angeles,,Cornu aspersum,Garden Snail,Mollusca,480298,Mollusca,Gastropoda,Stylommatophora,Helicidae,,
iNaturalist,38778599,Sat Feb 08 2020 13:14:31 GMT-0800 (PST),2/8/2020 0:00,2/9/2020,2020,2,9,0:14:31,300,Pacific Time (US & Canada),12809,cedric_lee,2020-02-18 04:21:08 +0300,2020-02-20 00:47:56 +0300,research,CC-BY-NC,https://www.inaturalist.org/observations/38778599,https://inaturalist-open-data.s3.amazonaws.com/photos/61685136/medium.jpg?1581988890,,,With Xerarionta,0,0,FALSE,3,"Los Angeles County, US-CA, US",San Clemente,33.023936,-118.568223,111,111,,,FALSE,,,,Los Angeles,California,United States,California,Los Angeles,Garden Snail,Cornu aspersum,Garden Snail,Mollusca,480298,Mollusca,Gastropoda,Stylommatophora,Helicidae,,
iNaturalist,38869463,Wed Feb 19 2020 10:24:08 GMT-0800 (PST),2/19/2020 0:00,2/19/2020,2020,2,19,21:24:08,300,Pacific Time (US & Canada),12809,cedric_lee,2020-02-20 04:45:06 +0300,2020-02-20 07:27:27 +0300,research,CC-BY-NC,https://www.inaturalist.org/observations/38869463,https://inaturalist-open-data.s3.amazonaws.com/photos/61810592/medium.jpg?1582163180,,,,1,0,FALSE,3,"Los Angeles County, US-CA, US",San Clemente,33.02540379,-118.5857019,13,13,,,FALSE,,,,Los Angeles,California,United States,California,Los Angeles,,Cornu aspersum,Garden Snail,Mollusca,480298,Mollusca,Gastropoda,Stylommatophora,Helicidae,,
iNaturalist,38869495,Wed Feb 19 2020 10:27:36 GMT-0800 (PST),2/19/2020 0:00,2/19/2020,2020,2,19,21:27:36,300,Pacific Time (US & Canada),12809,cedric_lee,2020-02-20 04:46:54 +0300,2020-02-20 13:44:04 +0300,research,CC-BY-NC,https://www.inaturalist.org/observations/38869495,https://inaturalist-open-data.s3.amazonaws.com/photos/61810734/medium.jpg?1582163393,,,,1,0,FALSE,3,"Los Angeles County, US-CA, US",San Clemente,33.02530041,-118.5856546,12,12,,,FALSE,,,,Los Angeles,California,United States,California,Los Angeles,,Cornu aspersum,Garden Snail,Mollusca,480298,Mollusca,Gastropoda,Stylommatophora,Helicidae,,
iNaturalist,38869821,Wed Feb 19 2020 10:51:19 GMT-0800 (PST),2/19/2020 0:00,2/19/2020,2020,2,19,21:51:19,300,Pacific Time (US & Canada),12809,cedric_lee,2020-02-20 05:02:27 +0300,2020-02-20 07:26:15 +0300,research,CC-BY-NC,https://www.inaturalist.org/observations/38869821,https://inaturalist-open-data.s3.amazonaws.com/photos/61811310/medium.jpg?1582164229,,,,2,0,FALSE,3,"Los Angeles County, US-CA, US",San Clemente,33.02527359,-118.586365,9,9,,,FALSE,,,,Los Angeles,California,United States,California,Los Angeles,,Cornu aspersum,Garden Snail,Mollusca,480298,Mollusca,Gastropoda,Stylommatophora,Helicidae,,
iNaturalist,38870428,Wed Feb 19 2020 10:48:27 GMT-0800 (PST),2/19/2020 0:00,2/19/2020,2020,2,19,21:48:27,300,Pacific Time (US & Canada),12809,cedric_lee,2020-02-20 05:26:04 +0300,2020-02-20 07:18:42 +0300,research,CC-BY-NC,https://www.inaturalist.org/observations/38870428,https://inaturalist-open-data.s3.amazonaws.com/photos/61812493/medium.jpg?1582165578,,,,1,0,FALSE,3,"Los Angeles County, US-CA, US",San Clemente,33.02547982,-118.5859835,12,12,,,FALSE,,,,Los Angeles,California,United States,California,Los Angeles,,Cornu aspersum,Garden Snail,Mollusca,480298,Mollusca,Gastropoda,Stylommatophora,Helicidae,,
iNaturalist,39071104,Wed Feb 19 2020 11:20:47 GMT-0800 (PST),2/19/2020 0:00,2/19/2020,2020,2,19,22:20:47,300,Pacific Time (US & Canada),12809,cedric_lee,2020-02-23 05:41:30 +0300,2020-02-23 05:59:22 +0300,research,CC-BY-NC,https://www.inaturalist.org/observations/39071104,https://inaturalist-open-data.s3.amazonaws.com/photos/61996402/medium.jpg?1582425758,,,,0,0,FALSE,3,"Los Angeles County, US-CA, US",San Clemente,33.02521433,-118.5870285,26,26,,,FALSE,,,,Los Angeles,California,United States,California,Los Angeles,,Cornu aspersum,Garden Snail,Mollusca,480298,Mollusca,Gastropoda,Stylommatophora,Helicidae,,
iNaturalist,39071502,Wed Feb 19 2020 11:16:29 GMT-0800 (PST),2/19/2020 0:00,2/19/2020,2020,2,19,22:16:29,300,Pacific Time (US & Canada),12809,cedric_lee,2020-02-23 05:52:55 +0300,2020-02-23 05:58:14 +0300,research,CC-BY-NC,https://www.inaturalist.org/observations/39071502,https://inaturalist-open-data.s3.amazonaws.com/photos/61997188/medium.jpg?1582426407,,,,0,0,FALSE,3,"Los Angeles County, US-CA, US",San Clemente,33.02518461,-118.5865472,9,9,,,FALSE,,,,Los Angeles,California,United States,California,Los Angeles,,Cornu aspersum,Garden Snail,Mollusca,480298,Mollusca,Gastropoda,Stylommatophora,Helicidae,,
iNaturalist,39227029,Wed Feb 19 2020 09:47:29 GMT-0800 (PST),2/19/2020 0:00,2/19/2020,2020,2,19,20:47:29,300,Pacific Time (US & Canada),12809,cedric_lee,2020-02-26 04:15:36 +0300,2020-02-26 04:54:48 +0300,research,CC-BY-NC,https://www.inaturalist.org/observations/39227029,https://inaturalist-open-data.s3.amazonaws.com/photos/62206940/medium.jpg?1582679762,,,,1,0,FALSE,3,"Los Angeles County, US-CA, US",San Clemente,33.02722619,-118.58467,9,9,,,FALSE,,,,Los Angeles,California,United States,California,Los Angeles,,Cornu aspersum,Garden Snail,Mollusca,480298,Mollusca,Gastropoda,Stylommatophora,Helicidae,,
iNaturalist,39973388,Wed Mar 11 2020 07:59:21 GMT-0700 (PDT),3/11/2020 0:00,3/11/2020,2020,3,11,17:59:21,300,Pacific Time (US & Canada),2107152,joseph398,2020-03-14 19:29:38 +0300,2020-03-15 02:00:56 +0300,research,,https://www.inaturalist.org/observations/39973388,https://static.inaturalist.org/photos/63475770/medium.jpg?1584203399,,,,1,0,FALSE,3,"San Clemente Island Underwater Range, CA, US",San Clemente,33.01664445,-118.5965367,16,16,,,FALSE,,,,Los Angeles,California,United States,California,Los Angeles,Garden Snail,Cornu aspersum,Garden Snail,Mollusca,480298,Mollusca,Gastropoda,Stylommatophora,Helicidae,,
iNaturalist,40675905,2020/02/19 12:59 PM PST,2/19/2020 0:00,2/19/2020,2020,2,19,23:59:00,300,Pacific Time (US & Canada),266196,shrike2,2020-03-25 05:55:16 +0300,2020-03-25 07:24:42 +0300,research,CC-BY-NC-ND,https://www.inaturalist.org/observations/40675905,https://static.inaturalist.org/photos/64478614/medium.jpeg?1585104775,,,,1,0,FALSE,,"Los Angeles, California, United States",San Clemente,33.02758889,-118.5823278,5,5,,,FALSE,,,,Los Angeles,California,United States,California,Los Angeles,Garden Snail,Cornu aspersum,Garden Snail,Mollusca,480298,Mollusca,Gastropoda,Stylommatophora,Helicidae,,
iNaturalist,40675906,2020/02/19 1:10 PM PST,2/19/2020 0:00,2/20/2020,2020,2,20,0:10:00,300,Pacific Time (US & Canada),266196,shrike2,2020-03-25 05:55:16 +0300,2020-03-25 07:24:53 +0300,research,CC-BY-NC-ND,https://www.inaturalist.org/observations/40675906,https://static.inaturalist.org/photos/64478622/medium.jpg?1585104780,,,,1,0,FALSE,,"Los Angeles County, CA, USA",San Clemente,33.02765556,-118.5844722,5,5,,,FALSE,,,,Los Angeles,California,United States,California,Los Angeles,Garden Snail,Cornu aspersum,Garden Snail,Mollusca,480298,Mollusca,Gastropoda,Stylommatophora,Helicidae,,
iNaturalist,40676012,2020/02/19 10:33 AM PST,2/19/2020 0:00,2/19/2020,2020,2,19,21:33:00,300,Pacific Time (US & Canada),266196,shrike2,2020-03-25 05:58:06 +0300,2020-03-28 23:05:20 +0300,research,CC-BY-NC-ND,https://www.inaturalist.org/observations/40676012,https://static.inaturalist.org/photos/64478902/medium.jpeg?1585105021,,,,2,0,FALSE,,"Los Angeles, California, United States",San Clemente,33.02809167,-118.5846417,10,10,,,FALSE,,,,Los Angeles,California,United States,California,Los Angeles,Garden Snail,Cornu aspersum,Garden Snail,Mollusca,480298,Mollusca,Gastropoda,Stylommatophora,Helicidae,,
iNaturalist,41779191,2019/06/24 6:44 AM PDT,6/24/2019 0:00,6/24/2019,2019,6,24,16:44:00,300,Pacific Time (US & Canada),173183,serpophaga,2020-04-09 22:38:09 +0300,2020-04-25 07:00:06 +0300,research,CC-BY-NC,https://www.inaturalist.org/observations/41779191,https://inaturalist-open-data.s3.amazonaws.com/photos/66288462/medium.jpeg?1586460869,,,,4,0,FALSE,,"Los Angeles County, CA, USA",San Clemente,32.99701944,-118.5562361,30,30,,,FALSE,,,,Los Angeles,California,United States,California,Los Angeles,Garden Snail,Cornu aspersum,Garden Snail,Mollusca,480298,Mollusca,Gastropoda,Stylommatophora,Helicidae,,
iNaturalist,74213312,Fri Apr 16 2021 13:05:26 GMT-0700 (PDT),4/16/2021 0:00,4/16/2021,2021,4,16,23:05:26,300,Pacific Time (US & Canada),246499,sulavanderplank,2021-04-17 08:54:40 +0300,2021-04-18 03:33:22 +0300,research,CC-BY,https://www.inaturalist.org/observations/74213312,https://inaturalist-open-data.s3.amazonaws.com/photos/121268283/medium.jpg?1618638884,,,,2,0,FALSE,3,"San Clemente Island Underwater Range, CA, US",San Clemente,33.02773617,-118.583755,4,4,,,FALSE,,,,Los Angeles,California,United States,California,Los Angeles,Gefleckte Weinbergschnecke,Cornu aspersum,Garden Snail,Mollusca,480298,Mollusca,Gastropoda,Stylommatophora,Helicidae,,
iNaturalist,913653,Sat Oct 04 2014 12:52:48 GMT-0700 (PDT),10/4/2014 0:00,10/4/2014,2014,10,4,23:52:48,400,Pacific Time (US & Canada),32423,pkleeman,2014-10-08 07:58:35 +0400,2019-10-20 01:17:43 +0300,research,CC-BY-NC,http://www.inaturalist.org/observations/913653,https://inaturalist-open-data.s3.amazonaws.com/photos/1165606/medium.jpg?1412740873,,,,3,0,FALSE,3,"San Nicolas Naval Facility, Channel Is Air Guard Station, CA, US",San Nicolas,33.25832,-119.5207967,,,,,FALSE,,,,Ventura,California,United States,California,Ventura,Garden Snail,Cornu aspersum,Garden Snail,Mollusca,480298,Mollusca,Gastropoda,Stylommatophora,Helicidae,,
iNaturalist,19684317,2012/10/13 1:38 PM MST,10/13/2012 0:00,10/13/2012,2012,10,13,23:38:00,400,Mountain Time (US & Canada),19215,tsirtalis,2019-01-17 03:49:29 +0300,2019-11-05 12:49:30 +0300,research,CC-BY-NC-ND,https://www.inaturalist.org/observations/19684317,https://static.inaturalist.org/photos/30318367/medium.jpeg?1547683972,,,,2,0,FALSE,,"Ventura County, CA, USA",San Nicolas,33.27858667,-119.5245183,,,,,FALSE,,,,Ventura,California,United States,California,Ventura,Garden Snail,Cornu aspersum,Garden Snail,Mollusca,480298,Mollusca,Gastropoda,Stylommatophora,Helicidae,,
iNaturalist,19684325,2012/10/13 2:07 PM MST,10/13/2012 0:00,10/14/2012,2012,10,14,0:07:00,400,Mountain Time (US & Canada),19215,tsirtalis,2019-01-17 03:49:36 +0300,2019-01-19 23:34:57 +0300,research,CC-BY-NC-ND,https://www.inaturalist.org/observations/19684325,https://static.inaturalist.org/photos/30318723/medium.jpeg?1547684568,,,,1,0,FALSE,,"Ventura County, CA, USA",San Nicolas,33.27969,-119.5225017,,,,,FALSE,,,,Ventura,California,United States,California,Ventura,Garden Snail,Cornu aspersum,Garden Snail,Mollusca,480298,Mollusca,Gastropoda,Stylommatophora,Helicidae,,
iNaturalist,20859002,2019/02/28 10:29 AM PST,2/28/2019 0:00,2/28/2019,2019,2,28,21:29:00,300,Pacific Time (US & Canada),173183,serpophaga,2019-03-01 23:25:02 +0300,2019-08-14 04:57:43 +0300,research,CC-BY-NC,https://www.inaturalist.org/observations/20859002,https://inaturalist-open-data.s3.amazonaws.com/photos/32180184/medium.jpg?1551471876,,,,4,0,FALSE,,"Ventura, California, United States",San Nicolas,33.25754167,-119.5476222,5,5,,,FALSE,,,,Ventura,California,United States,California,Ventura,Garden Snail,Cornu aspersum,Garden Snail,Mollusca,480298,Mollusca,Gastropoda,Stylommatophora,Helicidae,,
iNaturalist,26984576,2019-06-12 4:38:19 PM PDT,6/12/2019 0:00,6/13/2019,2019,6,13,2:38:19,300,Pacific Time (US & Canada),34488,pileated,2019-06-14 23:53:33 +0300,2021-02-11 06:31:56 +0300,research,CC-BY,https://www.inaturalist.org/observations/26984576,https://inaturalist-open-data.s3.amazonaws.com/photos/41938479/medium.jpeg?1560545616,,,,4,0,FALSE,2,"San Nicolas Island, California 93042, USA",San Nicolas,33.25756073,-119.5484695,,,,,FALSE,gps,gps,,Ventura,California,United States,California,Ventura,Garden Snail,Cornu aspersum,Garden Snail,Mollusca,480298,Mollusca,Gastropoda,Stylommatophora,Helicidae,,
iNaturalist,26984996,2019-06-12 1:44:29 PM PDT,6/12/2019 0:00,6/12/2019,2019,6,12,23:44:29,300,Pacific Time (US & Canada),34488,pileated,2019-06-15 00:01:45 +0300,2021-02-11 06:33:00 +0300,research,CC-BY,https://www.inaturalist.org/observations/26984996,https://inaturalist-open-data.s3.amazonaws.com/photos/41939214/medium.jpg?1560546107,,,,2,0,FALSE,2,"San Nicolas Island, California 93042, USA",San Nicolas,33.26055908,-119.5527191,,,,,FALSE,gps,gps,,Ventura,California,United States,California,Ventura,Garden Snail,Cornu aspersum,Garden Snail,Mollusca,480298,Mollusca,Gastropoda,Stylommatophora,Helicidae,,
iNaturalist,26985324,2019-06-12 12:22:01 PM PDT,6/12/2019 0:00,6/12/2019,2019,6,12,22:22:01,300,Pacific Time (US & Canada),34488,pileated,2019-06-15 00:07:02 +0300,2021-02-11 06:33:36 +0300,research,CC-BY,https://www.inaturalist.org/observations/26985324,https://inaturalist-open-data.s3.amazonaws.com/photos/41939643/medium.jpeg?1560546428,,,,5,0,FALSE,2,"San Nicolas Island, California 93042, USA",San Nicolas,33.26081467,-119.5536652,,,,,FALSE,gps,gps,,Ventura,California,United States,California,Ventura,Garden Snail,Cornu aspersum,Garden Snail,Mollusca,480298,Mollusca,Gastropoda,Stylommatophora,Helicidae,,
iNaturalist,62076197,2011/02/07 12:40 PM PST,2/7/2011 0:00,2/7/2011,2011,2,7,23:40:00,300,Pacific Time (US & Canada),14811,snakeinmypocket,2020-10-09 03:20:25 +0300,2020-10-17 02:13:17 +0300,research,CC-BY-NC-ND,https://www.inaturalist.org/observations/62076197,https://inaturalist-open-data.s3.amazonaws.com/photos/99377507/medium.jpg?1602186239,,,,1,0,FALSE,,"Ventura County, CA, USA",San Nicolas,33.24256261,-119.4912103,4,4,,,FALSE,,,,Ventura,California,United States,California,Ventura,Caracol europeo de jardín,Cornu aspersum,Garden Snail,Mollusca,480298,Mollusca,Gastropoda,Stylommatophora,Helicidae,,
iNaturalist,71010950,2018/01/29 11:01 AM PST,1/29/2018 0:00,1/29/2018,2018,1,29,22:01:00,300,Pacific Time (US & Canada),173183,serpophaga,2021-03-11 21:15:37 +0300,2021-03-12 19:53:11 +0300,research,CC-BY-NC,https://www.inaturalist.org/observations/71010950,https://inaturalist-open-data.s3.amazonaws.com/photos/115543066/medium.jpeg?1615486280,,,,3,0,FALSE,,"Ventura County, CA, USA",San Nicolas,33.27920278,-119.5438222,10,10,,,FALSE,,,,Ventura,California,United States,California,Ventura,Garden Snail,Cornu aspersum,Garden Snail,Mollusca,480298,Mollusca,Gastropoda,Stylommatophora,Helicidae,,
iNaturalist,86817817,Sat Jul 10 2021 15:19:50 GMT-0700 (PDT),7/10/2021 0:00,7/11/2021,2021,7,11,1:19:50,300,Pacific Time (US & Canada),2442991,amykhenry,2021-07-13 07:54:59 +0300,2021-07-14 16:28:49 +0300,research,,https://www.inaturalist.org/observations/86817817,https://static.inaturalist.org/photos/143090592/medium.jpg?1626152108,,,,3,0,FALSE,3,"San Nicolas Naval Facility, CA, US",San Nicolas,33.26969162,-119.518405,4318,4318,,,FALSE,,,,Ventura,California,United States,California,Ventura,Garden Snail,Cornu aspersum,Garden Snail,Mollusca,480298,Mollusca,Gastropoda,Stylommatophora,Helicidae,,
iNaturalist,1472535,7/19/2014 14:35,7/19/2014 0:00,7/20/2014,2014,7,20,1:35:35,400,Pacific Time (US & Canada),95810,kiloueka,2015-05-10 10:50:08 +0300,2017-09-14 06:27:51 +0300,research,CC-BY-NC,http://www.inaturalist.org/observations/1472535,https://inaturalist-open-data.s3.amazonaws.com/photos/1825557/medium.JPG?1431244218,,,,3,0,FALSE,,"Avalon, Ca",Santa Catalina,33.342819,-118.328228,3273,3273,,,FALSE,,,,Los Angeles,California,United States,California,Los Angeles,Garden Snail,Cornu aspersum,Garden Snail,Mollusca,480298,Mollusca,Gastropoda,Stylommatophora,Helicidae,,
iNaturalist,3820246,2016/08/06 2:11 PM PDT,8/6/2016 0:00,8/7/2016,2016,8,7,0:11:00,300,Pacific Time (US & Canada),12809,cedric_lee,2016-08-07 10:54:48 +0300,2017-04-05 02:05:46 +0300,research,CC-BY-NC,http://www.inaturalist.org/observations/3820246,https://static.inaturalist.org/photos/4466904/medium.jpeg?1470552562,,,,2,0,FALSE,,"Los Angeles, California, United States",Santa Catalina,33.34029333,-118.32207,,,,,FALSE,,,,Los Angeles,California,United States,California,Los Angeles,Garden Snail,Cornu aspersum,Garden Snail,Mollusca,480298,Mollusca,Gastropoda,Stylommatophora,Helicidae,,
iNaturalist,3820255,2016/08/06 2:16 PM PDT,8/6/2016 0:00,8/7/2016,2016,8,7,0:16:00,300,Pacific Time (US & Canada),12809,cedric_lee,2016-08-07 10:54:52 +0300,2017-04-05 02:05:46 +0300,research,CC-BY-NC,http://www.inaturalist.org/observations/3820255,https://static.inaturalist.org/photos/4466917/medium.jpeg?1470552641,,,,2,0,FALSE,,"Los Angeles, California, United States",Santa Catalina,33.3393,-118.322605,,,,,FALSE,,,,Los Angeles,California,United States,California,Los Angeles,Garden Snail,Cornu aspersum,Garden Snail,Mollusca,480298,Mollusca,Gastropoda,Stylommatophora,Helicidae,,
iNaturalist,5485230,2017-03-27 8:56:45 PM PDT,3/27/2017 0:00,3/28/2017,2017,3,28,6:56:45,300,Pacific Time (US & Canada),392423,bjdion,2017-03-28 06:57:21 +0300,2018-09-08 23:54:46 +0300,research,CC-BY-NC-SA,https://www.inaturalist.org/observations/5485230,https://inaturalist-open-data.s3.amazonaws.com/photos/6756868/medium.jpeg?1490673449,,,,2,0,FALSE,2,"Avalon, CA 90704",Santa Catalina,33.34067917,-118.3381424,,,,,FALSE,gps,gps,,Los Angeles,California,United States,California,Los Angeles,Garden Snail,Cornu aspersum,Garden Snail,Mollusca,480298,Mollusca,Gastropoda,Stylommatophora,Helicidae,,
iNaturalist,6815166,2017-06-22 7:59:31 AM PDT,6/22/2017 0:00,6/22/2017,2017,6,22,17:59:31,300,Pacific Time (US & Canada),518434,lisa189,2017-06-27 03:31:43 +0300,2019-01-13 22:39:52 +0300,research,,https://www.inaturalist.org/observations/6815166,https://static.inaturalist.org/photos/8673448/medium.jpeg?1498523508,,,,2,0,FALSE,2,"Avalon, CA 90704",Santa Catalina,33.4448336,-118.4820852,21,21,,,FALSE,,,,Los Angeles,California,United States,California,Los Angeles,Garden Snail,Cornu aspersum,Garden Snail,Mollusca,480298,Mollusca,Gastropoda,Stylommatophora,Helicidae,,
iNaturalist,9843052,2018-02-09 10:28:07 AM PST,2/9/2018 0:00,2/9/2018,2018,2,9,21:28:07,300,Pacific Time (US & Canada),392423,bjdion,2018-02-13 06:48:19 +0300,2019-12-31 10:12:33 +0300,research,CC-BY-NC-SA,https://www.inaturalist.org/observations/9843052,https://inaturalist-open-data.s3.amazonaws.com/photos/13481164/medium.jpeg?1518493704,,,,3,0,FALSE,2,"410 Avalon Cyn Rd, Avalon, CA 90704, USA",Santa Catalina,33.33956373,-118.3283771,9,9,,,FALSE,,,,Los Angeles,California,United States,California,Los Angeles,Garden Snail,Cornu aspersum,Garden Snail,Mollusca,480298,Mollusca,Gastropoda,Stylommatophora,Helicidae,,
iNaturalist,10064316,2018-03-02 8:31:54 PM PST,3/2/2018 0:00,3/3/2018,2018,3,3,7:31:54,300,Pacific Time (US & Canada),392423,bjdion,2018-03-03 08:02:03 +0300,2018-09-08 23:54:48 +0300,research,CC-BY-NC-SA,https://www.inaturalist.org/observations/10064316,https://inaturalist-open-data.s3.amazonaws.com/photos/13855221/medium.jpeg?1520053334,,,Scores coming out into the rain ,1,0,FALSE,2,"207-211 Whittley Ave, Avalon, CA 90704, USA",Santa Catalina,33.3442879,-118.3287957,7,7,,,FALSE,,,,Los Angeles,California,United States,California,Los Angeles,Garden Snail,Cornu aspersum,Garden Snail,Mollusca,480298,Mollusca,Gastropoda,Stylommatophora,Helicidae,,
iNaturalist,10183822,2018-03-11 8:02:09 AM PDT,3/11/2018 0:00,3/11/2018,2018,3,11,18:02:09,300,Pacific Time (US & Canada),392423,bjdion,2018-03-11 18:14:46 +0300,2020-01-01 02:27:56 +0300,research,CC-BY-NC-SA,https://www.inaturalist.org/observations/10183822,https://inaturalist-open-data.s3.amazonaws.com/photos/14063123/medium.jpeg?1520781299,,,,3,0,FALSE,2,"100 Avalon Cyn Rd, Avalon, CA 90704, USA",Santa Catalina,33.33176369,-118.3358767,9,9,,,FALSE,,,,Los Angeles,California,United States,California,Los Angeles,Garden Snail,Cornu aspersum,Garden Snail,Mollusca,480298,Mollusca,Gastropoda,Stylommatophora,Helicidae,,
iNaturalist,12022721,2018/04/29 1:19 PM PDT,4/29/2018 0:00,4/29/2018,2018,4,29,23:19:00,300,Pacific Time (US & Canada),6971,silversea_starsong,2018-05-02 04:25:13 +0300,2019-05-06 08:02:05 +0300,research,CC-BY-NC,https://www.inaturalist.org/observations/12022721,https://inaturalist-open-data.s3.amazonaws.com/photos/17231234/medium.jpeg?1525224298,,,,4,0,FALSE,,"Los Angeles County, CA, USA",Santa Catalina,33.35584333,-118.437085,,,,,FALSE,,,,Los Angeles,California,United States,California,Los Angeles,Petit - gris,Cornu aspersum,Garden Snail,Mollusca,480298,Mollusca,Gastropoda,Stylommatophora,Helicidae,,
iNaturalist,12530960,2018-05-16 1:18:46 PM MST,5/16/2018 0:00,5/16/2018,2018,5,16,22:18:46,300,Mountain Time (US & Canada),392423,bjdion,2018-05-17 03:56:41 +0300,2019-12-31 06:22:34 +0300,research,CC-BY-NC-SA,https://www.inaturalist.org/observations/12530960,https://inaturalist-open-data.s3.amazonaws.com/photos/18097624/medium.jpeg?1526518618,,,In dense fennel (F. vulgare) stand,4,0,FALSE,2,"Los Angeles County, US-CA, US",Santa Catalina,33.35084764,-118.4326793,12,12,,,FALSE,,,,Los Angeles,California,United States,California,Los Angeles,Garden Snail,Cornu aspersum,Garden Snail,Mollusca,480298,Mollusca,Gastropoda,Stylommatophora,Helicidae,,
iNaturalist,12652358,2018-05-19 9:47:07 AM PDT,5/19/2018 0:00,5/19/2018,2018,5,19,19:47:07,300,Pacific Time (US & Canada),835319,webe6794,2018-05-20 23:36:47 +0300,2019-12-31 08:38:27 +0300,research,CC-BY-NC,https://www.inaturalist.org/observations/12652358,https://inaturalist-open-data.s3.amazonaws.com/photos/18305667/medium.jpeg?1526848725,,,,4,0,FALSE,2,"208 Metropole Ave, Avalon, CA 90704, USA",Santa Catalina,33.34309006,-118.3273849,,,,,FALSE,gps,gps,,Los Angeles,California,United States,California,Los Angeles,Garden Snail,Cornu aspersum,Garden Snail,Mollusca,480298,Mollusca,Gastropoda,Stylommatophora,Helicidae,,
iNaturalist,19602740,2019-01-12 4:29:06 PM PST,1/12/2019 0:00,1/13/2019,2019,1,13,3:29:06,300,Pacific Time (US & Canada),392423,bjdion,2019-01-13 04:28:56 +0300,2019-01-16 06:32:04 +0300,research,CC-BY-NC-SA,https://www.inaturalist.org/observations/19602740,https://inaturalist-open-data.s3.amazonaws.com/photos/30179508/medium.jpeg?1547342942,,,,2,0,FALSE,2,"100 Avalon Cyn Rd, Avalon, CA 90704, USA",Santa Catalina,33.33060913,-118.3353968,12,12,,,FALSE,,,,Los Angeles,California,United States,California,Los Angeles,Garden Snail,Cornu aspersum,Garden Snail,Mollusca,480298,Mollusca,Gastropoda,Stylommatophora,Helicidae,,
iNaturalist,21080057,Sat Mar 09 2019 06:49:13 GMT-0800 (PST),3/9/2019 0:00,3/9/2019,2019,3,9,17:49:13,300,Pacific Time (US & Canada),834926,arapalandj,2019-03-09 17:58:05 +0300,2019-04-16 07:24:07 +0300,research,,https://www.inaturalist.org/observations/21080057,https://static.inaturalist.org/photos/32574145/medium.jpg?1552143489,,,"Found underneath a Bacci ball in the early morning. 
",2,0,FALSE,3,"Santa Catalina Island, , CA, US",Santa Catalina,33.4454947,-118.4800319,24,24,,,FALSE,,,,Los Angeles,California,United States,California,Los Angeles,Garden Snail,Cornu aspersum,Garden Snail,Mollusca,480298,Mollusca,Gastropoda,Stylommatophora,Helicidae,,
iNaturalist,22160736,2019-04-07 1:02:10 PM PDT,4/7/2019 0:00,4/7/2019,2019,4,7,23:02:10,300,Pacific Time (US & Canada),1502858,jeanshelton,2019-04-08 00:09:21 +0300,2019-04-16 01:32:38 +0300,research,,https://www.inaturalist.org/observations/22160736,https://static.inaturalist.org/photos/34309330/medium.jpeg?1554671386,,,,1,0,FALSE,2,"Los Angeles County, US-CA, US",Santa Catalina,33.34246826,-118.327713,,,,,FALSE,gps,gps,,Los Angeles,California,United States,California,Los Angeles,Garden Snail,Cornu aspersum,Garden Snail,Mollusca,480298,Mollusca,Gastropoda,Stylommatophora,Helicidae,,
iNaturalist,24205048,2019-04-30 11:25:49 AM PDT,4/30/2019 0:00,4/30/2019,2019,4,30,21:25:49,300,Pacific Time (US & Canada),1704735,sky_findley,2019-04-30 21:26:20 +0300,2019-07-02 03:25:43 +0300,research,CC-BY-NC,https://www.inaturalist.org/observations/24205048,https://inaturalist-open-data.s3.amazonaws.com/photos/37429502/medium.jpeg?1556648786,,,,2,0,FALSE,2,"100 Banning Dr, Avalon, CA 90704, USA",Santa Catalina,33.34159407,-118.3314139,4,4,,,FALSE,,,,Los Angeles,California,United States,California,Los Angeles,Garden Snail,Cornu aspersum,Garden Snail,Mollusca,480298,Mollusca,Gastropoda,Stylommatophora,Helicidae,,
iNaturalist,24599411,2011/04/22 11:44 AM PDT,4/22/2011 0:00,4/22/2011,2011,4,22,22:44:00,400,Pacific Time (US & Canada),99304,phylogenomics,2019-05-05 19:53:07 +0300,2019-12-30 19:55:07 +0300,research,CC-BY,https://www.inaturalist.org/observations/24599411,https://inaturalist-open-data.s3.amazonaws.com/photos/38036279/medium.jpg?1557074956,,iPhoto Original,,2,0,FALSE,,"Los Angeles County, CA, USA",Santa Catalina,33.44390409,-118.4795902,31,31,,,FALSE,,,,Los Angeles,California,United States,California,Los Angeles,Garden Snail,Cornu aspersum,Garden Snail,Mollusca,480298,Mollusca,Gastropoda,Stylommatophora,Helicidae,,
iNaturalist,24599423,2011/04/22 11:43 AM PDT,4/22/2011 0:00,4/22/2011,2011,4,22,22:43:00,400,Pacific Time (US & Canada),99304,phylogenomics,2019-05-05 19:53:09 +0300,2019-12-30 19:54:49 +0300,research,CC-BY,https://www.inaturalist.org/observations/24599423,https://inaturalist-open-data.s3.amazonaws.com/photos/38036311/medium.jpg?1557074972,,iPhoto Original,,2,0,FALSE,,"Los Angeles County, CA, USA",Santa Catalina,33.44390409,-118.4795902,31,31,,,FALSE,,,,Los Angeles,California,United States,California,Los Angeles,Garden Snail,Cornu aspersum,Garden Snail,Mollusca,480298,Mollusca,Gastropoda,Stylommatophora,Helicidae,,
iNaturalist,24602826,2012/07/16 10:54 AM PDT,7/16/2012 0:00,7/16/2012,2012,7,16,21:54:00,400,Pacific Time (US & Canada),99304,phylogenomics,2019-05-05 20:28:14 +0300,2019-08-02 08:54:05 +0300,research,CC-BY,https://www.inaturalist.org/observations/24602826,https://inaturalist-open-data.s3.amazonaws.com/photos/38039842/medium.jpg?1557076935,,,,2,0,FALSE,,"Los Angeles County, CA, USA",Santa Catalina,33.4412892,-118.4991025,411,411,,,FALSE,,,,Los Angeles,California,United States,California,Los Angeles,Garden Snail,Cornu aspersum,Garden Snail,Mollusca,480298,Mollusca,Gastropoda,Stylommatophora,Helicidae,,
iNaturalist,25472871,2019-05-20 4:24:27 PM PDT,5/20/2019 0:00,5/21/2019,2019,5,21,2:24:27,300,Pacific Time (US & Canada),1680342,ecozippertfb,2019-05-21 02:30:26 +0300,2019-12-30 19:24:45 +0300,research,CC-BY-NC,https://www.inaturalist.org/observations/25472871,https://inaturalist-open-data.s3.amazonaws.com/photos/39457666/medium.jpeg?1558395031,,,,3,0,FALSE,2,"Avalon, CA 90704, USA",Santa Catalina,33.34483801,-118.3285394,29,29,,,FALSE,,,,Los Angeles,California,United States,California,Los Angeles,Garden Snail,Cornu aspersum,Garden Snail,Mollusca,480298,Mollusca,Gastropoda,Stylommatophora,Helicidae,,
iNaturalist,25594141,Tue May 21 2019 11:31:30 GMT-0700 (PDT),5/21/2019 0:00,5/21/2019,2019,5,21,21:31:30,300,Pacific Time (US & Canada),1512775,parisrebl,2019-05-23 04:07:15 +0300,2019-07-11 09:54:30 +0300,research,CC-BY-NC,https://www.inaturalist.org/observations/25594141,https://inaturalist-open-data.s3.amazonaws.com/photos/39659777/medium.jpg?1558573645,,,,2,0,FALSE,3,"Los Angeles County, US-CA, US",Santa Catalina,33.35056413,-118.4327894,5,5,,,FALSE,,,,Los Angeles,California,United States,California,Los Angeles,Garden Snail,Cornu aspersum,Garden Snail,Mollusca,480298,Mollusca,Gastropoda,Stylommatophora,Helicidae,,
iNaturalist,26097159,2019-05-30 10:36:37 AM PDT,5/30/2019 0:00,5/30/2019,2019,5,30,20:36:37,300,Pacific Time (US & Canada),772899,ljbrenner,2019-05-31 06:44:15 +0300,2019-12-30 19:59:10 +0300,research,CC-BY-NC,https://www.inaturalist.org/observations/26097159,https://inaturalist-open-data.s3.amazonaws.com/photos/40493150/medium.jpeg?1559274270,,,,4,0,FALSE,2,"Los Angeles County, US-CA, US",Santa Catalina,33.35605136,-118.4452249,12,12,,,FALSE,,,,Los Angeles,California,United States,California,Los Angeles,Garden Snail,Cornu aspersum,Garden Snail,Mollusca,480298,Mollusca,Gastropoda,Stylommatophora,Helicidae,,
iNaturalist,30905165,2019/08/15 1:49 PM PDT,8/15/2019 0:00,8/15/2019,2019,8,15,23:49:00,300,Pacific Time (US & Canada),772899,ljbrenner,2019-08-16 03:04:43 +0300,2019-12-31 05:21:16 +0300,research,CC-BY-NC,https://www.inaturalist.org/observations/30905165,https://inaturalist-open-data.s3.amazonaws.com/photos/48314500/medium.jpeg?1565913580,,,Found on the back of a truck,3,0,FALSE,,"Los Angeles County, US-CA, US",Santa Catalina,33.28817678,-118.242818,488,28984,obscured,,TRUE,,,,Los Angeles,California,United States,California,Los Angeles,Garden Snail,Cornu aspersum,Garden Snail,Mollusca,480298,Mollusca,Gastropoda,Stylommatophora,Helicidae,,
iNaturalist,39979584,Mon Mar 09 2020 10:11:48 GMT-0700 (PDT),3/9/2020 0:00,3/9/2020,2020,3,9,20:11:48,300,Pacific Time (US & Canada),2239386,jgarcia850,2020-03-14 21:17:43 +0300,2020-06-21 00:58:40 +0300,research,CC-BY-NC,https://www.inaturalist.org/observations/39979584,https://inaturalist-open-data.s3.amazonaws.com/photos/63485905/medium.jpg?1584209870,,,,2,0,FALSE,3,"Santa Catalina Island, CA, US",Santa Catalina,33.44046667,-118.5051883,48,48,,,FALSE,,,,Los Angeles,California,United States,California,Los Angeles,Garden Snail,Cornu aspersum,Garden Snail,Mollusca,480298,Mollusca,Gastropoda,Stylommatophora,Helicidae,,
iNaturalist,43511354,Wed Apr 22 2020 08:04:01 GMT-0700 (PDT),4/22/2020 0:00,4/22/2020,2020,4,22,18:04:01,300,Pacific Time (US & Canada),81668,monicatydlaska,2020-04-26 04:30:13 +0300,2021-04-15 05:56:51 +0300,research,,https://www.inaturalist.org/observations/43511354,https://static.inaturalist.org/photos/69033757/medium.jpg?1587864630,,,,3,0,FALSE,3,"Santa Catalina Island, CA, US",Santa Catalina,33.355755,-118.4372333,10,10,,,FALSE,,,,Los Angeles,California,United States,California,Los Angeles,Garden Snail,Cornu aspersum,Garden Snail,Mollusca,480298,Mollusca,Gastropoda,Stylommatophora,Helicidae,,
iNaturalist,63248888,Thu Oct 22 2020 08:58:09 GMT-0700 (PDT),10/22/2020 0:00,10/22/2020,2020,10,22,18:58:09,300,Pacific Time (US & Canada),3546833,emmalynskey,2020-10-22 19:00:03 +0300,2021-02-12 01:01:27 +0300,research,CC-BY-NC,https://www.inaturalist.org/observations/63248888,https://inaturalist-open-data.s3.amazonaws.com/photos/101479470/medium.jpg?1603383748,,,,3,0,FALSE,3,"Santa Catalina Island, CA, US",Santa Catalina,33.4414033,-118.498375,6,6,,,FALSE,,,,Los Angeles,California,United States,California,Los Angeles,Garden Snail,Cornu aspersum,Garden Snail,Mollusca,480298,Mollusca,Gastropoda,Stylommatophora,Helicidae,,
iNaturalist,66359605,2020-12-09 6:42:40 PM PST,12/9/2020 0:00,12/10/2020,2020,12,10,5:42:40,300,Pacific Time (US & Canada),52738,laurendennhardt,2020-12-10 05:42:54 +0300,2021-03-05 08:40:47 +0300,research,,https://www.inaturalist.org/observations/66359605,https://static.inaturalist.org/photos/106959589/medium.jpeg?1607568178,,,,2,0,FALSE,2,"Avalon, CA 90704, USA",Santa Catalina,33.34327588,-118.3292262,7,7,,,FALSE,,,,Los Angeles,California,United States,California,Los Angeles,Garden Snail,Cornu aspersum,Garden Snail,Mollusca,480298,Mollusca,Gastropoda,Stylommatophora,Helicidae,,
iNaturalist,74892215,2021-04-20 12:34:42 PM PDT,4/20/2021 0:00,4/20/2021,2021,4,20,22:34:42,300,Pacific Time (US & Canada),305051,kylegunther,2021-04-23 02:59:43 +0300,2021-05-02 07:01:36 +0300,needs_id,,https://www.inaturalist.org/observations/74892215,https://static.inaturalist.org/photos/122459067/medium.jpeg?1619135985,,,,1,0,FALSE,2,"Los Angeles County, US-CA, US",Santa Catalina,33.44526363,-118.4573824,9,28957,obscured,,TRUE,gps,gps,,Los Angeles,California,United States,California,Los Angeles,Garden Snail,Cornu aspersum,Garden Snail,Mollusca,480298,Mollusca,Gastropoda,Stylommatophora,Helicidae,,
iNaturalist,74933641,2021-04-21 12:27:34 PM PDT,4/21/2021 0:00,4/21/2021,2021,4,21,22:27:34,300,Pacific Time (US & Canada),305051,kylegunther,2021-04-23 18:07:10 +0300,2021-05-02 06:59:17 +0300,needs_id,,https://www.inaturalist.org/observations/74933641,https://static.inaturalist.org/photos/122532986/medium.jpeg?1619190439,,,,1,0,FALSE,2,"Santa Catalina Island, California 90704, USA",Santa Catalina,33.41295808,-118.4689695,11,11,,,FALSE,gps,gps,,Los Angeles,California,United States,California,Los Angeles,Garden Snail,Cornu aspersum,Garden Snail,Mollusca,480298,Mollusca,Gastropoda,Stylommatophora,Helicidae,,
iNaturalist,21350794,2019-03-06 3:43:49 PM PST,3/6/2019 0:00,,,,,,,Pacific Time (US & Canada),34488,pileated,2019-03-18 09:04:55 +0300,2021-01-30 09:55:12 +0300,needs_id,CC-BY,https://www.inaturalist.org/observations/21350794,https://inaturalist-open-data.s3.amazonaws.com/photos/33022424/medium.jpg?1552889097,,,,2,0,FALSE,2,"Unnamed Road, California, USA",San Clemente,33.00000085,-118.5536623,352,352,,,FALSE,gps,gps,,Los Angeles,California,United States,California,Los Angeles,Smooth Land Slugs,Deroceras,Smooth Land Slugs,Mollusca,87902,Mollusca,Gastropoda,Stylommatophora,Agriolimacidae,,
iNaturalist,37628837,Wed Jan 15 2020 14:15:27 GMT-0800 (PST),1/15/2020 0:00,1/16/2020,2020,1,16,1:15:27,300,Pacific Time (US & Canada),266196,shrike2,2020-01-16 01:17:40 +0300,2020-04-07 02:07:10 +0300,research,CC-BY-NC-ND,https://www.inaturalist.org/observations/37628837,https://static.inaturalist.org/photos/59688145/medium.jpg?1579126682,,,,1,0,FALSE,3,"San Clemente Island Underwater Range, CA, US",San Clemente,32.99822455,-118.553163,5,5,,,FALSE,,,,Los Angeles,California,United States,California,Los Angeles,Chestnut Slug,Deroceras invadens,Chestnut Slug,Mollusca,366887,Mollusca,Gastropoda,Stylommatophora,Agriolimacidae,,
iNaturalist,37636598,Wed Jan 15 2020 10:36:52 GMT-0800 (PST),1/15/2020 0:00,1/15/2020,2020,1,15,21:36:52,300,Pacific Time (US & Canada),12809,cedric_lee,2020-01-16 05:16:42 +0300,2020-11-21 17:02:26 +0300,research,CC-BY-NC,https://www.inaturalist.org/observations/37636598,https://inaturalist-open-data.s3.amazonaws.com/photos/59701701/medium.jpg?1579141036,,,,2,0,FALSE,3,"Los Angeles County, US-CA, US",San Clemente,32.99811486,-118.5532788,4,4,,,FALSE,,,,Los Angeles,California,United States,California,Los Angeles,,Deroceras invadens,Chestnut Slug,Mollusca,366887,Mollusca,Gastropoda,Stylommatophora,Agriolimacidae,,
iNaturalist,37555994,Sun Jan 12 2020 14:36:52 GMT-0800 (PST),1/12/2020 0:00,1/13/2020,2020,1,13,1:36:52,300,Pacific Time (US & Canada),12809,cedric_lee,2020-01-13 16:44:37 +0300,2020-07-03 00:24:18 +0300,research,CC-BY-NC,https://www.inaturalist.org/observations/37555994,https://inaturalist-open-data.s3.amazonaws.com/photos/59559559/medium.jpg?1579377339,,,,1,0,FALSE,3,"Los Angeles County, US-CA, US",San Clemente,33.00244836,-118.5561552,37,37,,,FALSE,,,,Los Angeles,California,United States,California,Los Angeles,Meadow Slug,Deroceras laeve,Meadow Slug,Mollusca,209624,Mollusca,Gastropoda,Stylommatophora,Agriolimacidae,,
iNaturalist,37568215,Sun Jan 12 2020 14:35:25 GMT-0800 (PST),1/12/2020 0:00,1/13/2020,2020,1,13,1:35:25,300,Pacific Time (US & Canada),266196,shrike2,2020-01-14 01:09:55 +0300,2020-07-03 00:24:18 +0300,research,CC-BY-NC-ND,https://www.inaturalist.org/observations/37568215,https://static.inaturalist.org/photos/59580880/medium.jpg?1578953411,,,,1,0,FALSE,3,"San Clemente Island Underwater Range, CA, US",San Clemente,33.00233024,-118.5561147,19,19,,,FALSE,,,,Los Angeles,California,United States,California,Los Angeles,Meadow Slug,Deroceras laeve,Meadow Slug,Mollusca,209624,Mollusca,Gastropoda,Stylommatophora,Agriolimacidae,,
iNaturalist,37935473,Fri Jan 24 2020 17:04:20 GMT-0800 (PST),1/24/2020 0:00,1/25/2020,2020,1,25,4:04:20,300,Pacific Time (US & Canada),12809,cedric_lee,2020-01-25 05:55:59 +0300,2020-11-13 16:48:56 +0300,research,CC-BY-NC,https://www.inaturalist.org/observations/37935473,https://inaturalist-open-data.s3.amazonaws.com/photos/60215579/medium.jpg?1579920989,,,,2,0,FALSE,3,"Los Angeles County, US-CA, US",San Clemente,32.99664065,-118.5578347,12,12,,,FALSE,,,,Los Angeles,California,United States,California,Los Angeles,Meadow Slug,Deroceras laeve,Meadow Slug,Mollusca,209624,Mollusca,Gastropoda,Stylommatophora,Agriolimacidae,,
iNaturalist,38209080,2020-01-26 12:10:26 PM PST,1/26/2020 0:00,1/26/2020,2020,1,26,23:10:26,300,Pacific Time (US & Canada),34488,pileated,2020-02-02 08:40:38 +0300,2020-07-03 00:25:06 +0300,research,CC-BY,https://www.inaturalist.org/observations/38209080,https://inaturalist-open-data.s3.amazonaws.com/photos/60692587/medium.jpeg?1580622041,,,,1,0,FALSE,2,"Santa Cruz Island, California 93001, USA",Santa Cruz,34.01892471,-119.6837845,,,,,FALSE,gps,gps,,Santa Barbara,California,United States,California,Santa Barbara,Milky Slug,Deroceras reticulatum,Milky Slug,Mollusca,124432,Mollusca,Gastropoda,Stylommatophora,Agriolimacidae,,
iNaturalist,11843010,2018/04/29 10:10 AM PDT,4/29/2018 0:00,4/29/2018,2018,4,29,20:10:00,300,Pacific Time (US & Canada),6971,silversea_starsong,2018-04-30 06:47:48 +0300,2020-01-02 21:01:49 +0300,research,CC-BY-NC,https://www.inaturalist.org/observations/11843010,https://inaturalist-open-data.s3.amazonaws.com/photos/16948246/medium.jpeg?1525060020,,,,3,0,FALSE,,"Los Angeles County, US-CA, US",Santa Catalina,33.34403731,-118.4793061,,28984,,obscured,TRUE,,,,Los Angeles,California,United States,California,Los Angeles,Santa Catalina Lancetooth,Haplotrema catalinense,Santa Catalina Lancetooth Snail,Mollusca,210625,Mollusca,Gastropoda,,Haplotrematidae,,
iNaturalist,39394055,Wed Feb 26 2020 16:47:44 GMT-0800 (PST),2/26/2020 0:00,2/27/2020,2020,2,27,3:47:44,300,Pacific Time (US & Canada),173183,serpophaga,2020-03-01 10:24:54 +0300,2020-06-29 01:59:22 +0300,research,CC-BY-NC,https://www.inaturalist.org/observations/39394055,https://inaturalist-open-data.s3.amazonaws.com/photos/62493126/medium.jpg?1583047511,,,,2,0,FALSE,3,"California, US",Santa Barbara,33.5080086,-119.0018471,5,28957,,obscured,TRUE,,,,Santa Barbara,California,United States,California,Santa Barbara,Ribbed Lancetooth,Haplotrema duranti,Ribbed Lancetooth Snail,Mollusca,210626,Mollusca,Gastropoda,,Haplotrematidae,,
iNaturalist,35355293,Tue Nov 05 2019 16:25:00 GMT-0800 (PST),11/5/2019 0:00,11/6/2019,2019,11,6,5:25:00,300,Hawaii,464542,william_hoyer,2019-11-06 06:32:32 +0300,2021-01-14 02:20:25 +0300,research,CC-BY-NC,https://www.inaturalist.org/observations/35355293,https://inaturalist-open-data.s3.amazonaws.com/photos/55742816/medium.jpg?1573011159,,,Recently dead shells. ,2,0,FALSE,3,"California, US",San Nicolas,33.36058506,-119.5050755,349,28984,,obscured,TRUE,,,,Ventura,California,United States,California,Ventura,Haplotrema duranti duranti,Haplotrema duranti duranti,,Mollusca,447446,Mollusca,Gastropoda,,Haplotrematidae,,
iNaturalist,67990297,Thu Jan 07 2021 13:25:22 GMT-0800 (PST),1/7/2021 0:00,1/8/2021,2021,1,8,2:25:22,300,Hawaii,464542,william_hoyer,2021-01-13 07:57:51 +0300,2021-01-13 17:53:25 +0300,research,CC-BY-NC,https://www.inaturalist.org/observations/67990297,https://inaturalist-open-data.s3.amazonaws.com/photos/109990090/medium.jpg?1610513877,,,Live individual found and photographed. ,1,0,FALSE,3,"California, US",,33.36830667,-119.4128507,5,28984,,obscured,TRUE,,,,Ventura,California,United States,California,Ventura,Haplotrema duranti duranti,Haplotrema duranti duranti,,Mollusca,447446,Mollusca,Gastropoda,Stylommatophora,Haplotrematidae,Haplotrema,Haplotrema duranti duranti
iNaturalist,39394416,2/23/2020,2/23/2020 0:00,,,,,,,Pacific Time (US & Canada),12809,cedric_lee,2020-03-01 10:36:15 +0300,2021-03-09 09:46:05 +0300,research,CC-BY-NC,https://www.inaturalist.org/observations/39394416,https://inaturalist-open-data.s3.amazonaws.com/photos/62489824/medium.jpeg?1583043912,,,,1,0,FALSE,,"California, US",San Clemente,32.89299301,-118.4956544,165,29039,,obscured,TRUE,,,,Los Angeles,California,United States,California,Los Angeles,Haplotrema guadalupense,Haplotrema guadalupense,Guadalupe Lancetooth Snail,Mollusca,220927,Mollusca,Gastropoda,,Haplotrematidae,,
iNaturalist,57779867,Wed Aug 26 2020 15:33:09 GMT-0700 (PDT),8/26/2020 0:00,8/27/2020,2020,8,27,1:33:09,300,Pacific Time (US & Canada),479251,sscrivy,2020-08-28 01:32:34 +0300,2020-09-14 11:42:40 +0300,needs_id,CC-BY-NC,https://www.inaturalist.org/observations/57779867,https://inaturalist-open-data.s3.amazonaws.com/photos/92193095/medium.jpg?1598567562,,,,3,0,FALSE,3,"Channel Islands National Park, CA, US",Santa Cruz,34.01857783,-119.6837617,20,20,,,FALSE,,,,Santa Barbara,California,United States,California,Santa Barbara,Helicinan Snails and Slugs,Helicina,Helicinan Snails and Slugs,Mollusca,781349,Mollusca,Gastropoda,Cycloneritida,Helicinidae,,
iNaturalist,72533264,Mon Mar 29 2021 13:24:37 GMT-0700 (PDT),3/29/2021 0:00,3/29/2021,2021,3,29,23:24:37,300,Pacific Time (US & Canada),246499,sulavanderplank,2021-03-31 18:42:46 +0300,2021-04-02 01:21:41 +0300,needs_id,CC-BY,https://www.inaturalist.org/observations/72533264,https://static.inaturalist.org/photos/118274911/medium.jpg?1617205389,,,,3,0,FALSE,3,"Los Angeles County, US-CA, US",San Clemente,32.93200626,-118.5881579,3,29039,,obscured,TRUE,,,,Los Angeles,California,United States,California,Los Angeles,Helicoid Land Snails,Helicoidea,Helicoid Land Snails,Mollusca,68625,Mollusca,Gastropoda,Stylommatophora,Xanthonychidae,,
iNaturalist,1634160,6/6/2015,6/6/2015 0:00,,,,,,,Pacific Time (US & Canada),100507,angelanordeng,2015-06-15 08:58:35 +0300,2017-04-05 01:51:55 +0300,needs_id,CC-BY-NC,http://www.inaturalist.org/observations/1634160,https://inaturalist-open-data.s3.amazonaws.com/photos/2004493/medium.jpg?1434347946,,,,3,0,FALSE,,"Los Angeles County, US-CA, US",Santa Catalina,33.38232522,-118.5165285,20231,28971,,obscured,TRUE,,,,Los Angeles,California,United States,California,Los Angeles,Helicoid Terrestrial Snails,Helicoidea,Helicoid Land Snails,Mollusca,68625,Mollusca,Gastropoda,Stylommatophora,Xanthonychidae,,
iNaturalist,12802986,2018-05-23 4:45:17 PM PDT,5/23/2018 0:00,5/24/2018,2018,5,24,2:45:17,300,Pacific Time (US & Canada),392423,bjdion,2018-05-25 20:13:07 +0300,2020-01-02 21:50:12 +0300,needs_id,CC-BY-NC-SA,https://www.inaturalist.org/observations/12802986,https://inaturalist-open-data.s3.amazonaws.com/photos/18564200/medium.jpeg?1527268395,,,,3,0,FALSE,2,"Los Angeles County, US-CA, US",Santa Catalina,33.46854908,-118.5187622,9,28957,,obscured,TRUE,,,,Los Angeles,California,United States,California,Los Angeles,Helicoid Land Snails,Helicoidea,Helicoid Land Snails,Mollusca,68625,Mollusca,Gastropoda,Stylommatophora,Xanthonychidae,,
iNaturalist,74805589,2021-04-19 4:22:22 PM PDT,4/19/2021 0:00,4/20/2021,2021,4,20,2:22:22,300,Pacific Time (US & Canada),305051,kylegunther,2021-04-22 07:10:51 +0300,2021-04-22 07:11:36 +0300,needs_id,,https://www.inaturalist.org/observations/74805589,https://static.inaturalist.org/photos/122309644/medium.jpeg?1619064656,,,,0,0,FALSE,2,"Los Angeles County, US-CA, US",Santa Catalina,33.53867958,-118.5148131,9,28957,obscured,,TRUE,gps,gps,,Los Angeles,California,United States,California,Los Angeles,Helicoid Land Snails,Helicoidea,Helicoid Land Snails,Mollusca,68625,Mollusca,Gastropoda,Stylommatophora,Xanthonychidae,,
iNaturalist,74887021,2021-04-20 10:45:01 AM PDT,4/20/2021 0:00,4/20/2021,2021,4,20,20:45:01,300,Pacific Time (US & Canada),305051,kylegunther,2021-04-23 02:06:29 +0300,2021-05-09 01:32:36 +0300,needs_id,,https://www.inaturalist.org/observations/74887021,https://static.inaturalist.org/photos/122449955/medium.jpeg?1619132795,,,,1,0,FALSE,2,"Santa Catalina Island, California 90704, USA",Santa Catalina,33.4420871,-118.4860658,,,,,FALSE,gps,gps,,Los Angeles,California,United States,California,Los Angeles,Shoulderband Snails,Helminthoglypta,Shoulderband Snails,Mollusca,61945,Mollusca,Gastropoda,Stylommatophora,Xanthonychidae,,
iNaturalist,25644153,2019-05-22 12:47:49 PM PDT,5/22/2019 0:00,5/22/2019,2019,5,22,22:47:49,300,Pacific Time (US & Canada),75776,upandadam,2019-05-24 02:03:04 +0300,2020-04-01 00:53:37 +0300,needs_id,,https://www.inaturalist.org/observations/25644153,https://static.inaturalist.org/photos/39742920/medium.jpg?1558652586,,,,3,0,FALSE,2,"Channel Islands National Park, Channel Islands, Santa Barbara County, US-CA, US",San Miguel,33.99813545,-120.3815905,,28902,,obscured,TRUE,gps,gps,,Santa Barbara,California,United States,California,Santa Barbara,Shoulderband Snails,Helminthoglypta,Shoulderband Snails,Mollusca,61945,Mollusca,Gastropoda,Stylommatophora,Xanthonychidae,,
iNaturalist,25810179,2019-05-24 1:05:46 PM PDT,5/24/2019 0:00,5/24/2019,2019,5,24,23:05:46,300,Pacific Time (US & Canada),75776,upandadam,2019-05-26 18:33:34 +0300,2019-05-28 19:06:32 +0300,research,,https://www.inaturalist.org/observations/25810179,https://static.inaturalist.org/photos/40016685/medium.jpg?1558884824,,,,1,0,FALSE,2,"Channel Islands National Park, Channel Islands, Santa Barbara County, US-CA, US",Santa Rosa,33.88691387,-120.1368028,263,28902,,obscured,TRUE,gps,gps,,Santa Barbara,California,United States,California,Santa Barbara,San Miguel Shoulderband Snail,Helminthoglypta ayresiana,San Miguel Shoulderband Snail,Mollusca,210628,Mollusca,Gastropoda,Stylommatophora,Xanthonychidae,,
iNaturalist,82124204,5/19/2021 13:44,5/19/2021 0:00,5/19/2021,2021,5,19,23:44:26,300,Pacific Time (US & Canada),34488,pileated,2021-06-08 08:57:37 +0300,2021-06-08 21:14:53 +0300,research,CC-BY,https://www.inaturalist.org/observations/82124204,https://inaturalist-open-data.s3.amazonaws.com/photos/134765077/medium.jpeg?1623131860,,,,3,0,FALSE,2,"Channel Islands National Park, Channel Islands, Santa Barbara County, US-CA, US",Santa Rosa,33.98954175,-120.0969327,,28902,,obscured,TRUE,gps,gps,,Santa Barbara,California,United States,California,Santa Barbara,San Miguel Shoulderband Snail,Helminthoglypta ayresiana,San Miguel Shoulderband Snail,Mollusca,210628,Mollusca,Gastropoda,Stylommatophora,Xanthonychidae,,
iNaturalist,19092549,2018/02/17 10:26 AM PST,2/17/2018 0:00,2/17/2018,2018,2,17,21:26:00,300,Pacific Time (US & Canada),263075,yuck-dog,2018-12-19 02:30:56 +0300,2020-09-30 01:50:02 +0300,research,CC-BY-NC,https://www.inaturalist.org/observations/19092549,https://inaturalist-open-data.s3.amazonaws.com/photos/29298103/medium.jpg?1545175789,,,,2,0,FALSE,,"Channel Islands National Park, Channel Islands, Santa Barbara County, UCNRS, US-CA, US",Santa Cruz,33.90392937,-119.7308164,4,28902,,obscured,TRUE,,,,Santa Barbara,California,United States,California,Santa Barbara,Santa Cruz Island Shoulderband Snail,Helminthoglypta sanctaecrucis,Santa Cruz Island Shoulderband Snail,Mollusca,221096,Mollusca,Gastropoda,Stylommatophora,Xanthonychidae,,
iNaturalist,53398145,2020-07-17 8:58:46 AM PDT,7/17/2020 0:00,7/17/2020,2020,7,17,18:58:46,300,Pacific Time (US & Canada),772899,ljbrenner,2020-07-17 22:57:16 +0300,2020-07-18 05:37:24 +0300,research,CC-BY-NC,https://www.inaturalist.org/observations/53398145,https://inaturalist-open-data.s3.amazonaws.com/photos/84928112/medium.jpeg?1595015841,,,,2,0,FALSE,2,"Channel Islands National Park, Channel Islands, Santa Barbara County, UCNRS, US-CA, US",Santa Cruz,33.95104242,-119.6628119,,28902,,obscured,TRUE,gps,gps,,Santa Barbara,California,United States,California,Santa Barbara,Santa Cruz Island Shoulderband Snail,Helminthoglypta sanctaecrucis,Santa Cruz Island Shoulderband Snail,Mollusca,221096,Mollusca,Gastropoda,Stylommatophora,Xanthonychidae,,
iNaturalist,60560932,2020-09-20 10:33:45 AM PDT,9/20/2020 0:00,9/20/2020,2020,9,20,20:33:45,300,Pacific Time (US & Canada),34488,pileated,2020-09-24 01:23:53 +0300,2020-09-28 00:45:21 +0300,research,CC-BY,https://www.inaturalist.org/observations/60560932,https://inaturalist-open-data.s3.amazonaws.com/photos/96848578/medium.jpeg?1600899853,,,,1,0,FALSE,2,"Channel Islands National Park, Channel Islands, Santa Barbara County, US-CA, US",Santa Cruz,33.8872797,-119.7284944,200,28902,,obscured,TRUE,gps,gps,,Santa Barbara,California,United States,California,Santa Barbara,Santa Cruz Island Shoulderband Snail,Helminthoglypta sanctaecrucis,Santa Cruz Island Shoulderband Snail,Mollusca,221096,Mollusca,Gastropoda,Stylommatophora,Xanthonychidae,,
iNaturalist,85661206,2021/02/05 11:12 PM PST,2/5/2021 0:00,2/6/2021,2021,2,6,10:12:00,300,Pacific Time (US & Canada),5179,leptonia,2021-07-04 22:08:50 +0300,2021-07-06 22:00:26 +0300,research,CC-BY-NC,https://www.inaturalist.org/observations/85661206,https://inaturalist-open-data.s3.amazonaws.com/photos/140965857/medium.jpg?1625423274,,,,1,0,FALSE,,"Channel Islands National Park, Channel Islands, Santa Barbara County, UCNRS, US-CA, US",Santa Cruz,33.9203443,-119.7372039,71,28902,,obscured,TRUE,,,,Santa Barbara,California,United States,California,Santa Barbara,Santa Cruz Island Shoulderband Snail,Helminthoglypta sanctaecrucis,Santa Cruz Island Shoulderband Snail,Mollusca,221096,Mollusca,Gastropoda,Stylommatophora,Xanthonychidae,,
iNaturalist,10520145,2018-03-30 9:43:07 AM PDT,3/30/2018 0:00,3/30/2018,2018,3,30,19:43:07,300,Pacific Time (US & Canada),75776,upandadam,2018-03-31 06:09:29 +0300,2018-04-12 22:47:18 +0300,research,,https://www.inaturalist.org/observations/10520145,https://static.inaturalist.org/photos/14640755/medium.jpg?1522465771,,,,3,0,FALSE,2,"Channel Islands National Park, Channel Islands, Santa Barbara County, UCNRS, US-CA, US",,33.81986726,-119.6212187,,28902,,obscured,TRUE,gps,gps,,Santa Barbara,California,United States,California,Santa Barbara,Santa Cruz Island shoulderband,Helminthoglypta sanctaecrucis,Santa Cruz Island Shoulderband Snail,Mollusca,221096,Mollusca,Gastropoda,Stylommatophora,Xanthonychidae,Helminthoglypta,Helminthoglypta sanctaecrucis
iNaturalist,10560019,2018-03-31 10:23:10 AM PDT,3/31/2018 0:00,3/31/2018,2018,3,31,20:23:10,300,Pacific Time (US & Canada),75776,upandadam,2018-04-02 04:17:52 +0300,2018-04-03 07:15:25 +0300,research,,https://www.inaturalist.org/observations/10560019,https://static.inaturalist.org/photos/14710654/medium.jpg?1522631875,,,,3,0,FALSE,2,"Channel Islands National Park, Channel Islands, Santa Barbara County, UCNRS, US-CA, US",,33.82380658,-119.6779696,,28902,,obscured,TRUE,gps,gps,,Santa Barbara,California,United States,California,Santa Barbara,Santa Cruz Island shoulderband,Helminthoglypta sanctaecrucis,Santa Cruz Island Shoulderband Snail,Mollusca,221096,Mollusca,Gastropoda,Stylommatophora,Xanthonychidae,Helminthoglypta,Helminthoglypta sanctaecrucis
iNaturalist,19034322,Fri Dec 14 2018 14:15:22 GMT-0800 (PST),12/14/2018 0:00,12/15/2018,2018,12,15,1:15:22,300,Pacific Time (US & Canada),17630,gregpauly,2018-12-15 23:29:45 +0300,2019-01-11 03:13:59 +0300,research,CC-BY-NC,https://www.inaturalist.org/observations/19034322,https://inaturalist-open-data.s3.amazonaws.com/photos/29193847/medium.jpg?1544905797,,,,2,0,FALSE,3,"Channel Islands National Park, Channel Islands, Santa Barbara County, UCNRS, US-CA, US",,33.86371481,-119.7219647,5,28902,,obscured,TRUE,,,,Santa Barbara,California,United States,California,Santa Barbara,Santa Cruz Island shoulderband,Helminthoglypta sanctaecrucis,Santa Cruz Island Shoulderband Snail,Mollusca,221096,Mollusca,Gastropoda,Stylommatophora,Xanthonychidae,Helminthoglypta,Helminthoglypta sanctaecrucis
iNaturalist,19560511,2019/01/10 10:44 AM PST,1/10/2019 0:00,1/10/2019,2019,1,10,21:44:00,300,Pacific Time (US & Canada),23091,sue_meiman,2019-01-11 02:35:27 +0300,2019-04-24 19:45:26 +0300,needs_id,CC-BY-NC,https://www.inaturalist.org/observations/19560511,https://inaturalist-open-data.s3.amazonaws.com/photos/30107739/medium.jpg?1547163266,,,,2,0,FALSE,,"Los Angeles County, CA, USA",San Clemente,32.87486915,-118.4625725,140,140,,,FALSE,,,,Los Angeles,California,United States,California,Los Angeles,Helminthoglyptinae,Helminthoglyptinae,,Mollusca,803797,Mollusca,Gastropoda,Stylommatophora,Xanthonychidae,,
iNaturalist,33507936,2019-09-26 1:27:30 PM PDT,9/26/2019 0:00,9/26/2019,2019,9,26,23:27:30,300,Pacific Time (US & Canada),392423,bjdion,2019-09-28 03:38:20 +0300,2020-03-16 02:40:39 +0300,needs_id,CC-BY-NC-SA,https://www.inaturalist.org/observations/33507936,https://inaturalist-open-data.s3.amazonaws.com/photos/52631863/medium.jpeg?1569631105,,,,3,0,FALSE,2,"Los Angeles County, US-CA, US",Santa Catalina,33.44556422,-118.5713638,12,28957,,obscured,TRUE,,,,Los Angeles,California,United States,California,Los Angeles,Helminthoglyptinae,Helminthoglyptinae,,Mollusca,803797,Mollusca,Gastropoda,Stylommatophora,Xanthonychidae,,
iNaturalist,62002676,Wed Oct 07 2020 13:20:22 GMT-0700 (PDT),10/7/2020 0:00,10/7/2020,2020,10,7,23:20:22,300,Pacific Time (US & Canada),173183,serpophaga,2020-10-08 05:40:14 +0300,2020-10-08 05:40:37 +0300,needs_id,CC-BY-NC,https://www.inaturalist.org/observations/62002676,https://inaturalist-open-data.s3.amazonaws.com/photos/99284758/medium.jpg?1602124819,,,,0,0,FALSE,3,"Channel Islands National Park, CA, US",Anacapa,34.01578888,-119.3620083,5,5,,,FALSE,,,,Ventura,California,United States,California,Ventura,,Helminthoglyptinae,,Mollusca,803797,Mollusca,Gastropoda,Stylommatophora,Xanthonychidae,,
iNaturalist,22334672,Thu Apr 11 2019 10:24:41 GMT-0700 (PDT),4/11/2019 0:00,4/11/2019,2019,4,11,20:24:41,300,Pacific Time (US & Canada),266196,shrike2,2019-04-11 21:16:49 +0300,2019-04-12 22:29:52 +0300,research,CC-BY-NC-ND,https://www.inaturalist.org/observations/22334672,https://static.inaturalist.org/photos/34591921/medium.jpg?1555006664,,,,2,0,FALSE,3,"Los Angeles County, US-CA, US",San Clemente,32.94414606,-118.5298442,5,5,,,FALSE,,,,Los Angeles,California,United States,California,Los Angeles,Cellar Slug,Limacus flavus,Yellow Cellar Slug,Mollusca,322417,Mollusca,Gastropoda,Stylommatophora,Limacidae,,
iNaturalist,37507299,Sat Jan 11 2020 07:48:50 GMT-0800 (PST),1/11/2020 0:00,1/11/2020,2020,1,11,18:48:50,300,Pacific Time (US & Canada),12809,cedric_lee,2020-01-12 04:55:17 +0300,2020-01-12 05:23:44 +0300,research,CC-BY-NC,https://www.inaturalist.org/observations/37507299,https://inaturalist-open-data.s3.amazonaws.com/photos/59471690/medium.jpg?1578794290,,,,1,0,FALSE,3,"San Clemente Island Underwater Range, CA, US",San Clemente,32.97737456,-118.5533025,25,25,,,FALSE,,,,Los Angeles,California,United States,California,Los Angeles,,Limacus flavus,Yellow Cellar Slug,Mollusca,322417,Mollusca,Gastropoda,Stylommatophora,Limacidae,,
iNaturalist,37507320,Sat Jan 11 2020 07:56:14 GMT-0800 (PST),1/11/2020 0:00,1/11/2020,2020,1,11,18:56:14,300,Pacific Time (US & Canada),12809,cedric_lee,2020-01-12 04:55:52 +0300,2020-01-12 05:23:23 +0300,research,CC-BY-NC,https://www.inaturalist.org/observations/37507320,https://inaturalist-open-data.s3.amazonaws.com/photos/59471768/medium.jpg?1578794426,,,,1,0,FALSE,3,"San Clemente Island Underwater Range, CA, US",San Clemente,32.97735186,-118.5532456,57,57,,,FALSE,,,,Los Angeles,California,United States,California,Los Angeles,,Limacus flavus,Yellow Cellar Slug,Mollusca,322417,Mollusca,Gastropoda,Stylommatophora,Limacidae,,
iNaturalist,37507494,Sat Jan 11 2020 09:39:04 GMT-0800 (PST),1/11/2020 0:00,1/11/2020,2020,1,11,20:39:04,300,Pacific Time (US & Canada),12809,cedric_lee,2020-01-12 05:01:52 +0300,2020-10-12 09:45:26 +0300,research,CC-BY-NC,https://www.inaturalist.org/observations/37507494,https://inaturalist-open-data.s3.amazonaws.com/photos/59471919/medium.jpg?1578794574,,,,1,0,FALSE,3,"Los Angeles County, US-CA, US",San Clemente,32.97342353,-118.552123,9,9,,,FALSE,,,,Los Angeles,California,United States,California,Los Angeles,,Limacus flavus,Yellow Cellar Slug,Mollusca,322417,Mollusca,Gastropoda,Stylommatophora,Limacidae,,
iNaturalist,7044828,Tue Jul 11 2017 07:03:12 GMT-0700 (PDT),7/11/2017 0:00,7/11/2017,2017,7,11,17:03:12,300,Pacific Time (US & Canada),81668,monicatydlaska,2017-07-14 06:32:54 +0300,2019-12-31 10:18:34 +0300,research,,https://www.inaturalist.org/observations/7044828,https://static.inaturalist.org/photos/9040442/medium.jpg?1500003299,,,,2,0,FALSE,3,"Middle Ranch Rd, Avalon, CA, US",Santa Catalina,33.35551333,-118.4373633,,,,,FALSE,,,,Los Angeles,California,United States,California,Los Angeles,Yellow Cellar Slug,Limacus flavus,Yellow Cellar Slug,Mollusca,322417,Mollusca,Gastropoda,Stylommatophora,Limacidae,,
iNaturalist,25428137,Sun May 19 2019 21:18:32 GMT-0700 (PDT),5/19/2019 0:00,5/20/2019,2019,5,20,7:18:32,300,Pacific Time (US & Canada),1372719,andrew517,2019-05-20 08:12:35 +0300,2019-12-31 05:28:33 +0300,research,,https://www.inaturalist.org/observations/25428137,https://static.inaturalist.org/photos/39381725/medium.jpg?1558329164,,,,2,0,FALSE,3,"Santa Catalina Island, , CA, US",Santa Catalina,33.36933833,-118.34838,65,65,,,FALSE,,,,Los Angeles,California,United States,California,Los Angeles,Yellow Cellar Slug,Limacus flavus,Yellow Cellar Slug,Mollusca,322417,Mollusca,Gastropoda,Stylommatophora,Limacidae,,
iNaturalist,69606643,Sun Feb 14 2021 22:36:57 GMT-0800 (PST),2/14/2021 0:00,2/15/2021,2021,2,15,1:36:57,300,UTC,711300,mgalano89,2021-02-15 09:38:40 +0300,2021-02-15 22:44:30 +0300,research,,https://www.inaturalist.org/observations/69606643,https://static.inaturalist.org/photos/112978841/medium.jpg?1613371128,,,,2,0,FALSE,3,"Santa Catalina Island, Avalon, CA, US",Santa Catalina,33.34243296,-118.3276662,65,65,,,FALSE,,,,Los Angeles,California,United States,California,Los Angeles,黄蛞蝓,Limacus flavus,Yellow Cellar Slug,Mollusca,322417,Mollusca,Gastropoda,Stylommatophora,Limacidae,,
iNaturalist,69824512,Sun Feb 14 2021 22:38:08 GMT-0800 (PST),2/14/2021 0:00,2/15/2021,2021,2,15,1:38:08,300,UTC,711290,jcl,2021-02-19 22:26:19 +0300,2021-02-20 16:50:40 +0300,research,,https://www.inaturalist.org/observations/69824512,https://static.inaturalist.org/photos/113392086/medium.jpg?1613762796,,,,2,0,FALSE,3,"Santa Catalina Island, Avalon, CA, US",Santa Catalina,33.34243527,-118.3276847,65,65,,,FALSE,,,,Los Angeles,California,United States,California,Los Angeles,Yellow Cellar Slug,Limacus flavus,Yellow Cellar Slug,Mollusca,322417,Mollusca,Gastropoda,Stylommatophora,Limacidae,,
iNaturalist,9805592,Tue Feb 06 2018 14:09:20 GMT-0800 (PST),2/6/2018 0:00,2/7/2018,2018,2,7,1:09:20,300,Pacific Time (US & Canada),19715,gbentall,2018-02-10 04:33:00 +0300,2019-01-13 03:15:51 +0300,needs_id,CC-BY-NC,https://www.inaturalist.org/observations/9805592,https://inaturalist-open-data.s3.amazonaws.com/photos/13416372/medium.jpg?1518226400,,,,4,0,FALSE,3,"San Nicolas Island, CA",San Nicolas,33.246452,-119.499169,8236,8236,,,FALSE,,google,,Ventura,California,United States,California,Ventura,Micrarionta,Micrarionta,,Mollusca,89907,Mollusca,Gastropoda,Stylommatophora,Helminthoglyptidae,,
iNaturalist,10421258,2018/03/24 3:09 PM PDT,3/24/2018 0:00,3/25/2018,2018,3,25,1:09:00,300,Pacific Time (US & Canada),220795,neontetraploid,2018-03-26 01:54:04 +0300,2018-03-29 07:44:43 +0300,needs_id,CC-BY-NC,https://www.inaturalist.org/observations/10421258,https://inaturalist-open-data.s3.amazonaws.com/photos/14476432/medium.jpeg?1522017996,,,,1,0,FALSE,,"Los Angeles County, CA, USA",Santa Catalina,33.4445858,-118.4824262,150,150,,,FALSE,,,,Los Angeles,California,United States,California,Los Angeles,Micrarionta,Micrarionta,,Mollusca,89907,Mollusca,Gastropoda,Stylommatophora,Helminthoglyptidae,,
iNaturalist,10421259,2018/03/24 3:09 PM PDT,3/24/2018 0:00,3/25/2018,2018,3,25,1:09:00,300,Pacific Time (US & Canada),220795,neontetraploid,2018-03-26 01:54:05 +0300,2019-03-06 20:18:29 +0300,needs_id,CC-BY-NC,https://www.inaturalist.org/observations/10421259,https://inaturalist-open-data.s3.amazonaws.com/photos/14476439/medium.jpeg?1522018012,,,,2,0,FALSE,,"Los Angeles County, CA, USA",Santa Catalina,33.4445858,-118.4824262,150,150,,,FALSE,,,,Los Angeles,California,United States,California,Los Angeles,Micrarionta,Micrarionta,,Mollusca,89907,Mollusca,Gastropoda,Stylommatophora,Helminthoglyptidae,,
iNaturalist,10421275,2018/03/24 3:09 PM PDT,3/24/2018 0:00,3/25/2018,2018,3,25,1:09:00,300,Pacific Time (US & Canada),220795,neontetraploid,2018-03-26 01:54:53 +0300,2018-03-29 07:44:43 +0300,needs_id,CC-BY-NC,https://www.inaturalist.org/observations/10421275,https://inaturalist-open-data.s3.amazonaws.com/photos/14476610/medium.jpeg?1522018254,,,,1,0,FALSE,,"Los Angeles County, CA, USA",Santa Catalina,33.44470625,-118.4820614,98,98,,,FALSE,,,,Los Angeles,California,United States,California,Los Angeles,Micrarionta,Micrarionta,,Mollusca,89907,Mollusca,Gastropoda,Stylommatophora,Helminthoglyptidae,,
iNaturalist,22867770,2019/04/04 11:02 AM PDT,4/4/2019 0:00,4/4/2019,2019,4,4,21:02:00,300,Pacific Time (US & Canada),86100,naturenate,2019-04-22 08:23:49 +0300,2019-08-20 22:04:15 +0300,needs_id,CC-BY-NC,https://www.inaturalist.org/observations/22867770,https://static.inaturalist.org/photos/35446249/medium.jpeg?1555910520,,,,1,0,FALSE,,"Los Angeles County, CA, USA",Santa Catalina,33.38503833,-118.409225,,,,,FALSE,,,,Los Angeles,California,United States,California,Los Angeles,Micrarionta,Micrarionta,,Mollusca,89907,Mollusca,Gastropoda,Stylommatophora,Helminthoglyptidae,,
iNaturalist,1352761,2/28/2012,2/28/2012 0:00,,,,,,,Pacific Time (US & Canada),84767,tlawson,2015-03-31 18:39:15 +0300,2017-07-14 07:26:49 +0300,research,,http://www.inaturalist.org/observations/1352761,https://static.inaturalist.org/photos/3134523/medium.jpg?1457715074,,,"Micrarionta beatula Cockerel, 1929",2,0,FALSE,2,"Los Angeles County, US-CA, US",Santa Catalina,33.25295172,-118.2814355,1032,28971,,obscured,TRUE,gps,gps,,Los Angeles,California,United States,California,Los Angeles,Micrarionta beatula,Micrarionta beatula,Avalon Island Snail,Mollusca,225071,Mollusca,Gastropoda,Stylommatophora,Helminthoglyptidae,,
iNaturalist,3819806,2016/08/06 2:52 PM PDT,8/6/2016 0:00,8/7/2016,2016,8,7,0:52:00,300,Pacific Time (US & Canada),12809,cedric_lee,2016-08-07 08:50:33 +0300,2017-07-14 07:57:51 +0300,research,CC-BY-NC,http://www.inaturalist.org/observations/3819806,https://static.inaturalist.org/photos/4466427/medium.jpeg?1470549012,,,,2,0,FALSE,,"Los Angeles County, US-CA, US",Santa Catalina,33.34248702,-118.2480593,17,28971,,obscured,TRUE,,,,Los Angeles,California,United States,California,Los Angeles,Micrarionta beatula,Micrarionta beatula,Avalon Island Snail,Mollusca,225071,Mollusca,Gastropoda,Stylommatophora,Helminthoglyptidae,,
iNaturalist,11843009,2018/04/28 6:35 PM PDT,4/28/2018 0:00,4/29/2018,2018,4,29,4:35:00,300,Pacific Time (US & Canada),6971,silversea_starsong,2018-04-30 06:47:47 +0300,2021-03-26 06:01:19 +0300,research,CC-BY-NC,https://www.inaturalist.org/observations/11843009,https://inaturalist-open-data.s3.amazonaws.com/photos/16948148/medium.jpeg?1525059984,,,,3,0,FALSE,,"Los Angeles County, US-CA, US",Santa Catalina,33.31696542,-118.510511,,28984,,obscured,TRUE,,,,Los Angeles,California,United States,California,Los Angeles,Avalon Islandsnail,Micrarionta beatula,Avalon Island Snail,Mollusca,225071,Mollusca,Gastropoda,Stylommatophora,Helminthoglyptidae,,
iNaturalist,12000977,2018/04/28 3:34 PM PDT,4/28/2018 0:00,4/29/2018,2018,4,29,1:34:00,300,Pacific Time (US & Canada),6971,silversea_starsong,2018-05-01 21:12:47 +0300,2018-05-02 07:26:07 +0300,research,CC-BY-NC,https://www.inaturalist.org/observations/12000977,https://inaturalist-open-data.s3.amazonaws.com/photos/17194539/medium.jpeg?1525198200,,,,1,0,FALSE,,"Los Angeles County, US-CA, US",Santa Catalina,33.36464242,-118.2526722,,28984,,obscured,TRUE,,,,Los Angeles,California,United States,California,Los Angeles,Avalon Islandsnail,Micrarionta beatula,Avalon Island Snail,Mollusca,225071,Mollusca,Gastropoda,Stylommatophora,Helminthoglyptidae,,
iNaturalist,40087997,7/22/2001,7/22/2001 0:00,,,,,,,Pacific Time (US & Canada),94012,pliffgrieff,2020-03-16 20:41:38 +0300,2020-03-16 20:55:37 +0300,research,CC-BY-NC-SA,https://www.inaturalist.org/observations/40087997,https://inaturalist-open-data.s3.amazonaws.com/photos/63668628/medium.jpg?1584380073,,,catching up on some old observations. under talus at the base of a rock outcrop.,1,0,FALSE,,"Los Angeles County, US-CA, US",Santa Catalina,33.37953453,-118.3211727,161,28984,,obscured,TRUE,,,,Los Angeles,California,United States,California,Los Angeles,Avalon Island Snail,Micrarionta beatula,Avalon Island Snail,Mollusca,225071,Mollusca,Gastropoda,Stylommatophora,Helminthoglyptidae,,
iNaturalist,38226396,Fri Jan 31 2020 14:35:59 GMT-0800 (PST),1/31/2020 0:00,2/1/2020,2020,2,1,3:35:59,300,Hawaii,464542,william_hoyer,2020-02-02 22:00:19 +0300,2020-02-06 18:56:48 +0300,research,CC-BY-NC,https://www.inaturalist.org/observations/38226396,https://inaturalist-open-data.s3.amazonaws.com/photos/60723439/medium.jpg?1580670024,,,,0,0,FALSE,3,"Los Angeles County, US-CA, US",,33.25042379,-118.2252903,8,28984,,obscured,TRUE,,,,Los Angeles,California,United States,California,Los Angeles,Avalon Island Snail,Micrarionta beatula,Avalon Island Snail,Mollusca,225071,Mollusca,Gastropoda,Stylommatophora,Xanthonychidae,Micrarionta,Micrarionta beatula
iNaturalist,8746914,Fri Nov 03 2017 08:46:04 GMT-0700 (PDT),11/3/2017 0:00,11/3/2017,2017,11,3,18:46:04,300,Pacific Time (US & Canada),173183,serpophaga,2017-11-10 05:47:39 +0300,2020-09-24 05:07:55 +0300,research,CC-BY-NC,https://www.inaturalist.org/observations/8746914,https://inaturalist-open-data.s3.amazonaws.com/photos/11741634/medium.jpg?1510282065,,,,1,0,FALSE,3,"California, US",Santa Barbara,33.46166232,-119.112748,30,28957,,obscured,TRUE,,,,Santa Barbara,California,United States,California,Santa Barbara,Santa Barbara Islandsnail,Micrarionta facta,Santa Barbara Island Snail,Mollusca,105716,Mollusca,Gastropoda,Stylommatophora,Helminthoglyptidae,,
iNaturalist,37390931,Sat Jan 04 2020 11:16:34 GMT-0800 (PST),1/4/2020 0:00,1/5/2020,2020,1,5,0:16:34,300,Hawaii,464542,william_hoyer,2020-01-08 08:21:24 +0300,2020-06-25 09:12:46 +0300,research,CC-BY-NC,https://www.inaturalist.org/observations/37390931,https://inaturalist-open-data.s3.amazonaws.com/photos/59267774/medium.jpg?1578460901,,,,1,0,FALSE,3,"California, US",Santa Barbara,33.53298557,-119.0813019,16,28957,obscured,obscured,TRUE,,,,Santa Barbara,California,United States,California,Santa Barbara,Santa Barbara Island Snail,Micrarionta facta,Santa Barbara Island Snail,Mollusca,105716,Mollusca,Gastropoda,Stylommatophora,Helminthoglyptidae,,
iNaturalist,50802717,2009/08/21 2:02 PM CDT,8/21/2009 0:00,8/21/2009,2009,8,21,23:02:00,400,Central Time (US & Canada),19563,henicorhina,2020-06-24 22:01:42 +0300,2021-01-14 00:00:17 +0300,research,CC-BY-NC-ND,https://www.inaturalist.org/observations/50802717,https://inaturalist-open-data.s3.amazonaws.com/photos/80688738/medium.jpeg?1593024363,,,,1,0,FALSE,,"California, US",Santa Barbara,33.55239368,-119.0114064,244,28957,,obscured,TRUE,,,,Santa Barbara,California,United States,California,Santa Barbara,Santa Barbara Island Snail,Micrarionta facta,Santa Barbara Island Snail,Mollusca,105716,Mollusca,Gastropoda,Stylommatophora,Helminthoglyptidae,,
iNaturalist,63181202,2020/10/11 6:27 PM PDT,10/11/2020 0:00,10/12/2020,2020,10,12,4:27:00,300,Pacific Time (US & Canada),317669,alex_bairstow,2020-10-21 21:06:06 +0300,2021-01-13 23:59:58 +0300,research,CC-BY-NC,https://www.inaturalist.org/observations/63181202,https://inaturalist-open-data.s3.amazonaws.com/photos/101284678/medium.jpg?1603247019,,,,1,0,FALSE,,"California, US",Santa Barbara,33.54393401,-119.1007719,8,28957,,obscured,TRUE,,,,Santa Barbara,California,United States,California,Santa Barbara,Santa Barbara Island Snail,Micrarionta facta,Santa Barbara Island Snail,Mollusca,105716,Mollusca,Gastropoda,Stylommatophora,Helminthoglyptidae,,
iNaturalist,69650845,Mon Feb 15 2021 14:36:06 GMT-0800 (PST),2/15/2021 0:00,2/16/2021,2021,2,16,1:36:06,300,Pacific Time (US & Canada),173183,serpophaga,2021-02-16 05:35:27 +0300,2021-02-16 09:04:04 +0300,research,CC-BY-NC,https://www.inaturalist.org/observations/69650845,https://inaturalist-open-data.s3.amazonaws.com/photos/113061518/medium.jpg?1613442970,,,,2,0,FALSE,3,"California, US",Santa Barbara,33.40082123,-119.0063894,5,28957,,obscured,TRUE,,,,Santa Barbara,California,United States,California,Santa Barbara,Santa Barbara Island Snail,Micrarionta facta,Santa Barbara Island Snail,Mollusca,105716,Mollusca,Gastropoda,Stylommatophora,Helminthoglyptidae,,
iNaturalist,73465434,2019/03/24 10:31 AM PDT,3/24/2019 0:00,3/24/2019,2019,3,24,20:31:00,300,Pacific Time (US & Canada),173183,serpophaga,2021-04-10 08:46:18 +0300,2021-04-10 09:34:48 +0300,research,CC-BY-NC,https://www.inaturalist.org/observations/73465434,https://inaturalist-open-data.s3.amazonaws.com/photos/119943218/medium.jpeg?1618033019,,,,1,0,FALSE,,"California, US",Santa Barbara,33.52325269,-119.0195763,5,28957,,obscured,TRUE,,,,Santa Barbara,California,United States,California,Santa Barbara,Santa Barbara Island Snail,Micrarionta facta,Santa Barbara Island Snail,Mollusca,105716,Mollusca,Gastropoda,Stylommatophora,Helminthoglyptidae,,
iNaturalist,73467722,2019/03/26 9:20 AM PDT,3/26/2019 0:00,3/26/2019,2019,3,26,19:20:00,300,Pacific Time (US & Canada),173183,serpophaga,2021-04-10 09:37:16 +0300,2021-04-10 18:40:03 +0300,research,CC-BY-NC,https://www.inaturalist.org/observations/73467722,https://inaturalist-open-data.s3.amazonaws.com/photos/119947368/medium.jpeg?1618036167,,,,1,0,FALSE,,"California, US",Santa Barbara,33.50431212,-119.0301926,5,28957,,obscured,TRUE,,,,Santa Barbara,California,United States,California,Santa Barbara,Santa Barbara Island Snail,Micrarionta facta,Santa Barbara Island Snail,Mollusca,105716,Mollusca,Gastropoda,Stylommatophora,Helminthoglyptidae,,
iNaturalist,73467807,2019/03/26 5:37 PM PDT,3/26/2019 0:00,3/27/2019,2019,3,27,3:37:00,300,Pacific Time (US & Canada),173183,serpophaga,2021-04-10 09:39:17 +0300,2021-04-10 18:39:27 +0300,research,CC-BY-NC,https://www.inaturalist.org/observations/73467807,https://inaturalist-open-data.s3.amazonaws.com/photos/119948075/medium.jpg?1618036713,,,M. facta shell inside X. tryoni shell,1,0,FALSE,,"California, US",Santa Barbara,33.46271575,-119.1453631,10,28957,,obscured,TRUE,,,,Santa Barbara,California,United States,California,Santa Barbara,Santa Barbara Island Snail,Micrarionta facta,Santa Barbara Island Snail,Mollusca,105716,Mollusca,Gastropoda,Stylommatophora,Helminthoglyptidae,,
iNaturalist,21723254,Thu Mar 28 2019 08:12:02 GMT-0700 (PDT),3/28/2019 0:00,3/28/2019,2019,3,28,18:12:02,300,Pacific Time (US & Canada),173183,serpophaga,2019-03-29 05:25:10 +0300,2020-09-24 05:08:13 +0300,research,CC-BY-NC,https://www.inaturalist.org/observations/21723254,https://inaturalist-open-data.s3.amazonaws.com/photos/33639459/medium.jpg?1553826320,,,Inside a Bicolored Cactus-snail shell,2,0,FALSE,3,"California, US",,33.43019825,-119.143558,10,28957,,obscured,TRUE,,,,Santa Barbara,California,United States,California,Santa Barbara,Santa Barbara Island Snail,Micrarionta facta,Santa Barbara Island Snail,Mollusca,105716,Mollusca,Gastropoda,Stylommatophora,Xanthonychidae,Micrarionta,Micrarionta facta
iNaturalist,37390986,Sun Jan 05 2020 10:25:25 GMT-0800 (PST),1/5/2020 0:00,1/5/2020,2020,1,5,23:25:25,300,Hawaii,464542,william_hoyer,2020-01-08 08:23:28 +0300,2021-01-14 00:01:25 +0300,research,CC-BY-NC,https://www.inaturalist.org/observations/37390986,https://inaturalist-open-data.s3.amazonaws.com/photos/59268044/medium.jpg?1578461415,,,"Graveyard Cyn. 
",1,0,FALSE,3,"California, US",,33.58991686,-119.1611201,123,28957,obscured,obscured,TRUE,,,,Santa Barbara,California,United States,California,Santa Barbara,Santa Barbara Island Snail,Micrarionta facta,Santa Barbara Island Snail,Mollusca,105716,Mollusca,Gastropoda,Stylommatophora,Xanthonychidae,Micrarionta,Micrarionta facta
iNaturalist,69490261,Fri Feb 12 2021 08:46:33 GMT-0800 (PST),2/12/2021 0:00,2/12/2021,2021,2,12,19:46:33,300,Pacific Time (US & Canada),173183,serpophaga,2021-02-13 08:57:22 +0300,2021-02-13 20:36:07 +0300,research,CC-BY-NC,https://www.inaturalist.org/observations/69490261,https://inaturalist-open-data.s3.amazonaws.com/photos/112763441/medium.jpg?1613195922,,,,1,0,FALSE,3,"California, US",,33.57380333,-119.1059313,10,28957,,obscured,TRUE,,,,Santa Barbara,California,United States,California,Santa Barbara,Santa Barbara Island Snail,Micrarionta facta,Santa Barbara Island Snail,Mollusca,105716,Mollusca,Gastropoda,Stylommatophora,Xanthonychidae,Micrarionta,Micrarionta facta
iNaturalist,73460751,2019/03/22 10:29 AM PDT,3/22/2019 0:00,3/22/2019,2019,3,22,20:29:00,300,Pacific Time (US & Canada),173183,serpophaga,2021-04-10 07:12:41 +0300,2021-04-10 09:35:54 +0300,research,CC-BY-NC,https://www.inaturalist.org/observations/73460751,https://inaturalist-open-data.s3.amazonaws.com/photos/119933728/medium.jpeg?1618027600,,,,1,0,FALSE,,"California, US",,33.59179196,-119.0352084,5,28957,,obscured,TRUE,,,,Santa Barbara,California,United States,California,Santa Barbara,Santa Barbara Island Snail,Micrarionta facta,Santa Barbara Island Snail,Mollusca,105716,Mollusca,Gastropoda,Stylommatophora,Xanthonychidae,Micrarionta,Micrarionta facta
iNaturalist,73467716,2019/03/26 8:59 AM PDT,3/26/2019 0:00,3/26/2019,2019,3,26,18:59:00,300,Pacific Time (US & Canada),173183,serpophaga,2021-04-10 09:37:15 +0300,2021-04-10 18:40:18 +0300,research,CC-BY-NC,https://www.inaturalist.org/observations/73467716,https://inaturalist-open-data.s3.amazonaws.com/photos/119947329/medium.jpg?1618036136,,,,1,0,FALSE,,"California, US",,33.53945454,-119.1576961,5,28957,,obscured,TRUE,,,,Santa Barbara,California,United States,California,Santa Barbara,Santa Barbara Island Snail,Micrarionta facta,Santa Barbara Island Snail,Mollusca,105716,Mollusca,Gastropoda,Stylommatophora,Xanthonychidae,Micrarionta,Micrarionta facta
iNaturalist,73467723,2019/03/26 9:27 AM PDT,3/26/2019 0:00,3/26/2019,2019,3,26,19:27:00,300,Pacific Time (US & Canada),173183,serpophaga,2021-04-10 09:37:16 +0300,2021-04-10 18:39:49 +0300,research,CC-BY-NC,https://www.inaturalist.org/observations/73467723,https://inaturalist-open-data.s3.amazonaws.com/photos/119947393/medium.jpeg?1618036180,,,,1,0,FALSE,,"California, US",,33.44369749,-119.1593432,10,28957,,obscured,TRUE,,,,Santa Barbara,California,United States,California,Santa Barbara,Santa Barbara Island Snail,Micrarionta facta,Santa Barbara Island Snail,Mollusca,105716,Mollusca,Gastropoda,Stylommatophora,Xanthonychidae,Micrarionta,Micrarionta facta
iNaturalist,73467725,2019/03/26 9:35 AM PDT,3/26/2019 0:00,3/26/2019,2019,3,26,19:35:00,300,Pacific Time (US & Canada),173183,serpophaga,2021-04-10 09:37:17 +0300,2021-04-10 18:39:39 +0300,research,CC-BY-NC,https://www.inaturalist.org/observations/73467725,https://inaturalist-open-data.s3.amazonaws.com/photos/119947408/medium.jpg?1618036196,,,,1,0,FALSE,,"California, US",,33.41141754,-119.1584868,5,28957,,obscured,TRUE,,,,Santa Barbara,California,United States,California,Santa Barbara,Santa Barbara Island Snail,Micrarionta facta,Santa Barbara Island Snail,Mollusca,105716,Mollusca,Gastropoda,Stylommatophora,Xanthonychidae,Micrarionta,Micrarionta facta
iNaturalist,7835534,Fri Sep 08 2017 10:05:39 GMT-0700 (PDT),9/8/2017 0:00,9/8/2017,2017,9,8,20:05:39,300,Pacific Time (US & Canada),84767,tlawson,2017-09-08 21:44:39 +0300,2019-01-09 22:06:53 +0300,research,,https://www.inaturalist.org/observations/7835534,https://static.inaturalist.org/photos/11312159/medium.jpg?1508538772,,,"From an old collection. Micrarionta feralis collected by Henry Hemphill on San Nicolas Island in 1901. 

17-21 mm.",1,0,FALSE,3,"California, US",San Nicolas,33.24086918,-119.509864,2516,28984,,obscured,TRUE,,,,Ventura,California,United States,California,Ventura,San Nicolas Islandsnail,Micrarionta feralis,San Nicolas Island Snail,Mollusca,105717,Mollusca,Gastropoda,Stylommatophora,Helminthoglyptidae,,
iNaturalist,19684327,2012/10/13 2:29 PM MST,10/13/2012 0:00,10/14/2012,2012,10,14,0:29:00,400,Mountain Time (US & Canada),19215,tsirtalis,2019-01-17 03:49:37 +0300,2019-01-18 00:34:01 +0300,research,CC-BY-NC-ND,https://www.inaturalist.org/observations/19684327,https://static.inaturalist.org/photos/30318651/medium.jpeg?1547684451,,,,1,0,FALSE,,"California, US",San Nicolas,33.21747611,-119.5436377,,28984,,obscured,TRUE,,,,Ventura,California,United States,California,Ventura,San Nicolas Island Snail,Micrarionta feralis,San Nicolas Island Snail,Mollusca,105717,Mollusca,Gastropoda,Stylommatophora,Helminthoglyptidae,,
iNaturalist,19684338,2012/10/13 4:14 PM MST,10/13/2012 0:00,10/14/2012,2012,10,14,2:14:00,400,Mountain Time (US & Canada),19215,tsirtalis,2019-01-17 03:49:45 +0300,2019-01-18 00:32:37 +0300,research,CC-BY-NC-ND,https://www.inaturalist.org/observations/19684338,https://static.inaturalist.org/photos/30319215/medium.jpeg?1547685582,,,,1,0,FALSE,,"California, US",San Nicolas,33.26574083,-119.4709605,,28984,,obscured,TRUE,,,,Ventura,California,United States,California,Ventura,San Nicolas Island Snail,Micrarionta feralis,San Nicolas Island Snail,Mollusca,105717,Mollusca,Gastropoda,Stylommatophora,Helminthoglyptidae,,
iNaturalist,19684339,2012/10/13 4:15 PM MST,10/13/2012 0:00,10/14/2012,2012,10,14,2:15:00,400,Mountain Time (US & Canada),19215,tsirtalis,2019-01-17 03:49:47 +0300,2019-01-18 00:50:08 +0300,research,CC-BY-NC-ND,https://www.inaturalist.org/observations/19684339,https://static.inaturalist.org/photos/30319264/medium.jpeg?1547685704,,,,1,0,FALSE,,"California, US",San Nicolas,33.30712893,-119.555631,,28984,,obscured,TRUE,,,,Ventura,California,United States,California,Ventura,San Nicolas Island Snail,Micrarionta feralis,San Nicolas Island Snail,Mollusca,105717,Mollusca,Gastropoda,Stylommatophora,Helminthoglyptidae,,
iNaturalist,20102654,2014/08/28 5:09 PM MST,8/28/2014 0:00,8/29/2014,2014,8,29,4:09:00,400,Arizona,19215,tsirtalis,2019-02-05 07:59:55 +0300,2019-08-13 08:26:01 +0300,research,CC-BY-NC-ND,https://www.inaturalist.org/observations/20102654,https://static.inaturalist.org/photos/31032687/medium.jpeg?1549342467,,,,2,0,FALSE,,"California, US",San Nicolas,33.29882604,-119.5805305,,28984,,obscured,TRUE,,,,Ventura,California,United States,California,Ventura,San Nicolas Island Snail,Micrarionta feralis,San Nicolas Island Snail,Mollusca,105717,Mollusca,Gastropoda,Stylommatophora,Helminthoglyptidae,,
iNaturalist,20772706,Mon Feb 25 2019 11:11:51 GMT-0800 (PST),2/25/2019 0:00,2/25/2019,2019,2,25,22:11:51,300,Pacific Time (US & Canada),173183,serpophaga,2019-02-26 07:12:14 +0300,2019-11-06 07:08:16 +0300,research,CC-BY-NC,https://www.inaturalist.org/observations/20772706,https://inaturalist-open-data.s3.amazonaws.com/photos/32034177/medium.jpg?1551154382,,,,3,0,FALSE,3,"California, US",San Nicolas,33.2310193,-119.4223335,5,28984,,obscured,TRUE,,,,Ventura,California,United States,California,Ventura,San Nicolas Island Snail,Micrarionta feralis,San Nicolas Island Snail,Mollusca,105717,Mollusca,Gastropoda,Stylommatophora,Helminthoglyptidae,,
iNaturalist,67990368,Tue Jan 12 2021 14:33:50 GMT-0800 (PST),1/12/2021 0:00,1/13/2021,2021,1,13,3:33:50,300,Hawaii,464542,william_hoyer,2021-01-13 08:01:21 +0300,2021-01-13 23:20:04 +0300,research,CC-BY-NC,https://www.inaturalist.org/observations/67990368,https://inaturalist-open-data.s3.amazonaws.com/photos/109990243/medium.jpg?1610514099,,,In a rotting Leptosyne stem. ,1,0,FALSE,3,"California, US",San Nicolas,33.31205949,-119.4134396,4,28984,obscured,obscured,TRUE,,,,Ventura,California,United States,California,Ventura,San Nicolas Island Snail,Micrarionta feralis,San Nicolas Island Snail,Mollusca,105717,Mollusca,Gastropoda,Stylommatophora,Helminthoglyptidae,,
iNaturalist,67991275,Thu Jan 07 2021 08:30:24 GMT-0800 (PST),1/7/2021 0:00,1/7/2021,2021,1,7,21:30:24,300,Hawaii,464542,william_hoyer,2021-01-13 08:30:23 +0300,2021-01-13 23:19:50 +0300,research,CC-BY-NC,https://www.inaturalist.org/observations/67991275,https://inaturalist-open-data.s3.amazonaws.com/photos/109991924/medium.jpg?1610515843,,,Active!,1,0,FALSE,3,"California, US",San Nicolas,33.28576151,-119.4386493,38,28984,,obscured,TRUE,,,,Ventura,California,United States,California,Ventura,San Nicolas Island Snail,Micrarionta feralis,San Nicolas Island Snail,Mollusca,105717,Mollusca,Gastropoda,Stylommatophora,Helminthoglyptidae,,
iNaturalist,26985057,2019-06-12 1:22:43 PM PDT,6/12/2019 0:00,6/12/2019,2019,6,12,23:22:43,300,Pacific Time (US & Canada),34488,pileated,2019-06-15 00:02:56 +0300,2021-02-11 06:33:18 +0300,research,CC-BY,https://www.inaturalist.org/observations/26985057,https://inaturalist-open-data.s3.amazonaws.com/photos/41939313/medium.jpg?1560546178,,,,2,0,FALSE,2,"California, US",,33.38158177,-119.5753193,,28984,,obscured,TRUE,gps,gps,,Ventura,California,United States,California,Ventura,San Nicolas Island Snail,Micrarionta feralis,San Nicolas Island Snail,Mollusca,105717,Mollusca,Gastropoda,Stylommatophora,Xanthonychidae,Micrarionta,Micrarionta feralis
iNaturalist,7835615,Fri Sep 08 2017 10:15:38 GMT-0700 (PDT),9/8/2017 0:00,9/8/2017,2017,9,8,20:15:38,300,Pacific Time (US & Canada),84767,tlawson,2017-09-08 21:53:19 +0300,2020-03-08 11:12:19 +0300,research,,https://www.inaturalist.org/observations/7835615,https://static.inaturalist.org/photos/11312133/medium.jpg?1508538631,,,"From an old collection. Micrarionta gabbii (Newcomb, 1864) Collected by Henry Hemphill on San Clemente Island. 

11-12 mm.",1,0,FALSE,3,"California, US",San Clemente,32.83543007,-118.4381958,13294,29039,,obscured,TRUE,,,,Los Angeles,California,United States,California,Los Angeles,San Clemente Island Snail,Micrarionta gabbi,San Clemente Island Snail,Mollusca,225072,Mollusca,Gastropoda,Stylommatophora,Helminthoglyptidae,,
iNaturalist,19442048,Fri Jan 04 2019 15:25:09 GMT-0800 (PST),1/4/2019 0:00,1/5/2019,2019,1,5,2:25:09,300,Pacific Time (US & Canada),266196,shrike2,2019-01-05 18:00:05 +0300,2020-03-08 11:12:20 +0300,research,CC-BY-NC-ND,https://www.inaturalist.org/observations/19442048,https://inaturalist-open-data.s3.amazonaws.com/photos/29909899/medium.jpg?1546700459,,,,4,0,FALSE,3,"Los Angeles County, US-CA, US",San Clemente,33.05779076,-118.574811,5,29012,,obscured,TRUE,,,,Los Angeles,California,United States,California,Los Angeles,San Clemente Island Snail,Micrarionta gabbi,San Clemente Island Snail,Mollusca,225072,Mollusca,Gastropoda,Stylommatophora,Helminthoglyptidae,,
iNaturalist,19497752,2019/01/06 1:29 PM PST,1/6/2019 0:00,1/7/2019,2019,1,7,0:29:00,300,Pacific Time (US & Canada),213838,vireolanius,2019-01-08 00:20:36 +0300,2020-03-08 11:12:21 +0300,research,CC-BY-NC,https://www.inaturalist.org/observations/19497752,https://inaturalist-open-data.s3.amazonaws.com/photos/30002545/medium.jpg?1546895965,,,,2,0,FALSE,,"Los Angeles County, US-CA, US",San Clemente,32.92541553,-118.5756729,34,29039,,obscured,TRUE,,manual,,Los Angeles,California,United States,California,Los Angeles,San Clemente Island Snail,Micrarionta gabbi,San Clemente Island Snail,Mollusca,225072,Mollusca,Gastropoda,Stylommatophora,Helminthoglyptidae,,
iNaturalist,20158360,Sat Jan 26 2019 11:25:16 GMT-0800 (PST),1/26/2019 0:00,1/26/2019,2019,1,26,22:25:16,300,Pacific Time (US & Canada),266196,shrike2,2019-02-06 20:53:05 +0300,2020-03-08 11:12:23 +0300,research,CC-BY-NC-ND,https://www.inaturalist.org/observations/20158360,https://static.inaturalist.org/photos/31096690/medium.jpg?1549475593,,,,3,0,FALSE,3,"California, US",San Clemente,32.802767,-118.5087,93,29039,,obscured,TRUE,,,,Los Angeles,California,United States,California,Los Angeles,San Clemente Island Snail,Micrarionta gabbi,San Clemente Island Snail,Mollusca,225072,Mollusca,Gastropoda,Stylommatophora,Helminthoglyptidae,,
iNaturalist,20509314,Tue Feb 19 2019 17:03:30 GMT-0800 (PST),2/19/2019 0:00,2/20/2019,2019,2,20,4:03:30,300,Pacific Time (US & Canada),213838,vireolanius,2019-02-20 17:29:34 +0300,2020-03-08 11:12:24 +0300,research,CC-BY-NC,https://www.inaturalist.org/observations/20509314,https://inaturalist-open-data.s3.amazonaws.com/photos/31655888/medium.jpg?1550672988,,,,5,0,FALSE,3,"Los Angeles County, US-CA, US",San Clemente,32.86719989,-118.4109436,5,29039,,obscured,TRUE,,,,Los Angeles,California,United States,California,Los Angeles,San Clemente Island Snail,Micrarionta gabbi,San Clemente Island Snail,Mollusca,225072,Mollusca,Gastropoda,Stylommatophora,Helminthoglyptidae,,
iNaturalist,20858343,Thu Feb 28 2019 08:49:26 GMT-0800 (PST),2/28/2019 0:00,2/28/2019,2019,2,28,19:49:26,300,Pacific Time (US & Canada),266196,shrike2,2019-03-01 22:52:49 +0300,2020-03-08 11:12:25 +0300,research,CC-BY-NC-ND,https://www.inaturalist.org/observations/20858343,https://static.inaturalist.org/photos/32178987/medium.jpg?1551469972,,,,5,0,FALSE,3,"Los Angeles County, US-CA, US",San Clemente,33.0208261,-118.5660766,5,29012,,obscured,TRUE,,,,Los Angeles,California,United States,California,Los Angeles,San Clemente Island Snail,Micrarionta gabbi,San Clemente Island Snail,Mollusca,225072,Mollusca,Gastropoda,Stylommatophora,Helminthoglyptidae,,
iNaturalist,20953926,Mon Mar 04 2019 09:46:15 GMT-0800 (PST),3/4/2019 0:00,3/4/2019,2019,3,4,20:46:15,300,Pacific Time (US & Canada),213838,vireolanius,2019-03-05 01:10:47 +0300,2020-03-08 11:12:25 +0300,research,CC-BY-NC,https://www.inaturalist.org/observations/20953926,https://inaturalist-open-data.s3.amazonaws.com/photos/32349418/medium.jpg?1551737461,,,,5,0,FALSE,3,"California, US",San Clemente,32.81507501,-118.4012455,5,29039,,obscured,TRUE,,,,Los Angeles,California,United States,California,Los Angeles,San Clemente Island Snail,Micrarionta gabbi,San Clemente Island Snail,Mollusca,225072,Mollusca,Gastropoda,Stylommatophora,Helminthoglyptidae,,
iNaturalist,20953985,Mon Mar 04 2019 09:56:47 GMT-0800 (PST),3/4/2019 0:00,3/4/2019,2019,3,4,20:56:47,300,Pacific Time (US & Canada),213838,vireolanius,2019-03-05 01:12:32 +0300,2020-03-08 11:12:26 +0300,research,CC-BY-NC,https://www.inaturalist.org/observations/20953985,https://inaturalist-open-data.s3.amazonaws.com/photos/32349500/medium.jpg?1551737560,,,,5,0,FALSE,3,"California, US",San Clemente,32.98508798,-118.5512729,10,29039,,obscured,TRUE,,,,Los Angeles,California,United States,California,Los Angeles,San Clemente Island Snail,Micrarionta gabbi,San Clemente Island Snail,Mollusca,225072,Mollusca,Gastropoda,Stylommatophora,Helminthoglyptidae,,
iNaturalist,21067984,Tue Mar 05 2019 11:28:33 GMT-0800 (PST),3/5/2019 0:00,3/5/2019,2019,3,5,22:28:33,300,Pacific Time (US & Canada),266196,shrike2,2019-03-09 04:00:44 +0300,2020-03-08 11:12:26 +0300,research,CC-BY-NC-ND,https://www.inaturalist.org/observations/21067984,https://static.inaturalist.org/photos/32551406/medium.jpg?1552093270,,,,3,0,FALSE,3,"California, US",San Clemente,32.82747452,-118.4037996,5,29039,,obscured,TRUE,,,,Los Angeles,California,United States,California,Los Angeles,San Clemente Island Snail,Micrarionta gabbi,San Clemente Island Snail,Mollusca,225072,Mollusca,Gastropoda,Stylommatophora,Helminthoglyptidae,,
iNaturalist,21068136,Tue Mar 05 2019 12:08:46 GMT-0800 (PST),3/5/2019 0:00,3/5/2019,2019,3,5,23:08:46,300,Pacific Time (US & Canada),266196,shrike2,2019-03-09 04:10:01 +0300,2020-03-08 11:12:27 +0300,research,CC-BY-NC-ND,https://www.inaturalist.org/observations/21068136,https://static.inaturalist.org/photos/32551766/medium.jpg?1552093851,,,,3,0,FALSE,3,"California, US",San Clemente,32.94435962,-118.4331721,5,29039,,obscured,TRUE,,,,Los Angeles,California,United States,California,Los Angeles,San Clemente Island Snail,Micrarionta gabbi,San Clemente Island Snail,Mollusca,225072,Mollusca,Gastropoda,Stylommatophora,Helminthoglyptidae,,
iNaturalist,21069412,Fri Mar 08 2019 13:25:48 GMT-0800 (PST),3/8/2019 0:00,3/9/2019,2019,3,9,0:25:48,300,Pacific Time (US & Canada),266196,shrike2,2019-03-09 05:13:27 +0300,2021-01-14 00:03:47 +0300,research,CC-BY-NC-ND,https://www.inaturalist.org/observations/21069412,https://static.inaturalist.org/photos/32554596/medium.jpg?1552097624,,,,3,0,FALSE,3,"California, US",San Clemente,32.83892667,-118.4534259,5,29039,,obscured,TRUE,,,,Los Angeles,California,United States,California,Los Angeles,San Clemente Island Snail,Micrarionta gabbi,San Clemente Island Snail,Mollusca,225072,Mollusca,Gastropoda,Stylommatophora,Helminthoglyptidae,,
iNaturalist,21260450,2019/02/19 5:05 PM PST,2/19/2019 0:00,2/20/2019,2019,2,20,4:05:00,300,Pacific Time (US & Canada),266196,shrike2,2019-03-15 19:39:52 +0300,2020-03-08 11:12:28 +0300,research,CC-BY-NC-ND,https://www.inaturalist.org/observations/21260450,https://static.inaturalist.org/photos/32869550/medium.jpg?1552666473,,,young snail,4,0,FALSE,,"Los Angeles County, US-CA, US",San Clemente,32.95896754,-118.4483423,67,29039,,obscured,TRUE,,,,Los Angeles,California,United States,California,Los Angeles,San Clemente Island Snail,Micrarionta gabbi,San Clemente Island Snail,Mollusca,225072,Mollusca,Gastropoda,Stylommatophora,Helminthoglyptidae,,
iNaturalist,21260452,2019/02/19 5:05 PM PST,2/19/2019 0:00,2/20/2019,2019,2,20,4:05:00,300,Pacific Time (US & Canada),266196,shrike2,2019-03-15 19:39:53 +0300,2020-03-08 11:12:29 +0300,research,CC-BY-NC-ND,https://www.inaturalist.org/observations/21260452,https://static.inaturalist.org/photos/32869556/medium.jpg?1552666483,,,,4,0,FALSE,,"Los Angeles County, US-CA, US",San Clemente,32.93297908,-118.5462671,67,29039,,obscured,TRUE,,,,Los Angeles,California,United States,California,Los Angeles,San Clemente Island Snail,Micrarionta gabbi,San Clemente Island Snail,Mollusca,225072,Mollusca,Gastropoda,Stylommatophora,Helminthoglyptidae,,
iNaturalist,21260453,2019/02/19 5:06 PM PST,2/19/2019 0:00,2/20/2019,2019,2,20,4:06:00,300,Pacific Time (US & Canada),266196,shrike2,2019-03-15 19:39:55 +0300,2020-03-08 11:12:30 +0300,research,CC-BY-NC-ND,https://www.inaturalist.org/observations/21260453,https://static.inaturalist.org/photos/32869564/medium.jpg?1552666499,,,very young snail,4,0,FALSE,,"Los Angeles County, US-CA, US",San Clemente,32.89320478,-118.589289,67,29039,,obscured,TRUE,,,,Los Angeles,California,United States,California,Los Angeles,San Clemente Island Snail,Micrarionta gabbi,San Clemente Island Snail,Mollusca,225072,Mollusca,Gastropoda,Stylommatophora,Helminthoglyptidae,,
iNaturalist,21260455,2019/02/19 5:07 PM PST,2/19/2019 0:00,2/20/2019,2019,2,20,4:07:00,300,Pacific Time (US & Canada),266196,shrike2,2019-03-15 19:39:57 +0300,2020-03-08 11:12:30 +0300,research,CC-BY-NC-ND,https://www.inaturalist.org/observations/21260455,https://static.inaturalist.org/photos/32869596/medium.jpg?1552666541,,,,3,0,FALSE,,"Los Angeles County, US-CA, US",San Clemente,32.90259083,-118.5452053,67,29039,,obscured,TRUE,,,,Los Angeles,California,United States,California,Los Angeles,San Clemente Island Snail,Micrarionta gabbi,San Clemente Island Snail,Mollusca,225072,Mollusca,Gastropoda,Stylommatophora,Helminthoglyptidae,,
iNaturalist,21260457,2019/02/19 5:08 PM PST,2/19/2019 0:00,2/20/2019,2019,2,20,4:08:00,300,Pacific Time (US & Canada),266196,shrike2,2019-03-15 19:39:58 +0300,2020-03-08 11:12:31 +0300,research,CC-BY-NC-ND,https://www.inaturalist.org/observations/21260457,https://static.inaturalist.org/photos/32869601/medium.jpg?1552666550,,,young snail,4,0,FALSE,,"Los Angeles County, US-CA, US",San Clemente,32.90421279,-118.5350032,67,29039,,obscured,TRUE,,,,Los Angeles,California,United States,California,Los Angeles,San Clemente Island Snail,Micrarionta gabbi,San Clemente Island Snail,Mollusca,225072,Mollusca,Gastropoda,Stylommatophora,Helminthoglyptidae,,
iNaturalist,21411389,2019-03-03 9:12:15 AM PST,3/3/2019 0:00,,,,,,,Pacific Time (US & Canada),34488,pileated,2019-03-20 07:51:59 +0300,2021-01-09 01:12:52 +0300,research,CC-BY,https://www.inaturalist.org/observations/21411389,https://inaturalist-open-data.s3.amazonaws.com/photos/33124843/medium.jpeg?1553057522,,,,3,0,FALSE,2,"California, US",San Clemente,32.91914869,-118.4110343,352,29039,,obscured,TRUE,gps,gps,,Los Angeles,California,United States,California,Los Angeles,San Clemente Island Snail,Micrarionta gabbi,San Clemente Island Snail,Mollusca,225072,Mollusca,Gastropoda,Stylommatophora,Helminthoglyptidae,,
iNaturalist,21411422,2019-03-03 1:13:01 PM PST,3/3/2019 0:00,3/4/2019,2019,3,4,0:13:01,300,Pacific Time (US & Canada),34488,pileated,2019-03-20 07:54:10 +0300,2021-01-09 00:51:37 +0300,research,CC-BY,https://www.inaturalist.org/observations/21411422,https://inaturalist-open-data.s3.amazonaws.com/photos/33124924/medium.jpeg?1553057653,,,,3,0,FALSE,2,"California, US",San Clemente,32.96963299,-118.5719164,200,29039,,obscured,TRUE,gps,gps,,Los Angeles,California,United States,California,Los Angeles,San Clemente Island Snail,Micrarionta gabbi,San Clemente Island Snail,Mollusca,225072,Mollusca,Gastropoda,Stylommatophora,Helminthoglyptidae,,
iNaturalist,21769728,3/22/2019,3/22/2019 0:00,,,,,,,Pacific Time (US & Canada),12809,cedric_lee,2019-03-30 10:37:06 +0300,2021-01-09 01:10:50 +0300,research,CC-BY-NC,https://www.inaturalist.org/observations/21769728,https://inaturalist-open-data.s3.amazonaws.com/photos/33701882/medium.jpeg?1553908212,,,,3,0,FALSE,,"Los Angeles County, US-CA, US",San Clemente,32.94332677,-118.4409209,,29039,obscured,obscured,TRUE,,,,Los Angeles,California,United States,California,Los Angeles,San Clemente Island Snail,Micrarionta gabbi,San Clemente Island Snail,Mollusca,225072,Mollusca,Gastropoda,Stylommatophora,Helminthoglyptidae,,
iNaturalist,21786489,2019/03/22 5:22 PM PDT,3/22/2019 0:00,3/23/2019,2019,3,23,3:22:00,300,Pacific Time (US & Canada),12809,cedric_lee,2019-03-30 20:42:30 +0300,2021-01-14 00:02:02 +0300,research,CC-BY-NC,https://www.inaturalist.org/observations/21786489,https://inaturalist-open-data.s3.amazonaws.com/photos/33745905/medium.jpeg?1553968071,,,,3,0,FALSE,,"Los Angeles County, US-CA, US",San Clemente,32.82599127,-118.4057589,63,29039,obscured,obscured,TRUE,,,,Los Angeles,California,United States,California,Los Angeles,San Clemente Island Snail,Micrarionta gabbi,San Clemente Island Snail,Mollusca,225072,Mollusca,Gastropoda,Stylommatophora,Helminthoglyptidae,,
iNaturalist,21802992,2019/03/24 1:46 PM PDT,3/24/2019 0:00,3/24/2019,2019,3,24,23:46:00,300,Pacific Time (US & Canada),12809,cedric_lee,2019-03-31 02:11:30 +0300,2021-01-09 01:19:12 +0300,research,CC-BY-NC,https://www.inaturalist.org/observations/21802992,https://inaturalist-open-data.s3.amazonaws.com/photos/33767373/medium.jpeg?1553982734,,,,2,0,FALSE,,"California, US",San Clemente,32.91486486,-118.3176645,,29039,obscured,obscured,TRUE,,,,Los Angeles,California,United States,California,Los Angeles,San Clemente Island Snail,Micrarionta gabbi,San Clemente Island Snail,Mollusca,225072,Mollusca,Gastropoda,Stylommatophora,Helminthoglyptidae,,
iNaturalist,21810259,2019/03/25 2:54 PM PDT,3/25/2019 0:00,3/26/2019,2019,3,26,0:54:00,300,Pacific Time (US & Canada),12809,cedric_lee,2019-03-31 05:10:54 +0300,2021-01-09 01:24:21 +0300,research,CC-BY-NC,https://www.inaturalist.org/observations/21810259,https://inaturalist-open-data.s3.amazonaws.com/photos/33777104/medium.jpeg?1553991417,,,Micrarionta gabbi maxima compared to M. gabbi,4,0,FALSE,,"California, US",San Clemente,32.84956764,-118.4633462,81,29039,obscured,obscured,TRUE,,,,Los Angeles,California,United States,California,Los Angeles,San Clemente Island Snail,Micrarionta gabbi,San Clemente Island Snail,Mollusca,225072,Mollusca,Gastropoda,Stylommatophora,Helminthoglyptidae,,
iNaturalist,21814056,2019/03/26 8:41 AM PDT,3/26/2019 0:00,3/26/2019,2019,3,26,18:41:00,300,Pacific Time (US & Canada),12809,cedric_lee,2019-03-31 06:57:33 +0300,2020-07-02 06:54:33 +0300,research,CC-BY-NC,https://www.inaturalist.org/observations/21814056,https://inaturalist-open-data.s3.amazonaws.com/photos/33787308/medium.jpeg?1553999835,,,,2,0,FALSE,,"California, US",San Clemente,32.96886873,-118.4535949,,29039,obscured,obscured,TRUE,,,,Los Angeles,California,United States,California,Los Angeles,San Clemente Island Snail,Micrarionta gabbi,San Clemente Island Snail,Mollusca,225072,Mollusca,Gastropoda,Stylommatophora,Helminthoglyptidae,,
iNaturalist,21823975,2019/03/27 8:10 AM PDT,3/27/2019 0:00,3/27/2019,2019,3,27,18:10:00,300,Pacific Time (US & Canada),12809,cedric_lee,2019-03-31 16:20:00 +0300,2020-07-02 06:54:41 +0300,research,CC-BY-NC,https://www.inaturalist.org/observations/21823975,https://inaturalist-open-data.s3.amazonaws.com/photos/33809084/medium.jpeg?1554037565,,,,4,0,FALSE,,"California, US",San Clemente,32.85032799,-118.5593609,,29039,obscured,obscured,TRUE,,,,Los Angeles,California,United States,California,Los Angeles,San Clemente Island Snail,Micrarionta gabbi,San Clemente Island Snail,Mollusca,225072,Mollusca,Gastropoda,Stylommatophora,Helminthoglyptidae,,
iNaturalist,21831393,2019-03-26 9:30:53 AM PDT,3/26/2019 0:00,3/26/2019,2019,3,26,19:30:53,300,Pacific Time (US & Canada),34488,pileated,2019-03-31 19:54:45 +0300,2021-01-09 01:30:14 +0300,research,CC-BY,https://www.inaturalist.org/observations/21831393,https://inaturalist-open-data.s3.amazonaws.com/photos/33821425/medium.jpeg?1554051288,,,,3,0,FALSE,2,"California, US",San Clemente,32.85955103,-118.5550295,176,29039,,obscured,TRUE,gps,gps,,Los Angeles,California,United States,California,Los Angeles,San Clemente Island Snail,Micrarionta gabbi,San Clemente Island Snail,Mollusca,225072,Mollusca,Gastropoda,Stylommatophora,Helminthoglyptidae,,
iNaturalist,21831481,2019-03-26 10:01:59 AM PDT,3/26/2019 0:00,3/26/2019,2019,3,26,20:01:59,300,Pacific Time (US & Canada),34488,pileated,2019-03-31 19:56:52 +0300,2020-04-23 21:20:27 +0300,research,CC-BY,https://www.inaturalist.org/observations/21831481,https://inaturalist-open-data.s3.amazonaws.com/photos/33821537/medium.jpeg?1554051420,,,,3,0,FALSE,2,"California, US",San Clemente,32.91028266,-118.5489058,,29039,,obscured,TRUE,gps,gps,,Los Angeles,California,United States,California,Los Angeles,San Clemente Island Snail,Micrarionta gabbi,San Clemente Island Snail,Mollusca,225072,Mollusca,Gastropoda,Stylommatophora,Helminthoglyptidae,,
iNaturalist,21907543,2019/03/27 3:24 PM PDT,3/27/2019 0:00,3/28/2019,2019,3,28,1:24:00,300,Pacific Time (US & Canada),12809,cedric_lee,2019-04-02 16:39:42 +0300,2020-07-02 06:54:51 +0300,research,CC-BY-NC,https://www.inaturalist.org/observations/21907543,https://inaturalist-open-data.s3.amazonaws.com/photos/33937058/medium.jpeg?1554185704,,,,4,0,FALSE,,"California, US",San Clemente,32.93126543,-118.4163302,111,29039,obscured,obscured,TRUE,,,,Los Angeles,California,United States,California,Los Angeles,San Clemente Island Snail,Micrarionta gabbi,San Clemente Island Snail,Mollusca,225072,Mollusca,Gastropoda,Stylommatophora,Helminthoglyptidae,,
iNaturalist,22238759,Sat Apr 06 2019 14:38:37 GMT-0700 (PDT),4/6/2019 0:00,4/7/2019,2019,4,7,0:38:37,300,Pacific Time (US & Canada),266196,shrike2,2019-04-09 18:18:35 +0300,2020-03-08 11:12:38 +0300,research,CC-BY-NC-ND,https://www.inaturalist.org/observations/22238759,https://static.inaturalist.org/photos/34437141/medium.jpg?1554823128,,,,3,0,FALSE,3,"California, US",San Clemente,32.84050745,-118.5115234,5,29039,,obscured,TRUE,,,,Los Angeles,California,United States,California,Los Angeles,San Clemente Island Snail,Micrarionta gabbi,San Clemente Island Snail,Mollusca,225072,Mollusca,Gastropoda,Stylommatophora,Helminthoglyptidae,,
iNaturalist,23038868,2019-04-14 9:53:13 AM PDT,4/14/2019 0:00,4/14/2019,2019,4,14,19:53:13,300,Pacific Time (US & Canada),34488,pileated,2019-04-25 09:17:36 +0300,2021-01-09 01:28:27 +0300,research,CC-BY,https://www.inaturalist.org/observations/23038868,https://inaturalist-open-data.s3.amazonaws.com/photos/35716307/medium.jpeg?1556173065,,,,2,0,FALSE,2,"California, US",San Clemente,32.91876094,-118.4055485,44,29039,,obscured,TRUE,gps,gps,,Los Angeles,California,United States,California,Los Angeles,San Clemente Island Snail,Micrarionta gabbi,San Clemente Island Snail,Mollusca,225072,Mollusca,Gastropoda,Stylommatophora,Helminthoglyptidae,,
iNaturalist,24093497,Mon Apr 29 2019 16:29:19 GMT-0700 (PDT),4/29/2019 0:00,4/30/2019,2019,4,30,2:29:19,300,Pacific Time (US & Canada),266196,shrike2,2019-04-30 04:15:33 +0300,2020-04-30 21:10:30 +0300,research,CC-BY-NC-ND,https://www.inaturalist.org/observations/24093497,https://static.inaturalist.org/photos/37260772/medium.jpg?1556587110,,,,4,0,FALSE,3,"Los Angeles County, US-CA, US",San Clemente,33.03674116,-118.5452253,5,29012,,obscured,TRUE,,,,Los Angeles,California,United States,California,Los Angeles,San Clemente Island Snail,Micrarionta gabbi,San Clemente Island Snail,Mollusca,225072,Mollusca,Gastropoda,Stylommatophora,Helminthoglyptidae,,
iNaturalist,24851731,Wed May 08 2019 14:50:33 GMT-0700 (PDT),5/8/2019 0:00,5/9/2019,2019,5,9,0:50:33,300,Pacific Time (US & Canada),130586,xterrapin,2019-05-09 22:48:16 +0300,2020-04-23 03:20:58 +0300,research,CC-BY-NC,https://www.inaturalist.org/observations/24851731,https://inaturalist-open-data.s3.amazonaws.com/photos/38437531/medium.jpg?1557431299,,,,3,0,FALSE,3,"California, US",San Clemente,32.93942186,-118.515579,64,29039,,obscured,TRUE,,,,Los Angeles,California,United States,California,Los Angeles,San Clemente Island Snail,Micrarionta gabbi,San Clemente Island Snail,Mollusca,225072,Mollusca,Gastropoda,Stylommatophora,Helminthoglyptidae,,
iNaturalist,25094808,2019-05-08 2:51:01 PM PDT,5/8/2019 0:00,5/9/2019,2019,5,9,0:51:01,300,Pacific Time (US & Canada),34488,pileated,2019-05-14 07:11:07 +0300,2020-04-23 21:06:36 +0300,research,CC-BY,https://www.inaturalist.org/observations/25094808,https://inaturalist-open-data.s3.amazonaws.com/photos/38839378/medium.jpg?1557807913,,,,3,0,FALSE,2,"California, US",San Clemente,32.99510249,-118.4773616,,29039,,obscured,TRUE,gps,gps,,Los Angeles,California,United States,California,Los Angeles,San Clemente Island Snail,Micrarionta gabbi,San Clemente Island Snail,Mollusca,225072,Mollusca,Gastropoda,Stylommatophora,Helminthoglyptidae,,
iNaturalist,25095359,2019-05-07 12:39:14 PM PDT,5/7/2019 0:00,5/7/2019,2019,5,7,22:39:14,300,Pacific Time (US & Canada),34488,pileated,2019-05-14 07:28:15 +0300,2020-04-23 21:06:29 +0300,research,CC-BY,https://www.inaturalist.org/observations/25095359,https://inaturalist-open-data.s3.amazonaws.com/photos/38839594/medium.jpeg?1557808098,,,,3,0,FALSE,2,"California, US",San Clemente,32.87737661,-118.4967168,,29039,,obscured,TRUE,gps,gps,,Los Angeles,California,United States,California,Los Angeles,San Clemente Island Snail,Micrarionta gabbi,San Clemente Island Snail,Mollusca,225072,Mollusca,Gastropoda,Stylommatophora,Helminthoglyptidae,,
iNaturalist,29591564,Fri Jul 26 2019 10:16:28 GMT-0700 (PDT),7/26/2019 0:00,7/26/2019,2019,7,26,20:16:28,300,Pacific Time (US & Canada),266196,shrike2,2019-07-26 22:33:09 +0300,2020-03-08 11:12:44 +0300,research,CC-BY-NC-ND,https://www.inaturalist.org/observations/29591564,https://static.inaturalist.org/photos/46190313/medium.jpg?1564169629,,,,1,0,FALSE,3,"California, US",San Clemente,32.80590119,-118.4554817,30,29039,,obscured,TRUE,,,,Los Angeles,California,United States,California,Los Angeles,San Clemente Island Snail,Micrarionta gabbi,San Clemente Island Snail,Mollusca,225072,Mollusca,Gastropoda,Stylommatophora,Helminthoglyptidae,,
iNaturalist,33441465,Thu Sep 26 2019 10:12:55 GMT-0700 (PDT),9/26/2019 0:00,9/26/2019,2019,9,26,20:12:55,300,Pacific Time (US & Canada),266196,shrike2,2019-09-26 21:50:42 +0300,2020-04-30 21:05:49 +0300,research,CC-BY-NC-ND,https://www.inaturalist.org/observations/33441465,https://static.inaturalist.org/photos/52524450/medium.jpg?1569523857,,,,4,0,FALSE,3,"Los Angeles County, US-CA, US",San Clemente,33.03287737,-118.5006692,5,29012,,obscured,TRUE,,,,Los Angeles,California,United States,California,Los Angeles,San Clemente Island Snail,Micrarionta gabbi,San Clemente Island Snail,Mollusca,225072,Mollusca,Gastropoda,Stylommatophora,Helminthoglyptidae,,
iNaturalist,36260413,Sun Dec 01 2019 09:34:03 GMT-0800 (PST),12/1/2019 0:00,12/1/2019,2019,12,1,20:34:03,300,Pacific Time (US & Canada),266196,shrike2,2019-12-01 21:07:50 +0300,2020-04-30 21:06:38 +0300,research,CC-BY-NC-ND,https://www.inaturalist.org/observations/36260413,https://static.inaturalist.org/photos/57297168/medium.jpg?1575223711,,,,3,0,FALSE,3,"Los Angeles County, US-CA, US",San Clemente,32.95222059,-118.5057623,10,29039,,obscured,TRUE,,,,Los Angeles,California,United States,California,Los Angeles,San Clemente Island Snail,Micrarionta gabbi,San Clemente Island Snail,Mollusca,225072,Mollusca,Gastropoda,Stylommatophora,Helminthoglyptidae,,
iNaturalist,37504702,Sat Jan 11 2020 13:33:29 GMT-0800 (PST),1/11/2020 0:00,1/12/2020,2020,1,12,0:33:29,300,Pacific Time (US & Canada),266196,shrike2,2020-01-12 03:35:22 +0300,2020-04-30 21:02:03 +0300,research,CC-BY-NC-ND,https://www.inaturalist.org/observations/37504702,https://static.inaturalist.org/photos/59466899/medium.jpg?1578789330,,,,1,0,FALSE,3,"Los Angeles County, US-CA, US",San Clemente,32.92193398,-118.4189437,5,29039,,obscured,TRUE,,,,Los Angeles,California,United States,California,Los Angeles,San Clemente Island Snail,Micrarionta gabbi,San Clemente Island Snail,Mollusca,225072,Mollusca,Gastropoda,Stylommatophora,Helminthoglyptidae,,
iNaturalist,37546059,Sun Jan 12 2020 13:38:46 GMT-0800 (PST),1/12/2020 0:00,1/13/2020,2020,1,13,0:38:46,300,Pacific Time (US & Canada),12809,cedric_lee,2020-01-13 06:08:04 +0300,2020-07-02 06:53:21 +0300,research,CC-BY-NC,https://www.inaturalist.org/observations/37546059,https://inaturalist-open-data.s3.amazonaws.com/photos/59559532/medium.jpg?1578923070,,,,1,0,FALSE,3,"Los Angeles County, US-CA, US",San Clemente,32.9424094,-118.5900053,35,29039,,obscured,TRUE,,,,Los Angeles,California,United States,California,Los Angeles,San Clemente Island Snail,Micrarionta gabbi,San Clemente Island Snail,Mollusca,225072,Mollusca,Gastropoda,Stylommatophora,Helminthoglyptidae,,
iNaturalist,37672180,Thu Jan 16 2020 09:53:15 GMT-0800 (PST),1/16/2020 0:00,1/16/2020,2020,1,16,20:53:15,300,Pacific Time (US & Canada),12809,cedric_lee,2020-01-17 07:31:38 +0300,2020-07-02 06:53:24 +0300,research,CC-BY-NC,https://www.inaturalist.org/observations/37672180,https://inaturalist-open-data.s3.amazonaws.com/photos/59770847/medium.jpg?1579235506,,,,1,0,FALSE,3,"Los Angeles County, US-CA, US",San Clemente,33.02550138,-118.5140479,9,29012,,obscured,TRUE,,,,Los Angeles,California,United States,California,Los Angeles,,Micrarionta gabbi,San Clemente Island Snail,Mollusca,225072,Mollusca,Gastropoda,Stylommatophora,Helminthoglyptidae,,
iNaturalist,37859372,Wed Jan 22 2020 10:24:18 GMT-0800 (PST),1/22/2020 0:00,1/22/2020,2020,1,22,21:24:18,300,Pacific Time (US & Canada),12809,cedric_lee,2020-01-23 03:06:35 +0300,2020-07-02 06:53:25 +0300,research,CC-BY-NC,https://www.inaturalist.org/observations/37859372,https://inaturalist-open-data.s3.amazonaws.com/photos/60100025/medium.jpg?1579738038,,,,2,0,FALSE,3,"Los Angeles County, US-CA, US",San Clemente,32.83429439,-118.4802622,7,29039,,obscured,TRUE,,,,Los Angeles,California,United States,California,Los Angeles,San Clemente Island Snail,Micrarionta gabbi,San Clemente Island Snail,Mollusca,225072,Mollusca,Gastropoda,Stylommatophora,Helminthoglyptidae,,
iNaturalist,37986498,Sat Jan 25 2020 13:18:17 GMT-0800 (PST),1/25/2020 0:00,1/26/2020,2020,1,26,0:18:17,300,Pacific Time (US & Canada),12809,cedric_lee,2020-01-26 17:31:33 +0300,2020-07-02 06:53:26 +0300,research,CC-BY-NC,https://www.inaturalist.org/observations/37986498,https://inaturalist-open-data.s3.amazonaws.com/photos/60271983/medium.jpg?1579999091,,,,2,0,FALSE,,"Los Angeles County, US-CA, US",San Clemente,33.02573434,-118.5158259,9,29012,,obscured,TRUE,,,,Los Angeles,California,United States,California,Los Angeles,San Clemente Island Snail,Micrarionta gabbi,San Clemente Island Snail,Mollusca,225072,Mollusca,Gastropoda,Stylommatophora,Helminthoglyptidae,,
iNaturalist,38652033,Thu Feb 13 2020 09:38:08 GMT-0800 (PST),2/13/2020 0:00,2/13/2020,2020,2,13,20:38:08,300,Pacific Time (US & Canada),12809,cedric_lee,2020-02-15 02:56:25 +0300,2021-03-09 09:45:59 +0300,research,CC-BY-NC,https://www.inaturalist.org/observations/38652033,https://inaturalist-open-data.s3.amazonaws.com/photos/61461821/medium.jpg?1581724595,,,,2,0,FALSE,3,"California, US",San Clemente,32.97128638,-118.4156101,11,29039,,obscured,TRUE,,,,Los Angeles,California,United States,California,Los Angeles,San Clemente Island Snail,Micrarionta gabbi,San Clemente Island Snail,Mollusca,225072,Mollusca,Gastropoda,Stylommatophora,Helminthoglyptidae,,
iNaturalist,38662146,2/10/2020,2/10/2020 0:00,,,,,,,Pacific Time (US & Canada),12809,cedric_lee,2020-02-15 10:44:04 +0300,2021-03-09 09:45:59 +0300,needs_id,CC-BY-NC,https://www.inaturalist.org/observations/38662146,https://inaturalist-open-data.s3.amazonaws.com/photos/61478728/medium.jpeg?1581750305,,,,0,0,FALSE,,"California, US",San Clemente,32.8464019,-118.5806293,91,29039,,obscured,TRUE,,,,Los Angeles,California,United States,California,Los Angeles,San Clemente Island Snail,Micrarionta gabbi,San Clemente Island Snail,Mollusca,225072,Mollusca,Gastropoda,Stylommatophora,Helminthoglyptidae,,
iNaturalist,38662150,2/10/2020,2/10/2020 0:00,,,,,,,Pacific Time (US & Canada),12809,cedric_lee,2020-02-15 10:44:07 +0300,2021-03-09 09:45:59 +0300,needs_id,CC-BY-NC,https://www.inaturalist.org/observations/38662150,https://inaturalist-open-data.s3.amazonaws.com/photos/61478802/medium.jpeg?1581750388,,,,0,0,FALSE,,"California, US",San Clemente,32.86347866,-118.4392731,91,29039,,obscured,TRUE,,,,Los Angeles,California,United States,California,Los Angeles,San Clemente Island Snail,Micrarionta gabbi,San Clemente Island Snail,Mollusca,225072,Mollusca,Gastropoda,Stylommatophora,Helminthoglyptidae,,
iNaturalist,38662630,2/13/2020,2/13/2020 0:00,,,,,,,Pacific Time (US & Canada),12809,cedric_lee,2020-02-15 11:15:10 +0300,2021-03-09 09:45:59 +0300,needs_id,CC-BY-NC,https://www.inaturalist.org/observations/38662630,https://inaturalist-open-data.s3.amazonaws.com/photos/61479985/medium.jpeg?1581753230,,,,0,0,FALSE,,"California, US",San Clemente,32.96417874,-118.5865095,129,29039,,obscured,TRUE,,,,Los Angeles,California,United States,California,Los Angeles,San Clemente Island Snail,Micrarionta gabbi,San Clemente Island Snail,Mollusca,225072,Mollusca,Gastropoda,Stylommatophora,Helminthoglyptidae,,
iNaturalist,38662631,2/13/2020,2/13/2020 0:00,,,,,,,Pacific Time (US & Canada),12809,cedric_lee,2020-02-15 11:15:12 +0300,2021-03-09 09:46:00 +0300,research,CC-BY-NC,https://www.inaturalist.org/observations/38662631,https://inaturalist-open-data.s3.amazonaws.com/photos/61479998/medium.jpeg?1581753258,,,,1,0,FALSE,,"California, US",San Clemente,32.97012954,-118.4613124,129,29039,,obscured,TRUE,,,,Los Angeles,California,United States,California,Los Angeles,San Clemente Island Snail,Micrarionta gabbi,San Clemente Island Snail,Mollusca,225072,Mollusca,Gastropoda,Stylommatophora,Helminthoglyptidae,,
iNaturalist,38778228,Fri Feb 07 2020 10:19:33 GMT-0800 (PST),2/7/2020 0:00,2/7/2020,2020,2,7,21:19:33,300,Pacific Time (US & Canada),12809,cedric_lee,2020-02-18 04:12:35 +0300,2021-03-09 09:46:01 +0300,research,CC-BY-NC,https://www.inaturalist.org/observations/38778228,https://inaturalist-open-data.s3.amazonaws.com/photos/61684527/medium.jpg?1581988364,,,,1,0,FALSE,3,"Los Angeles County, US-CA, US",San Clemente,33.05641235,-118.5232005,9,29012,,obscured,TRUE,,,,Los Angeles,California,United States,California,Los Angeles,San Clemente Island Snail,Micrarionta gabbi,San Clemente Island Snail,Mollusca,225072,Mollusca,Gastropoda,Stylommatophora,Helminthoglyptidae,,
iNaturalist,38779453,Thu Feb 06 2020 16:45:34 GMT-0800 (PST),2/6/2020 0:00,2/7/2020,2020,2,7,3:45:34,300,Pacific Time (US & Canada),12809,cedric_lee,2020-02-18 04:46:05 +0300,2021-03-09 09:46:01 +0300,research,CC-BY-NC,https://www.inaturalist.org/observations/38779453,https://inaturalist-open-data.s3.amazonaws.com/photos/61686650/medium.jpg?1581990375,,,,1,0,FALSE,3,"Los Angeles County, US-CA, US",San Clemente,32.99592713,-118.5467275,14,29039,,obscured,TRUE,,,,Los Angeles,California,United States,California,Los Angeles,,Micrarionta gabbi,San Clemente Island Snail,Mollusca,225072,Mollusca,Gastropoda,Stylommatophora,Helminthoglyptidae,,
iNaturalist,39394397,2020/02/23 2:47 PM PST,2/23/2020 0:00,2/24/2020,2020,2,24,1:47:00,300,Pacific Time (US & Canada),12809,cedric_lee,2020-03-01 10:36:00 +0300,2020-04-30 21:03:19 +0300,research,CC-BY-NC,https://www.inaturalist.org/observations/39394397,https://inaturalist-open-data.s3.amazonaws.com/photos/62487780/medium.jpeg?1583041894,,,,1,0,FALSE,,"California, US",San Clemente,32.82752653,-118.4153003,87,29039,,obscured,TRUE,,,,Los Angeles,California,United States,California,Los Angeles,San Clemente Island Snail,Micrarionta gabbi,San Clemente Island Snail,Mollusca,225072,Mollusca,Gastropoda,Stylommatophora,Helminthoglyptidae,,
iNaturalist,39571133,2020/03/04 12:43 PM PST,3/4/2020 0:00,3/4/2020,2020,3,4,23:43:00,300,Pacific Time (US & Canada),266196,shrike2,2020-03-05 17:48:22 +0300,2020-03-08 11:12:57 +0300,research,CC-BY-NC-ND,https://www.inaturalist.org/observations/39571133,https://static.inaturalist.org/photos/62792524/medium.jpeg?1583419686,,,,2,0,FALSE,,"California, US",San Clemente,32.80739554,-118.5589293,5,29039,,obscured,TRUE,,,,Los Angeles,California,United States,California,Los Angeles,San Clemente Island Snail,Micrarionta gabbi,San Clemente Island Snail,Mollusca,225072,Mollusca,Gastropoda,Stylommatophora,Helminthoglyptidae,,
iNaturalist,39716375,Sun Mar 08 2020 10:52:35 GMT-0700 (PDT),3/8/2020 0:00,3/8/2020,2020,3,8,20:52:35,300,Pacific Time (US & Canada),266196,shrike2,2020-03-08 23:04:39 +0300,2020-03-09 19:46:19 +0300,research,CC-BY-NC-ND,https://www.inaturalist.org/observations/39716375,https://static.inaturalist.org/photos/63037751/medium.jpg?1583697902,,,,0,0,FALSE,3,"California, US",San Clemente,32.85019887,-118.5581739,10,29039,,obscured,TRUE,,,,Los Angeles,California,United States,California,Los Angeles,San Clemente Island Snail,Micrarionta gabbi,San Clemente Island Snail,Mollusca,225072,Mollusca,Gastropoda,Stylommatophora,Helminthoglyptidae,,
iNaturalist,39775141,Mon Mar 09 2020 09:27:00 GMT-0700 (PDT),3/9/2020 0:00,3/9/2020,2020,3,9,19:27:00,300,Pacific Time (US & Canada),266196,shrike2,2020-03-10 01:58:44 +0300,2020-03-10 16:56:22 +0300,research,CC-BY-NC-ND,https://www.inaturalist.org/observations/39775141,https://static.inaturalist.org/photos/63138254/medium.jpg?1583794733,,,,0,0,FALSE,3,"California, US",San Clemente,32.87162472,-118.4334737,19,29039,,obscured,TRUE,,,,Los Angeles,California,United States,California,Los Angeles,San Clemente Island Snail,Micrarionta gabbi,San Clemente Island Snail,Mollusca,225072,Mollusca,Gastropoda,Stylommatophora,Helminthoglyptidae,,
iNaturalist,40677870,2020/02/20 12:21 PM PST,2/20/2020 0:00,2/20/2020,2020,2,20,23:21:00,300,Pacific Time (US & Canada),266196,shrike2,2020-03-25 06:45:04 +0300,2020-03-25 16:06:41 +0300,research,CC-BY-NC-ND,https://www.inaturalist.org/observations/40677870,https://static.inaturalist.org/photos/64481537/medium.jpg?1585107500,,,,2,0,FALSE,,"Los Angeles County, US-CA, US",San Clemente,33.03582993,-118.6975691,5,29012,,obscured,TRUE,,,,Los Angeles,California,United States,California,Los Angeles,San Clemente Island Snail,Micrarionta gabbi,San Clemente Island Snail,Mollusca,225072,Mollusca,Gastropoda,Stylommatophora,Helminthoglyptidae,,
iNaturalist,41736421,2019/06/20 2:15 PM PDT,6/20/2019 0:00,6/21/2019,2019,6,21,0:15:00,300,Pacific Time (US & Canada),173183,serpophaga,2020-04-09 05:50:37 +0300,2020-04-25 06:59:45 +0300,research,CC-BY-NC,https://www.inaturalist.org/observations/41736421,https://inaturalist-open-data.s3.amazonaws.com/photos/66215736/medium.jpeg?1586400158,,,,2,0,FALSE,,"California, US",San Clemente,32.80038051,-118.2560283,10,29039,,obscured,TRUE,,,,Los Angeles,California,United States,California,Los Angeles,San Clemente Island Snail,Micrarionta gabbi,San Clemente Island Snail,Mollusca,225072,Mollusca,Gastropoda,Stylommatophora,Helminthoglyptidae,,
iNaturalist,41774901,2019/06/23 12:45 PM PDT,6/23/2019 0:00,6/23/2019,2019,6,23,22:45:00,300,Pacific Time (US & Canada),173183,serpophaga,2020-04-09 21:38:04 +0300,2020-04-25 07:00:01 +0300,research,CC-BY-NC,https://www.inaturalist.org/observations/41774901,https://inaturalist-open-data.s3.amazonaws.com/photos/66280361/medium.jpeg?1586457085,,,,2,0,FALSE,,"California, US",San Clemente,32.89568936,-118.5276778,50,29039,,obscured,TRUE,,,,Los Angeles,California,United States,California,Los Angeles,San Clemente Island Snail,Micrarionta gabbi,San Clemente Island Snail,Mollusca,225072,Mollusca,Gastropoda,Stylommatophora,Helminthoglyptidae,,
iNaturalist,41774906,2019/06/23 12:52 PM PDT,6/23/2019 0:00,6/23/2019,2019,6,23,22:52:00,300,Pacific Time (US & Canada),173183,serpophaga,2020-04-09 21:38:09 +0300,2020-04-25 07:00:03 +0300,needs_id,CC-BY-NC,https://www.inaturalist.org/observations/41774906,https://inaturalist-open-data.s3.amazonaws.com/photos/66280414/medium.jpeg?1586457110,,,,1,0,FALSE,,"California, US",San Clemente,32.94782535,-118.5750453,10,29039,,obscured,TRUE,,,,Los Angeles,California,United States,California,Los Angeles,Helminthoglyptinae,Micrarionta gabbi,San Clemente Island Snail,Mollusca,225072,Mollusca,Gastropoda,Stylommatophora,Helminthoglyptidae,,
iNaturalist,41774909,2019/06/23 1:00 PM PDT,6/23/2019 0:00,6/23/2019,2019,6,23,23:00:00,300,Pacific Time (US & Canada),173183,serpophaga,2020-04-09 21:38:11 +0300,2020-04-25 07:00:03 +0300,research,CC-BY-NC,https://www.inaturalist.org/observations/41774909,https://inaturalist-open-data.s3.amazonaws.com/photos/66280444/medium.jpeg?1586457121,,,,2,0,FALSE,,"California, US",San Clemente,32.9948441,-118.4756649,10,29039,,obscured,TRUE,,,,Los Angeles,California,United States,California,Los Angeles,San Clemente Island Snail,Micrarionta gabbi,San Clemente Island Snail,Mollusca,225072,Mollusca,Gastropoda,Stylommatophora,Helminthoglyptidae,,
iNaturalist,53518348,Fri Jul 17 2020 15:57:46 GMT-0700 (PDT),7/17/2020 0:00,7/18/2020,2020,7,18,1:57:46,300,Pacific Time (US & Canada),266196,shrike2,2020-07-18 23:24:56 +0300,2020-09-14 11:50:18 +0300,research,CC-BY-NC-ND,https://www.inaturalist.org/observations/53518348,https://static.inaturalist.org/photos/85124263/medium.jpg?1595103909,,,,1,0,FALSE,3,"California, US",San Clemente,32.91249815,-118.5024488,22,29039,,obscured,TRUE,,,,Los Angeles,California,United States,California,Los Angeles,San Clemente Island Snail,Micrarionta gabbi,San Clemente Island Snail,Mollusca,225072,Mollusca,Gastropoda,Stylommatophora,Helminthoglyptidae,,
iNaturalist,53536443,Sat Jul 18 2020 09:04:19 GMT-0700 (PDT),7/18/2020 0:00,7/18/2020,2020,7,18,19:04:19,300,Pacific Time (US & Canada),266196,shrike2,2020-07-19 02:14:53 +0300,2020-07-19 02:15:16 +0300,needs_id,CC-BY-NC-ND,https://www.inaturalist.org/observations/53536443,https://static.inaturalist.org/photos/85153883/medium.jpg?1595114104,,,,0,0,FALSE,3,"California, US",San Clemente,32.98370462,-118.540758,7,29039,,obscured,TRUE,,,,Los Angeles,California,United States,California,Los Angeles,,Micrarionta gabbi,San Clemente Island Snail,Mollusca,225072,Mollusca,Gastropoda,Stylommatophora,Helminthoglyptidae,,
iNaturalist,53540504,Sat Jul 18 2020 16:16:11 GMT-0700 (PDT),7/18/2020 0:00,7/19/2020,2020,7,19,2:16:11,300,Pacific Time (US & Canada),266196,shrike2,2020-07-19 03:01:14 +0300,2020-07-19 03:10:20 +0300,needs_id,CC-BY-NC-ND,https://www.inaturalist.org/observations/53540504,https://static.inaturalist.org/photos/85160665/medium.jpg?1595116884,,,,0,0,FALSE,3,"California, US",San Clemente,32.81397013,-118.5801068,22,29039,,obscured,TRUE,,,,Los Angeles,California,United States,California,Los Angeles,,Micrarionta gabbi,San Clemente Island Snail,Mollusca,225072,Mollusca,Gastropoda,Stylommatophora,Helminthoglyptidae,,
iNaturalist,76720976,Sun May 02 2021 14:13:25 GMT-0700 (PDT),5/2/2021 0:00,5/3/2021,2021,5,3,0:13:25,300,Pacific Time (US & Canada),266196,shrike2,2021-05-03 01:19:24 +0300,2021-05-05 01:29:38 +0300,research,CC-BY-NC-ND,https://www.inaturalist.org/observations/76720976,https://inaturalist-open-data.s3.amazonaws.com/photos/125479917/medium.jpg?1619993974,,,,1,0,FALSE,3,"Los Angeles County, US-CA, US",San Clemente,32.87291078,-118.5643051,4,29039,,obscured,TRUE,,,,Los Angeles,California,United States,California,Los Angeles,San Clemente Island Snail,Micrarionta gabbi,San Clemente Island Snail,Mollusca,225072,Mollusca,Gastropoda,Stylommatophora,Helminthoglyptidae,,
iNaturalist,20158298,Tue Feb 05 2019 16:15:08 GMT-0800 (PST),2/5/2019 0:00,2/6/2019,2019,2,6,3:15:08,300,Pacific Time (US & Canada),266196,shrike2,2019-02-06 20:50:33 +0300,2020-03-08 11:12:22 +0300,research,CC-BY-NC-ND,https://www.inaturalist.org/observations/20158298,https://static.inaturalist.org/photos/31096579/medium.jpg?1549475462,,,,4,0,FALSE,3,"Los Angeles County, US-CA, US",,33.15886951,-118.4084351,19,29012,,obscured,TRUE,,,,Los Angeles,California,United States,California,Los Angeles,San Clemente Island Snail,Micrarionta gabbi,San Clemente Island Snail,Mollusca,225072,Mollusca,Gastropoda,Stylommatophora,Xanthonychidae,Micrarionta,Micrarionta gabbi
iNaturalist,20368293,Fri Feb 15 2019 08:43:00 GMT-0800 (PST),2/15/2019 0:00,2/15/2019,2019,2,15,19:43:00,300,Pacific Time (US & Canada),266196,shrike2,2019-02-15 21:57:25 +0300,2020-03-08 11:12:23 +0300,research,CC-BY-NC-ND,https://www.inaturalist.org/observations/20368293,https://static.inaturalist.org/photos/31452545/medium.jpg?1550257086,,,,4,1,FALSE,3,"Los Angeles County, US-CA, US",,33.12873672,-118.484385,10,29012,,obscured,TRUE,,,,Los Angeles,California,United States,California,Los Angeles,San Clemente Island Snail,Micrarionta gabbi,San Clemente Island Snail,Mollusca,225072,Mollusca,Gastropoda,Stylommatophora,Xanthonychidae,Micrarionta,Micrarionta gabbi
iNaturalist,21793367,2019/03/23 1:13 PM PDT,3/23/2019 0:00,3/23/2019,2019,3,23,23:13:00,300,Pacific Time (US & Canada),12809,cedric_lee,2019-03-30 22:44:54 +0300,2021-01-09 01:15:01 +0300,research,CC-BY-NC,https://www.inaturalist.org/observations/21793367,https://inaturalist-open-data.s3.amazonaws.com/photos/33749734/medium.jpeg?1553970415,,,,2,0,FALSE,,"California, US",,32.88995995,-118.2214493,,29039,obscured,obscured,TRUE,,,,Los Angeles,California,United States,California,Los Angeles,San Clemente Island Snail,Micrarionta gabbi,San Clemente Island Snail,Mollusca,225072,Mollusca,Gastropoda,Stylommatophora,Xanthonychidae,Micrarionta,Micrarionta gabbi
iNaturalist,23055394,Thu Apr 25 2019 08:31:35 GMT-0700 (PDT),4/25/2019 0:00,4/25/2019,2019,4,25,18:31:35,300,Pacific Time (US & Canada),266196,shrike2,2019-04-25 18:56:23 +0300,2020-03-08 11:12:39 +0300,research,CC-BY-NC-ND,https://www.inaturalist.org/observations/23055394,https://static.inaturalist.org/photos/35743048/medium.jpg?1556207941,,,,3,0,FALSE,3,"Los Angeles County, US-CA, US",,33.10559771,-118.4713901,5,29012,,obscured,TRUE,,,,Los Angeles,California,United States,California,Los Angeles,San Clemente Island Snail,Micrarionta gabbi,San Clemente Island Snail,Mollusca,225072,Mollusca,Gastropoda,Stylommatophora,Xanthonychidae,Micrarionta,Micrarionta gabbi
iNaturalist,36829190,Sat Dec 21 2019 09:17:17 GMT-0800 (PST),12/21/2019 0:00,12/21/2019,2019,12,21,20:17:17,300,Pacific Time (US & Canada),266196,shrike2,2019-12-21 21:26:31 +0300,2020-03-08 11:12:45 +0300,research,CC-BY-NC-ND,https://www.inaturalist.org/observations/36829190,https://static.inaturalist.org/photos/58282756/medium.jpg?1576952795,,,,1,0,FALSE,3,"Los Angeles County, US-CA, US",,33.15449509,-118.5762117,5,29012,,obscured,TRUE,,,,Los Angeles,California,United States,California,Los Angeles,San Clemente Island Snail,Micrarionta gabbi,San Clemente Island Snail,Mollusca,225072,Mollusca,Gastropoda,Stylommatophora,Xanthonychidae,Micrarionta,Micrarionta gabbi
iNaturalist,36829214,Sat Dec 21 2019 10:20:39 GMT-0800 (PST),12/21/2019 0:00,12/21/2019,2019,12,21,21:20:39,300,Pacific Time (US & Canada),266196,shrike2,2019-12-21 21:27:33 +0300,2020-03-08 11:12:46 +0300,research,CC-BY-NC-ND,https://www.inaturalist.org/observations/36829214,https://static.inaturalist.org/photos/58282809/medium.jpg?1576952857,,,,2,0,FALSE,3,"Los Angeles County, US-CA, US",,33.06003936,-118.4379867,5,29012,,obscured,TRUE,,,,Los Angeles,California,United States,California,Los Angeles,San Clemente Island Snail,Micrarionta gabbi,San Clemente Island Snail,Mollusca,225072,Mollusca,Gastropoda,Stylommatophora,Xanthonychidae,Micrarionta,Micrarionta gabbi
iNaturalist,37672192,Thu Jan 16 2020 13:46:13 GMT-0800 (PST),1/16/2020 0:00,1/17/2020,2020,1,17,0:46:13,300,Pacific Time (US & Canada),12809,cedric_lee,2020-01-17 07:32:28 +0300,2020-07-02 06:53:24 +0300,research,CC-BY-NC,https://www.inaturalist.org/observations/37672192,https://inaturalist-open-data.s3.amazonaws.com/photos/59770967/medium.jpg?1579235640,,,,1,0,FALSE,3,"Los Angeles County, US-CA, US",,33.18947037,-118.4755347,14,29012,,obscured,TRUE,,,,Los Angeles,California,United States,California,Los Angeles,,Micrarionta gabbi,San Clemente Island Snail,Mollusca,225072,Mollusca,Gastropoda,Stylommatophora,Xanthonychidae,Micrarionta,Micrarionta gabbi
iNaturalist,38025418,Sun Jan 26 2020 08:21:31 GMT-0800 (PST),1/26/2020 0:00,1/26/2020,2020,1,26,19:21:31,300,Pacific Time (US & Canada),12809,cedric_lee,2020-01-27 16:44:50 +0300,2020-07-02 06:53:27 +0300,research,CC-BY-NC,https://www.inaturalist.org/observations/38025418,https://inaturalist-open-data.s3.amazonaws.com/photos/60374290/medium.jpg?1580132742,,,,1,0,FALSE,3,"Los Angeles County, US-CA, US",,33.14957102,-118.5021411,9,29012,,obscured,TRUE,,,,Los Angeles,California,United States,California,Los Angeles,,Micrarionta gabbi,San Clemente Island Snail,Mollusca,225072,Mollusca,Gastropoda,Stylommatophora,Xanthonychidae,Micrarionta,Micrarionta gabbi
iNaturalist,38869386,Wed Feb 19 2020 13:11:13 GMT-0800 (PST),2/19/2020 0:00,2/20/2020,2020,2,20,0:11:13,300,Pacific Time (US & Canada),12809,cedric_lee,2020-02-20 04:42:40 +0300,2021-03-09 09:46:02 +0300,research,CC-BY-NC,https://www.inaturalist.org/observations/38869386,https://inaturalist-open-data.s3.amazonaws.com/photos/61810362/medium.jpg?1582162889,,,,1,0,FALSE,,"Los Angeles County, US-CA, US",,33.10867867,-118.4604443,10,29012,,obscured,TRUE,,,,Los Angeles,California,United States,California,Los Angeles,San Clemente Island Snail,Micrarionta gabbi,San Clemente Island Snail,Mollusca,225072,Mollusca,Gastropoda,Stylommatophora,Xanthonychidae,Micrarionta,Micrarionta gabbi
iNaturalist,38870412,Wed Feb 19 2020 10:52:14 GMT-0800 (PST),2/19/2020 0:00,2/19/2020,2020,2,19,21:52:14,300,Pacific Time (US & Canada),12809,cedric_lee,2020-02-20 05:25:00 +0300,2021-03-09 09:46:03 +0300,needs_id,CC-BY-NC,https://www.inaturalist.org/observations/38870412,https://inaturalist-open-data.s3.amazonaws.com/photos/61812468/medium.jpg?1582165536,,,With Cornu aspersum ,0,0,FALSE,3,"Los Angeles County, US-CA, US",,33.15857015,-118.562312,6,29012,,obscured,TRUE,,,,Los Angeles,California,United States,California,Los Angeles,,Micrarionta gabbi,San Clemente Island Snail,Mollusca,225072,Mollusca,Gastropoda,Stylommatophora,Xanthonychidae,Micrarionta,Micrarionta gabbi
iNaturalist,38942293,Thu Feb 20 2020 09:13:39 GMT-0800 (PST),2/20/2020 0:00,2/20/2020,2020,2,20,20:13:39,300,Pacific Time (US & Canada),12809,cedric_lee,2020-02-21 03:54:16 +0300,2021-03-09 09:46:03 +0300,research,CC-BY-NC,https://www.inaturalist.org/observations/38942293,https://inaturalist-open-data.s3.amazonaws.com/photos/61865485/medium.jpg?1582246549,,,,1,0,FALSE,3,"Los Angeles County, US-CA, US",,33.12664976,-118.5639512,12,29012,,obscured,TRUE,,,,Los Angeles,California,United States,California,Los Angeles,,Micrarionta gabbi,San Clemente Island Snail,Mollusca,225072,Mollusca,Gastropoda,Stylommatophora,Xanthonychidae,Micrarionta,Micrarionta gabbi
iNaturalist,39070557,Thu Feb 20 2020 09:33:18 GMT-0800 (PST),2/20/2020 0:00,2/20/2020,2020,2,20,20:33:18,300,Pacific Time (US & Canada),12809,cedric_lee,2020-02-23 05:29:01 +0300,2021-03-09 09:46:04 +0300,research,CC-BY-NC,https://www.inaturalist.org/observations/39070557,https://inaturalist-open-data.s3.amazonaws.com/photos/61995439/medium.jpg?1582424977,,,,2,0,FALSE,3,"Los Angeles County, US-CA, US",,33.15894869,-118.4196352,31,29012,,obscured,TRUE,,,,Los Angeles,California,United States,California,Los Angeles,San Clemente Island Snail,Micrarionta gabbi,San Clemente Island Snail,Mollusca,225072,Mollusca,Gastropoda,Stylommatophora,Xanthonychidae,Micrarionta,Micrarionta gabbi
iNaturalist,39071177,Wed Feb 19 2020 11:08:33 GMT-0800 (PST),2/19/2020 0:00,2/19/2020,2020,2,19,22:08:33,300,Pacific Time (US & Canada),12809,cedric_lee,2020-02-23 05:43:00 +0300,2021-03-09 09:46:05 +0300,research,CC-BY-NC,https://www.inaturalist.org/observations/39071177,https://inaturalist-open-data.s3.amazonaws.com/photos/61996531/medium.jpg?1582425853,,,,1,0,FALSE,3,"Los Angeles County, US-CA, US",,33.06547036,-118.462941,9,29012,,obscured,TRUE,,,,Los Angeles,California,United States,California,Los Angeles,San Clemente Island Snail,Micrarionta gabbi,San Clemente Island Snail,Mollusca,225072,Mollusca,Gastropoda,Stylommatophora,Xanthonychidae,Micrarionta,Micrarionta gabbi
iNaturalist,19682106,2012/10/11 4:46 PM MST,10/11/2012 0:00,10/12/2012,2012,10,12,2:46:00,400,Mountain Time (US & Canada),19215,tsirtalis,2019-01-17 01:37:56 +0300,2019-01-19 00:49:17 +0300,research,CC-BY-NC-ND,https://www.inaturalist.org/observations/19682106,https://static.inaturalist.org/photos/30315531/medium.jpeg?1547677960,,,,1,0,FALSE,,"California, US",San Nicolas,33.31209312,-119.5975316,,28984,,obscured,TRUE,,,,Ventura,California,United States,California,Ventura,Prickly Pear Island Snail,Micrarionta opuntia,Prickly Pear Island Snail,Mollusca,105719,Mollusca,Gastropoda,Stylommatophora,Helminthoglyptidae,,
iNaturalist,19684335,2012/10/13 3:47 PM MST,10/13/2012 0:00,10/14/2012,2012,10,14,1:47:00,400,Mountain Time (US & Canada),19215,tsirtalis,2019-01-17 03:49:45 +0300,2019-01-17 03:49:45 +0300,needs_id,CC-BY-NC-ND,https://www.inaturalist.org/observations/19684335,https://static.inaturalist.org/photos/30319164/medium.jpeg?1547685413,,,,0,0,FALSE,,"California, US",San Nicolas,33.25132592,-119.5145095,,28984,,obscured,TRUE,,,,Ventura,California,United States,California,Ventura,Prickly Pear Island Snail,Micrarionta opuntia,Prickly Pear Island Snail,Mollusca,105719,Mollusca,Gastropoda,Stylommatophora,Helminthoglyptidae,,
iNaturalist,20102649,2014/08/28 4:43 PM MST,8/28/2014 0:00,8/29/2014,2014,8,29,3:43:00,400,Arizona,19215,tsirtalis,2019-02-05 07:59:53 +0300,2019-02-05 08:37:09 +0300,research,CC-BY-NC-ND,https://www.inaturalist.org/observations/20102649,https://static.inaturalist.org/photos/31032612/medium.jpeg?1549342300,,,,1,0,FALSE,,"California, US",San Nicolas,33.30393744,-119.4528151,,28984,,obscured,TRUE,,,,Ventura,California,United States,California,Ventura,Prickly Pear Island Snail,Micrarionta opuntia,Prickly Pear Island Snail,Mollusca,105719,Mollusca,Gastropoda,Stylommatophora,Helminthoglyptidae,,
iNaturalist,20102650,2014/08/28 4:59 PM MST,8/28/2014 0:00,8/29/2014,2014,8,29,3:59:00,400,Arizona,19215,tsirtalis,2019-02-05 07:59:53 +0300,2019-02-06 04:48:06 +0300,research,CC-BY-NC-ND,https://www.inaturalist.org/observations/20102650,https://static.inaturalist.org/photos/31032654/medium.jpeg?1549342405,,,,1,0,FALSE,,"California, US",San Nicolas,33.36620872,-119.5368231,,28984,,obscured,TRUE,,,,Ventura,California,United States,California,Ventura,Prickly Pear Island Snail,Micrarionta opuntia,Prickly Pear Island Snail,Mollusca,105719,Mollusca,Gastropoda,Stylommatophora,Helminthoglyptidae,,
iNaturalist,20262480,Sun Feb 10 2019 12:25:38 GMT-0800 (PST),2/10/2019 0:00,2/10/2019,2019,2,10,23:25:38,300,Pacific Time (US & Canada),19715,gbentall,2019-02-11 00:18:45 +0300,2019-02-11 18:30:29 +0300,research,CC-BY-NC,https://www.inaturalist.org/observations/20262480,https://inaturalist-open-data.s3.amazonaws.com/photos/31276427/medium.jpg?1549833581,,,,2,0,FALSE,3,"California, US",San Nicolas,33.28231784,-119.5844527,8236,28984,,obscured,TRUE,,,,Ventura,California,United States,California,Ventura,Prickly Pear Island Snail,Micrarionta opuntia,Prickly Pear Island Snail,Mollusca,105719,Mollusca,Gastropoda,Stylommatophora,Helminthoglyptidae,,
iNaturalist,20262689,Sun Feb 10 2019 12:31:04 GMT-0800 (PST),2/10/2019 0:00,2/10/2019,2019,2,10,23:31:04,300,Pacific Time (US & Canada),19715,gbentall,2019-02-11 00:28:57 +0300,2019-02-11 07:02:08 +0300,research,CC-BY-NC,https://www.inaturalist.org/observations/20262689,https://inaturalist-open-data.s3.amazonaws.com/photos/31276838/medium.jpg?1549834156,,,,2,0,FALSE,3,"California, US",San Nicolas,33.2509127,-119.5699005,8236,28984,,obscured,TRUE,,google,,Ventura,California,United States,California,Ventura,Prickly Pear Island Snail,Micrarionta opuntia,Prickly Pear Island Snail,Mollusca,105719,Mollusca,Gastropoda,Stylommatophora,Helminthoglyptidae,,
iNaturalist,7835669,Fri Sep 08 2017 11:56:38 GMT-0700 (PDT),9/8/2017 0:00,9/8/2017,2017,9,8,21:56:38,300,Pacific Time (US & Canada),84767,tlawson,2017-09-08 22:01:31 +0300,2017-10-14 09:18:16 +0300,research,,https://www.inaturalist.org/observations/7835669,https://static.inaturalist.org/photos/11168806/medium.jpg?1507961893,,,From an old collection. Ex. C. & C. Martin Collection. Collected on Santa Catalina Island. ,1,0,FALSE,3,"Los Angeles County, US-CA, US",Santa Catalina,33.50457712,-118.5205456,7455,28943,,obscured,TRUE,,,,Los Angeles,California,United States,California,Los Angeles,Santa Catalina Islandsnail,Micrarionta rufocincta,Santa Catalina Island Snail,Mollusca,225073,Mollusca,Gastropoda,Stylommatophora,Helminthoglyptidae,,
iNaturalist,10421274,2018/03/24 3:09 PM PDT,3/24/2018 0:00,3/25/2018,2018,3,25,1:09:00,300,Pacific Time (US & Canada),220795,neontetraploid,2018-03-26 01:54:53 +0300,2018-03-29 07:44:45 +0300,research,CC-BY-NC,https://www.inaturalist.org/observations/10421274,https://inaturalist-open-data.s3.amazonaws.com/photos/14476587/medium.jpeg?1522018233,,,,1,0,FALSE,,"Los Angeles County, US-CA, US",Santa Catalina,33.4365236,-118.5188566,98,28957,,obscured,TRUE,,,,Los Angeles,California,United States,California,Los Angeles,Santa Catalina Islandsnail,Micrarionta rufocincta,Santa Catalina Island Snail,Mollusca,225073,Mollusca,Gastropoda,Stylommatophora,Helminthoglyptidae,,
iNaturalist,10562698,2018-04-01 3:12:44 PM PDT,4/1/2018 0:00,4/2/2018,2018,4,2,1:12:44,300,Pacific Time (US & Canada),392423,bjdion,2018-04-02 06:29:49 +0300,2018-10-11 01:48:52 +0300,research,CC-BY-NC-SA,https://www.inaturalist.org/observations/10562698,https://inaturalist-open-data.s3.amazonaws.com/photos/14715045/medium.jpeg?1522639796,,,,2,0,FALSE,2,"Los Angeles County, US-CA, US",Santa Catalina,33.36866418,-118.5638381,28,28984,,obscured,TRUE,,,,Los Angeles,California,United States,California,Los Angeles,Santa Catalina Islandsnail,Micrarionta rufocincta,Santa Catalina Island Snail,Mollusca,225073,Mollusca,Gastropoda,Stylommatophora,Helminthoglyptidae,,
iNaturalist,11843011,2018/04/29 9:59 AM PDT,4/29/2018 0:00,4/29/2018,2018,4,29,19:59:00,300,Pacific Time (US & Canada),6971,silversea_starsong,2018-04-30 06:47:48 +0300,2018-05-02 07:25:30 +0300,research,CC-BY-NC,https://www.inaturalist.org/observations/11843011,https://inaturalist-open-data.s3.amazonaws.com/photos/16948207/medium.jpeg?1525060004,,,,2,0,FALSE,,"Los Angeles County, US-CA, US",Santa Catalina,33.38321808,-118.5107257,,28984,,obscured,TRUE,,,,Los Angeles,California,United States,California,Los Angeles,Santa Catalina Islandsnail,Micrarionta rufocincta,Santa Catalina Island Snail,Mollusca,225073,Mollusca,Gastropoda,Stylommatophora,Helminthoglyptidae,,
iNaturalist,12176224,2018-05-05 3:37:16 PM PDT,5/5/2018 0:00,5/6/2018,2018,5,6,1:37:16,300,Pacific Time (US & Canada),725443,jujuba,2018-05-06 01:40:12 +0300,2018-05-06 21:20:37 +0300,research,,https://www.inaturalist.org/observations/12176224,https://static.inaturalist.org/photos/17481964/medium.jpeg?1525560014,,,,1,0,FALSE,2,"Los Angeles County, US-CA, US",Santa Catalina,33.41810061,-118.5490151,,28957,,obscured,TRUE,gps,gps,,Los Angeles,California,United States,California,Los Angeles,Santa Catalina Islandsnail,Micrarionta rufocincta,Santa Catalina Island Snail,Mollusca,225073,Mollusca,Gastropoda,Stylommatophora,Helminthoglyptidae,,
iNaturalist,33507622,2019-09-24 6:28:27 PM PDT,9/24/2019 0:00,9/25/2019,2019,9,25,4:28:27,300,Pacific Time (US & Canada),392423,bjdion,2019-09-28 03:31:28 +0300,2019-10-26 23:41:28 +0300,needs_id,CC-BY-NC-SA,https://www.inaturalist.org/observations/33507622,https://inaturalist-open-data.s3.amazonaws.com/photos/52631267/medium.jpeg?1569630693,,,"Under Opuntia, next to Perityle emori, Dudleya hassei, Eriogonum grande grande. Up on rocky cliffy area at Parsons Beach",1,0,FALSE,2,"Los Angeles County, US-CA, US",Santa Catalina,33.53886052,-118.5440409,9,28957,,obscured,TRUE,,,,Los Angeles,California,United States,California,Los Angeles,Santa Catalina Island Snail,Micrarionta rufocincta,Santa Catalina Island Snail,Mollusca,225073,Mollusca,Gastropoda,Stylommatophora,Helminthoglyptidae,,
iNaturalist,34340493,2019-10-13 3:20:41 PM MST,10/13/2019 0:00,10/14/2019,2019,10,14,0:20:41,300,Mountain Time (US & Canada),392423,bjdion,2019-10-14 05:35:57 +0300,2019-11-22 19:22:13 +0300,research,CC-BY-NC-SA,https://www.inaturalist.org/observations/34340493,https://inaturalist-open-data.s3.amazonaws.com/photos/54032546/medium.jpeg?1571020561,,,,1,0,FALSE,2,"Los Angeles County, US-CA, US",Santa Catalina,33.35429456,-118.5430489,13,28984,,obscured,TRUE,,,,Los Angeles,California,United States,California,Los Angeles,Santa Catalina Island Snail,Micrarionta rufocincta,Santa Catalina Island Snail,Mollusca,225073,Mollusca,Gastropoda,Stylommatophora,Helminthoglyptidae,,
iNaturalist,1830808,Sat Aug 01 2015 15:49:05 GMT-0700 (PDT),8/1/2015 0:00,8/2/2015,2015,8,2,1:49:05,300,Pacific Time (US & Canada),3494,damontighe,2015-08-04 08:34:14 +0300,2019-02-22 08:41:11 +0300,research,CC-BY-NC,http://www.inaturalist.org/observations/1830808,https://inaturalist-open-data.s3.amazonaws.com/photos/2222806/medium.jpg?1438666567,,,,2,0,FALSE,3,"Los Angeles County, US-CA, US",,33.57602469,-118.5687846,,28957,,obscured,TRUE,,,,Los Angeles,California,United States,California,Los Angeles,Micrarionta rufocincta,Micrarionta rufocincta,Santa Catalina Island Snail,Mollusca,225073,Mollusca,Gastropoda,Stylommatophora,Xanthonychidae,Micrarionta,Micrarionta rufocincta
iNaturalist,7939891,6/13/2017,6/13/2017 0:00,,,,,,,Pacific Time (US & Canada),12809,cedric_lee,2017-09-16 05:09:26 +0300,2017-11-12 05:57:03 +0300,research,CC-BY-NC,https://www.inaturalist.org/observations/7939891,https://inaturalist-open-data.s3.amazonaws.com/photos/10484925/medium.jpeg?1505527513,,,"Shell is ~17mm

From NHMLA's malacology collection.",1,0,FALSE,,"Los Angeles County, US-CA, US",,33.55737449,-118.4232741,244,28943,,obscured,TRUE,,,,Los Angeles,California,United States,California,Los Angeles,Santa Catalina Islandsnail,Micrarionta rufocincta,Santa Catalina Island Snail,Mollusca,225073,Mollusca,Gastropoda,Stylommatophora,Xanthonychidae,Micrarionta,Micrarionta rufocincta
iNaturalist,7835582,Fri Sep 08 2017 10:11:02 GMT-0700 (PDT),9/8/2017 0:00,9/8/2017,2017,9,8,20:11:02,300,Pacific Time (US & Canada),84767,tlawson,2017-09-08 21:49:08 +0300,2019-01-12 22:16:42 +0300,research,,https://www.inaturalist.org/observations/7835582,https://static.inaturalist.org/photos/11610004/medium.jpg?1509732014,,,"From an old collection. Micrarionta sodalis (Hemphill, 1901) collected by Henry Hemphill himself on San Nicolas Island. 

This is an extinct species. This was a very diminutive species averaging about 6-7 mm. Probably one of the smallest Helminthoglyptidae. ",1,0,FALSE,3,"San Nicolas Naval Facility, Channel Is Air Guard Station, CA, US",San Nicolas,33.253796,-119.535198,886,886,,,FALSE,,,,Ventura,California,United States,California,Ventura,Micrarionta sodalis,Micrarionta sodalis,,Mollusca,559914,Mollusca,Gastropoda,Stylommatophora,Helminthoglyptidae,,
iNaturalist,35311074,Mon Nov 04 2019 16:32:18 GMT-0800 (PST),11/4/2019 0:00,11/5/2019,2019,11,5,5:32:18,300,Hawaii,464542,william_hoyer,2019-11-05 05:09:48 +0300,2021-01-13 23:23:00 +0300,research,CC-BY-NC,https://www.inaturalist.org/observations/35311074,https://inaturalist-open-data.s3.amazonaws.com/photos/55669079/medium.jpg?1572919803,,,Fossils found in sediment. ,2,0,FALSE,3,"San Nicolas Naval Facility, CA, US",San Nicolas,33.26576807,-119.4991944,135,135,,,FALSE,,,,Ventura,California,United States,California,Ventura,Micrarionta sodalis,Micrarionta sodalis,,Mollusca,559914,Mollusca,Gastropoda,Stylommatophora,Helminthoglyptidae,,
iNaturalist,36662916,Thu Dec 12 2019 13:22:42 GMT-0800 (PST),12/12/2019 0:00,12/13/2019,2019,12,13,2:22:42,300,Hawaii,464542,william_hoyer,2019-12-15 07:29:17 +0300,2020-04-30 20:23:58 +0300,research,CC-BY-NC,https://www.inaturalist.org/observations/36662916,https://inaturalist-open-data.s3.amazonaws.com/photos/57985663/medium.jpg?1576384168,,,,1,0,FALSE,3,"Ventura County, US-CA, US",San Nicolas,33.27404237,-119.5751192,11,11,,,FALSE,,,,Ventura,California,United States,California,Ventura,Micrarionta sodalis,Micrarionta sodalis,,Mollusca,559914,Mollusca,Gastropoda,Stylommatophora,Helminthoglyptidae,,
iNaturalist,5092857,Thu Feb 09 2017 10:12:31 GMT-0800 (PST),2/9/2017 0:00,2/9/2017,2017,2,9,21:12:31,300,Pacific Time (US & Canada),280979,emshaph,2017-02-12 05:10:36 +0300,2017-04-14 03:54:26 +0300,research,CC-BY-NC,https://www.inaturalist.org/observations/5092857,https://inaturalist-open-data.s3.amazonaws.com/photos/6257123/medium.jpg?1486865443,,,,2,0,FALSE,3,"W End Rd, Avalon, CA, US",Santa Catalina,33.46716124,-118.5337878,25,25,,,FALSE,,,,Los Angeles,California,United States,California,Los Angeles,Greenhouse Slug,Milax gagates,Greenhouse Slug,Mollusca,225159,Mollusca,Gastropoda,Stylommatophora,Milacidae,,
iNaturalist,19479285,Sun Dec 16 2018 10:36:28 GMT-0800 (PST),12/16/2018 0:00,12/16/2018,2018,12,16,21:36:28,300,Pacific Time (US & Canada),17630,gregpauly,2019-01-07 03:19:44 +0300,2019-11-05 12:49:41 +0300,research,CC-BY-NC,https://www.inaturalist.org/observations/19479285,https://inaturalist-open-data.s3.amazonaws.com/photos/29971267/medium.jpg?1546820389,,,,3,0,FALSE,3,"Santa Cruz Island Reserve, Channel Islands National Park, Channel Islands, Santa Barbara County, UCNRS, US-CA, US",Santa Cruz,34.00206512,-119.7429493,10,10,,,FALSE,,,,Santa Barbara,California,United States,California,Santa Barbara,Greenhouse Slug,Milax gagates,Greenhouse Slug,Mollusca,225159,Mollusca,Gastropoda,Stylommatophora,Milacidae,,
iNaturalist,20606163,Fri Feb 22 2019 12:11:23 GMT-0800 (PST),2/22/2019 0:00,2/22/2019,2019,2,22,23:11:23,300,Pacific Time (US & Canada),173183,serpophaga,2019-02-23 09:33:56 +0300,2020-01-02 01:42:37 +0300,research,CC-BY-NC,https://www.inaturalist.org/observations/20606163,https://inaturalist-open-data.s3.amazonaws.com/photos/31800140/medium.jpg?1550903662,,,,2,0,FALSE,3,"Channel Islands National Park, , CA, US",Santa Cruz,34.01836383,-119.6825417,5,5,,,FALSE,,,,Santa Barbara,California,United States,California,Santa Barbara,Greenhouse Slug,Milax gagates,Greenhouse Slug,Mollusca,225159,Mollusca,Gastropoda,Stylommatophora,Milacidae,,
iNaturalist,38209088,2020-01-26 12:11:05 PM PST,1/26/2020 0:00,1/26/2020,2020,1,26,23:11:05,300,Pacific Time (US & Canada),34488,pileated,2020-02-02 08:40:53 +0300,2020-02-02 09:52:14 +0300,research,CC-BY,https://www.inaturalist.org/observations/38209088,https://inaturalist-open-data.s3.amazonaws.com/photos/60692597/medium.jpeg?1580622057,,,,1,0,FALSE,2,"Santa Cruz Island, California 93001, USA",Santa Cruz,34.01892471,-119.6837845,,,,,FALSE,gps,gps,,Santa Barbara,California,United States,California,Santa Barbara,Greenhouse Slug,Milax gagates,Greenhouse Slug,Mollusca,225159,Mollusca,Gastropoda,Stylommatophora,Milacidae,,
iNaturalist,20371402,Fri Feb 15 2019 12:19:18 GMT-0800 (PST),2/15/2019 0:00,2/15/2019,2019,2,15,23:19:18,300,Pacific Time (US & Canada),266196,shrike2,2019-02-16 00:35:30 +0300,2019-05-26 09:52:12 +0300,research,CC-BY-NC-ND,https://www.inaturalist.org/observations/20371402,https://static.inaturalist.org/photos/31458546/medium.jpg?1550267025,,,,5,0,FALSE,3,"Los Angeles County, US-CA, US",San Clemente,32.94532242,-118.5327545,5,5,,,FALSE,,,,Los Angeles,California,United States,California,Los Angeles,Milk Snail,Otala lactea,Milk Snail,Mollusca,202861,Mollusca,Gastropoda,Stylommatophora,Helicidae,,
iNaturalist,21181209,Tue Mar 12 2019 11:12:06 GMT-0700 (PDT),3/12/2019 0:00,3/12/2019,2019,3,12,21:12:06,300,Pacific Time (US & Canada),266196,shrike2,2019-03-12 22:03:42 +0300,2020-01-02 22:39:10 +0300,research,CC-BY-NC-ND,https://www.inaturalist.org/observations/21181209,https://static.inaturalist.org/photos/32741398/medium.jpg?1552417447,,,,3,0,FALSE,3,"Los Angeles County, US-CA, US",San Clemente,32.945251,-118.532724,27,27,,,FALSE,,,,Los Angeles,California,United States,California,Los Angeles,Otala lactea,Otala lactea,Milk Snail,Mollusca,202861,Mollusca,Gastropoda,Stylommatophora,Helicidae,,
iNaturalist,27850441,Fri Jun 28 2019 12:49:45 GMT-0700 (PDT),6/28/2019 0:00,6/28/2019,2019,6,28,22:49:45,300,Pacific Time (US & Canada),266196,shrike2,2019-06-29 06:34:50 +0300,2019-07-27 03:52:42 +0300,research,CC-BY-NC-ND,https://www.inaturalist.org/observations/27850441,https://static.inaturalist.org/photos/43375278/medium.jpg?1561779360,,,,2,0,FALSE,3,"Los Angeles County, US-CA, US",San Clemente,32.9452782,-118.5327668,5,5,,,FALSE,,,,Los Angeles,California,United States,California,Los Angeles,Milk Snail,Otala lactea,Milk Snail,Mollusca,202861,Mollusca,Gastropoda,Stylommatophora,Helicidae,,
iNaturalist,36866011,Sun Dec 22 2019 11:37:43 GMT-0800 (PST),12/22/2019 0:00,12/22/2019,2019,12,22,22:37:43,300,Pacific Time (US & Canada),266196,shrike2,2019-12-23 01:21:04 +0300,2019-12-27 20:33:17 +0300,research,CC-BY-NC-ND,https://www.inaturalist.org/observations/36866011,https://static.inaturalist.org/photos/58346594/medium.jpg?1577053284,,,,2,0,FALSE,3,"Los Angeles County, US-CA, US",San Clemente,32.94521681,-118.5325684,5,5,,,FALSE,,,,Los Angeles,California,United States,California,Los Angeles,Milk Snail,Otala lactea,Milk Snail,Mollusca,202861,Mollusca,Gastropoda,Stylommatophora,Helicidae,,
iNaturalist,36866030,Sun Dec 22 2019 11:40:41 GMT-0800 (PST),12/22/2019 0:00,12/22/2019,2019,12,22,22:40:41,300,Pacific Time (US & Canada),266196,shrike2,2019-12-23 01:21:56 +0300,2019-12-27 20:33:14 +0300,research,CC-BY-NC-ND,https://www.inaturalist.org/observations/36866030,https://static.inaturalist.org/photos/58346641/medium.jpg?1577053331,,,,2,0,FALSE,3,"Los Angeles County, US-CA, US",San Clemente,32.94549303,-118.5324742,5,5,,,FALSE,,,,Los Angeles,California,United States,California,Los Angeles,Milk Snail,Otala lactea,Milk Snail,Mollusca,202861,Mollusca,Gastropoda,Stylommatophora,Helicidae,,
iNaturalist,36866120,Sun Dec 22 2019 11:49:50 GMT-0800 (PST),12/22/2019 0:00,12/22/2019,2019,12,22,22:49:50,300,Pacific Time (US & Canada),266196,shrike2,2019-12-23 01:24:30 +0300,2019-12-27 20:32:54 +0300,research,CC-BY-NC-ND,https://www.inaturalist.org/observations/36866120,https://static.inaturalist.org/photos/58346794/medium.jpg?1577053482,,,,2,0,FALSE,3,"Los Angeles County, US-CA, US",San Clemente,32.94598719,-118.5324988,5,5,,,FALSE,,,,Los Angeles,California,United States,California,Los Angeles,Milk Snail,Otala lactea,Milk Snail,Mollusca,202861,Mollusca,Gastropoda,Stylommatophora,Helicidae,,
iNaturalist,37409905,Wed Jan 08 2020 08:22:58 GMT-0800 (PST),1/8/2020 0:00,1/8/2020,2020,1,8,19:22:58,300,Pacific Time (US & Canada),266196,shrike2,2020-01-09 01:11:49 +0300,2020-01-09 05:36:46 +0300,research,CC-BY-NC-ND,https://www.inaturalist.org/observations/37409905,https://static.inaturalist.org/photos/59300967/medium.jpg?1578521522,,,,1,0,FALSE,3,"Los Angeles County, US-CA, US",San Clemente,32.94506224,-118.5314519,5,5,,,FALSE,,,,Los Angeles,California,United States,California,Los Angeles,Milk Snail,Otala lactea,Milk Snail,Mollusca,202861,Mollusca,Gastropoda,Stylommatophora,Helicidae,,
iNaturalist,37409917,Wed Jan 08 2020 09:28:26 GMT-0800 (PST),1/8/2020 0:00,1/8/2020,2020,1,8,20:28:26,300,Pacific Time (US & Canada),266196,shrike2,2020-01-09 01:12:22 +0300,2020-01-09 05:01:12 +0300,research,CC-BY-NC-ND,https://www.inaturalist.org/observations/37409917,https://static.inaturalist.org/photos/59301026/medium.jpg?1578521573,,,,1,0,FALSE,3,"Los Angeles County, US-CA, US",San Clemente,32.94502285,-118.5310279,5,5,,,FALSE,,,,Los Angeles,California,United States,California,Los Angeles,Milk Snail,Otala lactea,Milk Snail,Mollusca,202861,Mollusca,Gastropoda,Stylommatophora,Helicidae,,
iNaturalist,37409968,Wed Jan 08 2020 10:32:09 GMT-0800 (PST),1/8/2020 0:00,1/8/2020,2020,1,8,21:32:09,300,Pacific Time (US & Canada),266196,shrike2,2020-01-09 01:13:58 +0300,2020-01-09 05:30:33 +0300,research,CC-BY-NC-ND,https://www.inaturalist.org/observations/37409968,https://static.inaturalist.org/photos/59310391/medium.jpg?1578535703,,,,1,0,FALSE,3,"Los Angeles County, US-CA, US",San Clemente,32.94519476,-118.5317434,5,5,,,FALSE,,,,Los Angeles,California,United States,California,Los Angeles,Otala lactea,Otala lactea,Milk Snail,Mollusca,202861,Mollusca,Gastropoda,Stylommatophora,Helicidae,,
iNaturalist,37415410,Wed Jan 08 2020 10:45:23 GMT-0800 (PST),1/8/2020 0:00,1/8/2020,2020,1,8,21:45:23,300,Pacific Time (US & Canada),266196,shrike2,2020-01-09 05:01:20 +0300,2020-01-09 07:05:15 +0300,research,CC-BY-NC-ND,https://www.inaturalist.org/observations/37415410,https://static.inaturalist.org/photos/59310510/medium.jpg?1578535951,,,,1,0,FALSE,3,"Los Angeles County, US-CA, US",San Clemente,32.94526152,-118.5319624,10,10,,,FALSE,,,,Los Angeles,California,United States,California,Los Angeles,Milk Snail,Otala lactea,Milk Snail,Mollusca,202861,Mollusca,Gastropoda,Stylommatophora,Helicidae,,
iNaturalist,37415663,Wed Jan 08 2020 12:07:38 GMT-0800 (PST),1/8/2020 0:00,1/8/2020,2020,1,8,23:07:38,300,Pacific Time (US & Canada),266196,shrike2,2020-01-09 05:12:37 +0300,2020-01-09 07:06:07 +0300,research,CC-BY-NC-ND,https://www.inaturalist.org/observations/37415663,https://static.inaturalist.org/photos/59310532/medium.jpg?1578536016,,,,1,0,FALSE,3,"Los Angeles County, US-CA, US",San Clemente,32.94496614,-118.5321354,5,5,,,FALSE,,,,Los Angeles,California,United States,California,Los Angeles,Milk Snail,Otala lactea,Milk Snail,Mollusca,202861,Mollusca,Gastropoda,Stylommatophora,Helicidae,,
iNaturalist,37438269,Thu Jan 09 2020 10:40:57 GMT-0800 (PST),1/9/2020 0:00,1/9/2020,2020,1,9,21:40:57,300,Pacific Time (US & Canada),266196,shrike2,2020-01-10 00:55:51 +0300,2020-01-10 05:32:38 +0300,research,CC-BY-NC-ND,https://www.inaturalist.org/observations/37438269,https://static.inaturalist.org/photos/59350515/medium.jpg?1578607001,,,,1,0,FALSE,3,"Los Angeles County, US-CA, US",San Clemente,32.94530783,-118.5327519,10,10,,,FALSE,,,,Los Angeles,California,United States,California,Los Angeles,Milk Snail,Otala lactea,Milk Snail,Mollusca,202861,Mollusca,Gastropoda,Stylommatophora,Helicidae,,
iNaturalist,37438562,Thu Jan 09 2020 12:06:35 GMT-0800 (PST),1/9/2020 0:00,1/9/2020,2020,1,9,23:06:35,300,Pacific Time (US & Canada),266196,shrike2,2020-01-10 01:04:07 +0300,2020-01-10 05:33:21 +0300,research,CC-BY-NC-ND,https://www.inaturalist.org/observations/37438562,https://static.inaturalist.org/photos/59350906/medium.jpg?1578607482,,,,1,0,FALSE,3,"Los Angeles County, US-CA, US",San Clemente,32.94546064,-118.5357178,5,5,,,FALSE,,,,Los Angeles,California,United States,California,Los Angeles,Milk Snail,Otala lactea,Milk Snail,Mollusca,202861,Mollusca,Gastropoda,Stylommatophora,Helicidae,,
iNaturalist,37438656,Thu Jan 09 2020 12:44:09 GMT-0800 (PST),1/9/2020 0:00,1/9/2020,2020,1,9,23:44:09,300,Pacific Time (US & Canada),266196,shrike2,2020-01-10 01:08:36 +0300,2020-01-10 05:34:24 +0300,research,CC-BY-NC-ND,https://www.inaturalist.org/observations/37438656,https://static.inaturalist.org/photos/59351187/medium.jpg?1578607763,,,,1,0,FALSE,3,"Los Angeles County, US-CA, US",San Clemente,32.94763863,-118.5343245,10,10,,,FALSE,,,,Los Angeles,California,United States,California,Los Angeles,Milk Snail,Otala lactea,Milk Snail,Mollusca,202861,Mollusca,Gastropoda,Stylommatophora,Helicidae,,
iNaturalist,37438708,Thu Jan 09 2020 12:48:47 GMT-0800 (PST),1/9/2020 0:00,1/9/2020,2020,1,9,23:48:47,300,Pacific Time (US & Canada),266196,shrike2,2020-01-10 01:10:00 +0300,2020-01-10 05:34:54 +0300,research,CC-BY-NC-ND,https://www.inaturalist.org/observations/37438708,https://static.inaturalist.org/photos/59351226/medium.jpg?1578607837,,,,1,0,FALSE,3,"Los Angeles County, US-CA, US",San Clemente,32.94759911,-118.5340198,5,5,,,FALSE,,,,Los Angeles,California,United States,California,Los Angeles,Milk Snail,Otala lactea,Milk Snail,Mollusca,202861,Mollusca,Gastropoda,Stylommatophora,Helicidae,,
iNaturalist,37441857,Thu Jan 09 2020 10:42:40 GMT-0800 (PST),1/9/2020 0:00,1/9/2020,2020,1,9,21:42:40,300,Pacific Time (US & Canada),12809,cedric_lee,2020-01-10 03:29:37 +0300,2020-01-10 03:43:22 +0300,research,CC-BY-NC,https://www.inaturalist.org/observations/37441857,https://inaturalist-open-data.s3.amazonaws.com/photos/59356503/medium.jpg?1578616367,,,,1,0,FALSE,3,"Los Angeles County, US-CA, US",San Clemente,32.9453909,-118.5327688,20,20,,,FALSE,,,,Los Angeles,California,United States,California,Los Angeles,Otala lactea,Otala lactea,Milk Snail,Mollusca,202861,Mollusca,Gastropoda,Stylommatophora,Helicidae,,
iNaturalist,37442023,Thu Jan 09 2020 11:45:23 GMT-0800 (PST),1/9/2020 0:00,1/9/2020,2020,1,9,22:45:23,300,Pacific Time (US & Canada),12809,cedric_lee,2020-01-10 03:35:59 +0300,2020-01-10 04:11:56 +0300,research,CC-BY-NC,https://www.inaturalist.org/observations/37442023,https://inaturalist-open-data.s3.amazonaws.com/photos/59356952/medium.jpg?1578617020,,,,1,0,FALSE,3,"Los Angeles County, US-CA, US",San Clemente,32.94733824,-118.5339029,9,9,,,FALSE,,,,Los Angeles,California,United States,California,Los Angeles,,Otala lactea,Milk Snail,Mollusca,202861,Mollusca,Gastropoda,Stylommatophora,Helicidae,,
iNaturalist,37465392,Fri Jan 10 2020 07:59:00 GMT-0800 (PST),1/10/2020 0:00,1/10/2020,2020,1,10,18:59:00,300,Pacific Time (US & Canada),266196,shrike2,2020-01-11 00:14:19 +0300,2020-01-11 03:36:28 +0300,research,CC-BY-NC-ND,https://www.inaturalist.org/observations/37465392,https://static.inaturalist.org/photos/59397726/medium.jpg?1578690908,,,,1,0,FALSE,3,"Los Angeles County, US-CA, US",San Clemente,32.94478333,-118.5314033,5,5,,,FALSE,,,,Los Angeles,California,United States,California,Los Angeles,Milk Snail,Otala lactea,Milk Snail,Mollusca,202861,Mollusca,Gastropoda,Stylommatophora,Helicidae,,
iNaturalist,37465909,Fri Jan 10 2020 10:32:43 GMT-0800 (PST),1/10/2020 0:00,1/10/2020,2020,1,10,21:32:43,300,Pacific Time (US & Canada),266196,shrike2,2020-01-11 00:30:15 +0300,2020-01-11 03:43:28 +0300,research,CC-BY-NC-ND,https://www.inaturalist.org/observations/37465909,https://static.inaturalist.org/photos/59398671/medium.jpg?1578691844,,,,1,0,FALSE,3,"Los Angeles County, US-CA, US",San Clemente,32.94399313,-118.5339469,5,5,,,FALSE,,,,Los Angeles,California,United States,California,Los Angeles,Otala lactea,Otala lactea,Milk Snail,Mollusca,202861,Mollusca,Gastropoda,Stylommatophora,Helicidae,,
iNaturalist,37576355,Mon Jan 13 2020 11:52:30 GMT-0800 (PST),1/13/2020 0:00,1/13/2020,2020,1,13,22:52:30,300,Pacific Time (US & Canada),12809,cedric_lee,2020-01-14 06:23:10 +0300,2020-01-14 06:24:57 +0300,needs_id,CC-BY-NC,https://www.inaturalist.org/observations/37576355,https://inaturalist-open-data.s3.amazonaws.com/photos/59594815/medium.jpg?1578972269,,,,0,0,FALSE,3,"Los Angeles County, US-CA, US",San Clemente,32.94854413,-118.5221543,28,28,,,FALSE,,,,Los Angeles,California,United States,California,Los Angeles,,Otala lactea,Milk Snail,Mollusca,202861,Mollusca,Gastropoda,Stylommatophora,Helicidae,,
iNaturalist,38522854,Mon Feb 10 2020 09:08:54 GMT-0800 (PST),2/10/2020 0:00,2/10/2020,2020,2,10,20:08:54,300,Pacific Time (US & Canada),12809,cedric_lee,2020-02-11 03:58:41 +0300,2020-02-11 06:32:36 +0300,research,CC-BY-NC,https://www.inaturalist.org/observations/38522854,https://inaturalist-open-data.s3.amazonaws.com/photos/61236937/medium.jpg?1581382775,,,,0,0,FALSE,3,"Los Angeles County, US-CA, US",San Clemente,32.94499646,-118.5311088,9,9,,,FALSE,,,,Los Angeles,California,United States,California,Los Angeles,,Otala lactea,Milk Snail,Mollusca,202861,Mollusca,Gastropoda,Stylommatophora,Helicidae,,
iNaturalist,38555057,Mon Feb 10 2020 08:40:44 GMT-0800 (PST),2/10/2020 0:00,2/10/2020,2020,2,10,19:40:44,300,Pacific Time (US & Canada),12809,cedric_lee,2020-02-12 04:09:46 +0300,2020-02-12 13:43:41 +0300,research,CC-BY-NC,https://www.inaturalist.org/observations/38555057,https://inaturalist-open-data.s3.amazonaws.com/photos/61293594/medium.jpg?1581469869,,,,1,0,FALSE,3,"Los Angeles County, US-CA, US",San Clemente,32.94501371,-118.5316913,30,30,,,FALSE,,,,Los Angeles,California,United States,California,Los Angeles,,Otala lactea,Milk Snail,Mollusca,202861,Mollusca,Gastropoda,Stylommatophora,Helicidae,,
iNaturalist,48773226,Wed May 27 2020 15:49:42 GMT-0700 (PDT),5/27/2020 0:00,5/28/2020,2020,5,28,1:49:42,300,Pacific Time (US & Canada),266196,shrike2,2020-06-07 16:31:37 +0300,2020-06-07 19:43:39 +0300,research,CC-BY-NC-ND,https://www.inaturalist.org/observations/48773226,https://static.inaturalist.org/photos/77407242/medium.jpg?1591536743,,,,1,0,FALSE,3,"San Clemente Island Underwater Range, CA, US",San Clemente,32.94526667,-118.53277,6,6,,,FALSE,,,,Los Angeles,California,United States,California,Los Angeles,Milk Snail,Otala lactea,Milk Snail,Mollusca,202861,Mollusca,Gastropoda,Stylommatophora,Helicidae,,
iNaturalist,49875396,Tue Jun 16 2020 10:51:43 GMT-0700 (PDT),6/16/2020 0:00,6/16/2020,2020,6,16,20:51:43,300,Pacific Time (US & Canada),266196,shrike2,2020-06-16 23:14:46 +0300,2020-06-16 23:19:58 +0300,research,CC-BY-NC-ND,https://www.inaturalist.org/observations/49875396,https://static.inaturalist.org/photos/79188014/medium.jpg?1592338523,,,In cracks and on surface of telephone pole (including as high as ~30’),1,0,FALSE,3,"San Clemente Island Underwater Range, CA, US",San Clemente,32.94557167,-118.5326917,10,10,,,FALSE,,,,Los Angeles,California,United States,California,Los Angeles,Milk Snail,Otala lactea,Milk Snail,Mollusca,202861,Mollusca,Gastropoda,Stylommatophora,Helicidae,,
iNaturalist,49875472,Tue Jun 16 2020 10:55:32 GMT-0700 (PDT),6/16/2020 0:00,6/16/2020,2020,6,16,20:55:32,300,Pacific Time (US & Canada),266196,shrike2,2020-06-16 23:15:30 +0300,2020-06-16 23:20:06 +0300,research,CC-BY-NC-ND,https://www.inaturalist.org/observations/49875472,https://static.inaturalist.org/photos/79188096/medium.jpg?1592338550,,,,1,0,FALSE,3,"San Clemente Island Underwater Range, CA, US",San Clemente,32.94539667,-118.5336083,15,15,,,FALSE,,,,Los Angeles,California,United States,California,Los Angeles,Milk Snail,Otala lactea,Milk Snail,Mollusca,202861,Mollusca,Gastropoda,Stylommatophora,Helicidae,,
iNaturalist,49875541,Tue Jun 16 2020 10:55:52 GMT-0700 (PDT),6/16/2020 0:00,6/16/2020,2020,6,16,20:55:52,300,Pacific Time (US & Canada),266196,shrike2,2020-06-16 23:15:57 +0300,2020-06-16 23:20:46 +0300,research,CC-BY-NC-ND,https://www.inaturalist.org/observations/49875541,https://static.inaturalist.org/photos/79188276/medium.jpg?1592338614,,,,1,0,FALSE,3,"San Clemente Island Underwater Range, CA, US",San Clemente,32.94534667,-118.5336833,6,6,,,FALSE,,,,Los Angeles,California,United States,California,Los Angeles,Milk Snail,Otala lactea,Milk Snail,Mollusca,202861,Mollusca,Gastropoda,Stylommatophora,Helicidae,,
iNaturalist,49875778,Tue Jun 16 2020 11:00:55 GMT-0700 (PDT),6/16/2020 0:00,6/16/2020,2020,6,16,21:00:55,300,Pacific Time (US & Canada),266196,shrike2,2020-06-16 23:17:35 +0300,2020-06-16 23:20:35 +0300,research,CC-BY-NC-ND,https://www.inaturalist.org/observations/49875778,https://static.inaturalist.org/photos/79188500/medium.jpg?1592338684,,,,1,0,FALSE,3,"San Clemente Island Underwater Range, CA, US",San Clemente,32.94528667,-118.5328667,5,5,,,FALSE,,,,Los Angeles,California,United States,California,Los Angeles,Milk Snail,Otala lactea,Milk Snail,Mollusca,202861,Mollusca,Gastropoda,Stylommatophora,Helicidae,,
iNaturalist,49876082,Tue Jun 16 2020 11:01:55 GMT-0700 (PDT),6/16/2020 0:00,6/16/2020,2020,6,16,21:01:55,300,Pacific Time (US & Canada),266196,shrike2,2020-06-16 23:19:47 +0300,2020-06-18 13:33:23 +0300,research,CC-BY-NC-ND,https://www.inaturalist.org/observations/49876082,https://static.inaturalist.org/photos/79189381/medium.jpg?1592338993,,,,2,0,FALSE,3,"San Clemente Island Underwater Range, CA, US",San Clemente,32.94521667,-118.53273,5,5,,,FALSE,,,,Los Angeles,California,United States,California,Los Angeles,Milk Snail,Otala lactea,Milk Snail,Mollusca,202861,Mollusca,Gastropoda,Stylommatophora,Helicidae,,
iNaturalist,65966510,Tue Dec 01 2020 08:16:12 GMT-0800 (PST),12/1/2020 0:00,12/1/2020,2020,12,1,19:16:12,300,Pacific Time (US & Canada),266196,shrike2,2020-12-02 01:05:22 +0300,2020-12-02 04:50:50 +0300,research,CC-BY-NC-ND,https://www.inaturalist.org/observations/65966510,https://static.inaturalist.org/photos/106250814/medium.jpg?1606861289,,,,1,0,FALSE,3,"San Clemente Island Underwater Range, CA, US",San Clemente,32.94526333,-118.5327917,4,4,,,FALSE,,,,Los Angeles,California,United States,California,Los Angeles,Otala lactea,Otala lactea,Milk Snail,Mollusca,202861,Mollusca,Gastropoda,Stylommatophora,Helicidae,,
iNaturalist,68169197,2021/01/03 3:50 PM PST,1/3/2021 0:00,1/4/2021,2021,1,4,2:50:00,300,Pacific Time (US & Canada),266196,shrike2,2021-01-16 22:51:25 +0300,2021-01-24 02:55:56 +0300,research,CC-BY-NC-ND,https://www.inaturalist.org/observations/68169197,https://static.inaturalist.org/photos/110313001/medium.jpeg?1610826567,,,"Rat observation:
https://www.inaturalist.org/observations/68169198",1,0,FALSE,,"Los Angeles County, US-CA, US",San Clemente,32.94525174,-118.5327592,4,4,,,FALSE,,,,Los Angeles,California,United States,California,Los Angeles,Milk Snail,Otala lactea,Milk Snail,Mollusca,202861,Mollusca,Gastropoda,Stylommatophora,Helicidae,,
iNaturalist,68169630,Wed Dec 30 2020 09:29:56 GMT-0800 (PST),12/30/2020 0:00,12/30/2020,2020,12,30,20:29:56,300,Pacific Time (US & Canada),266196,shrike2,2021-01-16 22:59:08 +0300,2021-01-16 23:22:10 +0300,research,CC-BY-NC-ND,https://www.inaturalist.org/observations/68169630,https://static.inaturalist.org/photos/110314029/medium.jpg?1610827186,,,"Examples of shells chewed by Rattus rattus in predating Otala lactea. Hundreds of Otala were estivating on a building, the rats either removed them from their estivation location or opportunistically predated them as they left the building following an increase in moisture associated with a modest winter rain event. 

Camera trap images that confirm black rats as the predator:
https://www.inaturalist.org/observations/68169475
https://www.inaturalist.org/observations/68169197
https://www.inaturalist.org/observations/68169198",1,0,FALSE,3,"San Clemente Island Underwater Range, CA, US",San Clemente,32.94521475,-118.5327421,22,22,,,FALSE,,,,Los Angeles,California,United States,California,Los Angeles,Milk Snail,Otala lactea,Milk Snail,Mollusca,202861,Mollusca,Gastropoda,Stylommatophora,Helicidae,,
iNaturalist,76670447,Sun May 02 2021 13:00:51 GMT-0700 (PDT),5/2/2021 0:00,5/2/2021,2021,5,2,23:00:51,300,Pacific Time (US & Canada),266196,shrike2,2021-05-02 23:02:50 +0300,2021-05-04 22:53:23 +0300,research,CC-BY-NC-ND,https://www.inaturalist.org/observations/76670447,https://inaturalist-open-data.s3.amazonaws.com/photos/125417931/medium.jpg?1619987520,,,,1,0,FALSE,3,"San Clemente Island Underwater Range, CA, US",San Clemente,32.94524667,-118.532775,4,4,,,FALSE,,,,Los Angeles,California,United States,California,Los Angeles,Milk Snail,Otala lactea,Milk Snail,Mollusca,202861,Mollusca,Gastropoda,Stylommatophora,Helicidae,,
iNaturalist,20831655,Thu Feb 28 2019 08:58:47 GMT-0800 (PST),2/28/2019 0:00,2/28/2019,2019,2,28,19:58:47,300,Pacific Time (US & Canada),266196,shrike2,2019-02-28 20:40:01 +0300,2019-03-05 01:11:38 +0300,research,CC-BY-NC-ND,https://www.inaturalist.org/observations/20831655,https://static.inaturalist.org/photos/32133437/medium.jpg?1551375647,,,,2,0,FALSE,3,"San Clemente Island Underwater Range, , CA, US",San Clemente,33.00222439,-118.5564578,10,10,,,FALSE,,,,Los Angeles,California,United States,California,Los Angeles,Draparnaud's Glass Snail,Oxychilus draparnaudi,Draparnaud's Glass Snail,Mollusca,226720,Mollusca,Gastropoda,Stylommatophora,Oxychilidae,,
iNaturalist,21260467,2019/02/21 2:12 PM PST,2/21/2019 0:00,,,,,,,Pacific Time (US & Canada),266196,shrike2,2019-03-15 19:40:08 +0300,2019-03-26 20:46:03 +0300,research,CC-BY-NC-ND,https://www.inaturalist.org/observations/21260467,https://static.inaturalist.org/photos/32869786/medium.jpg?1552666809,,,,2,0,FALSE,,"Los Angeles County, CA, USA",San Clemente,33.00229939,-118.5553397,15,15,,,FALSE,,,,Los Angeles,California,United States,California,Los Angeles,Draparnaud's Glass Snail,Oxychilus draparnaudi,Draparnaud's Glass Snail,Mollusca,226720,Mollusca,Gastropoda,Stylommatophora,Oxychilidae,,
iNaturalist,37537744,Sun Jan 12 2020 14:26:30 GMT-0800 (PST),1/12/2020 0:00,1/13/2020,2020,1,13,1:26:30,300,Pacific Time (US & Canada),266196,shrike2,2020-01-13 01:28:58 +0300,2020-01-13 21:35:30 +0300,research,CC-BY-NC-ND,https://www.inaturalist.org/observations/37537744,https://static.inaturalist.org/photos/59526744/medium.jpg?1578868145,,,,1,0,FALSE,3,"San Clemente Island Underwater Range, CA, US",San Clemente,33.0023291,-118.5559648,20,20,,,FALSE,,,,Los Angeles,California,United States,California,Los Angeles,Draparnaud's Glass Snail,Oxychilus draparnaudi,Draparnaud's Glass Snail,Mollusca,226720,Mollusca,Gastropoda,Stylommatophora,Oxychilidae,,
iNaturalist,3756831,2012/06/14 6:12 PM PDT,6/14/2012 0:00,6/15/2012,2012,6,15,5:12:00,400,Pacific Time (US & Canada),275891,psyllidhipster,2016-07-28 04:16:58 +0300,2017-10-14 23:32:01 +0300,research,CC-BY-NC,http://www.inaturalist.org/observations/3756831,https://inaturalist-open-data.s3.amazonaws.com/photos/4374428/medium.jpg?1469668548,,,"Stumped...
shell diamter about 5mm or a little more",3,0,FALSE,,"Avalon, CA 90704, USA",Santa Catalina,33.3428193,-118.3282279,2403,2403,,,FALSE,,,,Los Angeles,California,United States,California,Los Angeles,Draparnaud's Glass-snail,Oxychilus draparnaudi,Draparnaud's Glass Snail,Mollusca,226720,Mollusca,Gastropoda,Stylommatophora,Oxychilidae,,
iNaturalist,3825223,2016/08/06 3:38 PM PDT,8/6/2016 0:00,8/7/2016,2016,8,7,1:38:00,300,Pacific Time (US & Canada),12809,cedric_lee,2016-08-07 22:07:38 +0300,2017-04-05 02:05:46 +0300,research,CC-BY-NC,http://www.inaturalist.org/observations/3825223,https://static.inaturalist.org/photos/4473216/medium.jpeg?1470596802,,,,2,0,FALSE,,"Avalon, CA 90704, USA",Santa Catalina,33.33959167,-118.3237367,,,,,FALSE,,,,Los Angeles,California,United States,California,Los Angeles,Draparnaud's Glass-snail,Oxychilus draparnaudi,Draparnaud's Glass Snail,Mollusca,226720,Mollusca,Gastropoda,Stylommatophora,Oxychilidae,,
iNaturalist,32776484,2019-09-14 5:27:46 PM PDT,9/14/2019 0:00,9/15/2019,2019,9,15,3:27:46,300,Pacific Time (US & Canada),392423,bjdion,2019-09-15 20:31:39 +0300,2020-01-01 04:10:06 +0300,research,CC-BY-NC-SA,https://www.inaturalist.org/observations/32776484,https://inaturalist-open-data.s3.amazonaws.com/photos/51431307/medium.jpeg?1568568703,,,Glass snail Oxychilus,1,0,FALSE,2,"Los Angeles County, US-CA, US",Santa Catalina,33.44103364,-118.4986116,9,9,,,FALSE,,,,Los Angeles,California,United States,California,Los Angeles,Draparnaud's Glass Snail,Oxychilus draparnaudi,Draparnaud's Glass Snail,Mollusca,226720,Mollusca,Gastropoda,Stylommatophora,Oxychilidae,,
iNaturalist,38732150,2020/02/16 11:05 AM PST,2/16/2020 0:00,2/16/2020,2020,2,16,22:05:00,300,Pacific Time (US & Canada),23091,sue_meiman,2020-02-17 03:11:33 +0300,2020-05-23 08:59:54 +0300,needs_id,CC-BY-NC,https://www.inaturalist.org/observations/38732150,https://inaturalist-open-data.s3.amazonaws.com/photos/61602884/medium.jpg?1581897327,,,In puddle with green algae and other snails.,1,0,FALSE,,"Los Angeles County, CA, USA",San Clemente,32.84647124,-118.4414097,45,45,,,FALSE,,,,Los Angeles,California,United States,California,Los Angeles,Bladder Snails,Physa,,Mollusca,133821,Mollusca,Gastropoda,Hygrophila(Superorder),Physidae,,
iNaturalist,38732151,2020/02/16 11:04 AM PST,2/16/2020 0:00,2/16/2020,2020,2,16,22:04:00,300,Pacific Time (US & Canada),23091,sue_meiman,2020-02-17 03:11:33 +0300,2021-05-19 19:41:47 +0300,needs_id,CC-BY-NC,https://www.inaturalist.org/observations/38732151,https://inaturalist-open-data.s3.amazonaws.com/photos/61602887/medium.jpg?1581897329,,,In puddle with green algae and other snails.,1,0,FALSE,,"Los Angeles County, CA, USA",San Clemente,32.8462966,-118.4415203,56,56,,,FALSE,,,,Los Angeles,California,United States,California,Los Angeles,Bladder Snails,Physa,,Mollusca,133821,Mollusca,Gastropoda,Hygrophila(Superorder),Physidae,,
iNaturalist,27891043,Sat Jun 29 2019 10:54:00 GMT-0700 (PDT),6/29/2019 0:00,6/29/2019,2019,6,29,20:54:00,300,Pacific Time (US & Canada),266196,shrike2,2019-06-29 23:47:07 +0300,2020-02-25 00:39:37 +0300,needs_id,CC-BY-NC-ND,https://www.inaturalist.org/observations/27891043,https://static.inaturalist.org/photos/43440224/medium.jpg?1561841236,,,,0,0,FALSE,3,"Los Angeles County, US-CA, US",San Clemente,32.88527706,-118.4901693,10,10,,open,FALSE,,,,Los Angeles,California,United States,California,Los Angeles,,Physa acuta,Acute Bladder Snail,Mollusca,563819,Mollusca,Gastropoda,Hygrophila(Superorder),Physidae,,
iNaturalist,37533619,Sun Jan 12 2020 10:07:51 GMT-0800 (PST),1/12/2020 0:00,1/12/2020,2020,1,12,21:07:51,300,Pacific Time (US & Canada),266196,shrike2,2020-01-12 23:33:52 +0300,2020-02-25 00:39:08 +0300,research,CC-BY-NC-ND,https://www.inaturalist.org/observations/37533619,https://static.inaturalist.org/photos/59519722/medium.jpg?1578861243,,,,0,0,FALSE,3,"Los Angeles County, US-CA, US",San Clemente,32.88547833,-118.4898617,10,10,,open,FALSE,,,,Los Angeles,California,United States,California,Los Angeles,Acute Bladder Snail,Physa acuta,Acute Bladder Snail,Mollusca,563819,Mollusca,Gastropoda,Hygrophila(Superorder),Physidae,,
iNaturalist,37542675,Sun Jan 12 2020 10:23:28 GMT-0800 (PST),1/12/2020 0:00,1/12/2020,2020,1,12,21:23:28,300,Pacific Time (US & Canada),12809,cedric_lee,2020-01-13 04:03:01 +0300,2020-02-25 00:30:00 +0300,needs_id,CC-BY-NC,https://www.inaturalist.org/observations/37542675,https://inaturalist-open-data.s3.amazonaws.com/photos/59535911/medium.jpg?1578878017,,,,0,0,FALSE,3,"Los Angeles County, US-CA, US",San Clemente,32.88653846,-118.4888355,9,9,,open,FALSE,,,,Los Angeles,California,United States,California,Los Angeles,Acute Bladder Snail,Physa acuta,Acute Bladder Snail,Mollusca,563819,Mollusca,Gastropoda,Hygrophila(Superorder),Physidae,,
iNaturalist,39394392,2020/02/23 2:05 PM PST,2/23/2020 0:00,2/24/2020,2020,2,24,1:05:00,300,Pacific Time (US & Canada),12809,cedric_lee,2020-03-01 10:35:56 +0300,2020-03-17 01:55:17 +0300,needs_id,CC-BY-NC,https://www.inaturalist.org/observations/39394392,https://inaturalist-open-data.s3.amazonaws.com/photos/62487660/medium.jpeg?1583041801,,,,0,0,FALSE,,"Los Angeles County, CA, USA",San Clemente,32.84200116,-118.4422543,173,173,,open,FALSE,,,,Los Angeles,California,United States,California,Los Angeles,Acute Bladder Snail,Physa acuta,Acute Bladder Snail,Mollusca,563819,Mollusca,Gastropoda,Hygrophila(Superorder),Physidae,,
iNaturalist,57451849,Fri Aug 14 2020 07:45:21 GMT-0700 (PDT),8/14/2020 0:00,8/14/2020,2020,8,14,17:45:21,300,Pacific Time (US & Canada),266196,shrike2,2020-08-24 18:36:55 +0300,2020-08-24 18:37:20 +0300,needs_id,CC-BY-NC-ND,https://www.inaturalist.org/observations/57451849,https://static.inaturalist.org/photos/91640701/medium.jpg?1598283419,,,,0,0,FALSE,3,"San Clemente Island Underwater Range, CA, US",San Clemente,32.93030833,-118.5076833,4,4,,open,FALSE,,,,Los Angeles,California,United States,California,Los Angeles,,Physa acuta,Acute Bladder Snail,Mollusca,563819,Mollusca,Gastropoda,Hygrophila(Superorder),Physidae,,
iNaturalist,24398002,Wed May 01 2019 08:14:48 GMT-0700 (PDT),5/1/2019 0:00,5/1/2019,2019,5,1,18:14:48,300,Pacific Time (US & Canada),1512775,parisrebl,2019-05-03 00:23:56 +0300,2019-05-03 04:37:00 +0300,needs_id,CC-BY-NC,https://www.inaturalist.org/observations/24398002,https://inaturalist-open-data.s3.amazonaws.com/photos/37725392/medium.jpg?1556832241,,,,0,0,FALSE,3,"Los Angeles County, US-CA, US",Santa Catalina,33.35178722,-118.4323098,5,5,,open,FALSE,,,,Los Angeles,California,United States,California,Los Angeles,,Physa acuta,Acute Bladder Snail,Mollusca,563819,Mollusca,Gastropoda,Hygrophila(Superorder),Physidae,,
iNaturalist,3483590,2016-06-11 11:59:24 AM PDT,6/11/2016 0:00,6/11/2016,2016,6,11,21:59:24,300,Pacific Time (US & Canada),149065,pleistocen3,2016-06-19 22:24:15 +0300,2020-02-27 21:39:39 +0300,needs_id,CC-BY-NC-SA,http://www.inaturalist.org/observations/3483590,https://inaturalist-open-data.s3.amazonaws.com/photos/4051623/medium.jpeg?1466364263,,,Several hanging out in drying pool of water in canyon-bottom. Clinging to algae. ,3,0,FALSE,2,"Norton Canyon, San Clemente Island, CA",San Clemente,32.86384,-118.491671,93,93,,,FALSE,,,,Los Angeles,California,United States,California,Los Angeles,Physidae,Physidae,Bladder Snails,Mollusca,85989,Mollusca,Gastropoda,Hygrophila(Superorder),Physidae,,
iNaturalist,28401150,Sun Jul 07 2019 10:08:26 GMT-0700 (PDT),7/7/2019 0:00,7/7/2019,2019,7,7,20:08:26,300,Pacific Time (US & Canada),1474963,stephlbartlett,2019-07-08 02:52:46 +0300,2020-02-27 20:53:51 +0300,needs_id,CC-BY-NC,https://www.inaturalist.org/observations/28401150,https://inaturalist-open-data.s3.amazonaws.com/photos/44271580/medium.jpg?1562543599,,,,3,1,FALSE,3,"San Clemente Island Underwater Range, , CA, US",San Clemente,32.85443,-118.4725883,5,5,,open,FALSE,,,,Los Angeles,California,United States,California,Los Angeles,Bladder Snails,Physidae,Bladder Snails,Mollusca,85989,Mollusca,Gastropoda,Hygrophila(Superorder),Physidae,,
iNaturalist,37009325,2019-12-27 9:17:47 AM PST,12/27/2019 0:00,12/27/2019,2019,12,27,20:17:47,300,Pacific Time (US & Canada),772899,ljbrenner,2019-12-28 00:02:09 +0300,2020-04-27 22:54:06 +0300,needs_id,CC-BY-NC,https://www.inaturalist.org/observations/37009325,https://inaturalist-open-data.s3.amazonaws.com/photos/58596925/medium.jpeg?1577480538,,,,1,0,FALSE,2,"Santa Catalina Island, California 90704, USA",Santa Catalina,33.36798817,-118.4732855,313,313,,,FALSE,gps,gps,,Los Angeles,California,United States,California,Los Angeles,Ramshorn snails,Planorbella,,Mollusca,91113,Mollusca,Gastropoda,Hygrophila(Superorder),Planorbidae,,
iNaturalist,10242953,Wed Mar 14 2018 16:46:37 GMT-0700 (PDT),3/14/2018 0:00,3/15/2018,2018,3,15,2:46:37,300,Pacific Time (US & Canada),819,rebeccafay,2018-03-15 09:26:19 +0300,2020-03-16 02:39:56 +0300,research,CC0,https://www.inaturalist.org/observations/10242953,https://inaturalist-open-data.s3.amazonaws.com/photos/14165396/medium.jpg?1521095187,,,,2,0,FALSE,3,"Los Angeles County, US-CA, US",,33.56659824,-118.4886381,5,28957,,obscured,TRUE,,,,Los Angeles,California,United States,California,Los Angeles,Speckled Cactussnail,Plesarionta stearnsiana,Speckled Cactussnail,Mollusca,1046665,Mollusca,Gastropoda,Stylommatophora,Xanthonychidae,Xerarionta,Xerarionta stearnsiana
iNaturalist,24870709,Mon May 06 2019 13:45:13 GMT-0700 (PDT),5/6/2019 0:00,5/6/2019,2019,5,6,23:45:13,300,Tijuana,23647,jhvaldez_tutor,2019-05-10 06:26:11 +0300,2020-03-24 08:28:37 +0300,needs_id,CC-BY-NC,https://www.inaturalist.org/observations/24870709,https://inaturalist-open-data.s3.amazonaws.com/photos/38468975/medium.jpg?1557458784,,,Isla Todos Santos sur,1,0,FALSE,3,"Ensenada, MX-BN, MX",,31.93192756,-116.6215998,28,29173,,obscured,TRUE,,,,,Baja California,Mexico,Baja California,Ensenada,Speckled Cactussnail,Plesarionta stearnsiana,Speckled Cactussnail,Mollusca,1046665,Mollusca,Gastropoda,Stylommatophora,Xanthonychidae,Xerarionta,Xerarionta stearnsiana
iNaturalist,8031068,2017-09-21 9:01:36 AM PDT,9/21/2017 0:00,9/21/2017,2017,9,21,19:01:36,300,Pacific Time (US & Canada),392423,bjdion,2017-09-22 02:46:06 +0300,2017-10-18 05:14:32 +0300,needs_id,CC-BY-NC-SA,https://www.inaturalist.org/observations/8031068,https://inaturalist-open-data.s3.amazonaws.com/photos/10633677/medium.jpeg?1506037571,,"snail, catalinaisland",,1,0,FALSE,2,"Los Angeles County, US-CA, US",Santa Catalina,33.35383747,-118.4396268,7,7,,,FALSE,,,,Los Angeles,California,United States,California,Los Angeles,Apple Snails,Pomacea,,Mollusca,84111,Mollusca,Gastropoda,,Ampullariidae,,
iNaturalist,32929866,Fri Sep 13 2019 10:08:16 GMT-0700 (PDT),9/13/2019 0:00,9/13/2019,2019,9,13,20:08:16,300,Pacific Time (US & Canada),464542,william_hoyer,2019-09-18 06:10:15 +0300,2021-01-15 23:51:25 +0300,research,CC-BY-NC,https://www.inaturalist.org/observations/32929866,https://inaturalist-open-data.s3.amazonaws.com/photos/51684310/medium.jpg?1568776264,,,,3,0,FALSE,3,"Los Angeles County, US-CA, US",Santa Catalina,33.25182798,-118.3673884,1356,28984,obscured,obscured,TRUE,,,,Los Angeles,California,United States,California,Los Angeles,Catalina Mountainsnail,Radiocentrum avalonense,Catalina Mountainsnail,Mollusca,111476,Mollusca,Gastropoda,Stylommatophora,Oreohelicidae,,
iNaturalist,19048418,Sat Dec 15 2018 10:34:13 GMT-0800 (PST),12/15/2018 0:00,12/15/2018,2018,12,15,21:34:13,300,Pacific Time (US & Canada),521220,drbh2o,2018-12-16 18:09:41 +0300,2019-09-23 07:17:20 +0300,research,CC-BY-NC,https://www.inaturalist.org/observations/19048418,https://static.inaturalist.org/photos/29219160/medium.jpg?1544972999,,,,2,0,FALSE,3,"Los Angeles County, US-CA, US",,33.20866727,-118.2661837,5,28984,,obscured,TRUE,,,,Los Angeles,California,United States,California,Los Angeles,Catalina Mountainsnail,Radiocentrum avalonense,Catalina Mountainsnail,Mollusca,111476,Mollusca,Gastropoda,Stylommatophora,Oreohelicidae,Radiocentrum,Radiocentrum avalonense
iNaturalist,20155108,Tue Feb 05 2019 16:08:57 GMT-0800 (PST),2/5/2019 0:00,2/6/2019,2019,2,6,3:08:57,300,Pacific Time (US & Canada),266196,shrike2,2019-02-06 17:56:43 +0300,2020-10-19 19:22:32 +0300,research,CC-BY-NC-ND,https://www.inaturalist.org/observations/20155108,https://static.inaturalist.org/photos/31090314/medium.jpg?1549465072,,,,3,0,FALSE,3,"San Clemente Island Underwater Range, , CA, US",San Clemente,33.00228684,-118.5563191,5,5,,,FALSE,,,,Los Angeles,California,United States,California,Los Angeles,Decollate Snail,Rumina decollata,Decollate Snail,Mollusca,125669,Mollusca,Gastropoda,Stylommatophora,Achatinidae,,
iNaturalist,21231059,2019-03-06 3:37:05 PM PST,3/6/2019 0:00,3/7/2019,2019,3,7,2:37:05,300,Pacific Time (US & Canada),34488,pileated,2019-03-14 18:32:05 +0300,2021-01-30 09:39:48 +0300,research,CC-BY,https://www.inaturalist.org/observations/21231059,https://inaturalist-open-data.s3.amazonaws.com/photos/32820846/medium.jpg?1552577526,,,,3,0,FALSE,2,"Los Angeles County, US-CA, US",San Clemente,32.99835968,-118.5529099,,,,,FALSE,gps,gps,,Los Angeles,California,United States,California,Los Angeles,Decollate Snail,Rumina decollata,Decollate Snail,Mollusca,125669,Mollusca,Gastropoda,Stylommatophora,Achatinidae,,
iNaturalist,21350796,2019-03-06 3:45:55 PM PST,3/6/2019 0:00,,,,,,,Pacific Time (US & Canada),34488,pileated,2019-03-18 09:05:08 +0300,2020-10-19 19:24:13 +0300,research,CC-BY,https://www.inaturalist.org/observations/21350796,https://inaturalist-open-data.s3.amazonaws.com/photos/33022432/medium.jpg?1552889110,,,,3,0,FALSE,2,"Unnamed Road, California, USA",San Clemente,33.00220533,-118.5542775,176,176,,,FALSE,gps,gps,,Los Angeles,California,United States,California,Los Angeles,Decollate Snail,Rumina decollata,Decollate Snail,Mollusca,125669,Mollusca,Gastropoda,Stylommatophora,Achatinidae,,
iNaturalist,21350800,2019-03-06 3:55:42 PM PST,3/6/2019 0:00,,,,,,,Pacific Time (US & Canada),34488,pileated,2019-03-18 09:05:25 +0300,2020-10-19 19:24:14 +0300,research,CC-BY,https://www.inaturalist.org/observations/21350800,https://inaturalist-open-data.s3.amazonaws.com/photos/33022443/medium.jpg?1552889128,,,,3,0,FALSE,2,"Unnamed Road, California, USA",San Clemente,33.00224666,-118.5544193,176,176,,,FALSE,gps,gps,,Los Angeles,California,United States,California,Los Angeles,Decollate Snail,Rumina decollata,Decollate Snail,Mollusca,125669,Mollusca,Gastropoda,Stylommatophora,Achatinidae,,
iNaturalist,24086471,Mon Apr 29 2019 16:20:33 GMT-0700 (PDT),4/29/2019 0:00,4/30/2019,2019,4,30,2:20:33,300,Pacific Time (US & Canada),266196,shrike2,2019-04-30 03:49:39 +0300,2020-10-19 19:27:09 +0300,research,CC-BY-NC-ND,https://www.inaturalist.org/observations/24086471,https://static.inaturalist.org/photos/37251879/medium.jpg?1556585795,,,,4,0,FALSE,3,"San Clemente Island Underwater Range, , CA, US",San Clemente,33.00225457,-118.5561258,10,10,,,FALSE,,,,Los Angeles,California,United States,California,Los Angeles,Decollate Snail,Rumina decollata,Decollate Snail,Mollusca,125669,Mollusca,Gastropoda,Stylommatophora,Achatinidae,,
iNaturalist,37081922,Sun Dec 29 2019 16:19:38 GMT-0800 (PST),12/29/2019 0:00,12/30/2019,2019,12,30,3:19:38,300,Pacific Time (US & Canada),266196,shrike2,2019-12-30 03:20:36 +0300,2019-12-30 10:30:29 +0300,research,CC-BY-NC-ND,https://www.inaturalist.org/observations/37081922,https://static.inaturalist.org/photos/58726939/medium.jpg?1577665242,,,,2,0,FALSE,3,"San Clemente Island Underwater Range, CA, US",San Clemente,33.00213676,-118.5551998,5,5,,,FALSE,,,,Los Angeles,California,United States,California,Los Angeles,Decollate Snail,Rumina decollata,Decollate Snail,Mollusca,125669,Mollusca,Gastropoda,Stylommatophora,Achatinidae,,
iNaturalist,37081947,Sun Dec 29 2019 16:21:38 GMT-0800 (PST),12/29/2019 0:00,12/30/2019,2019,12,30,3:21:38,300,Pacific Time (US & Canada),266196,shrike2,2019-12-30 03:21:48 +0300,2019-12-30 10:30:47 +0300,research,CC-BY-NC-ND,https://www.inaturalist.org/observations/37081947,https://static.inaturalist.org/photos/58727025/medium.jpg?1577665325,,,,2,0,FALSE,3,"San Clemente Island Underwater Range, CA, US",San Clemente,33.00216413,-118.5550967,10,10,,,FALSE,,,,Los Angeles,California,United States,California,Los Angeles,Decollate Snail,Rumina decollata,Decollate Snail,Mollusca,125669,Mollusca,Gastropoda,Stylommatophora,Achatinidae,,
iNaturalist,37914426,Thu Jan 23 2020 10:38:50 GMT-0800 (PST),1/23/2020 0:00,1/23/2020,2020,1,23,21:38:50,300,Pacific Time (US & Canada),12809,cedric_lee,2020-01-24 16:27:45 +0300,2020-04-16 04:08:05 +0300,research,CC-BY-NC,https://www.inaturalist.org/observations/37914426,https://inaturalist-open-data.s3.amazonaws.com/photos/60179414/medium.jpg?1579872519,,,,1,0,FALSE,3,"Los Angeles County, US-CA, US",San Clemente,33.00173829,-118.5571548,8,8,,,FALSE,,,,Los Angeles,California,United States,California,Los Angeles,,Rumina decollata,Decollate Snail,Mollusca,125669,Mollusca,Gastropoda,Stylommatophora,Achatinidae,,
iNaturalist,37914855,Thu Jan 23 2020 14:14:14 GMT-0800 (PST),1/23/2020 0:00,1/24/2020,2020,1,24,1:14:14,300,Pacific Time (US & Canada),12809,cedric_lee,2020-01-24 16:49:41 +0300,2020-04-16 04:08:06 +0300,research,CC-BY-NC,https://www.inaturalist.org/observations/37914855,https://inaturalist-open-data.s3.amazonaws.com/photos/60180174/medium.jpg?1579873833,,,,2,0,FALSE,3,"Los Angeles County, US-CA, US",San Clemente,33.00233154,-118.5556596,9,9,,,FALSE,,,,Los Angeles,California,United States,California,Los Angeles,,Rumina decollata,Decollate Snail,Mollusca,125669,Mollusca,Gastropoda,Stylommatophora,Achatinidae,,
iNaturalist,38491352,Sun Feb 09 2020 10:49:28 GMT-0800 (PST),2/9/2020 0:00,2/9/2020,2020,2,9,21:49:28,300,Pacific Time (US & Canada),12809,cedric_lee,2020-02-10 05:29:17 +0300,2020-04-16 04:08:33 +0300,research,CC-BY-NC,https://www.inaturalist.org/observations/38491352,https://inaturalist-open-data.s3.amazonaws.com/photos/61182377/medium.jpg?1581301795,,,Over 800 collected from Wilson Cove and killed. Some Oxychilus are in there too.,2,0,FALSE,3,"San Clemente Island Underwater Range, CA, US",San Clemente,33.00223948,-118.5543324,172,172,,,FALSE,,,,Los Angeles,California,United States,California,Los Angeles,,Rumina decollata,Decollate Snail,Mollusca,125669,Mollusca,Gastropoda,Stylommatophora,Achatinidae,,
iNaturalist,38554951,Sun Feb 09 2020 09:07:38 GMT-0800 (PST),2/9/2020 0:00,2/9/2020,2020,2,9,20:07:38,300,Pacific Time (US & Canada),12809,cedric_lee,2020-02-12 04:05:22 +0300,2020-04-16 04:08:37 +0300,research,CC-BY-NC,https://www.inaturalist.org/observations/38554951,https://inaturalist-open-data.s3.amazonaws.com/photos/61293358/medium.jpg?1581469566,,,,2,0,FALSE,3,"Los Angeles County, US-CA, US",San Clemente,33.00249842,-118.5542947,10,10,,,FALSE,,,,Los Angeles,California,United States,California,Los Angeles,,Rumina decollata,Decollate Snail,Mollusca,125669,Mollusca,Gastropoda,Stylommatophora,Achatinidae,,
iNaturalist,38554974,Sun Feb 09 2020 08:52:05 GMT-0800 (PST),2/9/2020 0:00,2/9/2020,2020,2,9,19:52:05,300,Pacific Time (US & Canada),12809,cedric_lee,2020-02-12 04:06:34 +0300,2020-04-16 04:08:38 +0300,research,CC-BY-NC,https://www.inaturalist.org/observations/38554974,https://inaturalist-open-data.s3.amazonaws.com/photos/61293417/medium.jpg?1581469636,,,,2,0,FALSE,3,"Los Angeles County, US-CA, US",San Clemente,33.00239835,-118.5549532,5,5,,,FALSE,,,,Los Angeles,California,United States,California,Los Angeles,,Rumina decollata,Decollate Snail,Mollusca,125669,Mollusca,Gastropoda,Stylommatophora,Achatinidae,,
iNaturalist,39826994,Tue Mar 10 2020 16:14:34 GMT-0700 (PDT),3/10/2020 0:00,3/11/2020,2020,3,11,2:14:34,300,Pacific Time (US & Canada),266196,shrike2,2020-03-11 06:14:12 +0300,2021-01-13 08:49:34 +0300,research,CC-BY-NC-ND,https://www.inaturalist.org/observations/39826994,https://static.inaturalist.org/photos/63226046/medium.jpg?1583896504,,,,2,0,FALSE,3,"San Clemente Island Underwater Range, CA, US",San Clemente,33.00259445,-118.5556033,,,,,FALSE,,,,Los Angeles,California,United States,California,Los Angeles,Decollate Snail,Rumina decollata,Decollate Snail,Mollusca,125669,Mollusca,Gastropoda,Stylommatophora,Achatinidae,,
iNaturalist,19682107,2012/10/11 5:11 PM MST,10/11/2012 0:00,10/12/2012,2012,10,12,3:11:00,400,Mountain Time (US & Canada),19215,tsirtalis,2019-01-17 01:37:56 +0300,2019-01-17 02:13:35 +0300,research,CC-BY-NC-ND,https://www.inaturalist.org/observations/19682107,https://static.inaturalist.org/photos/30315590/medium.jpeg?1547678109,,,,1,0,FALSE,,"Ventura County, CA, USA",San Nicolas,33.26190667,-119.4820217,,,,,FALSE,,,,Ventura,California,United States,California,Ventura,Decollate Snail,Rumina decollata,Decollate Snail,Mollusca,125669,Mollusca,Gastropoda,Stylommatophora,Achatinidae,,
iNaturalist,20103046,2014/08/29 4:10 PM MST,8/29/2014 0:00,8/30/2014,2014,8,30,3:10:00,400,Arizona,19215,tsirtalis,2019-02-05 08:05:59 +0300,2020-10-19 19:22:27 +0300,research,CC-BY-NC-ND,https://www.inaturalist.org/observations/20103046,https://static.inaturalist.org/photos/31032909/medium.jpeg?1549343127,,,,5,0,FALSE,,"Ventura County, CA, USA",San Nicolas,33.2620295,-119.4914005,,,,,FALSE,,,,Ventura,California,United States,California,Ventura,Decollate Snail,Rumina decollata,Decollate Snail,Mollusca,125669,Mollusca,Gastropoda,Stylommatophora,Achatinidae,,
iNaturalist,20279806,Thu Jan 17 2019 19:01:51 GMT-0800 (PST),1/17/2019 0:00,1/18/2019,2019,1,18,6:01:51,300,Pacific Time (US & Canada),151342,joeycurti3,2019-02-11 17:23:16 +0300,2020-10-19 19:22:41 +0300,research,,https://www.inaturalist.org/observations/20279806,https://static.inaturalist.org/photos/31306366/medium.jpg?1549895729,,,,3,0,FALSE,3,"San Nicolas Naval Facility, , CA, US",San Nicolas,33.25587833,-119.486145,10,10,,,FALSE,,,,Ventura,California,United States,California,Ventura,Decollate Snail,Rumina decollata,Decollate Snail,Mollusca,125669,Mollusca,Gastropoda,Stylommatophora,Achatinidae,,
iNaturalist,20772853,Mon Feb 25 2019 13:03:44 GMT-0800 (PST),2/25/2019 0:00,2/26/2019,2019,2,26,0:03:44,300,Pacific Time (US & Canada),173183,serpophaga,2019-02-26 07:20:26 +0300,2020-10-19 19:22:56 +0300,research,CC-BY-NC,https://www.inaturalist.org/observations/20772853,https://inaturalist-open-data.s3.amazonaws.com/photos/32034458/medium.jpg?1551154852,,,,2,0,FALSE,3,"San Nicolas Naval Facility, , CA, US",San Nicolas,33.26100333,-119.494325,5,5,,,FALSE,,,,Ventura,California,United States,California,Ventura,Decollate Snail,Rumina decollata,Decollate Snail,Mollusca,125669,Mollusca,Gastropoda,Stylommatophora,Achatinidae,,
iNaturalist,20858970,2019/02/28 6:58 AM PST,2/28/2019 0:00,2/28/2019,2019,2,28,17:58:00,300,Pacific Time (US & Canada),173183,serpophaga,2019-03-01 23:24:42 +0300,2021-07-27 07:32:36 +0300,research,CC-BY-NC,https://www.inaturalist.org/observations/20858970,https://inaturalist-open-data.s3.amazonaws.com/photos/32179655/medium.jpg?1551470998,,,,4,0,FALSE,,"Ventura County, CA, USA",San Nicolas,33.25554167,-119.48645,5,5,,,FALSE,,,,Ventura,California,United States,California,Ventura,Decollate Snail,Rumina decollata,Decollate Snail,Mollusca,125669,Mollusca,Gastropoda,Stylommatophora,Achatinidae,,
iNaturalist,5262259,1/1/2012,1/1/2012 0:00,,,,,,,Pacific Time (US & Canada),275891,psyllidhipster,2017-03-10 04:02:15 +0300,2020-12-30 05:11:25 +0300,research,CC-BY-NC,https://www.inaturalist.org/observations/5262259,https://inaturalist-open-data.s3.amazonaws.com/photos/6512194/medium.jpg?1489105210,,,,3,0,FALSE,,"Two Harbors, CA 90704, USA",Santa Catalina,33.44,-118.49833,1550,1550,,,FALSE,,,,Los Angeles,California,United States,California,Los Angeles,Decollate Snail,Rumina decollata,Decollate Snail,Mollusca,125669,Mollusca,Gastropoda,Stylommatophora,Achatinidae,,
iNaturalist,36687461,2019-12-15 4:01:38 PM PST,12/15/2019 0:00,12/16/2019,2019,12,16,3:01:38,300,Pacific Time (US & Canada),772899,ljbrenner,2019-12-16 03:02:49 +0300,2019-12-30 10:31:26 +0300,research,CC-BY-NC,https://www.inaturalist.org/observations/36687461,https://inaturalist-open-data.s3.amazonaws.com/photos/58030080/medium.jpeg?1576454574,,,Population of ~60 individuals (alive and dead) found on one block in town of Avalon.,4,0,FALSE,2,"Los Angeles County, US-CA, US",Santa Catalina,33.3439611,-118.3302544,23,23,,,FALSE,,,,Los Angeles,California,United States,California,Los Angeles,Decollate Snail,Rumina decollata,Decollate Snail,Mollusca,125669,Mollusca,Gastropoda,Stylommatophora,Achatinidae,,
iNaturalist,21810239,2019/03/25 10:05 AM PDT,3/25/2019 0:00,3/25/2019,2019,3,25,20:05:00,300,Pacific Time (US & Canada),12809,cedric_lee,2019-03-31 05:10:40 +0300,2021-01-09 08:39:44 +0300,needs_id,CC-BY-NC,https://www.inaturalist.org/observations/21810239,https://inaturalist-open-data.s3.amazonaws.com/photos/33776633/medium.jpeg?1553991069,,,,3,0,FALSE,,"Los Angeles County, CA, USA",San Clemente,32.87794112,-118.4357364,95,95,,,FALSE,,,,Los Angeles,California,United States,California,Los Angeles,Striatura,Striatura,,Mollusca,171814,Mollusca,Gastropoda,,Gastrodontidae,,
iNaturalist,25095295,2019-05-08 2:24:27 PM PDT,5/8/2019 0:00,5/9/2019,2019,5,9,0:24:27,300,Pacific Time (US & Canada),34488,pileated,2019-05-14 07:25:27 +0300,2021-01-09 08:40:04 +0300,needs_id,CC-BY,https://www.inaturalist.org/observations/25095295,https://inaturalist-open-data.s3.amazonaws.com/photos/38839394/medium.jpg?1557807929,,,,1,0,FALSE,2,"Los Angeles County, US-CA, US",San Clemente,32.91421509,-118.4811249,,,,,FALSE,gps,gps,,Los Angeles,California,United States,California,Los Angeles,Striatura,Striatura,,Mollusca,171814,Mollusca,Gastropoda,,Gastrodontidae,,
iNaturalist,25297220,2019/03/25 5:39 PM PDT,3/25/2019 0:00,3/26/2019,2019,3,26,3:39:00,300,Pacific Time (US & Canada),195291,stephanomeria,2019-05-18 06:31:32 +0300,2020-05-03 21:07:10 +0300,needs_id,CC-BY-NC,https://www.inaturalist.org/observations/25297220,https://inaturalist-open-data.s3.amazonaws.com/photos/39166454/medium.jpeg?1558149201,,,,3,0,FALSE,,Grove Canyon,San Clemente,32.87903608,-118.4345851,169,169,,,FALSE,,,,Los Angeles,California,United States,California,Los Angeles,Striatura,Striatura,,Mollusca,171814,Mollusca,Gastropoda,,Gastrodontidae,,
iNaturalist,38662629,2/13/2020,2/13/2020 0:00,,,,,,,Pacific Time (US & Canada),12809,cedric_lee,2020-02-15 11:15:10 +0300,2021-03-09 09:45:59 +0300,needs_id,CC-BY-NC,https://www.inaturalist.org/observations/38662629,https://inaturalist-open-data.s3.amazonaws.com/photos/61479933/medium.jpeg?1581753152,,,,1,0,FALSE,,"Los Angeles County, CA, USA",San Clemente,32.87548705,-118.4823154,129,129,,,FALSE,,,,Los Angeles,California,United States,California,Los Angeles,Striatura,Striatura,,Mollusca,171814,Mollusca,Gastropoda,,Gastrodontidae,,
iNaturalist,39394390,2020/02/23 1:40 PM PST,2/23/2020 0:00,2/24/2020,2020,2,24,0:40:00,300,Pacific Time (US & Canada),12809,cedric_lee,2020-03-01 10:35:54 +0300,2020-05-03 21:06:32 +0300,needs_id,CC-BY-NC,https://www.inaturalist.org/observations/39394390,https://inaturalist-open-data.s3.amazonaws.com/photos/62487580/medium.jpeg?1583041730,,,,2,0,FALSE,,"Los Angeles County, CA, USA",San Clemente,32.84200116,-118.4422543,173,173,,,FALSE,,,,Los Angeles,California,United States,California,Los Angeles,Striatura,Striatura,,Mollusca,171814,Mollusca,Gastropoda,,Gastrodontidae,,
iNaturalist,39395980,2020/02/24 1:03 PM PST,2/24/2020 0:00,2/25/2020,2020,2,25,0:03:00,300,Pacific Time (US & Canada),12809,cedric_lee,2020-03-01 11:51:23 +0300,2020-05-03 21:06:20 +0300,needs_id,CC-BY-NC,https://www.inaturalist.org/observations/39395980,https://inaturalist-open-data.s3.amazonaws.com/photos/62494511/medium.jpeg?1583048961,,,,1,0,FALSE,,"Los Angeles County, CA, USA",San Clemente,32.86937726,-118.4314459,177,177,,,FALSE,,,,Los Angeles,California,United States,California,Los Angeles,Striatura,Striatura,,Mollusca,171814,Mollusca,Gastropoda,,Gastrodontidae,,
iNaturalist,22545156,4/11/2019 14:25,4/11/2019 0:00,4/12/2019,2019,4,12,0:25:00,300,Pacific Time (US & Canada),6971,silversea_starsong,2019-04-16 07:45:05 +0300,2021-02-26 05:56:34 +0300,needs_id,CC-BY-NC,https://www.inaturalist.org/observations/22545156,https://inaturalist-open-data.s3.amazonaws.com/photos/114035779/medium.jpeg?1614308168,,,,4,0,FALSE,,"Santa Barbara County, CA, USA",Santa Cruz,34.00377167,-119.7595833,,,,,FALSE,,,,Santa Barbara,California,United States,California,Santa Barbara,Striatura,Striatura,,Mollusca,171814,Mollusca,Gastropoda,,Gastrodontidae,,
iNaturalist,21816793,2019/03/26 10:00 AM PDT,3/26/2019 0:00,3/26/2019,2019,3,26,20:00:00,300,Pacific Time (US & Canada),12809,cedric_lee,2019-03-31 08:34:57 +0300,2020-04-24 01:35:47 +0300,needs_id,CC-BY-NC,https://www.inaturalist.org/observations/21816793,https://inaturalist-open-data.s3.amazonaws.com/photos/33795839/medium.jpeg?1554008966,,,probably Micrarionta,1,0,FALSE,,"California, US",San Clemente,32.94604852,-118.5268675,15,29039,obscured,,TRUE,,,,Los Angeles,California,United States,California,Los Angeles,Common Land Snails and Slugs,Stylommatophora,Common Land Snails and Slugs,Mollusca,47485,Mollusca,Gastropoda,,,,
iNaturalist,37914409,Thu Jan 23 2020 10:26:08 GMT-0800 (PST),1/23/2020 0:00,1/23/2020,2020,1,23,21:26:08,300,Pacific Time (US & Canada),12809,cedric_lee,2020-01-24 16:27:12 +0300,2020-02-28 01:39:37 +0300,needs_id,CC-BY-NC,https://www.inaturalist.org/observations/37914409,https://inaturalist-open-data.s3.amazonaws.com/photos/60179378/medium.jpg?1579872459,,,,0,0,FALSE,3,"Los Angeles County, US-CA, US",San Clemente,33.00179614,-118.557622,8,8,,,FALSE,,,,Los Angeles,California,United States,California,Los Angeles,,Stylommatophora,Common Land Snails and Slugs,Mollusca,47485,Mollusca,Gastropoda,,,,
iNaturalist,90432855,Sun Aug 08 2021 11:59:23 GMT-0700 (PDT),8/8/2021 0:00,8/8/2021,2021,8,8,21:59:23,300,Pacific Time (US & Canada),676484,linarose,2021-08-08 21:59:58 +0300,2021-08-08 22:00:50 +0300,needs_id,,https://www.inaturalist.org/observations/90432855,https://static.inaturalist.org/photos/149461238/medium.jpg?1628449214,,,,0,0,FALSE,3,"Santa Catalina Island, CA, US",Santa Catalina,33.42828747,-118.4954392,11,11,,,FALSE,,,,Los Angeles,California,United States,California,Los Angeles,,Stylommatophora,Common Land Snails and Slugs,Mollusca,47485,Mollusca,Gastropoda,,,,
iNaturalist,38109824,Mon Jan 27 2020 12:19:28 GMT-0800 (PST),1/27/2020 0:00,1/27/2020,2020,1,27,23:19:28,300,Pacific Time (US & Canada),12809,cedric_lee,2020-01-30 07:00:49 +0300,2021-06-11 22:30:17 +0300,needs_id,CC-BY-NC,https://www.inaturalist.org/observations/38109824,https://inaturalist-open-data.s3.amazonaws.com/photos/60521888/medium.jpg?1580356895,,,,0,0,FALSE,3,"Los Angeles County, US-CA, US",San Clemente,32.94845415,-118.5322166,12,12,,,FALSE,,,,Los Angeles,California,United States,California,Los Angeles,Succinea,Succinea,,Mollusca,92304,Mollusca,Gastropoda,Stylommatophora,Succineidae,,
iNaturalist,38194299,2020/01/26 11:19 AM PST,1/26/2020 0:00,1/26/2020,2020,1,26,22:19:00,300,Pacific Time (US & Canada),12809,cedric_lee,2020-02-02 00:32:37 +0300,2021-06-11 22:30:18 +0300,needs_id,CC-BY-NC,https://www.inaturalist.org/observations/38194299,https://inaturalist-open-data.s3.amazonaws.com/photos/60660171/medium.jpeg?1580586842,,,,0,0,FALSE,,"Los Angeles County, CA, USA",San Clemente,33.0257768,-118.5719494,31,31,,,FALSE,,,,Los Angeles,California,United States,California,Los Angeles,Succinea,Succinea,,Mollusca,92304,Mollusca,Gastropoda,Stylommatophora,Succineidae,,
iNaturalist,39583008,2/21/2020,2/21/2020 0:00,,,,,,,Pacific Time (US & Canada),12809,cedric_lee,2020-03-05 23:28:38 +0300,2021-03-09 09:46:05 +0300,needs_id,CC-BY-NC,https://www.inaturalist.org/observations/39583008,https://inaturalist-open-data.s3.amazonaws.com/photos/62811770/medium.jpeg?1583439492,,,,0,0,FALSE,,"Unnamed Road, California, USA",San Clemente,32.871,-118.448,,,,,FALSE,,,,Los Angeles,California,United States,California,Los Angeles,Succinea,Succinea,,Mollusca,92304,Mollusca,Gastropoda,Stylommatophora,Succineidae,,
iNaturalist,39583009,2/20/2020,2/20/2020 0:00,,,,,,,Pacific Time (US & Canada),12809,cedric_lee,2020-03-05 23:28:38 +0300,2021-03-09 09:46:05 +0300,needs_id,CC-BY-NC,https://www.inaturalist.org/observations/39583009,https://inaturalist-open-data.s3.amazonaws.com/photos/62811798/medium.jpeg?1583439512,,,,0,0,FALSE,,"Channel Islands, California, USA",San Clemente,33.023,-118.595,,,,,FALSE,,,,Los Angeles,California,United States,California,Los Angeles,Succinea,Succinea,,Mollusca,92304,Mollusca,Gastropoda,Stylommatophora,Succineidae,,
iNaturalist,39583010,2/26/2020,2/26/2020 0:00,,,,,,,Pacific Time (US & Canada),12809,cedric_lee,2020-03-05 23:28:38 +0300,2021-03-09 09:46:05 +0300,needs_id,CC-BY-NC,https://www.inaturalist.org/observations/39583010,https://inaturalist-open-data.s3.amazonaws.com/photos/62811834/medium.jpeg?1583439540,,,,0,0,FALSE,,"Unnamed Road, California, USA",San Clemente,32.897,-118.525,,,,,FALSE,,,,Los Angeles,California,United States,California,Los Angeles,Succinea,Succinea,,Mollusca,92304,Mollusca,Gastropoda,Stylommatophora,Succineidae,,
iNaturalist,39583011,1/31/2020,1/31/2020 0:00,,,,,,,Pacific Time (US & Canada),12809,cedric_lee,2020-03-05 23:28:42 +0300,2021-03-09 09:46:05 +0300,needs_id,CC-BY-NC,https://www.inaturalist.org/observations/39583011,https://inaturalist-open-data.s3.amazonaws.com/photos/62811855/medium.jpeg?1583439556,,,,0,0,FALSE,,"Unnamed Road, California, USA",San Clemente,32.996787,-118.549527,,,,,FALSE,,,,Los Angeles,California,United States,California,Los Angeles,Succinea,Succinea,,Mollusca,92304,Mollusca,Gastropoda,Stylommatophora,Succineidae,,
iNaturalist,39583012,2/13/2020,2/13/2020 0:00,,,,,,,Pacific Time (US & Canada),12809,cedric_lee,2020-03-05 23:28:43 +0300,2021-03-09 09:46:05 +0300,needs_id,CC-BY-NC,https://www.inaturalist.org/observations/39583012,https://inaturalist-open-data.s3.amazonaws.com/photos/62811877/medium.jpeg?1583439571,,,,0,0,FALSE,,"Unnamed Road, California, USA",San Clemente,32.887,-118.484,,,,,FALSE,,,,Los Angeles,California,United States,California,Los Angeles,Succinea,Succinea,,Mollusca,92304,Mollusca,Gastropoda,Stylommatophora,Succineidae,,
iNaturalist,39583013,2/20/2020,2/20/2020 0:00,,,,,,,Pacific Time (US & Canada),12809,cedric_lee,2020-03-05 23:28:43 +0300,2021-03-09 09:46:05 +0300,needs_id,CC-BY-NC,https://www.inaturalist.org/observations/39583013,https://inaturalist-open-data.s3.amazonaws.com/photos/62811891/medium.jpeg?1583439581,,,,0,0,FALSE,,"Channel Islands, California, USA",San Clemente,33.023,-118.595,,,,,FALSE,,,,Los Angeles,California,United States,California,Los Angeles,Succinea,Succinea,,Mollusca,92304,Mollusca,Gastropoda,Stylommatophora,Succineidae,,
iNaturalist,39583014,2/21/2020,2/21/2020 0:00,,,,,,,Pacific Time (US & Canada),12809,cedric_lee,2020-03-05 23:28:46 +0300,2021-03-09 09:46:05 +0300,needs_id,CC-BY-NC,https://www.inaturalist.org/observations/39583014,https://inaturalist-open-data.s3.amazonaws.com/photos/62811917/medium.jpeg?1583439597,,,,0,0,FALSE,,"Unnamed Road, California, USA",San Clemente,32.873,-118.447,,,,,FALSE,,,,Los Angeles,California,United States,California,Los Angeles,Succinea,Succinea,,Mollusca,92304,Mollusca,Gastropoda,Stylommatophora,Succineidae,,
iNaturalist,39583015,2/21/2020,2/21/2020 0:00,,,,,,,Pacific Time (US & Canada),12809,cedric_lee,2020-03-05 23:28:47 +0300,2021-03-09 09:46:05 +0300,needs_id,CC-BY-NC,https://www.inaturalist.org/observations/39583015,https://inaturalist-open-data.s3.amazonaws.com/photos/62811947/medium.jpeg?1583439619,,,,0,0,FALSE,,"Unnamed Road, California, USA",San Clemente,32.873,-118.447,,,,,FALSE,,,,Los Angeles,California,United States,California,Los Angeles,Succinea,Succinea,,Mollusca,92304,Mollusca,Gastropoda,Stylommatophora,Succineidae,,
iNaturalist,39583017,2/21/2020,2/21/2020 0:00,,,,,,,Pacific Time (US & Canada),12809,cedric_lee,2020-03-05 23:28:49 +0300,2021-03-09 09:46:05 +0300,needs_id,CC-BY-NC,https://www.inaturalist.org/observations/39583017,https://inaturalist-open-data.s3.amazonaws.com/photos/62811972/medium.jpeg?1583439642,,,,0,0,FALSE,,"Unnamed Road, California, USA",San Clemente,32.873,-118.447,,,,,FALSE,,,,Los Angeles,California,United States,California,Los Angeles,Succinea,Succinea,,Mollusca,92304,Mollusca,Gastropoda,Stylommatophora,Succineidae,,
iNaturalist,39583021,2/19/2020,2/19/2020 0:00,,,,,,,Pacific Time (US & Canada),12809,cedric_lee,2020-03-05 23:28:51 +0300,2021-03-09 09:46:05 +0300,needs_id,CC-BY-NC,https://www.inaturalist.org/observations/39583021,https://inaturalist-open-data.s3.amazonaws.com/photos/62811999/medium.jpeg?1583439668,,,,0,0,FALSE,,"Channel Islands, California, USA",San Clemente,33.024,-118.59,,,,,FALSE,,,,Los Angeles,California,United States,California,Los Angeles,Succinea,Succinea,,Mollusca,92304,Mollusca,Gastropoda,Stylommatophora,Succineidae,,
iNaturalist,39583022,2/20/2020,2/20/2020 0:00,,,,,,,Pacific Time (US & Canada),12809,cedric_lee,2020-03-05 23:28:51 +0300,2021-03-09 09:46:06 +0300,needs_id,CC-BY-NC,https://www.inaturalist.org/observations/39583022,https://inaturalist-open-data.s3.amazonaws.com/photos/62812019/medium.jpeg?1583439689,,,,0,0,FALSE,,"Los Angeles County, CA, USA",San Clemente,33.0214705,-118.5952141,42,42,,,FALSE,,,,Los Angeles,California,United States,California,Los Angeles,Succinea,Succinea,,Mollusca,92304,Mollusca,Gastropoda,Stylommatophora,Succineidae,,
iNaturalist,39583026,2/20/2020,2/20/2020 0:00,,,,,,,Pacific Time (US & Canada),12809,cedric_lee,2020-03-05 23:28:54 +0300,2021-03-09 09:46:06 +0300,needs_id,CC-BY-NC,https://www.inaturalist.org/observations/39583026,https://inaturalist-open-data.s3.amazonaws.com/photos/62812038/medium.jpeg?1583439705,,,,0,0,FALSE,,"Unnamed Road, California, USA",San Clemente,32.9,-118.471,,,,,FALSE,,,,Los Angeles,California,United States,California,Los Angeles,Succinea,Succinea,,Mollusca,92304,Mollusca,Gastropoda,Stylommatophora,Succineidae,,
iNaturalist,40057357,2/22/2020,2/22/2020 0:00,,,,,,,Pacific Time (US & Canada),12809,cedric_lee,2020-03-16 03:39:27 +0300,2021-03-09 09:46:06 +0300,needs_id,CC-BY-NC,https://www.inaturalist.org/observations/40057357,https://inaturalist-open-data.s3.amazonaws.com/photos/63618398/medium.jpg?1584319616,,,,0,0,FALSE,,"Unnamed Road, California, USA",San Clemente,32.901,-118.47,,,,,FALSE,,,,Los Angeles,California,United States,California,Los Angeles,Succinea,Succinea,,Mollusca,92304,Mollusca,Gastropoda,Stylommatophora,Succineidae,,
iNaturalist,40057358,2/22/2020,2/22/2020 0:00,,,,,,,Pacific Time (US & Canada),12809,cedric_lee,2020-03-16 03:39:28 +0300,2021-03-09 09:46:06 +0300,needs_id,CC-BY-NC,https://www.inaturalist.org/observations/40057358,https://inaturalist-open-data.s3.amazonaws.com/photos/63617600/medium.jpeg?1584319126,,,,0,0,FALSE,,"Unnamed Road, California, USA",San Clemente,32.898,-118.471,,,,,FALSE,,,,Los Angeles,California,United States,California,Los Angeles,Succinea,Succinea,,Mollusca,92304,Mollusca,Gastropoda,Stylommatophora,Succineidae,,
iNaturalist,40115849,1/26/2020,1/26/2020 0:00,,,,,,,Pacific Time (US & Canada),12809,cedric_lee,2020-03-17 07:19:09 +0300,2020-03-17 07:51:10 +0300,needs_id,CC-BY-NC,https://www.inaturalist.org/observations/40115849,https://inaturalist-open-data.s3.amazonaws.com/photos/63717857/medium.jpeg?1584418706,,,,0,0,FALSE,,"Unnamed Road, California, USA",San Clemente,33.025,-118.574,,,,,FALSE,,,,Los Angeles,California,United States,California,Los Angeles,Succinea,Succinea,,Mollusca,92304,Mollusca,Gastropoda,Stylommatophora,Succineidae,,
iNaturalist,40172594,1/24/2020,1/24/2020 0:00,,,,,,,Pacific Time (US & Canada),12809,cedric_lee,2020-03-18 13:16:00 +0300,2020-03-18 18:52:50 +0300,needs_id,CC-BY-NC,https://www.inaturalist.org/observations/40172594,https://inaturalist-open-data.s3.amazonaws.com/photos/63811886/medium.jpeg?1584525497,,,,1,0,FALSE,,"Unnamed Road, California, USA",San Clemente,33.001,-118.553,,,,,FALSE,,,,Los Angeles,California,United States,California,Los Angeles,Succinea,Succinea,,Mollusca,92304,Mollusca,Gastropoda,Stylommatophora,Succineidae,,
iNaturalist,40172595,1/23/2020,1/23/2020 0:00,,,,,,,Pacific Time (US & Canada),12809,cedric_lee,2020-03-18 13:16:01 +0300,2020-03-18 18:52:44 +0300,needs_id,CC-BY-NC,https://www.inaturalist.org/observations/40172595,https://inaturalist-open-data.s3.amazonaws.com/photos/63811912/medium.jpeg?1584525531,,,,1,0,FALSE,,"Unnamed Road, CA, USA",San Clemente,33.0018,-118.5559,,,,,FALSE,,,,Los Angeles,California,United States,California,Los Angeles,Succinea,Succinea,,Mollusca,92304,Mollusca,Gastropoda,Stylommatophora,Succineidae,,
iNaturalist,40172596,2/8/2020,2/8/2020 0:00,,,,,,,Pacific Time (US & Canada),12809,cedric_lee,2020-03-18 13:16:01 +0300,2020-03-18 18:52:38 +0300,needs_id,CC-BY-NC,https://www.inaturalist.org/observations/40172596,https://inaturalist-open-data.s3.amazonaws.com/photos/63811925/medium.jpeg?1584525554,,,,1,0,FALSE,,"Unnamed Road, California, USA",San Clemente,33.0195,-118.573,,,,,FALSE,,,,Los Angeles,California,United States,California,Los Angeles,Succinea,Succinea,,Mollusca,92304,Mollusca,Gastropoda,Stylommatophora,Succineidae,,
iNaturalist,40172597,2/20/2020,2/20/2020 0:00,,,,,,,Pacific Time (US & Canada),12809,cedric_lee,2020-03-18 13:16:04 +0300,2020-03-18 18:52:33 +0300,needs_id,CC-BY-NC,https://www.inaturalist.org/observations/40172597,https://inaturalist-open-data.s3.amazonaws.com/photos/63811948/medium.jpeg?1584525588,,,,1,0,FALSE,,"Unnamed Road, California, USA",San Clemente,33.028,-118.602,,,,,FALSE,,,,Los Angeles,California,United States,California,Los Angeles,Succinea,Succinea,,Mollusca,92304,Mollusca,Gastropoda,Stylommatophora,Succineidae,,
iNaturalist,40172598,1/31/2020,1/31/2020 0:00,,,,,,,Pacific Time (US & Canada),12809,cedric_lee,2020-03-18 13:16:04 +0300,2021-01-13 08:48:11 +0300,needs_id,CC-BY-NC,https://www.inaturalist.org/observations/40172598,https://inaturalist-open-data.s3.amazonaws.com/photos/63811968/medium.jpeg?1584525623,,,,2,0,FALSE,,"Unnamed Road, California, USA",San Clemente,32.997,-118.549,,,,,FALSE,,,,Los Angeles,California,United States,California,Los Angeles,Succinea,Succinea,,Mollusca,92304,Mollusca,Gastropoda,Stylommatophora,Succineidae,,
iNaturalist,40172599,2/7/2020,2/7/2020 0:00,,,,,,,Pacific Time (US & Canada),12809,cedric_lee,2020-03-18 13:16:04 +0300,2020-03-18 18:52:21 +0300,needs_id,CC-BY-NC,https://www.inaturalist.org/observations/40172599,https://inaturalist-open-data.s3.amazonaws.com/photos/63811981/medium.jpeg?1584525650,,,,1,0,FALSE,,"Unnamed Road, California, USA",San Clemente,33.001,-118.567,,,,,FALSE,,,,Los Angeles,California,United States,California,Los Angeles,Succinea,Succinea,,Mollusca,92304,Mollusca,Gastropoda,Stylommatophora,Succineidae,,
iNaturalist,40172603,1/28/2020,1/28/2020 0:00,,,,,,,Pacific Time (US & Canada),12809,cedric_lee,2020-03-18 13:16:08 +0300,2020-03-18 18:52:16 +0300,needs_id,CC-BY-NC,https://www.inaturalist.org/observations/40172603,https://inaturalist-open-data.s3.amazonaws.com/photos/63811996/medium.jpeg?1584525681,,,,1,0,FALSE,,"Unnamed Road, California, USA",San Clemente,32.947,-118.535,,,,,FALSE,,,,Los Angeles,California,United States,California,Los Angeles,Succinea,Succinea,,Mollusca,92304,Mollusca,Gastropoda,Stylommatophora,Succineidae,,
iNaturalist,40172604,2/7/2020,2/7/2020 0:00,,,,,,,Pacific Time (US & Canada),12809,cedric_lee,2020-03-18 13:16:08 +0300,2020-03-18 18:52:11 +0300,needs_id,CC-BY-NC,https://www.inaturalist.org/observations/40172604,https://inaturalist-open-data.s3.amazonaws.com/photos/63812013/medium.jpeg?1584525712,,,,1,0,FALSE,,"Channel Islands, California, USA",San Clemente,33.0214,-118.5798,,,,,FALSE,,,,Los Angeles,California,United States,California,Los Angeles,Succinea,Succinea,,Mollusca,92304,Mollusca,Gastropoda,Stylommatophora,Succineidae,,
iNaturalist,40172605,2/26/2020,2/26/2020 0:00,,,,,,,Pacific Time (US & Canada),12809,cedric_lee,2020-03-18 13:16:08 +0300,2020-03-18 18:52:06 +0300,needs_id,CC-BY-NC,https://www.inaturalist.org/observations/40172605,https://inaturalist-open-data.s3.amazonaws.com/photos/63812030/medium.jpeg?1584525744,,,,1,0,FALSE,,"Unnamed Road, California, USA",San Clemente,32.897,-118.525,,,,,FALSE,,,,Los Angeles,California,United States,California,Los Angeles,Succinea,Succinea,,Mollusca,92304,Mollusca,Gastropoda,Stylommatophora,Succineidae,,
iNaturalist,40172606,2/26/2020,2/26/2020 0:00,,,,,,,Pacific Time (US & Canada),12809,cedric_lee,2020-03-18 13:16:11 +0300,2020-03-18 18:52:01 +0300,needs_id,CC-BY-NC,https://www.inaturalist.org/observations/40172606,https://inaturalist-open-data.s3.amazonaws.com/photos/63812042/medium.jpeg?1584525767,,,,1,0,FALSE,,"Unnamed Road, California, USA",San Clemente,32.897,-118.525,,,,,FALSE,,,,Los Angeles,California,United States,California,Los Angeles,Succinea,Succinea,,Mollusca,92304,Mollusca,Gastropoda,Stylommatophora,Succineidae,,
iNaturalist,40172607,2/21/2020,2/21/2020 0:00,,,,,,,Pacific Time (US & Canada),12809,cedric_lee,2020-03-18 13:16:11 +0300,2020-03-18 18:51:55 +0300,needs_id,CC-BY-NC,https://www.inaturalist.org/observations/40172607,https://inaturalist-open-data.s3.amazonaws.com/photos/63812062/medium.jpeg?1584525799,,,,1,0,FALSE,,"Unnamed Road, California, USA",San Clemente,32.873,-118.447,,,,,FALSE,,,,Los Angeles,California,United States,California,Los Angeles,Succinea,Succinea,,Mollusca,92304,Mollusca,Gastropoda,Stylommatophora,Succineidae,,
iNaturalist,40172608,2/22/2020,2/22/2020 0:00,,,,,,,Pacific Time (US & Canada),12809,cedric_lee,2020-03-18 13:16:11 +0300,2020-03-18 18:51:48 +0300,needs_id,CC-BY-NC,https://www.inaturalist.org/observations/40172608,https://inaturalist-open-data.s3.amazonaws.com/photos/63812080/medium.jpeg?1584525830,,,,1,0,FALSE,,"Unnamed Road, California, USA",San Clemente,32.901,-118.47,,,,,FALSE,,,,Los Angeles,California,United States,California,Los Angeles,Succinea,Succinea,,Mollusca,92304,Mollusca,Gastropoda,Stylommatophora,Succineidae,,
iNaturalist,20345443,Tue Feb 05 2019 11:02:29 GMT-0800 (PST),2/5/2019 0:00,2/5/2019,2019,2,5,22:02:29,300,Pacific Time (US & Canada),1474963,stephlbartlett,2019-02-14 19:50:18 +0300,2020-02-27 21:33:50 +0300,needs_id,CC-BY-NC,https://www.inaturalist.org/observations/20345443,https://inaturalist-open-data.s3.amazonaws.com/photos/31415432/medium.jpg?1550163023,,,,2,0,FALSE,3,"San Clemente Island Underwater Range, , CA, US",San Clemente,32.918764,-118.540278,200,200,,,FALSE,,,,Los Angeles,California,United States,California,Los Angeles,Amber Snails,Succineidae,Amber Snails,Mollusca,86090,Mollusca,Gastropoda,Stylommatophora,Succineidae,,
iNaturalist,20368154,Fri Feb 15 2019 08:19:36 GMT-0800 (PST),2/15/2019 0:00,2/15/2019,2019,2,15,19:19:36,300,Pacific Time (US & Canada),266196,shrike2,2019-02-15 21:50:11 +0300,2020-02-25 00:38:47 +0300,needs_id,CC-BY-NC-ND,https://www.inaturalist.org/observations/20368154,https://static.inaturalist.org/photos/31452316/medium.jpg?1550256656,,,,3,0,FALSE,3,"San Clemente Island Underwater Range, , CA, US",San Clemente,33.00215185,-118.5562581,5,5,,,FALSE,,,,Los Angeles,California,United States,California,Los Angeles,Amber Snails,Succineidae,Amber Snails,Mollusca,86090,Mollusca,Gastropoda,Stylommatophora,Succineidae,,
iNaturalist,20368432,Fri Feb 15 2019 08:37:59 GMT-0800 (PST),2/15/2019 0:00,2/15/2019,2019,2,15,19:37:59,300,Pacific Time (US & Canada),266196,shrike2,2019-02-15 22:03:42 +0300,2020-02-25 00:38:56 +0300,needs_id,CC-BY-NC-ND,https://www.inaturalist.org/observations/20368432,https://static.inaturalist.org/photos/31452731/medium.jpg?1550257471,,,,3,0,FALSE,3,"San Clemente Island Underwater Range, , CA, US",San Clemente,33.00220567,-118.5563442,19,19,,,FALSE,,,,Los Angeles,California,United States,California,Los Angeles,Amber Snails,Succineidae,Amber Snails,Mollusca,86090,Mollusca,Gastropoda,Stylommatophora,Succineidae,,
iNaturalist,20464491,Mon Feb 18 2019 09:42:52 GMT-0800 (PST),2/18/2019 0:00,2/18/2019,2019,2,18,20:42:52,300,Pacific Time (US & Canada),1474963,stephlbartlett,2019-02-19 00:28:58 +0300,2020-02-27 21:33:14 +0300,needs_id,CC-BY-NC,https://www.inaturalist.org/observations/20464491,https://inaturalist-open-data.s3.amazonaws.com/photos/31589012/medium.jpg?1550525341,,,,3,0,FALSE,3,"San Clemente Island Underwater Range, , CA, US",San Clemente,32.91413833,-118.4846883,5,5,,,FALSE,,,,Los Angeles,California,United States,California,Los Angeles,Amber Snails,Succineidae,Amber Snails,Mollusca,86090,Mollusca,Gastropoda,Stylommatophora,Succineidae,,
iNaturalist,21094598,Sat Mar 09 2019 13:58:51 GMT-0800 (PST),3/9/2019 0:00,3/10/2019,2019,3,10,0:58:51,300,Pacific Time (US & Canada),266196,shrike2,2019-03-10 02:22:27 +0300,2020-02-25 00:39:35 +0300,needs_id,CC-BY-NC-ND,https://www.inaturalist.org/observations/21094598,https://static.inaturalist.org/photos/32599202/medium.jpg?1552173770,,,,2,0,FALSE,3,"Los Angeles County, US-CA, US",San Clemente,32.86756434,-118.4567121,5,5,,,FALSE,,,,Los Angeles,California,United States,California,Los Angeles,Amber Snails,Succineidae,Amber Snails,Mollusca,86090,Mollusca,Gastropoda,Stylommatophora,Succineidae,,
iNaturalist,21230937,2019-03-06 3:06:41 PM PST,3/6/2019 0:00,3/7/2019,2019,3,7,2:06:41,300,Pacific Time (US & Canada),34488,pileated,2019-03-14 18:27:31 +0300,2020-04-23 21:20:33 +0300,needs_id,CC-BY,https://www.inaturalist.org/observations/21230937,https://inaturalist-open-data.s3.amazonaws.com/photos/32820679/medium.jpg?1552577252,,,,2,0,FALSE,2,"Los Angeles County, US-CA, US",San Clemente,32.99835968,-118.5529099,,,,,FALSE,gps,gps,,Los Angeles,California,United States,California,Los Angeles,Amber Snails,Succineidae,Amber Snails,Mollusca,86090,Mollusca,Gastropoda,Stylommatophora,Succineidae,,
iNaturalist,21350803,2019-03-06 4:10:47 PM PST,3/6/2019 0:00,,,,,,,Pacific Time (US & Canada),34488,pileated,2019-03-18 09:05:35 +0300,2020-04-23 21:20:57 +0300,needs_id,CC-BY,https://www.inaturalist.org/observations/21350803,https://inaturalist-open-data.s3.amazonaws.com/photos/33022449/medium.jpg?1552889137,,,,1,0,FALSE,2,"Unnamed Road, California, USA",San Clemente,33.00235773,-118.5543435,176,176,,,FALSE,gps,gps,,Los Angeles,California,United States,California,Los Angeles,Amber Snails,Succineidae,Amber Snails,Mollusca,86090,Mollusca,Gastropoda,Stylommatophora,Succineidae,,
iNaturalist,21769753,3/22/2019,3/22/2019 0:00,,,,,,,Pacific Time (US & Canada),12809,cedric_lee,2019-03-30 10:37:29 +0300,2020-04-24 02:03:30 +0300,needs_id,CC-BY-NC,https://www.inaturalist.org/observations/21769753,https://inaturalist-open-data.s3.amazonaws.com/photos/33713950/medium.jpeg?1553921528,,,,0,0,FALSE,,"Los Angeles County, US-CA, US",San Clemente,32.92108939,-118.5538596,,29039,obscured,,TRUE,,,,Los Angeles,California,United States,California,Los Angeles,Amber Snails,Succineidae,Amber Snails,Mollusca,86090,Mollusca,Gastropoda,Stylommatophora,Succineidae,,
iNaturalist,21823960,2019/03/27 8:01 AM PDT,3/27/2019 0:00,3/27/2019,2019,3,27,18:01:00,300,Pacific Time (US & Canada),12809,cedric_lee,2019-03-31 16:19:49 +0300,2020-04-24 01:28:54 +0300,needs_id,CC-BY-NC,https://www.inaturalist.org/observations/21823960,https://inaturalist-open-data.s3.amazonaws.com/photos/33807986/medium.jpeg?1554036099,,,,2,0,FALSE,,"California, US",San Clemente,32.98180384,-118.5290765,,29039,obscured,,TRUE,,,,Los Angeles,California,United States,California,Los Angeles,Amber Snails,Succineidae,Amber Snails,Mollusca,86090,Mollusca,Gastropoda,Stylommatophora,Succineidae,,
iNaturalist,21824720,2019/03/27 9:51 AM PDT,3/27/2019 0:00,3/27/2019,2019,3,27,19:51:00,300,Pacific Time (US & Canada),12809,cedric_lee,2019-03-31 16:44:12 +0300,2020-04-24 01:27:36 +0300,needs_id,CC-BY-NC,https://www.inaturalist.org/observations/21824720,https://inaturalist-open-data.s3.amazonaws.com/photos/33810331/medium.jpeg?1554039252,,,,2,0,FALSE,,"California, US",San Clemente,32.95766398,-118.586052,,29039,obscured,,TRUE,,,,Los Angeles,California,United States,California,Los Angeles,Amber Snails,Succineidae,Amber Snails,Mollusca,86090,Mollusca,Gastropoda,Stylommatophora,Succineidae,,
iNaturalist,21825519,2019/03/27 11:07 AM PDT,3/27/2019 0:00,3/27/2019,2019,3,27,21:07:00,300,Pacific Time (US & Canada),12809,cedric_lee,2019-03-31 17:16:53 +0300,2020-04-24 01:26:15 +0300,needs_id,CC-BY-NC,https://www.inaturalist.org/observations/21825519,https://inaturalist-open-data.s3.amazonaws.com/photos/33810932/medium.jpeg?1554040142,,,,2,0,FALSE,,"California, US",San Clemente,32.98417852,-118.5803469,,29039,obscured,,TRUE,,,,Los Angeles,California,United States,California,Los Angeles,Amber Snails,Succineidae,Amber Snails,Mollusca,86090,Mollusca,Gastropoda,Stylommatophora,Succineidae,,
iNaturalist,21908487,2019/03/28 12:28 PM PDT,3/28/2019 0:00,3/28/2019,2019,3,28,22:28:00,300,Pacific Time (US & Canada),12809,cedric_lee,2019-04-02 17:09:13 +0300,2021-06-11 22:25:35 +0300,needs_id,CC-BY-NC,https://www.inaturalist.org/observations/21908487,https://inaturalist-open-data.s3.amazonaws.com/photos/33947472/medium.jpeg?1554213017,,,,1,0,FALSE,,"California, US",San Clemente,32.90968793,-118.5290257,,29039,obscured,,TRUE,,,,Los Angeles,California,United States,California,Los Angeles,Amber Snails,Succineidae,Amber Snails,Mollusca,86090,Mollusca,Gastropoda,Stylommatophora,Succineidae,,
iNaturalist,22868923,2019-04-11 6:49:26 PM PDT,4/11/2019 0:00,4/12/2019,2019,4,12,4:49:26,300,Pacific Time (US & Canada),34488,pileated,2019-04-22 09:19:05 +0300,2020-04-23 21:20:54 +0300,needs_id,CC-BY,https://www.inaturalist.org/observations/22868923,https://inaturalist-open-data.s3.amazonaws.com/photos/35448445/medium.jpg?1555913947,,,,3,0,FALSE,2,"Los Angeles County, US-CA, US",San Clemente,32.87900826,-118.4590366,88,88,,,FALSE,gps,gps,,Los Angeles,California,United States,California,Los Angeles,Amber Snails,Succineidae,Amber Snails,Mollusca,86090,Mollusca,Gastropoda,Stylommatophora,Succineidae,,
iNaturalist,23532269,Sat Apr 27 2019 09:22:55 GMT-0700 (PDT),4/27/2019 0:00,4/27/2019,2019,4,27,19:22:55,300,Pacific Time (US & Canada),1474963,stephlbartlett,2019-04-28 04:28:46 +0300,2020-02-27 21:24:36 +0300,needs_id,CC-BY-NC,https://www.inaturalist.org/observations/23532269,https://inaturalist-open-data.s3.amazonaws.com/photos/36438303/medium.jpg?1556414932,,,,2,0,FALSE,3,"San Clemente Island Underwater Range, , CA, US",San Clemente,32.82132167,-118.3670717,5,5,,,FALSE,,,,Los Angeles,California,United States,California,Los Angeles,Amber Snails,Succineidae,Amber Snails,Mollusca,86090,Mollusca,Gastropoda,Stylommatophora,Succineidae,,
iNaturalist,24087456,Mon Apr 29 2019 16:23:32 GMT-0700 (PDT),4/29/2019 0:00,4/30/2019,2019,4,30,2:23:32,300,Pacific Time (US & Canada),213838,vireolanius,2019-04-30 03:52:55 +0300,2020-02-27 20:33:19 +0300,needs_id,CC-BY-NC,https://www.inaturalist.org/observations/24087456,https://inaturalist-open-data.s3.amazonaws.com/photos/37250435/medium.jpg?1556585597,,,,3,0,FALSE,3,"Los Angeles County, US-CA, US",San Clemente,33.00104485,-118.5584221,5,5,,,FALSE,,,,Los Angeles,California,United States,California,Los Angeles,Amber Snails,Succineidae,Amber Snails,Mollusca,86090,Mollusca,Gastropoda,Stylommatophora,Succineidae,,
iNaturalist,24088761,Mon Apr 29 2019 16:23:52 GMT-0700 (PDT),4/29/2019 0:00,4/30/2019,2019,4,30,2:23:52,300,Pacific Time (US & Canada),266196,shrike2,2019-04-30 03:57:49 +0300,2020-02-25 00:38:10 +0300,needs_id,CC-BY-NC-ND,https://www.inaturalist.org/observations/24088761,https://static.inaturalist.org/photos/37254532/medium.jpg?1556586153,,,,3,0,FALSE,3,"San Clemente Island Underwater Range, , CA, US",San Clemente,33.00227385,-118.5563814,5,5,,,FALSE,,,,Los Angeles,California,United States,California,Los Angeles,Amber Snails,Succineidae,Amber Snails,Mollusca,86090,Mollusca,Gastropoda,Stylommatophora,Succineidae,,
iNaturalist,26525336,2019-05-30 7:50:08 AM PDT,5/30/2019 0:00,5/30/2019,2019,5,30,17:50:08,300,Pacific Time (US & Canada),34488,pileated,2019-06-07 03:33:12 +0300,2020-04-23 21:06:50 +0300,needs_id,CC-BY,https://www.inaturalist.org/observations/26525336,https://inaturalist-open-data.s3.amazonaws.com/photos/41195780/medium.jpg?1559867594,,,,1,0,FALSE,2,"Los Angeles County, US-CA, US",San Clemente,33.00135187,-118.5557012,9,9,,,FALSE,,,,Los Angeles,California,United States,California,Los Angeles,Ambersnails,Succineidae,Amber Snails,Mollusca,86090,Mollusca,Gastropoda,Stylommatophora,Succineidae,,
iNaturalist,27893431,Sat Jun 29 2019 10:27:51 GMT-0700 (PDT),6/29/2019 0:00,6/29/2019,2019,6,29,20:27:51,300,Pacific Time (US & Canada),266196,shrike2,2019-06-30 00:30:01 +0300,2020-02-25 00:39:38 +0300,needs_id,CC-BY-NC-ND,https://www.inaturalist.org/observations/27893431,https://static.inaturalist.org/photos/43444183/medium.jpg?1561843859,,,,1,0,FALSE,3,"Los Angeles County, US-CA, US",San Clemente,32.88510745,-118.4902739,10,10,,,FALSE,,,,Los Angeles,California,United States,California,Los Angeles,Ambersnails,Succineidae,Amber Snails,Mollusca,86090,Mollusca,Gastropoda,Stylommatophora,Succineidae,,
iNaturalist,27893481,Sat Jun 29 2019 10:33:50 GMT-0700 (PDT),6/29/2019 0:00,6/29/2019,2019,6,29,20:33:50,300,Pacific Time (US & Canada),266196,shrike2,2019-06-30 00:31:07 +0300,2020-02-25 00:39:38 +0300,needs_id,CC-BY-NC-ND,https://www.inaturalist.org/observations/27893481,https://static.inaturalist.org/photos/43444198/medium.jpg?1561843877,,,,1,0,FALSE,3,"Los Angeles County, US-CA, US",San Clemente,32.88510703,-118.4902386,10,10,,,FALSE,,,,Los Angeles,California,United States,California,Los Angeles,Ambersnails,Succineidae,Amber Snails,Mollusca,86090,Mollusca,Gastropoda,Stylommatophora,Succineidae,,
iNaturalist,37503752,Sat Jan 11 2020 09:14:17 GMT-0800 (PST),1/11/2020 0:00,1/11/2020,2020,1,11,20:14:17,300,Pacific Time (US & Canada),266196,shrike2,2020-01-12 03:08:07 +0300,2020-02-25 00:39:42 +0300,needs_id,CC-BY-NC-ND,https://www.inaturalist.org/observations/37503752,https://static.inaturalist.org/photos/59465016/medium.jpg?1578787707,,,,2,0,FALSE,3,"Los Angeles County, US-CA, US",San Clemente,32.97623693,-118.5530572,5,5,,,FALSE,,,,Los Angeles,California,United States,California,Los Angeles,Amber Snails,Succineidae,Amber Snails,Mollusca,86090,Mollusca,Gastropoda,Stylommatophora,Succineidae,,
iNaturalist,37576115,Mon Jan 13 2020 12:03:26 GMT-0800 (PST),1/13/2020 0:00,1/13/2020,2020,1,13,23:03:26,300,Pacific Time (US & Canada),12809,cedric_lee,2020-01-14 06:13:37 +0300,2020-02-25 00:30:00 +0300,needs_id,CC-BY-NC,https://www.inaturalist.org/observations/37576115,https://inaturalist-open-data.s3.amazonaws.com/photos/59594424/medium.jpg?1578971658,,,,1,0,FALSE,3,"Los Angeles County, US-CA, US",San Clemente,32.94829861,-118.5214203,28,28,,,FALSE,,,,Los Angeles,California,United States,California,Los Angeles,,Succineidae,Amber Snails,Mollusca,86090,Mollusca,Gastropoda,Stylommatophora,Succineidae,,
iNaturalist,37914450,Thu Jan 23 2020 11:23:20 GMT-0800 (PST),1/23/2020 0:00,1/23/2020,2020,1,23,22:23:20,300,Pacific Time (US & Canada),12809,cedric_lee,2020-01-24 16:28:51 +0300,2020-02-25 00:30:03 +0300,needs_id,CC-BY-NC,https://www.inaturalist.org/observations/37914450,https://inaturalist-open-data.s3.amazonaws.com/photos/60179996/medium.jpg?1579873598,,,,0,0,FALSE,3,"Los Angeles County, US-CA, US",San Clemente,33.00185913,-118.556397,7,7,,,FALSE,,,,Los Angeles,California,United States,California,Los Angeles,,Succineidae,Amber Snails,Mollusca,86090,Mollusca,Gastropoda,Stylommatophora,Succineidae,,
iNaturalist,37914451,Thu Jan 23 2020 13:00:10 GMT-0800 (PST),1/23/2020 0:00,1/24/2020,2020,1,24,0:00:10,300,Pacific Time (US & Canada),12809,cedric_lee,2020-01-24 16:28:58 +0300,2020-02-25 00:30:03 +0300,needs_id,CC-BY-NC,https://www.inaturalist.org/observations/37914451,https://inaturalist-open-data.s3.amazonaws.com/photos/60179446/medium.jpg?1579872561,,,,0,0,FALSE,3,"Los Angeles County, US-CA, US",San Clemente,33.00183351,-118.5560037,6,6,,,FALSE,,,,Los Angeles,California,United States,California,Los Angeles,,Succineidae,Amber Snails,Mollusca,86090,Mollusca,Gastropoda,Stylommatophora,Succineidae,,
iNaturalist,37935489,Fri Jan 24 2020 17:05:04 GMT-0800 (PST),1/24/2020 0:00,1/25/2020,2020,1,25,4:05:04,300,Pacific Time (US & Canada),12809,cedric_lee,2020-01-25 05:56:39 +0300,2020-02-25 00:30:04 +0300,needs_id,CC-BY-NC,https://www.inaturalist.org/observations/37935489,https://inaturalist-open-data.s3.amazonaws.com/photos/60304650/medium.jpg?1580047803,,,,0,0,FALSE,3,"Los Angeles County, US-CA, US",San Clemente,32.99677485,-118.5577753,25,25,,,FALSE,,,,Los Angeles,California,United States,California,Los Angeles,,Succineidae,Amber Snails,Mollusca,86090,Mollusca,Gastropoda,Stylommatophora,Succineidae,,
iNaturalist,38194340,2020/01/29 8:21 PM PST,1/29/2020 0:00,1/30/2020,2020,1,30,7:21:00,300,Pacific Time (US & Canada),12809,cedric_lee,2020-02-02 00:33:18 +0300,2021-03-09 09:45:57 +0300,needs_id,CC-BY-NC,https://www.inaturalist.org/observations/38194340,https://inaturalist-open-data.s3.amazonaws.com/photos/60661547/medium.jpeg?1580588224,,,,0,0,FALSE,,"Los Angeles, California, United States",San Clemente,32.99509167,-118.5574417,,,,,FALSE,,,,Los Angeles,California,United States,California,Los Angeles,Amber Snails,Succineidae,Amber Snails,Mollusca,86090,Mollusca,Gastropoda,Stylommatophora,Succineidae,,
iNaturalist,38779428,Thu Feb 06 2020 16:37:15 GMT-0800 (PST),2/6/2020 0:00,2/7/2020,2020,2,7,3:37:15,300,Pacific Time (US & Canada),12809,cedric_lee,2020-02-18 04:45:21 +0300,2021-03-09 09:46:01 +0300,needs_id,CC-BY-NC,https://www.inaturalist.org/observations/38779428,https://inaturalist-open-data.s3.amazonaws.com/photos/61686600/medium.jpg?1581990334,,,,0,0,FALSE,3,"Los Angeles County, US-CA, US",San Clemente,32.99844415,-118.5589642,10,10,,,FALSE,,,,Los Angeles,California,United States,California,Los Angeles,,Succineidae,Amber Snails,Mollusca,86090,Mollusca,Gastropoda,Stylommatophora,Succineidae,,
iNaturalist,38870542,Wed Feb 19 2020 11:58:47 GMT-0800 (PST),2/19/2020 0:00,2/19/2020,2020,2,19,22:58:47,300,Pacific Time (US & Canada),12809,cedric_lee,2020-02-20 05:30:19 +0300,2021-03-09 09:46:03 +0300,needs_id,CC-BY-NC,https://www.inaturalist.org/observations/38870542,https://inaturalist-open-data.s3.amazonaws.com/photos/61871189/medium.jpg?1582252984,,,,0,0,FALSE,3,"Los Angeles County, US-CA, US",San Clemente,33.0246585,-118.5901969,10,10,,,FALSE,,,,Los Angeles,California,United States,California,Los Angeles,,Succineidae,Amber Snails,Mollusca,86090,Mollusca,Gastropoda,Stylommatophora,Succineidae,,
iNaturalist,38906594,Thu Feb 20 2020 09:35:21 GMT-0800 (PST),2/20/2020 0:00,2/20/2020,2020,2,20,20:35:21,300,Pacific Time (US & Canada),266196,shrike2,2020-02-20 20:37:12 +0300,2020-02-25 00:39:45 +0300,needs_id,CC-BY-NC-ND,https://www.inaturalist.org/observations/38906594,https://static.inaturalist.org/photos/61842816/medium.jpg?1582220239,,,,0,0,FALSE,3,"San Clemente Island Underwater Range, CA, US",San Clemente,33.02238333,-118.6003633,5,5,,,FALSE,,,,Los Angeles,California,United States,California,Los Angeles,Amber Snails,Succineidae,Amber Snails,Mollusca,86090,Mollusca,Gastropoda,Stylommatophora,Succineidae,,
iNaturalist,38908621,Thu Feb 20 2020 09:46:05 GMT-0800 (PST),2/20/2020 0:00,2/20/2020,2020,2,20,20:46:05,300,Pacific Time (US & Canada),266196,shrike2,2020-02-20 20:53:00 +0300,2020-02-25 00:39:46 +0300,needs_id,CC-BY-NC-ND,https://www.inaturalist.org/observations/38908621,https://static.inaturalist.org/photos/61843653/medium.jpg?1582221270,,,,0,0,FALSE,3,"San Clemente Island Underwater Range, CA, US",San Clemente,33.02246413,-118.6005018,10,10,,,FALSE,,,,Los Angeles,California,United States,California,Los Angeles,Amber Snails,Succineidae,Amber Snails,Mollusca,86090,Mollusca,Gastropoda,Stylommatophora,Succineidae,,
iNaturalist,38941544,Thu Feb 20 2020 09:38:33 GMT-0800 (PST),2/20/2020 0:00,2/20/2020,2020,2,20,20:38:33,300,Pacific Time (US & Canada),266196,shrike2,2020-02-21 03:25:23 +0300,2020-02-25 00:39:17 +0300,needs_id,CC-BY-NC-ND,https://www.inaturalist.org/observations/38941544,https://static.inaturalist.org/photos/61864080/medium.jpg?1582244745,,,,0,0,FALSE,3,"San Clemente Island Underwater Range, CA, US",San Clemente,33.02248232,-118.6003833,5,5,,,FALSE,,,,Los Angeles,California,United States,California,Los Angeles,Amber Snails,Succineidae,Amber Snails,Mollusca,86090,Mollusca,Gastropoda,Stylommatophora,Succineidae,,
iNaturalist,39389300,2020/02/22 2:29 PM PST,2/22/2020 0:00,2/23/2020,2020,2,23,1:29:00,300,Pacific Time (US & Canada),12809,cedric_lee,2020-03-01 07:58:04 +0300,2020-03-01 09:52:59 +0300,needs_id,CC-BY-NC,https://www.inaturalist.org/observations/39389300,https://inaturalist-open-data.s3.amazonaws.com/photos/62481695/medium.jpeg?1583037094,,,,0,0,FALSE,,"Los Angeles, California, United States",San Clemente,32.90056167,-118.4720767,,,,,FALSE,,,,Los Angeles,California,United States,California,Los Angeles,Amber Snails,Succineidae,Amber Snails,Mollusca,86090,Mollusca,Gastropoda,Stylommatophora,Succineidae,,
iNaturalist,39716858,Sun Mar 08 2020 11:53:27 GMT-0700 (PDT),3/8/2020 0:00,3/8/2020,2020,3,8,21:53:27,300,Pacific Time (US & Canada),266196,shrike2,2020-03-08 23:12:02 +0300,2020-03-09 19:49:33 +0300,needs_id,CC-BY-NC-ND,https://www.inaturalist.org/observations/39716858,https://static.inaturalist.org/photos/63038366/medium.jpg?1583698357,,,,0,0,FALSE,3,"Los Angeles County, US-CA, US",San Clemente,32.90499042,-118.4750414,5,5,,,FALSE,,,,Los Angeles,California,United States,California,Los Angeles,Amber Snails,Succineidae,Amber Snails,Mollusca,86090,Mollusca,Gastropoda,Stylommatophora,Succineidae,,
iNaturalist,39716896,Sun Mar 08 2020 11:54:56 GMT-0700 (PDT),3/8/2020 0:00,3/8/2020,2020,3,8,21:54:56,300,Pacific Time (US & Canada),266196,shrike2,2020-03-08 23:12:44 +0300,2020-03-09 19:49:29 +0300,needs_id,CC-BY-NC-ND,https://www.inaturalist.org/observations/39716896,https://static.inaturalist.org/photos/63038392/medium.jpg?1583698372,,,,0,0,FALSE,3,"Los Angeles County, US-CA, US",San Clemente,32.90504729,-118.4748601,10,10,,,FALSE,,,,Los Angeles,California,United States,California,Los Angeles,Amber Snails,Succineidae,Amber Snails,Mollusca,86090,Mollusca,Gastropoda,Stylommatophora,Succineidae,,
iNaturalist,39901384,Thu Mar 12 2020 13:33:08 GMT-0700 (PDT),3/12/2020 0:00,3/12/2020,2020,3,12,23:33:08,300,Pacific Time (US & Canada),266196,shrike2,2020-03-13 01:21:29 +0300,2020-03-13 01:21:53 +0300,needs_id,CC-BY-NC-ND,https://www.inaturalist.org/observations/39901384,https://static.inaturalist.org/photos/63351949/medium.jpg?1584051696,,,,0,0,FALSE,3,"Los Angeles County, US-CA, US",San Clemente,32.83617,-118.3798833,,,,,FALSE,,,,Los Angeles,California,United States,California,Los Angeles,,Succineidae,Amber Snails,Mollusca,86090,Mollusca,Gastropoda,Stylommatophora,Succineidae,,
iNaturalist,39901393,Thu Mar 12 2020 13:32:19 GMT-0700 (PDT),3/12/2020 0:00,3/12/2020,2020,3,12,23:32:19,300,Pacific Time (US & Canada),266196,shrike2,2020-03-13 01:21:57 +0300,2020-03-13 01:22:35 +0300,needs_id,CC-BY-NC-ND,https://www.inaturalist.org/observations/39901393,https://static.inaturalist.org/photos/63351985/medium.jpg?1584051737,,,,0,0,FALSE,3,"Los Angeles County, US-CA, US",San Clemente,32.83618,-118.3799133,,,,,FALSE,,,,Los Angeles,California,United States,California,Los Angeles,,Succineidae,Amber Snails,Mollusca,86090,Mollusca,Gastropoda,Stylommatophora,Succineidae,,
iNaturalist,40677851,2020/02/20 9:35 AM PST,2/20/2020 0:00,2/20/2020,2020,2,20,20:35:00,300,Pacific Time (US & Canada),266196,shrike2,2020-03-25 06:44:43 +0300,2020-03-25 07:10:18 +0300,needs_id,CC-BY-NC-ND,https://www.inaturalist.org/observations/40677851,https://static.inaturalist.org/photos/64481446/medium.jpeg?1585107433,,,,1,0,FALSE,,"Los Angeles, California, United States",San Clemente,33.02238333,-118.6003639,5,5,,,FALSE,,,,Los Angeles,California,United States,California,Los Angeles,Amber Snails,Succineidae,Amber Snails,Mollusca,86090,Mollusca,Gastropoda,Stylommatophora,Succineidae,,
iNaturalist,40677855,2020/02/20 9:38 AM PST,2/20/2020 0:00,2/20/2020,2020,2,20,20:38:00,300,Pacific Time (US & Canada),266196,shrike2,2020-03-25 06:44:47 +0300,2020-03-25 07:10:10 +0300,needs_id,CC-BY-NC-ND,https://www.inaturalist.org/observations/40677855,https://static.inaturalist.org/photos/64481449/medium.jpg?1585107436,,,,1,0,FALSE,,"Los Angeles, California, United States",San Clemente,33.02248333,-118.6003806,50,50,,,FALSE,,,,Los Angeles,California,United States,California,Los Angeles,Amber Snails,Succineidae,Amber Snails,Mollusca,86090,Mollusca,Gastropoda,Stylommatophora,Succineidae,,
iNaturalist,40677856,2020/02/20 9:46 AM PST,2/20/2020 0:00,2/20/2020,2020,2,20,20:46:00,300,Pacific Time (US & Canada),266196,shrike2,2020-03-25 06:44:47 +0300,2020-03-25 07:10:00 +0300,needs_id,CC-BY-NC-ND,https://www.inaturalist.org/observations/40677856,https://static.inaturalist.org/photos/64481453/medium.jpg?1585107441,,,,1,0,FALSE,,"Los Angeles, California, United States",San Clemente,33.02250556,-118.6004722,5,5,,,FALSE,,,,Los Angeles,California,United States,California,Los Angeles,Amber Snails,Succineidae,Amber Snails,Mollusca,86090,Mollusca,Gastropoda,Stylommatophora,Succineidae,,
iNaturalist,40677858,2020/02/20 9:46 AM PST,2/20/2020 0:00,2/20/2020,2020,2,20,20:46:00,300,Pacific Time (US & Canada),266196,shrike2,2020-03-25 06:44:50 +0300,2020-03-25 07:10:37 +0300,needs_id,CC-BY-NC-ND,https://www.inaturalist.org/observations/40677858,https://static.inaturalist.org/photos/64481460/medium.jpg?1585107447,,,,1,0,FALSE,,"Los Angeles, California, United States",San Clemente,33.02250833,-118.6004694,5,5,,,FALSE,,,,Los Angeles,California,United States,California,Los Angeles,Amber Snails,Succineidae,Amber Snails,Mollusca,86090,Mollusca,Gastropoda,Stylommatophora,Succineidae,,
iNaturalist,40677861,2020/02/20 9:47 AM PST,2/20/2020 0:00,2/20/2020,2020,2,20,20:47:00,300,Pacific Time (US & Canada),266196,shrike2,2020-03-25 06:44:54 +0300,2020-03-25 07:09:51 +0300,needs_id,CC-BY-NC-ND,https://www.inaturalist.org/observations/40677861,https://static.inaturalist.org/photos/64481464/medium.jpg?1585107451,,,,1,0,FALSE,,"Los Angeles, California, United States",San Clemente,33.02251111,-118.6004639,5,5,,,FALSE,,,,Los Angeles,California,United States,California,Los Angeles,Amber Snails,Succineidae,Amber Snails,Mollusca,86090,Mollusca,Gastropoda,Stylommatophora,Succineidae,,
iNaturalist,27757162,Thu Jun 27 2019 08:09:10 GMT-0700 (PDT),6/27/2019 0:00,6/27/2019,2019,6,27,18:09:10,300,Pacific Time (US & Canada),1474963,stephlbartlett,2019-06-27 18:12:13 +0300,2019-12-26 23:48:26 +0300,research,CC-BY-NC,https://www.inaturalist.org/observations/27757162,https://inaturalist-open-data.s3.amazonaws.com/photos/43221612/medium.jpg?1561648348,,,,4,0,FALSE,3,"San Clemente Island Underwater Range, , CA, US",San Clemente,32.97529637,-118.5494513,64,64,,,FALSE,,,,Los Angeles,California,United States,California,Los Angeles,White Italian Snail,Theba pisana,White Italian Snail,Mollusca,119608,Mollusca,Gastropoda,Stylommatophora,Helicidae,,
iNaturalist,28219906,2019-06-27 1:22:01 PM PDT,6/27/2019 0:00,6/27/2019,2019,6,27,23:22:01,300,Pacific Time (US & Canada),34488,pileated,2019-07-05 10:26:21 +0300,2021-01-30 09:49:25 +0300,research,CC-BY,https://www.inaturalist.org/observations/28219906,https://inaturalist-open-data.s3.amazonaws.com/photos/43975766/medium.jpg?1562311583,,,Found by Stephanie Bartlett @stephlbartlett,2,0,FALSE,2,"Los Angeles County, CA, USA",San Clemente,32.97280314,-118.5476816,44,44,,,FALSE,gps,gps,,Los Angeles,California,United States,California,Los Angeles,White Italian Snail,Theba pisana,White Italian Snail,Mollusca,119608,Mollusca,Gastropoda,Stylommatophora,Helicidae,,
iNaturalist,21810268,2019/03/25 4:21 PM PDT,3/25/2019 0:00,3/26/2019,2019,3,26,2:21:00,300,Pacific Time (US & Canada),12809,cedric_lee,2019-03-31 05:11:00 +0300,2020-04-24 01:43:32 +0300,needs_id,CC-BY-NC,https://www.inaturalist.org/observations/21810268,https://inaturalist-open-data.s3.amazonaws.com/photos/34125592/medium.jpeg?1554456318,,,,1,0,FALSE,,"California, US",San Clemente,32.96845432,-118.4184582,81,29039,obscured,,TRUE,,,,Los Angeles,California,United States,California,Los Angeles,Vertigo,Vertigo,Vertigo Snails,Mollusca,92785,Mollusca,Gastropoda,,Vertiginidae,,
iNaturalist,21810279,2019/03/25 7:52 PM PDT,3/25/2019 0:00,3/26/2019,2019,3,26,5:52:00,300,Pacific Time (US & Canada),12809,cedric_lee,2019-03-31 05:11:09 +0300,2021-01-30 10:21:47 +0300,needs_id,CC-BY-NC,https://www.inaturalist.org/observations/21810279,https://inaturalist-open-data.s3.amazonaws.com/photos/33777855/medium.jpeg?1553991951,,,,1,0,FALSE,,"California, US",San Clemente,32.82850304,-118.493829,81,29039,obscured,,TRUE,,,,Los Angeles,California,United States,California,Los Angeles,Vertigo,Vertigo,Vertigo Snails,Mollusca,92785,Mollusca,Gastropoda,,Vertiginidae,,
iNaturalist,22869058,2019-04-12 1:27:26 PM PDT,4/12/2019 0:00,4/12/2019,2019,4,12,23:27:26,300,Pacific Time (US & Canada),34488,pileated,2019-04-22 09:25:14 +0300,2020-04-23 21:21:05 +0300,needs_id,CC-BY,https://www.inaturalist.org/observations/22869058,https://inaturalist-open-data.s3.amazonaws.com/photos/35448728/medium.jpg?1555914316,,,,0,0,FALSE,2,Stone Station,San Clemente,32.91906229,-118.4901217,176,176,,,FALSE,gps,gps,,Los Angeles,California,United States,California,Los Angeles,Vertigo,Vertigo,Vertigo Snails,Mollusca,92785,Mollusca,Gastropoda,,Vertiginidae,,
iNaturalist,23038882,2019-04-14 10:33:50 AM PDT,4/14/2019 0:00,4/14/2019,2019,4,14,20:33:50,300,Pacific Time (US & Canada),34488,pileated,2019-04-25 09:18:41 +0300,2020-04-23 21:21:05 +0300,needs_id,CC-BY,https://www.inaturalist.org/observations/23038882,https://inaturalist-open-data.s3.amazonaws.com/photos/35716342/medium.jpeg?1556173128,,,,1,0,FALSE,2,"Los Angeles County, CA, USA",San Clemente,32.87794026,-118.4350922,88,88,,,FALSE,gps,gps,,Los Angeles,California,United States,California,Los Angeles,Vertigo Snails,Vertigo,Vertigo Snails,Mollusca,92785,Mollusca,Gastropoda,,Vertiginidae,,
iNaturalist,25297501,2019/03/25 5:39 PM PDT,3/25/2019 0:00,3/26/2019,2019,3,26,3:39:00,300,Pacific Time (US & Canada),195291,stephanomeria,2019-05-18 06:42:08 +0300,2021-02-26 05:25:48 +0300,needs_id,CC-BY-NC,https://www.inaturalist.org/observations/25297501,https://inaturalist-open-data.s3.amazonaws.com/photos/39166454/medium.jpeg?1558149201,,,,3,0,FALSE,,"California, US",San Clemente,32.89376932,-118.4158951,169,29039,,obscured,TRUE,,,,Los Angeles,California,United States,California,Los Angeles,Vertigo Snails,Vertigo,Vertigo Snails,Mollusca,92785,Mollusca,Gastropoda,,Vertiginidae,,
iNaturalist,40675119,2020/03/11 9:02 PM PDT,3/11/2020 0:00,3/12/2020,2020,3,12,7:02:00,300,Pacific Time (US & Canada),266196,shrike2,2020-03-25 05:35:24 +0300,2020-03-25 06:04:13 +0300,needs_id,CC-BY-NC-ND,https://www.inaturalist.org/observations/40675119,https://static.inaturalist.org/photos/64477158/medium.jpg?1585103557,,,,0,0,FALSE,,"Los Angeles County, CA, USA",San Clemente,32.90049981,-118.5045343,8,8,,,FALSE,,,,Los Angeles,California,United States,California,Los Angeles,Vertigo,Vertigo,Vertigo Snails,Mollusca,92785,Mollusca,Gastropoda,,Vertiginidae,,
iNaturalist,41774910,2019/06/23 1:28 PM PDT,6/23/2019 0:00,6/23/2019,2019,6,23,23:28:00,300,Pacific Time (US & Canada),173183,serpophaga,2020-04-09 21:38:11 +0300,2020-04-25 07:00:04 +0300,needs_id,CC-BY-NC,https://www.inaturalist.org/observations/41774910,https://inaturalist-open-data.s3.amazonaws.com/photos/66280490/medium.jpg?1586457141,,,,2,0,FALSE,,"Los Angeles, California, United States",San Clemente,32.87812778,-118.4354861,10,10,,,FALSE,,,,Los Angeles,California,United States,California,Los Angeles,Vertigo Snails,Vertigo,Vertigo Snails,Mollusca,92785,Mollusca,Gastropoda,,Vertiginidae,,
iNaturalist,53520863,Sat Jul 18 2020 09:21:16 GMT-0700 (PDT),7/18/2020 0:00,7/18/2020,2020,7,18,19:21:16,300,Pacific Time (US & Canada),266196,shrike2,2020-07-18 23:46:13 +0300,2020-07-19 00:01:30 +0300,needs_id,CC-BY-NC-ND,https://www.inaturalist.org/observations/53520863,https://static.inaturalist.org/photos/85128965/medium.jpg?1595105293,,,,1,0,FALSE,3,"San Clemente Island Underwater Range, CA, US",San Clemente,32.87398667,-118.4605167,7,7,,,FALSE,,,,Los Angeles,California,United States,California,Los Angeles,Vertigo Snails,Vertigo,Vertigo Snails,Mollusca,92785,Mollusca,Gastropoda,,Vertiginidae,,
iNaturalist,53521135,Sat Jul 18 2020 09:35:56 GMT-0700 (PDT),7/18/2020 0:00,7/18/2020,2020,7,18,19:35:56,300,Pacific Time (US & Canada),266196,shrike2,2020-07-18 23:48:17 +0300,2020-07-18 23:59:37 +0300,needs_id,CC-BY-NC-ND,https://www.inaturalist.org/observations/53521135,https://static.inaturalist.org/photos/85129003/medium.jpg?1595105305,,,,1,0,FALSE,3,"San Clemente Island Underwater Range, CA, US",San Clemente,32.87409667,-118.4606467,6,6,,,FALSE,,,,Los Angeles,California,United States,California,Los Angeles,Vertigo Snails,Vertigo,Vertigo Snails,Mollusca,92785,Mollusca,Gastropoda,,Vertiginidae,,
iNaturalist,32776509,2019-09-14 5:29:32 PM PDT,9/14/2019 0:00,9/15/2019,2019,9,15,3:29:32,300,Pacific Time (US & Canada),392423,bjdion,2019-09-15 20:31:48 +0300,2019-09-16 03:23:06 +0300,needs_id,CC-BY-NC-SA,https://www.inaturalist.org/observations/32776509,https://inaturalist-open-data.s3.amazonaws.com/photos/51477316/medium.jpg?1568593384,,,Vertigo longa or V. catalinaria,0,0,FALSE,2,"Santa Catalina Island, California 90704, USA",Santa Catalina,33.45049021,-118.514048,263,263,,,FALSE,gps,gps,,Los Angeles,California,United States,California,Los Angeles,Vertigo Snails,Vertigo,Vertigo Snails,Mollusca,92785,Mollusca,Gastropoda,,Vertiginidae,,
iNaturalist,32803954,2019-09-14 3:51:18 PM PDT,9/14/2019 0:00,9/15/2019,2019,9,15,1:51:18,300,Pacific Time (US & Canada),392423,bjdion,2019-09-16 03:23:08 +0300,2019-09-16 03:23:11 +0300,needs_id,CC-BY-NC-SA,https://www.inaturalist.org/observations/32803954,https://inaturalist-open-data.s3.amazonaws.com/photos/51477325/medium.jpg?1568593389,,,Either longa or catalina,0,0,FALSE,2,"Santa Catalina Island, California 90704, USA",Santa Catalina,33.4714009,-118.5751059,263,263,,,FALSE,gps,gps,,Los Angeles,California,United States,California,Los Angeles,Vertigo Snails,Vertigo,Vertigo Snails,Mollusca,92785,Mollusca,Gastropoda,,Vertiginidae,,
iNaturalist,73467714,2019/03/26 8:50 AM PDT,3/26/2019 0:00,3/26/2019,2019,3,26,18:50:00,300,Pacific Time (US & Canada),173183,serpophaga,2021-04-10 09:37:15 +0300,2021-04-10 22:06:59 +0300,needs_id,CC-BY-NC,https://www.inaturalist.org/observations/73467714,https://inaturalist-open-data.s3.amazonaws.com/photos/119947309/medium.jpeg?1618036122,,,V. californica?,1,0,FALSE,,"Santa Barbara County, CA, USA",Santa Barbara,33.48109167,-119.0299083,5,5,,,FALSE,,,,Santa Barbara,California,United States,California,Santa Barbara,Vertigo Snails,Vertigo,Vertigo Snails,Mollusca,92785,Mollusca,Gastropoda,,Vertiginidae,,
iNaturalist,38744387,2/13/2020,2/13/2020 0:00,,,,,,,Pacific Time (US & Canada),12809,cedric_lee,2020-02-17 09:38:46 +0300,2021-03-09 09:46:01 +0300,needs_id,CC-BY-NC,https://www.inaturalist.org/observations/38744387,https://inaturalist-open-data.s3.amazonaws.com/photos/61626931/medium.jpeg?1581923830,,,,0,0,FALSE,,"Los Angeles County, CA, USA",San Clemente,32.87548705,-118.4823154,129,129,,,FALSE,,,,Los Angeles,California,United States,California,Los Angeles,Vertigo californica,Vertigo californica,,Mollusca,862080,Mollusca,Gastropoda,,Vertiginidae,,
iNaturalist,39863466,Wed Mar 11 2020 11:46:03 GMT-0700 (PDT),3/11/2020 0:00,3/11/2020,2020,3,11,21:46:03,300,Pacific Time (US & Canada),266196,shrike2,2020-03-12 03:35:34 +0300,2020-03-12 03:52:45 +0300,needs_id,CC-BY-NC-ND,https://www.inaturalist.org/observations/39863466,https://static.inaturalist.org/photos/63288152/medium.jpg?1583973738,,,,0,0,FALSE,3,"San Clemente Island Underwater Range, CA, US",San Clemente,32.89963,-118.5053467,,,,,FALSE,,,,Los Angeles,California,United States,California,Los Angeles,Vertigo californica,Vertigo californica,,Mollusca,862080,Mollusca,Gastropoda,,Vertiginidae,,
iNaturalist,40116262,2/23/2020,2/23/2020 0:00,,,,,,,Pacific Time (US & Canada),12809,cedric_lee,2020-03-17 07:38:14 +0300,2020-03-17 07:38:14 +0300,needs_id,CC-BY-NC,https://www.inaturalist.org/observations/40116262,https://inaturalist-open-data.s3.amazonaws.com/photos/63718555/medium.jpeg?1584419650,,,,0,0,FALSE,,"Unnamed Road, California, USA",San Clemente,32.84,-118.443,,,,,FALSE,,,,Los Angeles,California,United States,California,Los Angeles,Vertigo californica,Vertigo californica,,Mollusca,862080,Mollusca,Gastropoda,,Vertiginidae,,
iNaturalist,40675120,2020/03/11 9:15 PM PDT,3/11/2020 0:00,3/12/2020,2020,3,12,7:15:00,300,Pacific Time (US & Canada),266196,shrike2,2020-03-25 05:35:25 +0300,2021-05-23 08:00:14 +0300,research,CC-BY-NC-ND,https://www.inaturalist.org/observations/40675120,https://static.inaturalist.org/photos/64477166/medium.jpg?1585103559,,,,1,0,FALSE,,"Los Angeles County, CA, USA",San Clemente,32.90049981,-118.5045343,8,8,,,FALSE,,,,Los Angeles,California,United States,California,Los Angeles,Vertigo californica,Vertigo californica,,Mollusca,862080,Mollusca,Gastropoda,,Vertiginidae,,
iNaturalist,40675121,2020/03/11 9:17 PM PDT,3/11/2020 0:00,3/12/2020,2020,3,12,7:17:00,300,Pacific Time (US & Canada),266196,shrike2,2020-03-25 05:35:25 +0300,2020-03-25 06:03:52 +0300,needs_id,CC-BY-NC-ND,https://www.inaturalist.org/observations/40675121,https://static.inaturalist.org/photos/64477177/medium.jpg?1585103562,,,,0,0,FALSE,,"Los Angeles County, CA, USA",San Clemente,32.90049981,-118.5045343,8,8,,,FALSE,,,,Los Angeles,California,United States,California,Los Angeles,Vertigo californica,Vertigo californica,,Mollusca,862080,Mollusca,Gastropoda,,Vertiginidae,,
iNaturalist,40683552,2/23/2020,2/23/2020 0:00,,,,,,,Pacific Time (US & Canada),12809,cedric_lee,2020-03-25 11:26:02 +0300,2020-03-25 11:26:02 +0300,needs_id,CC-BY-NC,https://www.inaturalist.org/observations/40683552,https://inaturalist-open-data.s3.amazonaws.com/photos/64491470/medium.jpeg?1585123164,,,,0,0,FALSE,,"Unnamed Road, California, USA",San Clemente,32.841844,-118.442482,,,,,FALSE,,,,Los Angeles,California,United States,California,Los Angeles,Vertigo californica,Vertigo californica,,Mollusca,862080,Mollusca,Gastropoda,,Vertiginidae,,
iNaturalist,7677255,4/12/1988,4/12/1988 0:00,,,,,,,Pacific Time (US & Canada),12809,cedric_lee,2017-08-27 23:04:46 +0300,2020-04-13 17:53:26 +0300,needs_id,CC-BY-NC,https://www.inaturalist.org/observations/7677255,https://static.inaturalist.org/photos/10055784/medium.jpg?1503865586,,,This shell is from NHMLA's malacology collection.,1,1,FALSE,,"Los Angeles County, CA, USA",San Clemente,33.00216532,-118.5581131,129,129,,,FALSE,,,,Los Angeles,California,United States,California,Los Angeles,Vertigo californica longa,Vertigo californica longa,,Mollusca,862085,Mollusca,Gastropoda,,Vertiginidae,,
iNaturalist,21825521,2019/03/27 11:11 AM PDT,3/27/2019 0:00,3/27/2019,2019,3,27,21:11:00,300,Pacific Time (US & Canada),12809,cedric_lee,2019-03-31 17:16:56 +0300,2020-04-24 01:26:04 +0300,research,CC-BY-NC,https://www.inaturalist.org/observations/21825521,https://inaturalist-open-data.s3.amazonaws.com/photos/33810965/medium.jpeg?1554040165,,,,1,0,FALSE,,"Los Angeles, California, United States",San Clemente,32.86993833,-118.4950933,,,,,FALSE,,,,Los Angeles,California,United States,California,Los Angeles,Vertigo californica longa,Vertigo californica longa,,Mollusca,862085,Mollusca,Gastropoda,,Vertiginidae,,
iNaturalist,38194372,2020/01/31 2:04 PM PST,1/31/2020 0:00,2/1/2020,2020,2,1,1:04:00,300,Pacific Time (US & Canada),12809,cedric_lee,2020-02-02 00:33:39 +0300,2021-03-09 09:45:58 +0300,needs_id,CC-BY-NC,https://www.inaturalist.org/observations/38194372,https://inaturalist-open-data.s3.amazonaws.com/photos/60662546/medium.jpeg?1580589184,,,,0,0,FALSE,,"Los Angeles, California, United States",San Clemente,32.99678667,-118.5495267,,,,,FALSE,,,,Los Angeles,California,United States,California,Los Angeles,Vertigo californica longa,Vertigo californica longa,,Mollusca,862085,Mollusca,Gastropoda,,Vertiginidae,,
iNaturalist,39027893,Fri Feb 21 2020 15:04:49 GMT-0800 (PST),2/21/2020 0:00,2/22/2020,2020,2,22,2:04:49,300,Pacific Time (US & Canada),12809,cedric_lee,2020-02-22 03:37:22 +0300,2021-03-09 09:46:04 +0300,research,CC-BY-NC,https://www.inaturalist.org/observations/39027893,https://inaturalist-open-data.s3.amazonaws.com/photos/61923913/medium.jpg?1582331878,,,,0,0,FALSE,3,"San Clemente Island Underwater Range, CA, US",San Clemente,32.868055,-118.4508333,,,,,FALSE,,,,Los Angeles,California,United States,California,Los Angeles,,Vertigo californica longa,,Mollusca,862085,Mollusca,Gastropoda,,Vertiginidae,,
iNaturalist,39378881,2020/02/20 11:45 AM PST,2/20/2020 0:00,2/20/2020,2020,2,20,22:45:00,300,Pacific Time (US & Canada),12809,cedric_lee,2020-03-01 03:29:07 +0300,2020-03-01 03:29:07 +0300,needs_id,CC-BY-NC,https://www.inaturalist.org/observations/39378881,https://inaturalist-open-data.s3.amazonaws.com/photos/62459262/medium.jpeg?1583017949,,,,0,0,FALSE,,"Los Angeles County, CA, USA",San Clemente,33.02507667,-118.5946633,,,,,FALSE,,,,Los Angeles,California,United States,California,Los Angeles,Vertigo californica longa,Vertigo californica longa,,Mollusca,862085,Mollusca,Gastropoda,,Vertiginidae,,
iNaturalist,39394323,2020/02/22 3:24 PM PST,2/22/2020 0:00,2/23/2020,2020,2,23,2:24:00,300,Pacific Time (US & Canada),12809,cedric_lee,2020-03-01 10:35:20 +0300,2021-05-26 05:21:28 +0300,needs_id,CC-BY-NC,https://www.inaturalist.org/observations/39394323,https://inaturalist-open-data.s3.amazonaws.com/photos/62486334/medium.jpeg?1583040793,,,,0,0,FALSE,,"Los Angeles County, CA, USA",San Clemente,32.904443,-118.471232,27,27,,,FALSE,,,,Los Angeles,California,United States,California,Los Angeles,Vertigo californica longa,Vertigo californica longa,,Mollusca,862085,Mollusca,Gastropoda,,Vertiginidae,,
iNaturalist,40116264,2/24/2020,2/24/2020 0:00,,,,,,,Pacific Time (US & Canada),12809,cedric_lee,2020-03-17 07:38:14 +0300,2021-01-13 08:51:56 +0300,research,CC-BY-NC,https://www.inaturalist.org/observations/40116264,https://inaturalist-open-data.s3.amazonaws.com/photos/63718609/medium.jpeg?1584419691,,,,1,0,FALSE,,"Unnamed Road, California, USA",San Clemente,32.870182,-118.430303,55,55,,,FALSE,,,,Los Angeles,California,United States,California,Los Angeles,Vertigo californica longa,Vertigo californica longa,,Mollusca,862085,Mollusca,Gastropoda,,Vertiginidae,,
iNaturalist,20844673,2019/02/26 11:51 AM PST,2/26/2019 0:00,2/26/2019,2019,2,26,22:51:00,300,Pacific Time (US & Canada),173183,serpophaga,2019-03-01 07:20:25 +0300,2019-11-11 17:57:23 +0300,research,CC-BY-NC,https://www.inaturalist.org/observations/20844673,https://inaturalist-open-data.s3.amazonaws.com/photos/32155673/medium.jpg?1551413066,,,,1,0,FALSE,,"Ventura County, CA, USA",San Nicolas,33.265025,-119.5246972,10,10,,,FALSE,,,,Ventura,California,United States,California,Ventura,Vertigo californica longa,Vertigo californica longa,,Mollusca,862085,Mollusca,Gastropoda,,Vertiginidae,,
iNaturalist,35595479,2019-11-05 2:02:03 PM PST,11/5/2019 0:00,11/6/2019,2019,11,6,1:02:03,300,Pacific Time (US & Canada),34488,pileated,2019-11-12 05:54:07 +0300,2021-02-11 06:31:01 +0300,research,CC-BY,https://www.inaturalist.org/observations/35595479,https://inaturalist-open-data.s3.amazonaws.com/photos/56145742/medium.jpg?1573527249,,,,1,0,FALSE,2,"San Nicolas Island, California 93042, USA",San Nicolas,33.2454834,-119.4510269,,,,,FALSE,gps,gps,,Ventura,California,United States,California,Ventura,Vertigo californica longa,Vertigo californica longa,,Mollusca,862085,Mollusca,Gastropoda,,Vertiginidae,,
iNaturalist,8161169,2/20/1941,2/20/1941 0:00,,,,,,,Pacific Time (US & Canada),12809,cedric_lee,2017-09-29 02:42:46 +0300,2019-03-31 05:05:00 +0300,research,CC-BY-NC,https://www.inaturalist.org/observations/8161169,https://inaturalist-open-data.s3.amazonaws.com/photos/10805934/medium.jpeg?1506641664,,,From the Kanakoff Collection at NHMLA,2,0,FALSE,,"California, US",San Clemente,32.81132347,-118.5915576,17578,29039,,obscured,TRUE,,,,Los Angeles,California,United States,California,Los Angeles,Vertigo clementina,Vertigo clementina,San Clemente Island Blunt-top Snail,Mollusca,878396,Mollusca,Gastropoda,,Vertiginidae,,
iNaturalist,38744430,2/13/2020,2/13/2020 0:00,,,,,,,Pacific Time (US & Canada),12809,cedric_lee,2020-02-17 09:41:41 +0300,2021-03-09 09:46:01 +0300,needs_id,CC-BY-NC,https://www.inaturalist.org/observations/38744430,https://inaturalist-open-data.s3.amazonaws.com/photos/61626787/medium.jpeg?1581923614,,,,0,0,FALSE,,"California, US",San Clemente,32.82980779,-118.4900943,129,29039,,obscured,TRUE,,,,Los Angeles,California,United States,California,Los Angeles,San Clemente Island Blunt-top Snail,Vertigo clementina,San Clemente Island Blunt-top Snail,Mollusca,878396,Mollusca,Gastropoda,,Vertiginidae,,
iNaturalist,38744450,Mon Feb 10 2020 10:55:28 GMT-0800 (PST),2/10/2020 0:00,2/10/2020,2020,2,10,21:55:28,300,Pacific Time (US & Canada),12809,cedric_lee,2020-02-17 09:44:08 +0300,2021-03-09 09:46:01 +0300,needs_id,CC-BY-NC,https://www.inaturalist.org/observations/38744450,https://inaturalist-open-data.s3.amazonaws.com/photos/61625952/medium.jpeg?1581921847,,,,0,0,FALSE,,"California, US",San Clemente,32.80877634,-118.5049912,7,29039,,obscured,TRUE,,,,Los Angeles,California,United States,California,Los Angeles,San Clemente Island Blunt-top Snail,Vertigo clementina,San Clemente Island Blunt-top Snail,Mollusca,878396,Mollusca,Gastropoda,,Vertiginidae,,
iNaturalist,39027927,Fri Feb 21 2020 15:11:39 GMT-0800 (PST),2/21/2020 0:00,2/22/2020,2020,2,22,2:11:39,300,Pacific Time (US & Canada),12809,cedric_lee,2020-02-22 03:38:23 +0300,2021-03-09 09:46:04 +0300,research,CC-BY-NC,https://www.inaturalist.org/observations/39027927,https://inaturalist-open-data.s3.amazonaws.com/photos/61923964/medium.jpg?1582331945,,,,0,0,FALSE,3,"California, US",San Clemente,32.90258504,-118.448436,,29039,,obscured,TRUE,,,,Los Angeles,California,United States,California,Los Angeles,,Vertigo clementina,San Clemente Island Blunt-top Snail,Mollusca,878396,Mollusca,Gastropoda,,Vertiginidae,,
iNaturalist,40116263,2/23/2020,2/23/2020 0:00,,,,,,,Pacific Time (US & Canada),12809,cedric_lee,2020-03-17 07:38:14 +0300,2021-01-13 08:51:14 +0300,research,CC-BY-NC,https://www.inaturalist.org/observations/40116263,https://inaturalist-open-data.s3.amazonaws.com/photos/63718589/medium.jpeg?1584419675,,,,1,0,FALSE,,"California, US",San Clemente,32.86018736,-118.5768711,,29039,,obscured,TRUE,,,,Los Angeles,California,United States,California,Los Angeles,San Clemente Island Blunt-top Snail,Vertigo clementina,San Clemente Island Blunt-top Snail,Mollusca,878396,Mollusca,Gastropoda,,Vertiginidae,,
iNaturalist,20822143,Wed Feb 27 2019 10:12:11 GMT-0800 (PST),2/27/2019 0:00,2/27/2019,2019,2,27,21:12:11,300,Pacific Time (US & Canada),5179,leptonia,2019-02-28 07:43:47 +0300,2019-11-06 06:45:53 +0300,research,CC-BY-NC,https://www.inaturalist.org/observations/20822143,https://inaturalist-open-data.s3.amazonaws.com/photos/32116822/medium.jpg?1551329039,,,,3,0,FALSE,3,"California, US",San Nicolas,33.29262743,-119.5254456,6,28984,,obscured,TRUE,,,,Ventura,California,United States,California,Ventura,San Clemente Island Blunt-top Snail,Vertigo clementina,San Clemente Island Blunt-top Snail,Mollusca,878396,Mollusca,Gastropoda,,Vertiginidae,,
iNaturalist,20854929,2019/02/27 10:12 AM PST,2/27/2019 0:00,2/27/2019,2019,2,27,21:12:00,300,Pacific Time (US & Canada),173183,serpophaga,2019-03-01 20:42:39 +0300,2019-08-13 08:19:28 +0300,research,CC-BY-NC,https://www.inaturalist.org/observations/20854929,https://inaturalist-open-data.s3.amazonaws.com/photos/32173612/medium.jpg?1551461932,,,,2,0,FALSE,,"California, US",San Nicolas,33.20516761,-119.4992384,5,28984,,obscured,TRUE,,,,Ventura,California,United States,California,Ventura,San Clemente Island Blunt-top Snail,Vertigo clementina,San Clemente Island Blunt-top Snail,Mollusca,878396,Mollusca,Gastropoda,,Vertiginidae,,
iNaturalist,20854930,2019/02/27 10:13 AM PST,2/27/2019 0:00,2/27/2019,2019,2,27,21:13:00,300,Pacific Time (US & Canada),173183,serpophaga,2019-03-01 20:42:42 +0300,2020-03-16 07:28:50 +0300,research,CC-BY-NC,https://www.inaturalist.org/observations/20854930,https://inaturalist-open-data.s3.amazonaws.com/photos/32173617/medium.jpg?1551461942,,,,2,0,FALSE,,"California, US",San Nicolas,33.20558674,-119.532596,5,28984,,obscured,TRUE,,,,Ventura,California,United States,California,Ventura,San Clemente Island Blunt-top Snail,Vertigo clementina,San Clemente Island Blunt-top Snail,Mollusca,878396,Mollusca,Gastropoda,,Vertiginidae,,
iNaturalist,37390906,Sat Jan 04 2020 10:24:27 GMT-0800 (PST),1/4/2020 0:00,1/4/2020,2020,1,4,23:24:27,300,Hawaii,464542,william_hoyer,2020-01-08 08:19:24 +0300,2020-04-03 17:08:54 +0300,research,CC-BY-NC,https://www.inaturalist.org/observations/37390906,https://inaturalist-open-data.s3.amazonaws.com/photos/59267686/medium.jpg?1578460779,,,"On dead LEPGIG under OPUORI
",1,0,FALSE,3,"California, US",Santa Barbara,33.48967781,-119.0077415,27,28957,,obscured,TRUE,,,,Santa Barbara,California,United States,California,Santa Barbara,San Clemente Island Blunt-top Snail,Vertigo clementina,San Clemente Island Blunt-top Snail,Mollusca,878396,Mollusca,Gastropoda,,Vertiginidae,,
iNaturalist,36654848,Sat Dec 14 2019 11:16:38 GMT-0800 (PST),12/14/2019 0:00,12/15/2019,2019,12,15,0:16:38,300,Hawaii,464542,william_hoyer,2019-12-15 01:48:05 +0300,2019-12-15 01:49:00 +0300,needs_id,CC-BY-NC,https://www.inaturalist.org/observations/36654848,https://inaturalist-open-data.s3.amazonaws.com/photos/57970361/medium.jpg?1576363736,,,,0,0,FALSE,3,"California, US",,33.38479782,-119.5055094,7,28984,,obscured,TRUE,,,,Ventura,California,United States,California,Ventura,,Vertigo clementina,San Clemente Island Blunt-top Snail,Mollusca,878396,Mollusca,Gastropoda,Stylommatophora,Vertiginidae,Vertigo,Vertigo clementina
iNaturalist,10236614,Wed Mar 14 2018 10:01:18 GMT-0700 (PDT),3/14/2018 0:00,3/14/2018,2018,3,14,20:01:18,300,Pacific Time (US & Canada),213838,vireolanius,2018-03-15 00:38:32 +0300,2020-03-30 19:25:50 +0300,needs_id,CC-BY-NC,https://www.inaturalist.org/observations/10236614,https://inaturalist-open-data.s3.amazonaws.com/photos/14153606/medium.jpg?1521063532,,,,3,1,FALSE,3,"California, US",San Clemente,32.82803584,-118.5453537,5,29039,,obscured,TRUE,,,,Los Angeles,California,United States,California,Los Angeles,Xerarionta,Xerarionta,,Mollusca,92870,Mollusca,Gastropoda,Stylommatophora,Helminthoglyptidae,,
iNaturalist,20497021,Tue Feb 19 2019 13:49:47 GMT-0800 (PST),2/19/2019 0:00,2/20/2019,2019,2,20,0:49:47,300,Pacific Time (US & Canada),213838,vireolanius,2019-02-20 01:59:18 +0300,2020-02-27 20:33:18 +0300,needs_id,CC-BY-NC,https://www.inaturalist.org/observations/20497021,https://inaturalist-open-data.s3.amazonaws.com/photos/31634737/medium.jpg?1550617163,,,,3,0,FALSE,3,"Los Angeles County, US-CA, US",San Clemente,32.89845082,-118.5156537,5,5,,,FALSE,,,,Los Angeles,California,United States,California,Los Angeles,Xerarionta,Xerarionta,,Mollusca,92870,Mollusca,Gastropoda,Stylommatophora,Helminthoglyptidae,,
iNaturalist,21230530,2019-02-28 7:37:53 PM PST,2/28/2019 0:00,3/1/2019,2019,3,1,6:37:53,300,Pacific Time (US & Canada),34488,pileated,2019-03-14 18:09:25 +0300,2020-04-23 21:20:30 +0300,needs_id,CC-BY,https://www.inaturalist.org/observations/21230530,https://inaturalist-open-data.s3.amazonaws.com/photos/32820009/medium.jpeg?1552576167,,,,2,0,FALSE,2,"Los Angeles County, US-CA, US",San Clemente,33.01279674,-118.5520436,176,29012,,obscured,TRUE,gps,gps,,Los Angeles,California,United States,California,Los Angeles,Xerarionta,Xerarionta,,Mollusca,92870,Mollusca,Gastropoda,Stylommatophora,Helminthoglyptidae,,
iNaturalist,21260464,2019/02/21 1:53 PM PST,2/21/2019 0:00,2/22/2019,2019,2,22,0:53:00,300,Pacific Time (US & Canada),266196,shrike2,2019-03-15 19:40:04 +0300,2020-02-25 00:38:21 +0300,needs_id,CC-BY-NC-ND,https://www.inaturalist.org/observations/21260464,https://static.inaturalist.org/photos/32869702/medium.jpg?1552666694,,,,3,0,FALSE,,"Los Angeles County, US-CA, US",San Clemente,33.00425017,-118.471081,15,29012,,obscured,TRUE,,,,Los Angeles,California,United States,California,Los Angeles,Xerarionta,Xerarionta,,Mollusca,92870,Mollusca,Gastropoda,Stylommatophora,Helminthoglyptidae,,
iNaturalist,21263477,2019/01/06 2:27 PM PST,1/6/2019 0:00,,,,,,,Pacific Time (US & Canada),266196,shrike2,2019-03-15 21:33:57 +0300,2020-02-25 00:39:32 +0300,needs_id,CC-BY-NC-ND,https://www.inaturalist.org/observations/21263477,https://static.inaturalist.org/photos/32875026/medium.jpg?1552674335,,,,1,0,FALSE,,"Los Angeles, California, United States",San Clemente,32.99407222,-118.5484861,,,,,FALSE,,,,Los Angeles,California,United States,California,Los Angeles,Xerarionta,Xerarionta,,Mollusca,92870,Mollusca,Gastropoda,Stylommatophora,Helminthoglyptidae,,
iNaturalist,21817627,2019/03/26 2:51 PM PDT,3/26/2019 0:00,3/27/2019,2019,3,27,0:51:00,300,Pacific Time (US & Canada),12809,cedric_lee,2019-03-31 09:24:25 +0300,2020-04-24 01:32:27 +0300,needs_id,CC-BY-NC,https://www.inaturalist.org/observations/21817627,https://inaturalist-open-data.s3.amazonaws.com/photos/33797898/medium.jpeg?1554012724,,,,2,0,FALSE,,"Los Angeles County, US-CA, US",San Clemente,32.9586647,-118.4638727,,29039,obscured,,TRUE,,,,Los Angeles,California,United States,California,Los Angeles,Xerarionta,Xerarionta,,Mollusca,92870,Mollusca,Gastropoda,Stylommatophora,Helminthoglyptidae,,
iNaturalist,21822887,2019/03/26 3:50 PM PDT,3/26/2019 0:00,3/27/2019,2019,3,27,1:50:00,300,Pacific Time (US & Canada),12809,cedric_lee,2019-03-31 15:33:37 +0300,2020-04-24 01:31:56 +0300,needs_id,CC-BY-NC,https://www.inaturalist.org/observations/21822887,https://inaturalist-open-data.s3.amazonaws.com/photos/33806147/medium.jpeg?1554032897,,,X. intercisa and X. redimita Total 19 individuals from one rock,2,0,FALSE,,"Los Angeles County, US-CA, US",San Clemente,32.81601712,-118.4492726,,29039,obscured,,TRUE,,,,Los Angeles,California,United States,California,Los Angeles,Xerarionta,Xerarionta,,Mollusca,92870,Mollusca,Gastropoda,Stylommatophora,Helminthoglyptidae,,
iNaturalist,21825545,2019/03/27 12:13 PM PDT,3/27/2019 0:00,3/27/2019,2019,3,27,22:13:00,300,Pacific Time (US & Canada),12809,cedric_lee,2019-03-31 17:17:13 +0300,2020-04-24 01:19:53 +0300,needs_id,CC-BY-NC,https://www.inaturalist.org/observations/21825545,https://inaturalist-open-data.s3.amazonaws.com/photos/33811307/medium.jpeg?1554040615,,,,2,0,FALSE,,"California, US",San Clemente,32.86578435,-118.5789587,,29039,obscured,,TRUE,,,,Los Angeles,California,United States,California,Los Angeles,Xerarionta,Xerarionta,,Mollusca,92870,Mollusca,Gastropoda,Stylommatophora,Helminthoglyptidae,,
iNaturalist,24124142,Mon Apr 29 2019 08:12:22 GMT-0700 (PDT),4/29/2019 0:00,4/29/2019,2019,4,29,18:12:22,300,Pacific Time (US & Canada),688240,empid,2019-04-30 06:15:27 +0300,2020-03-08 11:12:24 +0300,needs_id,CC-BY-NC,https://www.inaturalist.org/observations/24124142,https://inaturalist-open-data.s3.amazonaws.com/photos/37307790/medium.jpg?1556594130,,,,3,1,FALSE,3,"California, US",San Clemente,32.81774768,-118.4795228,5,29039,,obscured,TRUE,,,,Los Angeles,California,United States,California,Los Angeles,Xerarionta,Xerarionta,,Mollusca,92870,Mollusca,Gastropoda,Stylommatophora,Helminthoglyptidae,,
iNaturalist,37533592,Sun Jan 12 2020 09:58:42 GMT-0800 (PST),1/12/2020 0:00,1/12/2020,2020,1,12,20:58:42,300,Pacific Time (US & Canada),266196,shrike2,2020-01-12 23:32:58 +0300,2020-02-25 00:39:44 +0300,needs_id,CC-BY-NC-ND,https://www.inaturalist.org/observations/37533592,https://static.inaturalist.org/photos/59519702/medium.jpg?1578861223,,,,1,0,FALSE,3,"Los Angeles County, US-CA, US",San Clemente,32.88572323,-118.4897158,5,5,,,FALSE,,,,Los Angeles,California,United States,California,Los Angeles,Xerarionta,Xerarionta,,Mollusca,92870,Mollusca,Gastropoda,Stylommatophora,Helminthoglyptidae,,
iNaturalist,82291969,6/5/2021 17:36,6/5/2021 0:00,6/6/2021,2021,6,6,3:36:30,300,Pacific Time (US & Canada),454365,koriecm,2021-06-09 17:21:15 +0300,2021-06-27 21:58:52 +0300,needs_id,CC-BY-NC,https://www.inaturalist.org/observations/82291969,https://inaturalist-open-data.s3.amazonaws.com/photos/135050439/medium.jpeg?1623248477,,,,1,0,FALSE,2,"California, US",San Clemente,32.97486809,-118.4085291,1017,29039,obscured,,TRUE,gps,gps,,Los Angeles,California,United States,California,Los Angeles,Xerarionta,Xerarionta,,Mollusca,92870,Mollusca,Gastropoda,Stylommatophora,Helminthoglyptidae,,
iNaturalist,86366592,Fri Jul 09 2021 12:53:46 GMT-0700 (PDT),7/9/2021 0:00,7/9/2021,2021,7,9,22:53:46,300,Pacific Time (US & Canada),2442991,amykhenry,2021-07-10 07:16:25 +0300,2021-07-14 01:34:26 +0300,needs_id,,https://www.inaturalist.org/observations/86366592,https://static.inaturalist.org/photos/142831816/medium.jpg?1626064708,,,,1,0,FALSE,3,"San Nicolas Naval Facility, CA, US",San Nicolas,33.25983773,-119.4907132,357,357,,,FALSE,,,,Ventura,California,United States,California,Ventura,Xerarionta,Xerarionta,,Mollusca,92870,Mollusca,Gastropoda,Stylommatophora,Helminthoglyptidae,,
iNaturalist,4742611,Fri Dec 09 2016 09:31:40 GMT-0800 (PST),12/9/2016 0:00,12/9/2016,2016,12,9,20:31:40,300,Pacific Time (US & Canada),266196,shrike2,2016-12-09 20:37:27 +0300,2020-02-25 03:33:56 +0300,research,CC-BY-NC-ND,http://www.inaturalist.org/observations/4742611,https://inaturalist-open-data.s3.amazonaws.com/photos/5747762/medium.jpg?1481305075,,,,1,0,FALSE,3,"Los Angeles County, US-CA, US",San Clemente,32.88081737,-118.5944509,19,29039,,obscured,TRUE,,,,Los Angeles,California,United States,California,Los Angeles,Plain Cactus Snail,Xerarionta intercisa,Plain Cactus Snail,Mollusca,115078,Mollusca,Gastropoda,Stylommatophora,Helminthoglyptidae,,
iNaturalist,4885742,2016/12/12 8:53 AM PST,12/12/2016 0:00,12/12/2016,2016,12,12,19:53:00,300,Pacific Time (US & Canada),266196,shrike2,2017-01-03 05:12:25 +0300,2020-02-25 00:38:44 +0300,research,CC-BY-NC-ND,https://www.inaturalist.org/observations/4885742,https://inaturalist-open-data.s3.amazonaws.com/photos/5940861/medium.jpg?1483409419,,,,3,0,FALSE,,"California, US",San Clemente,32.99690538,-118.4645253,426,29025,,obscured,TRUE,,,,Los Angeles,California,United States,California,Los Angeles,Xerarionta intercisa,Xerarionta intercisa,Plain Cactus Snail,Mollusca,115078,Mollusca,Gastropoda,Stylommatophora,Helminthoglyptidae,,
iNaturalist,4885752,2016/12/12 8:53 AM PST,12/12/2016 0:00,12/12/2016,2016,12,12,19:53:00,300,Pacific Time (US & Canada),266196,shrike2,2017-01-03 05:14:16 +0300,2020-02-25 00:39:23 +0300,research,CC-BY-NC-ND,https://www.inaturalist.org/observations/4885752,https://inaturalist-open-data.s3.amazonaws.com/photos/5940891/medium.jpg?1483409572,,,,2,0,FALSE,,"California, US",San Clemente,32.85212412,-118.5931991,565,29025,,obscured,TRUE,,,,Los Angeles,California,United States,California,Los Angeles,Xerarionta intercisa,Xerarionta intercisa,Plain Cactus Snail,Mollusca,115078,Mollusca,Gastropoda,Stylommatophora,Helminthoglyptidae,,
iNaturalist,4885775,2016/12/12 8:53 AM PST,12/12/2016 0:00,12/12/2016,2016,12,12,19:53:00,300,Pacific Time (US & Canada),266196,shrike2,2017-01-03 05:17:10 +0300,2020-02-25 00:38:47 +0300,research,CC-BY-NC-ND,https://www.inaturalist.org/observations/4885775,https://inaturalist-open-data.s3.amazonaws.com/photos/5940913/medium.jpg?1483409683,,,,3,0,FALSE,,"California, US",San Clemente,32.9100591,-118.5783671,137,29025,,obscured,TRUE,,manual,,Los Angeles,California,United States,California,Los Angeles,Xerarionta intercisa,Xerarionta intercisa,Plain Cactus Snail,Mollusca,115078,Mollusca,Gastropoda,Stylommatophora,Helminthoglyptidae,,
iNaturalist,4885776,2016/12/12 8:57 AM PST,12/12/2016 0:00,12/12/2016,2016,12,12,19:57:00,300,Pacific Time (US & Canada),266196,shrike2,2017-01-03 05:17:10 +0300,2020-02-25 00:37:33 +0300,research,CC-BY-NC-ND,https://www.inaturalist.org/observations/4885776,https://inaturalist-open-data.s3.amazonaws.com/photos/5940921/medium.jpg?1483409735,,,,3,0,FALSE,,"California, US",San Clemente,32.90272491,-118.4690254,137,29025,,obscured,TRUE,,manual,,Los Angeles,California,United States,California,Los Angeles,Xerarionta intercisa,Xerarionta intercisa,Plain Cactus Snail,Mollusca,115078,Mollusca,Gastropoda,Stylommatophora,Helminthoglyptidae,,
iNaturalist,4885777,2016/12/12 9:00 AM PST,12/12/2016 0:00,12/12/2016,2016,12,12,20:00:00,300,Pacific Time (US & Canada),266196,shrike2,2017-01-03 05:17:10 +0300,2020-02-25 00:38:33 +0300,research,CC-BY-NC-ND,https://www.inaturalist.org/observations/4885777,https://inaturalist-open-data.s3.amazonaws.com/photos/5940927/medium.jpg?1483409746,,,,3,0,FALSE,,"California, US",San Clemente,32.80097819,-118.4445243,137,29039,,obscured,TRUE,,manual,,Los Angeles,California,United States,California,Los Angeles,Plain Cactus Snail,Xerarionta intercisa,Plain Cactus Snail,Mollusca,115078,Mollusca,Gastropoda,Stylommatophora,Helminthoglyptidae,,
iNaturalist,5024317,2017/01/26 3:28 PM PST,1/26/2017 0:00,1/27/2017,2017,1,27,2:28:00,300,Pacific Time (US & Canada),173183,serpophaga,2017-01-30 02:25:10 +0300,2020-01-01 07:40:12 +0300,research,CC-BY-NC,https://www.inaturalist.org/observations/5024317,https://inaturalist-open-data.s3.amazonaws.com/photos/6149200/medium.jpg?1485732267,,,,3,0,FALSE,,"California, US",San Clemente,32.93864839,-118.5191546,,29039,,obscured,TRUE,,,,Los Angeles,California,United States,California,Los Angeles,Plain Cactus Snail,Xerarionta intercisa,Plain Cactus Snail,Mollusca,115078,Mollusca,Gastropoda,Stylommatophora,Helminthoglyptidae,,
iNaturalist,5048831,2017/01/26 3:27 PM PST,1/26/2017 0:00,1/27/2017,2017,1,27,2:27:00,300,Pacific Time (US & Canada),195291,stephanomeria,2017-02-04 03:01:41 +0300,2018-07-06 20:51:07 +0300,research,CC-BY-NC,https://www.inaturalist.org/observations/5048831,https://inaturalist-open-data.s3.amazonaws.com/photos/6187282/medium.jpeg?1486163386,,,,2,0,FALSE,,"California, US",San Clemente,32.85492118,-118.5404161,,29039,,obscured,TRUE,,,,Los Angeles,California,United States,California,Los Angeles,Xerarionta intercisa,Xerarionta intercisa,Plain Cactus Snail,Mollusca,115078,Mollusca,Gastropoda,Stylommatophora,Helminthoglyptidae,,
iNaturalist,7670592,4/12/1988,4/12/1988 0:00,,,,,,,Pacific Time (US & Canada),12809,cedric_lee,2017-08-27 11:05:31 +0300,2020-02-25 00:31:45 +0300,research,CC-BY-NC,https://www.inaturalist.org/observations/7670592,https://static.inaturalist.org/photos/10044387/medium.jpeg?1503821049,,,"This shell is from NHMLA's malacology collection.
",3,0,FALSE,,"Los Angeles County, US-CA, US",San Clemente,33.00590489,-118.5573013,141,29012,,obscured,TRUE,,,,Los Angeles,California,United States,California,Los Angeles,Plain Cactus Snail,Xerarionta intercisa,Plain Cactus Snail,Mollusca,115078,Mollusca,Gastropoda,Stylommatophora,Helminthoglyptidae,,
iNaturalist,7834695,12/1/1935,12/1/1935 0:00,,,,,,,Pacific Time (US & Canada),84767,tlawson,2017-09-08 20:34:52 +0300,2021-03-11 22:50:00 +0300,research,,https://www.inaturalist.org/observations/7834695,https://static.inaturalist.org/photos/11164498/medium.jpg?1507943005,,,From an old collection. Collected by C. & C. Martin on San Clemente Island in December 1935.,2,0,FALSE,3,"California, US",San Clemente,32.94710909,-118.5371899,2065,29039,,obscured,TRUE,,,,Los Angeles,California,United States,California,Los Angeles,Plain Cactus Snail,Xerarionta intercisa,Plain Cactus Snail,Mollusca,115078,Mollusca,Gastropoda,Stylommatophora,Helminthoglyptidae,,
iNaturalist,7834747,Fri Sep 08 2017 09:53:37 GMT-0700 (PDT),9/8/2017 0:00,9/8/2017,2017,9,8,19:53:37,300,Pacific Time (US & Canada),84767,tlawson,2017-09-08 20:40:06 +0300,2017-11-03 20:36:34 +0300,research,,https://www.inaturalist.org/observations/7834747,https://static.inaturalist.org/photos/11436759/medium.jpg?1509031624,,,From an old collection. Xerarionta intercisa var minor. Collected by Henry Hemphill on San Clemente Island. ,1,0,FALSE,3,"California, US",San Clemente,32.96398382,-118.5036888,4415,29025,,obscured,TRUE,,,,Los Angeles,California,United States,California,Los Angeles,Plain Cactus Snail,Xerarionta intercisa,Plain Cactus Snail,Mollusca,115078,Mollusca,Gastropoda,Stylommatophora,Helminthoglyptidae,,
iNaturalist,12395526,Sat May 12 2018 09:19:06 GMT-0700 (PDT),5/12/2018 0:00,5/12/2018,2018,5,12,19:19:06,300,Pacific Time (US & Canada),213838,vireolanius,2018-05-13 01:21:54 +0300,2020-02-27 20:33:18 +0300,research,CC-BY-NC,https://www.inaturalist.org/observations/12395526,https://inaturalist-open-data.s3.amazonaws.com/photos/17865241/medium.jpg?1526163731,,,,2,0,FALSE,3,"California, US",San Clemente,32.89309113,-118.5245199,5,29039,,obscured,TRUE,,,,Los Angeles,California,United States,California,Los Angeles,Plain Cactus Snail,Xerarionta intercisa,Plain Cactus Snail,Mollusca,115078,Mollusca,Gastropoda,Stylommatophora,Helminthoglyptidae,,
iNaturalist,17976368,2018/10/29 2:45 PM PDT,10/29/2018 0:00,10/30/2018,2018,10,30,0:45:00,300,Pacific Time (US & Canada),724795,jim_carretta,2018-10-31 03:53:05 +0300,2020-03-16 02:38:45 +0300,research,CC-BY-NC,https://www.inaturalist.org/observations/17976368,https://inaturalist-open-data.s3.amazonaws.com/photos/27475628/medium.jpeg?1540946983,,,,1,0,FALSE,,"California, US",San Clemente,32.80466969,-118.4476513,,29039,,obscured,TRUE,,,,Los Angeles,California,United States,California,Los Angeles,Plain Cactus Snail,Xerarionta intercisa,Plain Cactus Snail,Mollusca,115078,Mollusca,Gastropoda,Stylommatophora,Helminthoglyptidae,,
iNaturalist,19196824,Mon Dec 24 2018 08:04:31 GMT-0800 (PST),12/24/2018 0:00,12/24/2018,2018,12,24,19:04:31,300,Pacific Time (US & Canada),213838,vireolanius,2018-12-24 20:57:35 +0300,2020-02-27 21:37:36 +0300,needs_id,CC-BY-NC,https://www.inaturalist.org/observations/19196824,https://inaturalist-open-data.s3.amazonaws.com/photos/29485772/medium.jpg?1545674266,,,,1,0,FALSE,3,"California, US",San Clemente,32.89171983,-118.523011,5,29039,,obscured,TRUE,,,,Los Angeles,California,United States,California,Los Angeles,Plain Cactus Snail,Xerarionta intercisa,Plain Cactus Snail,Mollusca,115078,Mollusca,Gastropoda,Stylommatophora,Helminthoglyptidae,,
iNaturalist,19497749,2019/01/06 1:29 PM PST,1/6/2019 0:00,1/7/2019,2019,1,7,0:29:00,300,Pacific Time (US & Canada),213838,vireolanius,2019-01-08 00:20:34 +0300,2020-02-27 20:33:15 +0300,research,CC-BY-NC,https://www.inaturalist.org/observations/19497749,https://inaturalist-open-data.s3.amazonaws.com/photos/30002534/medium.jpg?1546895953,,,,2,0,FALSE,,"Los Angeles County, US-CA, US",San Clemente,32.84943197,-118.4426473,34,29039,,obscured,TRUE,,manual,,Los Angeles,California,United States,California,Los Angeles,Plain Cactus Snail,Xerarionta intercisa,Plain Cactus Snail,Mollusca,115078,Mollusca,Gastropoda,Stylommatophora,Helminthoglyptidae,,
iNaturalist,20345466,Thu Feb 07 2019 09:09:01 GMT-0800 (PST),2/7/2019 0:00,2/7/2019,2019,2,7,20:09:01,300,Pacific Time (US & Canada),1474963,stephlbartlett,2019-02-14 19:51:23 +0300,2019-04-20 05:55:40 +0300,research,CC-BY-NC,https://www.inaturalist.org/observations/20345466,https://inaturalist-open-data.s3.amazonaws.com/photos/31415453/medium.jpg?1550163087,,,,2,0,FALSE,3,"California, US",San Clemente,32.81700373,-118.5130507,200,29039,,obscured,TRUE,,,,Los Angeles,California,United States,California,Los Angeles,Plain Cactus Snail,Xerarionta intercisa,Plain Cactus Snail,Mollusca,115078,Mollusca,Gastropoda,Stylommatophora,Helminthoglyptidae,,
iNaturalist,20370995,Fri Feb 15 2019 12:21:26 GMT-0800 (PST),2/15/2019 0:00,2/15/2019,2019,2,15,23:21:26,300,Pacific Time (US & Canada),266196,shrike2,2019-02-16 00:14:34 +0300,2020-02-25 00:38:31 +0300,research,CC-BY-NC-ND,https://www.inaturalist.org/observations/20370995,https://static.inaturalist.org/photos/31457264/medium.jpg?1550265520,,,,4,0,FALSE,3,"California, US",San Clemente,32.82650641,-118.5836929,5,29039,,obscured,TRUE,,,,Los Angeles,California,United States,California,Los Angeles,Plain Cactus Snail,Xerarionta intercisa,Plain Cactus Snail,Mollusca,115078,Mollusca,Gastropoda,Stylommatophora,Helminthoglyptidae,,
iNaturalist,20509320,Tue Feb 19 2019 17:21:56 GMT-0800 (PST),2/19/2019 0:00,2/20/2019,2019,2,20,4:21:56,300,Pacific Time (US & Canada),213838,vireolanius,2019-02-20 17:31:05 +0300,2020-02-27 20:33:18 +0300,research,CC-BY-NC,https://www.inaturalist.org/observations/20509320,https://inaturalist-open-data.s3.amazonaws.com/photos/31655909/medium.jpg?1550673086,,,,4,0,FALSE,3,"Los Angeles County, US-CA, US",San Clemente,32.97837795,-118.426065,5,29039,,obscured,TRUE,,,,Los Angeles,California,United States,California,Los Angeles,Plain Cactus Snail,Xerarionta intercisa,Plain Cactus Snail,Mollusca,115078,Mollusca,Gastropoda,Stylommatophora,Helminthoglyptidae,,
iNaturalist,20858240,Tue Feb 26 2019 12:56:46 GMT-0800 (PST),2/26/2019 0:00,2/26/2019,2019,2,26,23:56:46,300,Pacific Time (US & Canada),266196,shrike2,2019-03-01 22:48:07 +0300,2020-02-25 00:39:22 +0300,research,CC-BY-NC-ND,https://www.inaturalist.org/observations/20858240,https://static.inaturalist.org/photos/32178777/medium.jpg?1551469701,,,,2,0,FALSE,3,"California, US",San Clemente,32.98016788,-118.4074935,5,29039,,obscured,TRUE,,,,Los Angeles,California,United States,California,Los Angeles,Plain Cactus Snail,Xerarionta intercisa,Plain Cactus Snail,Mollusca,115078,Mollusca,Gastropoda,Stylommatophora,Helminthoglyptidae,,
iNaturalist,20858322,Tue Feb 26 2019 15:44:44 GMT-0800 (PST),2/26/2019 0:00,2/27/2019,2019,2,27,2:44:44,300,Pacific Time (US & Canada),266196,shrike2,2019-03-01 22:51:37 +0300,2020-02-25 00:38:33 +0300,research,CC-BY-NC-ND,https://www.inaturalist.org/observations/20858322,https://static.inaturalist.org/photos/32178924/medium.jpg?1551469906,,,,3,0,FALSE,3,"Los Angeles County, US-CA, US",San Clemente,33.01497702,-118.4473115,5,29012,,obscured,TRUE,,,,Los Angeles,California,United States,California,Los Angeles,Plain Cactus Snail,Xerarionta intercisa,Plain Cactus Snail,Mollusca,115078,Mollusca,Gastropoda,Stylommatophora,Helminthoglyptidae,,
iNaturalist,20858336,Thu Feb 28 2019 08:44:31 GMT-0800 (PST),2/28/2019 0:00,2/28/2019,2019,2,28,19:44:31,300,Pacific Time (US & Canada),266196,shrike2,2019-03-01 22:52:26 +0300,2020-02-25 00:37:30 +0300,research,CC-BY-NC-ND,https://www.inaturalist.org/observations/20858336,https://static.inaturalist.org/photos/32178978/medium.jpg?1551469957,,,,3,0,FALSE,3,"Los Angeles County, US-CA, US",San Clemente,33.02707843,-118.4808349,30,29012,,obscured,TRUE,,,,Los Angeles,California,United States,California,Los Angeles,Plain Cactus Snail,Xerarionta intercisa,Plain Cactus Snail,Mollusca,115078,Mollusca,Gastropoda,Stylommatophora,Helminthoglyptidae,,
iNaturalist,20859205,Fri Mar 01 2019 10:00:05 GMT-0800 (PST),3/1/2019 0:00,3/1/2019,2019,3,1,21:00:05,300,Pacific Time (US & Canada),213838,vireolanius,2019-03-01 23:35:59 +0300,2020-02-27 20:33:16 +0300,research,CC-BY-NC,https://www.inaturalist.org/observations/20859205,https://inaturalist-open-data.s3.amazonaws.com/photos/32180547/medium.jpg?1551472570,,,,4,0,FALSE,3,"California, US",San Clemente,32.85015249,-118.599591,5,29039,,obscured,TRUE,,,,Los Angeles,California,United States,California,Los Angeles,Plain Cactus Snail,Xerarionta intercisa,Plain Cactus Snail,Mollusca,115078,Mollusca,Gastropoda,Stylommatophora,Helminthoglyptidae,,
iNaturalist,20986845,Tue Mar 05 2019 08:06:36 GMT-0800 (PST),3/5/2019 0:00,3/5/2019,2019,3,5,19:06:36,300,Pacific Time (US & Canada),1474963,stephlbartlett,2019-03-06 06:19:52 +0300,2019-03-31 01:18:52 +0300,research,CC-BY-NC,https://www.inaturalist.org/observations/20986845,https://inaturalist-open-data.s3.amazonaws.com/photos/32411211/medium.jpg?1551842401,,,,4,0,FALSE,3,"California, US",San Clemente,32.92523817,-118.539528,10,29039,,obscured,TRUE,,,,Los Angeles,California,United States,California,Los Angeles,Plain Cactus Snail,Xerarionta intercisa,Plain Cactus Snail,Mollusca,115078,Mollusca,Gastropoda,Stylommatophora,Helminthoglyptidae,,
iNaturalist,21068706,Wed Mar 06 2019 16:14:15 GMT-0800 (PST),3/6/2019 0:00,3/7/2019,2019,3,7,3:14:15,300,Pacific Time (US & Canada),266196,shrike2,2019-03-09 04:32:23 +0300,2020-02-25 00:38:32 +0300,research,CC-BY-NC-ND,https://www.inaturalist.org/observations/21068706,https://static.inaturalist.org/photos/32552819/medium.jpg?1552095201,,,,3,0,FALSE,3,"Los Angeles County, US-CA, US",San Clemente,32.87372817,-118.5772436,5,29039,,obscured,TRUE,,,,Los Angeles,California,United States,California,Los Angeles,Plain Cactus Snail,Xerarionta intercisa,Plain Cactus Snail,Mollusca,115078,Mollusca,Gastropoda,Stylommatophora,Helminthoglyptidae,,
iNaturalist,21069394,Fri Mar 08 2019 13:22:01 GMT-0800 (PST),3/8/2019 0:00,3/9/2019,2019,3,9,0:22:01,300,Pacific Time (US & Canada),266196,shrike2,2019-03-09 05:11:51 +0300,2020-02-25 00:38:13 +0300,research,CC-BY-NC-ND,https://www.inaturalist.org/observations/21069394,https://static.inaturalist.org/photos/32554555/medium.jpg?1552097541,,,,3,0,FALSE,3,"California, US",San Clemente,32.94301265,-118.4018885,5,29039,,obscured,TRUE,,,,Los Angeles,California,United States,California,Los Angeles,Plain Cactus Snail,Xerarionta intercisa,Plain Cactus Snail,Mollusca,115078,Mollusca,Gastropoda,Stylommatophora,Helminthoglyptidae,,
iNaturalist,21094350,Sat Mar 09 2019 13:23:46 GMT-0800 (PST),3/9/2019 0:00,3/10/2019,2019,3,10,0:23:46,300,Pacific Time (US & Canada),266196,shrike2,2019-03-10 02:15:22 +0300,2020-02-25 00:38:14 +0300,research,CC-BY-NC-ND,https://www.inaturalist.org/observations/21094350,https://static.inaturalist.org/photos/32598675/medium.jpg?1552173340,,,,3,0,FALSE,3,"California, US",San Clemente,32.81782006,-118.5415881,5,29039,,obscured,TRUE,,,,Los Angeles,California,United States,California,Los Angeles,Plain Cactus Snail,Xerarionta intercisa,Plain Cactus Snail,Mollusca,115078,Mollusca,Gastropoda,Stylommatophora,Helminthoglyptidae,,
iNaturalist,21230589,2019-03-02 8:57:00 AM PST,3/2/2019 0:00,3/2/2019,2019,3,2,19:57:00,300,Pacific Time (US & Canada),34488,pileated,2019-03-14 18:11:56 +0300,2020-04-23 21:20:54 +0300,needs_id,CC-BY,https://www.inaturalist.org/observations/21230589,https://inaturalist-open-data.s3.amazonaws.com/photos/32820110/medium.jpeg?1552576319,,,,0,0,FALSE,2,"Los Angeles County, US-CA, US",San Clemente,32.96654365,-118.5632289,9,29039,,obscured,TRUE,,,,Los Angeles,California,United States,California,Los Angeles,Plain Cactus Snail,Xerarionta intercisa,Plain Cactus Snail,Mollusca,115078,Mollusca,Gastropoda,Stylommatophora,Helminthoglyptidae,,
iNaturalist,21230598,2019-03-02 10:53:11 AM PST,3/2/2019 0:00,3/2/2019,2019,3,2,21:53:11,300,Pacific Time (US & Canada),34488,pileated,2019-03-14 18:12:21 +0300,2020-04-23 21:20:56 +0300,research,CC-BY,https://www.inaturalist.org/observations/21230598,https://inaturalist-open-data.s3.amazonaws.com/photos/32820137/medium.jpg?1552576346,,,Site 1,3,0,FALSE,2,"California, US",San Clemente,32.95254885,-118.56422,176,29039,,obscured,TRUE,gps,gps,,Los Angeles,California,United States,California,Los Angeles,Plain Cactus Snail,Xerarionta intercisa,Plain Cactus Snail,Mollusca,115078,Mollusca,Gastropoda,Stylommatophora,Helminthoglyptidae,,
iNaturalist,21230621,2019-03-02 4:48:07 PM PST,3/2/2019 0:00,3/3/2019,2019,3,3,3:48:07,300,Pacific Time (US & Canada),34488,pileated,2019-03-14 18:13:27 +0300,2020-04-23 21:20:49 +0300,needs_id,CC-BY,https://www.inaturalist.org/observations/21230621,https://inaturalist-open-data.s3.amazonaws.com/photos/32820197/medium.jpeg?1552576410,,,,0,0,FALSE,2,"Los Angeles County, US-CA, US",San Clemente,32.9088018,-118.4446159,,29039,,obscured,TRUE,gps,gps,,Los Angeles,California,United States,California,Los Angeles,Plain Cactus Snail,Xerarionta intercisa,Plain Cactus Snail,Mollusca,115078,Mollusca,Gastropoda,Stylommatophora,Helminthoglyptidae,,
iNaturalist,21230635,2019-03-02 4:59:27 PM PST,3/2/2019 0:00,3/3/2019,2019,3,3,3:59:27,300,Pacific Time (US & Canada),34488,pileated,2019-03-14 18:13:59 +0300,2020-04-23 21:20:54 +0300,needs_id,CC-BY,https://www.inaturalist.org/observations/21230635,https://inaturalist-open-data.s3.amazonaws.com/photos/32820234/medium.jpeg?1552576445,,,,0,0,FALSE,2,"Los Angeles County, US-CA, US",San Clemente,32.87569163,-118.4411606,,29039,,obscured,TRUE,gps,gps,,Los Angeles,California,United States,California,Los Angeles,Plain Cactus Snail,Xerarionta intercisa,Plain Cactus Snail,Mollusca,115078,Mollusca,Gastropoda,Stylommatophora,Helminthoglyptidae,,
iNaturalist,21230950,2019-03-06 3:25:27 PM PST,3/6/2019 0:00,3/7/2019,2019,3,7,2:25:27,300,Pacific Time (US & Canada),34488,pileated,2019-03-14 18:28:04 +0300,2020-04-23 21:20:53 +0300,research,CC-BY,https://www.inaturalist.org/observations/21230950,https://inaturalist-open-data.s3.amazonaws.com/photos/32820702/medium.jpeg?1552577287,,,,3,0,FALSE,2,"Los Angeles County, US-CA, US",San Clemente,32.89984318,-118.4865849,,29039,,obscured,TRUE,gps,gps,,Los Angeles,California,United States,California,Los Angeles,Plain Cactus Snail,Xerarionta intercisa,Plain Cactus Snail,Mollusca,115078,Mollusca,Gastropoda,Stylommatophora,Helminthoglyptidae,,
iNaturalist,21231342,2019-03-07 2:48:49 PM PST,3/7/2019 0:00,3/8/2019,2019,3,8,1:48:49,300,Pacific Time (US & Canada),34488,pileated,2019-03-14 18:43:06 +0300,2020-04-23 21:20:53 +0300,research,CC-BY,https://www.inaturalist.org/observations/21231342,https://inaturalist-open-data.s3.amazonaws.com/photos/32821303/medium.jpeg?1552578189,,,,2,0,FALSE,2,"California, US",San Clemente,32.92663168,-118.4687917,176,29039,,obscured,TRUE,gps,gps,,Los Angeles,California,United States,California,Los Angeles,Plain Cactus Snail,Xerarionta intercisa,Plain Cactus Snail,Mollusca,115078,Mollusca,Gastropoda,Stylommatophora,Helminthoglyptidae,,
iNaturalist,21260454,2019/02/19 5:07 PM PST,2/19/2019 0:00,2/20/2019,2019,2,20,4:07:00,300,Pacific Time (US & Canada),266196,shrike2,2019-03-15 19:39:56 +0300,2020-02-25 00:38:40 +0300,research,CC-BY-NC-ND,https://www.inaturalist.org/observations/21260454,https://static.inaturalist.org/photos/32869588/medium.jpg?1552666530,,,,4,0,FALSE,,"Los Angeles County, US-CA, US",San Clemente,32.8048079,-118.5547017,67,29039,,obscured,TRUE,,,,Los Angeles,California,United States,California,Los Angeles,Plain Cactus Snail,Xerarionta intercisa,Plain Cactus Snail,Mollusca,115078,Mollusca,Gastropoda,Stylommatophora,Helminthoglyptidae,,
iNaturalist,21260461,2019/02/19 5:20 PM PST,2/19/2019 0:00,2/20/2019,2019,2,20,4:20:00,300,Pacific Time (US & Canada),266196,shrike2,2019-03-15 19:40:00 +0300,2020-02-25 00:38:42 +0300,research,CC-BY-NC-ND,https://www.inaturalist.org/observations/21260461,https://static.inaturalist.org/photos/32869659/medium.jpg?1552666623,,,,3,0,FALSE,,"Los Angeles County, US-CA, US",San Clemente,32.87857272,-118.5250634,,29039,,obscured,TRUE,,,,Los Angeles,California,United States,California,Los Angeles,Plain Cactus Snail,Xerarionta intercisa,Plain Cactus Snail,Mollusca,115078,Mollusca,Gastropoda,Stylommatophora,Helminthoglyptidae,,
iNaturalist,21263476,2019/01/06 2:23 PM PST,1/6/2019 0:00,1/7/2019,2019,1,7,1:23:00,300,Pacific Time (US & Canada),266196,shrike2,2019-03-15 21:33:57 +0300,2020-02-25 00:38:41 +0300,research,CC-BY-NC-ND,https://www.inaturalist.org/observations/21263476,https://static.inaturalist.org/photos/32874997/medium.jpg?1552674297,,,,2,0,FALSE,,"Los Angeles County, US-CA, US",San Clemente,32.97471295,-118.4227654,,29039,,obscured,TRUE,,,,Los Angeles,California,United States,California,Los Angeles,Plain Cactus Snail,Xerarionta intercisa,Plain Cactus Snail,Mollusca,115078,Mollusca,Gastropoda,Stylommatophora,Helminthoglyptidae,,
iNaturalist,21263484,2019/01/06 2:38 PM PST,1/6/2019 0:00,1/7/2019,2019,1,7,1:38:00,300,Pacific Time (US & Canada),266196,shrike2,2019-03-15 21:34:05 +0300,2020-02-25 00:38:39 +0300,research,CC-BY-NC-ND,https://www.inaturalist.org/observations/21263484,https://static.inaturalist.org/photos/32875107/medium.jpg?1552674437,,,,2,0,FALSE,,"Los Angeles County, US-CA, US",San Clemente,32.82713376,-118.5709766,,29039,,obscured,TRUE,,,,Los Angeles,California,United States,California,Los Angeles,Plain Cactus Snail,Xerarionta intercisa,Plain Cactus Snail,Mollusca,115078,Mollusca,Gastropoda,Stylommatophora,Helminthoglyptidae,,
iNaturalist,21278982,2019-03-02 8:56:46 AM PST,3/2/2019 0:00,,,,,,,Pacific Time (US & Canada),34488,pileated,2019-03-16 09:39:18 +0300,2020-04-23 21:20:42 +0300,research,CC-BY,https://www.inaturalist.org/observations/21278982,https://inaturalist-open-data.s3.amazonaws.com/photos/32901869/medium.jpeg?1552718361,,,,2,0,FALSE,2,"Los Angeles County, US-CA, US",San Clemente,32.88193326,-118.5332556,352,29039,,obscured,TRUE,gps,gps,,Los Angeles,California,United States,California,Los Angeles,Plain Cactus Snail,Xerarionta intercisa,Plain Cactus Snail,Mollusca,115078,Mollusca,Gastropoda,Stylommatophora,Helminthoglyptidae,,
iNaturalist,21278984,2019-03-02 8:55:51 AM PST,3/2/2019 0:00,,,,,,,Pacific Time (US & Canada),34488,pileated,2019-03-16 09:39:26 +0300,2020-04-23 21:20:54 +0300,research,CC-BY,https://www.inaturalist.org/observations/21278984,https://inaturalist-open-data.s3.amazonaws.com/photos/32901874/medium.jpeg?1552718370,,,,3,0,FALSE,2,"Los Angeles County, US-CA, US",San Clemente,32.82807228,-118.4852955,88,29039,,obscured,TRUE,gps,gps,,Los Angeles,California,United States,California,Los Angeles,Plain Cactus Snail,Xerarionta intercisa,Plain Cactus Snail,Mollusca,115078,Mollusca,Gastropoda,Stylommatophora,Helminthoglyptidae,,
iNaturalist,21759660,3/21/2019,3/21/2019 0:00,,,,,,,Pacific Time (US & Canada),12809,cedric_lee,2019-03-30 03:55:08 +0300,2020-07-02 06:54:14 +0300,research,CC-BY-NC,https://www.inaturalist.org/observations/21759660,https://inaturalist-open-data.s3.amazonaws.com/photos/33689814/medium.jpeg?1553895748,,,X. intercisa (left) compared to X. redimita (right),2,0,FALSE,,"Los Angeles County, US-CA, US",San Clemente,32.84298451,-118.5551544,,29039,obscured,obscured,TRUE,,,,Los Angeles,California,United States,California,Los Angeles,Plain Cactus Snail,Xerarionta intercisa,Plain Cactus Snail,Mollusca,115078,Mollusca,Gastropoda,Stylommatophora,Helminthoglyptidae,,
iNaturalist,21769797,3/22/2019,3/22/2019 0:00,,,,,,,Pacific Time (US & Canada),12809,cedric_lee,2019-03-30 10:38:05 +0300,2020-07-02 06:54:19 +0300,research,CC-BY-NC,https://www.inaturalist.org/observations/21769797,https://inaturalist-open-data.s3.amazonaws.com/photos/33715733/medium.jpeg?1553924323,,,,1,0,FALSE,,"California, US",San Clemente,32.83046664,-118.4508798,,29039,obscured,obscured,TRUE,,,,Los Angeles,California,United States,California,Los Angeles,Plain Cactus Snail,Xerarionta intercisa,Plain Cactus Snail,Mollusca,115078,Mollusca,Gastropoda,Stylommatophora,Helminthoglyptidae,,
iNaturalist,21786452,2019/03/22 3:11 PM PDT,3/22/2019 0:00,3/23/2019,2019,3,23,1:11:00,300,Pacific Time (US & Canada),12809,cedric_lee,2019-03-30 20:42:09 +0300,2021-01-11 23:38:20 +0300,research,CC-BY-NC,https://www.inaturalist.org/observations/21786452,https://inaturalist-open-data.s3.amazonaws.com/photos/33741641/medium.jpeg?1553964669,,,,3,0,FALSE,,"California, US",San Clemente,32.8761243,-118.4049245,,29039,obscured,obscured,TRUE,,,,Los Angeles,California,United States,California,Los Angeles,Plain Cactus Snail,Xerarionta intercisa,Plain Cactus Snail,Mollusca,115078,Mollusca,Gastropoda,Stylommatophora,Helminthoglyptidae,,
iNaturalist,21817628,2019/03/26 2:52 PM PDT,3/26/2019 0:00,3/27/2019,2019,3,27,0:52:00,300,Pacific Time (US & Canada),12809,cedric_lee,2019-03-31 09:24:26 +0300,2020-07-02 06:54:37 +0300,research,CC-BY-NC,https://www.inaturalist.org/observations/21817628,https://inaturalist-open-data.s3.amazonaws.com/photos/33797915/medium.jpeg?1554012756,,,,3,0,FALSE,,"Los Angeles County, US-CA, US",San Clemente,32.8293903,-118.5765859,,29039,obscured,obscured,TRUE,,,,Los Angeles,California,United States,California,Los Angeles,Plain Cactus Snail,Xerarionta intercisa,Plain Cactus Snail,Mollusca,115078,Mollusca,Gastropoda,Stylommatophora,Helminthoglyptidae,,
iNaturalist,21822889,2019/03/26 3:58 PM PDT,3/26/2019 0:00,3/27/2019,2019,3,27,1:58:00,300,Pacific Time (US & Canada),12809,cedric_lee,2019-03-31 15:33:38 +0300,2020-07-02 06:54:38 +0300,research,CC-BY-NC,https://www.inaturalist.org/observations/21822889,https://inaturalist-open-data.s3.amazonaws.com/photos/33806160/medium.jpeg?1554032919,,,,4,0,FALSE,,"Los Angeles County, US-CA, US",San Clemente,32.96664387,-118.5573426,,29039,obscured,obscured,TRUE,,,,Los Angeles,California,United States,California,Los Angeles,Plain Cactus Snail,Xerarionta intercisa,Plain Cactus Snail,Mollusca,115078,Mollusca,Gastropoda,Stylommatophora,Helminthoglyptidae,,
iNaturalist,21822896,2019/03/26 4:52 PM PDT,3/26/2019 0:00,3/27/2019,2019,3,27,2:52:00,300,Pacific Time (US & Canada),12809,cedric_lee,2019-03-31 15:33:42 +0300,2020-07-02 06:54:38 +0300,research,CC-BY-NC,https://www.inaturalist.org/observations/21822896,https://inaturalist-open-data.s3.amazonaws.com/photos/33806210/medium.jpeg?1554033011,,,,2,0,FALSE,,"Los Angeles County, US-CA, US",San Clemente,32.99449994,-118.5561594,111,29039,obscured,obscured,TRUE,,,,Los Angeles,California,United States,California,Los Angeles,Plain Cactus Snail,Xerarionta intercisa,Plain Cactus Snail,Mollusca,115078,Mollusca,Gastropoda,Stylommatophora,Helminthoglyptidae,,
iNaturalist,21822898,2019/03/26 4:57 PM PDT,3/26/2019 0:00,3/27/2019,2019,3,27,2:57:00,300,Pacific Time (US & Canada),12809,cedric_lee,2019-03-31 15:33:43 +0300,2020-07-02 06:54:39 +0300,research,CC-BY-NC,https://www.inaturalist.org/observations/21822898,https://inaturalist-open-data.s3.amazonaws.com/photos/33973802/medium.jpg?1554243158,,,X. redimita furthest to the left for comparison,3,0,FALSE,,"Los Angeles County, US-CA, US",San Clemente,32.92359367,-118.5581215,111,29039,obscured,obscured,TRUE,,,,Los Angeles,California,United States,California,Los Angeles,Plain Cactus Snail,Xerarionta intercisa,Plain Cactus Snail,Mollusca,115078,Mollusca,Gastropoda,Stylommatophora,Helminthoglyptidae,,
iNaturalist,21823949,2019/03/27 7:44 AM PDT,3/27/2019 0:00,3/27/2019,2019,3,27,17:44:00,300,Pacific Time (US & Canada),12809,cedric_lee,2019-03-31 16:19:42 +0300,2020-07-02 06:54:39 +0300,research,CC-BY-NC,https://www.inaturalist.org/observations/21823949,https://inaturalist-open-data.s3.amazonaws.com/photos/33807817/medium.jpeg?1554035924,,,,4,0,FALSE,,"California, US",San Clemente,32.92134351,-118.5232911,,29039,obscured,obscured,TRUE,,,,Los Angeles,California,United States,California,Los Angeles,Plain Cactus Snail,Xerarionta intercisa,Plain Cactus Snail,Mollusca,115078,Mollusca,Gastropoda,Stylommatophora,Helminthoglyptidae,,
iNaturalist,21823979,2019/03/27 8:25 AM PDT,3/27/2019 0:00,3/27/2019,2019,3,27,18:25:00,300,Pacific Time (US & Canada),12809,cedric_lee,2019-03-31 16:20:03 +0300,2020-07-02 06:54:42 +0300,research,CC-BY-NC,https://www.inaturalist.org/observations/21823979,https://inaturalist-open-data.s3.amazonaws.com/photos/33809134/medium.jpeg?1554037645,,,,4,0,FALSE,,"California, US",San Clemente,32.80117609,-118.4245429,,29039,obscured,obscured,TRUE,,,,Los Angeles,California,United States,California,Los Angeles,Plain Cactus Snail,Xerarionta intercisa,Plain Cactus Snail,Mollusca,115078,Mollusca,Gastropoda,Stylommatophora,Helminthoglyptidae,,
iNaturalist,21825515,2019/03/27 11:06 AM PDT,3/27/2019 0:00,3/27/2019,2019,3,27,21:06:00,300,Pacific Time (US & Canada),12809,cedric_lee,2019-03-31 17:16:50 +0300,2020-07-02 06:54:45 +0300,research,CC-BY-NC,https://www.inaturalist.org/observations/21825515,https://inaturalist-open-data.s3.amazonaws.com/photos/33810905/medium.jpeg?1554040114,,,,4,0,FALSE,,"California, US",San Clemente,32.92505385,-118.4668994,,29039,obscured,obscured,TRUE,,,,Los Angeles,California,United States,California,Los Angeles,Plain Cactus Snail,Xerarionta intercisa,Plain Cactus Snail,Mollusca,115078,Mollusca,Gastropoda,Stylommatophora,Helminthoglyptidae,,
iNaturalist,21825518,2019/03/27 11:07 AM PDT,3/27/2019 0:00,3/27/2019,2019,3,27,21:07:00,300,Pacific Time (US & Canada),12809,cedric_lee,2019-03-31 17:16:52 +0300,2020-07-02 06:54:46 +0300,research,CC-BY-NC,https://www.inaturalist.org/observations/21825518,https://inaturalist-open-data.s3.amazonaws.com/photos/33810927/medium.jpeg?1554040130,,,,4,0,FALSE,,"California, US",San Clemente,32.91519791,-118.4243732,,29039,obscured,obscured,TRUE,,,,Los Angeles,California,United States,California,Los Angeles,Plain Cactus Snail,Xerarionta intercisa,Plain Cactus Snail,Mollusca,115078,Mollusca,Gastropoda,Stylommatophora,Helminthoglyptidae,,
iNaturalist,21825524,2019/03/27 11:15 AM PDT,3/27/2019 0:00,3/27/2019,2019,3,27,21:15:00,300,Pacific Time (US & Canada),12809,cedric_lee,2019-03-31 17:16:59 +0300,2020-07-02 06:54:46 +0300,research,CC-BY-NC,https://www.inaturalist.org/observations/21825524,https://inaturalist-open-data.s3.amazonaws.com/photos/33810973/medium.jpeg?1554040172,,,,4,0,FALSE,,"California, US",San Clemente,32.83122428,-118.5727656,,29039,obscured,obscured,TRUE,,,,Los Angeles,California,United States,California,Los Angeles,Plain Cactus Snail,Xerarionta intercisa,Plain Cactus Snail,Mollusca,115078,Mollusca,Gastropoda,Stylommatophora,Helminthoglyptidae,,
iNaturalist,21825548,2019/03/27 12:16 PM PDT,3/27/2019 0:00,3/27/2019,2019,3,27,22:16:00,300,Pacific Time (US & Canada),12809,cedric_lee,2019-03-31 17:17:17 +0300,2020-07-02 06:54:48 +0300,research,CC-BY-NC,https://www.inaturalist.org/observations/21825548,https://inaturalist-open-data.s3.amazonaws.com/photos/33811318/medium.jpeg?1554040629,,,,3,0,FALSE,,"California, US",San Clemente,32.89276795,-118.4974037,15,29039,obscured,obscured,TRUE,,,,Los Angeles,California,United States,California,Los Angeles,Plain Cactus Snail,Xerarionta intercisa,Plain Cactus Snail,Mollusca,115078,Mollusca,Gastropoda,Stylommatophora,Helminthoglyptidae,,
iNaturalist,21829459,2019-03-21 5:06:19 PM PDT,3/21/2019 0:00,3/22/2019,2019,3,22,3:06:19,300,Pacific Time (US & Canada),34488,pileated,2019-03-31 19:06:48 +0300,2020-04-23 21:20:55 +0300,research,CC-BY,https://www.inaturalist.org/observations/21829459,https://inaturalist-open-data.s3.amazonaws.com/photos/33818567/medium.jpeg?1554048411,,,Juvenile Xerarionta aestivating under Opuntia litter,2,0,FALSE,2,"Los Angeles County, US-CA, US",San Clemente,32.94087106,-118.4104378,,29039,,obscured,TRUE,gps,gps,,Los Angeles,California,United States,California,Los Angeles,Plain Cactus Snail,Xerarionta intercisa,Plain Cactus Snail,Mollusca,115078,Mollusca,Gastropoda,Stylommatophora,Helminthoglyptidae,,
iNaturalist,21908434,2019/03/28 10:36 AM PDT,3/28/2019 0:00,3/28/2019,2019,3,28,20:36:00,300,Pacific Time (US & Canada),12809,cedric_lee,2019-04-02 17:08:50 +0300,2020-07-02 06:54:53 +0300,research,CC-BY-NC,https://www.inaturalist.org/observations/21908434,https://inaturalist-open-data.s3.amazonaws.com/photos/33947227/medium.jpeg?1554212764,,,,1,0,FALSE,,"California, US",San Clemente,32.84614466,-118.535628,,29039,obscured,obscured,TRUE,,,,Los Angeles,California,United States,California,Los Angeles,Plain Cactus Snail,Xerarionta intercisa,Plain Cactus Snail,Mollusca,115078,Mollusca,Gastropoda,Stylommatophora,Helminthoglyptidae,,
iNaturalist,21908470,2019/03/28 12:06 PM PDT,3/28/2019 0:00,3/28/2019,2019,3,28,22:06:00,300,Pacific Time (US & Canada),12809,cedric_lee,2019-04-02 17:09:07 +0300,2020-07-02 06:54:54 +0300,research,CC-BY-NC,https://www.inaturalist.org/observations/21908470,https://inaturalist-open-data.s3.amazonaws.com/photos/33947404/medium.jpeg?1554212948,,,,3,0,FALSE,,"California, US",San Clemente,32.89075224,-118.4101972,,29039,obscured,obscured,TRUE,,,,Los Angeles,California,United States,California,Los Angeles,Plain Cactus Snail,Xerarionta intercisa,Plain Cactus Snail,Mollusca,115078,Mollusca,Gastropoda,Stylommatophora,Helminthoglyptidae,,
iNaturalist,22055797,Fri Apr 05 2019 09:25:46 GMT-0700 (PDT),4/5/2019 0:00,4/5/2019,2019,4,5,19:25:46,300,Pacific Time (US & Canada),266196,shrike2,2019-04-06 00:27:24 +0300,2020-02-25 00:39:24 +0300,research,CC-BY-NC-ND,https://www.inaturalist.org/observations/22055797,https://static.inaturalist.org/photos/34156479/medium.jpg?1554499656,,,,1,0,FALSE,3,"California, US",San Clemente,32.94483279,-118.5441526,5,29039,,obscured,TRUE,,,,Los Angeles,California,United States,California,Los Angeles,Plain Cactus Snail,Xerarionta intercisa,Plain Cactus Snail,Mollusca,115078,Mollusca,Gastropoda,Stylommatophora,Helminthoglyptidae,,
iNaturalist,22576246,Tue Apr 16 2019 09:34:34 GMT-0700 (PDT),4/16/2019 0:00,4/16/2019,2019,4,16,19:34:34,300,Pacific Time (US & Canada),246499,sulavanderplank,2019-04-17 00:16:29 +0300,2020-02-27 21:25:07 +0300,research,CC-BY,https://www.inaturalist.org/observations/22576246,https://static.inaturalist.org/photos/34978276/medium.jpg?1555449400,,,,3,1,FALSE,3,"California, US",San Clemente,32.98788464,-118.4551769,5,29039,,obscured,TRUE,,,,Los Angeles,California,United States,California,Los Angeles,Plain Cactus Snail,Xerarionta intercisa,Plain Cactus Snail,Mollusca,115078,Mollusca,Gastropoda,Stylommatophora,Helminthoglyptidae,,
iNaturalist,22576258,Tue Apr 16 2019 09:47:18 GMT-0700 (PDT),4/16/2019 0:00,4/16/2019,2019,4,16,19:47:18,300,Pacific Time (US & Canada),246499,sulavanderplank,2019-04-17 00:16:47 +0300,2019-04-22 02:29:48 +0300,research,CC-BY,https://www.inaturalist.org/observations/22576258,https://static.inaturalist.org/photos/34979930/medium.jpg?1555450540,,,,2,0,FALSE,3,"California, US",San Clemente,32.87331414,-118.4522937,5,29039,,obscured,TRUE,,,,Los Angeles,California,United States,California,Los Angeles,Plain Cactus Snail,Xerarionta intercisa,Plain Cactus Snail,Mollusca,115078,Mollusca,Gastropoda,Stylommatophora,Helminthoglyptidae,,
iNaturalist,22664363,2019-04-17 1:23:17 PM PDT,4/17/2019 0:00,4/17/2019,2019,4,17,23:23:17,300,Pacific Time (US & Canada),1577275,demi5,2019-04-18 19:57:53 +0300,2020-04-23 03:24:13 +0300,research,,https://www.inaturalist.org/observations/22664363,https://static.inaturalist.org/photos/35117012/medium.jpeg?1555606676,,,L21.8,2,0,FALSE,2,"California, US",San Clemente,32.94380135,-118.5260429,8,29039,,obscured,TRUE,,,,Los Angeles,California,United States,California,Los Angeles,Plain Cactus Snail,Xerarionta intercisa,Plain Cactus Snail,Mollusca,115078,Mollusca,Gastropoda,Stylommatophora,Helminthoglyptidae,,
iNaturalist,22733023,Wed Apr 17 2019 08:31:30 GMT-0700 (PDT),4/17/2019 0:00,4/17/2019,2019,4,17,18:31:30,300,Pacific Time (US & Canada),266196,shrike2,2019-04-20 03:13:12 +0300,2020-02-25 00:38:50 +0300,research,CC-BY-NC-ND,https://www.inaturalist.org/observations/22733023,https://static.inaturalist.org/photos/35228684/medium.jpg?1555719311,,,,2,0,FALSE,3,"California, US",San Clemente,32.94879389,-118.5681495,5,29039,,obscured,TRUE,,,,Los Angeles,California,United States,California,Los Angeles,Plain Cactus Snail,Xerarionta intercisa,Plain Cactus Snail,Mollusca,115078,Mollusca,Gastropoda,Stylommatophora,Helminthoglyptidae,,
iNaturalist,22868812,2019-04-10 4:04:20 PM PDT,4/10/2019 0:00,4/11/2019,2019,4,11,2:04:20,300,Pacific Time (US & Canada),34488,pileated,2019-04-22 09:14:11 +0300,2020-04-23 21:20:52 +0300,research,CC-BY,https://www.inaturalist.org/observations/22868812,https://inaturalist-open-data.s3.amazonaws.com/photos/35448261/medium.jpeg?1555913655,,,"The top ones, X. intercisa.",2,0,FALSE,2,"Los Angeles County, US-CA, US",San Clemente,32.90070861,-118.5331868,,29039,,obscured,TRUE,gps,gps,,Los Angeles,California,United States,California,Los Angeles,Plain Cactus Snail,Xerarionta intercisa,Plain Cactus Snail,Mollusca,115078,Mollusca,Gastropoda,Stylommatophora,Helminthoglyptidae,,
iNaturalist,23039166,2019-04-16 11:31:30 AM PDT,4/16/2019 0:00,4/16/2019,2019,4,16,21:31:30,300,Pacific Time (US & Canada),34488,pileated,2019-04-25 09:32:41 +0300,2020-04-23 21:06:51 +0300,research,CC-BY,https://www.inaturalist.org/observations/23039166,https://inaturalist-open-data.s3.amazonaws.com/photos/35716812/medium.jpeg?1556173967,,,,3,0,FALSE,2,"Los Angeles County, US-CA, US",San Clemente,32.97857594,-118.5111151,,29039,,obscured,TRUE,gps,gps,,Los Angeles,California,United States,California,Los Angeles,Plain Cactus Snail,Xerarionta intercisa,Plain Cactus Snail,Mollusca,115078,Mollusca,Gastropoda,Stylommatophora,Helminthoglyptidae,,
iNaturalist,24381035,Thu Apr 25 2019 14:47:01 GMT-1000 (HST),4/25/2019 0:00,4/26/2019,2019,4,26,3:47:01,300,Hawaii,903501,dmlawson,2019-05-02 20:20:15 +0300,2019-12-31 10:52:07 +0300,research,,https://www.inaturalist.org/observations/24381035,https://static.inaturalist.org/photos/37699420/medium.jpg?1556817622,,,,3,0,FALSE,3,"California, US",San Clemente,32.84566771,-118.4943398,5,29039,,obscured,TRUE,,,,Los Angeles,California,United States,California,Los Angeles,Plain Cactus Snail,Xerarionta intercisa,Plain Cactus Snail,Mollusca,115078,Mollusca,Gastropoda,Stylommatophora,Helminthoglyptidae,,
iNaturalist,25096874,2019-05-04 5:22:42 PM PDT,5/4/2019 0:00,5/5/2019,2019,5,5,3:22:42,300,Pacific Time (US & Canada),34488,pileated,2019-05-14 08:18:39 +0300,2020-04-23 21:06:50 +0300,research,CC-BY,https://www.inaturalist.org/observations/25096874,https://inaturalist-open-data.s3.amazonaws.com/photos/38842367/medium.jpeg?1557811123,,,,3,0,FALSE,2,"Los Angeles County, US-CA, US",San Clemente,32.94863441,-118.4842553,,29039,,obscured,TRUE,gps,gps,,Los Angeles,California,United States,California,Los Angeles,Plain Cactus Snail,Xerarionta intercisa,Plain Cactus Snail,Mollusca,115078,Mollusca,Gastropoda,Stylommatophora,Helminthoglyptidae,,
iNaturalist,28220213,2019-06-21 10:25:11 AM PDT,6/21/2019 0:00,6/21/2019,2019,6,21,20:25:11,300,Pacific Time (US & Canada),34488,pileated,2019-07-05 10:43:00 +0300,2020-04-23 20:59:57 +0300,research,CC-BY,https://www.inaturalist.org/observations/28220213,https://inaturalist-open-data.s3.amazonaws.com/photos/43976323/medium.jpg?1562312582,,,,3,0,FALSE,2,"Los Angeles County, US-CA, US",San Clemente,32.82289311,-118.585143,44,29039,,obscured,TRUE,gps,gps,,Los Angeles,California,United States,California,Los Angeles,Plain Cactus Snail,Xerarionta intercisa,Plain Cactus Snail,Mollusca,115078,Mollusca,Gastropoda,Stylommatophora,Helminthoglyptidae,,
iNaturalist,28243962,Fri Jul 05 2019 11:01:47 GMT-0700 (PDT),7/5/2019 0:00,7/5/2019,2019,7,5,21:01:47,300,Pacific Time (US & Canada),1474963,stephlbartlett,2019-07-05 21:31:55 +0300,2019-12-31 05:28:12 +0300,research,CC-BY-NC,https://www.inaturalist.org/observations/28243962,https://inaturalist-open-data.s3.amazonaws.com/photos/44014376/medium.jpg?1562351586,,,,4,0,FALSE,3,"Los Angeles County, US-CA, US",San Clemente,32.9064961,-118.5355191,5,29039,,obscured,TRUE,,,,Los Angeles,California,United States,California,Los Angeles,Plain Cactus Snail,Xerarionta intercisa,Plain Cactus Snail,Mollusca,115078,Mollusca,Gastropoda,Stylommatophora,Helminthoglyptidae,,
iNaturalist,28252594,2019-06-28 1:51:01 PM PDT,6/28/2019 0:00,6/28/2019,2019,6,28,23:51:01,300,Pacific Time (US & Canada),34488,pileated,2019-07-06 00:10:14 +0300,2020-04-23 20:59:59 +0300,research,CC-BY,https://www.inaturalist.org/observations/28252594,https://inaturalist-open-data.s3.amazonaws.com/photos/44028944/medium.jpg?1562361018,,,,3,0,FALSE,2,"Los Angeles County, US-CA, US",San Clemente,32.94776865,-118.4049726,,29039,,obscured,TRUE,gps,gps,,Los Angeles,California,United States,California,Los Angeles,Plain Cactus Snail,Xerarionta intercisa,Plain Cactus Snail,Mollusca,115078,Mollusca,Gastropoda,Stylommatophora,Helminthoglyptidae,,
iNaturalist,29657259,Sat Jul 27 2019 08:45:12 GMT-0700 (PDT),7/27/2019 0:00,7/27/2019,2019,7,27,18:45:12,300,Pacific Time (US & Canada),266196,shrike2,2019-07-27 22:34:15 +0300,2020-02-25 00:39:06 +0300,research,CC-BY-NC-ND,https://www.inaturalist.org/observations/29657259,https://static.inaturalist.org/photos/46294150/medium.jpg?1564256073,,,,2,0,FALSE,3,"California, US",San Clemente,32.80183525,-118.4679559,5,29039,,obscured,TRUE,,,,Los Angeles,California,United States,California,Los Angeles,Plain Cactus Snail,Xerarionta intercisa,Plain Cactus Snail,Mollusca,115078,Mollusca,Gastropoda,Stylommatophora,Helminthoglyptidae,,
iNaturalist,29928926,2019-03-27 9:16:24 AM PDT,3/27/2019 0:00,3/27/2019,2019,3,27,19:16:24,300,Pacific Time (US & Canada),34488,pileated,2019-07-31 20:50:08 +0300,2020-04-23 20:59:59 +0300,research,CC-BY,https://www.inaturalist.org/observations/29928926,https://inaturalist-open-data.s3.amazonaws.com/photos/46734678/medium.jpeg?1564595411,,,SBBG-SCl-TIC_000155,3,0,FALSE,2,"California, US",San Clemente,32.91975279,-118.4584755,176,29039,,obscured,TRUE,gps,gps,,Los Angeles,California,United States,California,Los Angeles,Plain Cactus Snail,Xerarionta intercisa,Plain Cactus Snail,Mollusca,115078,Mollusca,Gastropoda,Stylommatophora,Helminthoglyptidae,,
iNaturalist,30820161,Wed Aug 14 2019 08:17:25 GMT-0700 (PDT),8/14/2019 0:00,8/14/2019,2019,8,14,18:17:25,300,Pacific Time (US & Canada),266196,shrike2,2019-08-14 20:20:25 +0300,2020-02-25 00:39:10 +0300,research,CC-BY-NC-ND,https://www.inaturalist.org/observations/30820161,https://static.inaturalist.org/photos/48174654/medium.jpg?1565803276,,,,2,0,FALSE,3,"Los Angeles County, US-CA, US",San Clemente,33.08951485,-118.57492,5,29012,,obscured,TRUE,,,,Los Angeles,California,United States,California,Los Angeles,Plain Cactus Snail,Xerarionta intercisa,Plain Cactus Snail,Mollusca,115078,Mollusca,Gastropoda,Stylommatophora,Helminthoglyptidae,,
iNaturalist,31154403,Thu Aug 15 2019 11:36:50 GMT-0700 (PDT),8/15/2019 0:00,8/15/2019,2019,8,15,21:36:50,300,Pacific Time (US & Canada),246499,sulavanderplank,2019-08-20 05:06:54 +0300,2019-12-30 10:37:38 +0300,research,CC-BY,https://www.inaturalist.org/observations/31154403,https://static.inaturalist.org/photos/48733266/medium.jpg?1566267169,,,,3,0,FALSE,3,"California, US",San Clemente,32.80153841,-118.5644418,5,29039,,obscured,TRUE,,,,Los Angeles,California,United States,California,Los Angeles,Plain Cactus Snail,Xerarionta intercisa,Plain Cactus Snail,Mollusca,115078,Mollusca,Gastropoda,Stylommatophora,Helminthoglyptidae,,
iNaturalist,35925142,Thu Nov 21 2019 11:52:47 GMT-0800 (PST),11/21/2019 0:00,11/21/2019,2019,11,21,22:52:47,300,Pacific Time (US & Canada),266196,shrike2,2019-11-21 22:53:46 +0300,2020-02-25 00:37:38 +0300,research,CC-BY-NC-ND,https://www.inaturalist.org/observations/35925142,https://static.inaturalist.org/photos/56713853/medium.jpg?1574366038,,,,2,0,FALSE,3,"Los Angeles County, US-CA, US",San Clemente,32.80104502,-118.453814,5,29039,,obscured,TRUE,,,,Los Angeles,California,United States,California,Los Angeles,Plain Cactus Snail,Xerarionta intercisa,Plain Cactus Snail,Mollusca,115078,Mollusca,Gastropoda,Stylommatophora,Helminthoglyptidae,,
iNaturalist,36300342,Mon Dec 02 2019 11:02:17 GMT-0800 (PST),12/2/2019 0:00,12/2/2019,2019,12,2,22:02:17,300,Pacific Time (US & Canada),266196,shrike2,2019-12-03 01:16:42 +0300,2020-02-25 00:38:17 +0300,research,CC-BY-NC-ND,https://www.inaturalist.org/observations/36300342,https://static.inaturalist.org/photos/57365194/medium.jpg?1575325055,,,,2,0,FALSE,3,"California, US",San Clemente,32.99152602,-118.4521169,5,29039,,obscured,TRUE,,,,Los Angeles,California,United States,California,Los Angeles,Plain Cactus Snail,Xerarionta intercisa,Plain Cactus Snail,Mollusca,115078,Mollusca,Gastropoda,Stylommatophora,Helminthoglyptidae,,
iNaturalist,36416296,2019/12/06 10:27 AM PST,12/6/2019 0:00,12/6/2019,2019,12,6,21:27:00,300,Pacific Time (US & Canada),23091,sue_meiman,2019-12-07 01:03:43 +0300,2020-02-27 21:09:20 +0300,research,CC-BY-NC,https://www.inaturalist.org/observations/36416296,https://inaturalist-open-data.s3.amazonaws.com/photos/57562533/medium.jpg?1575669677,,,,3,0,FALSE,,"California, US",San Clemente,32.93033604,-118.5637242,109,29039,,obscured,TRUE,,,,Los Angeles,California,United States,California,Los Angeles,Plain Cactus Snail,Xerarionta intercisa,Plain Cactus Snail,Mollusca,115078,Mollusca,Gastropoda,Stylommatophora,Helminthoglyptidae,,
iNaturalist,36829222,Sat Dec 21 2019 10:22:19 GMT-0800 (PST),12/21/2019 0:00,12/21/2019,2019,12,21,21:22:19,300,Pacific Time (US & Canada),266196,shrike2,2019-12-21 21:28:03 +0300,2020-02-25 00:39:07 +0300,research,CC-BY-NC-ND,https://www.inaturalist.org/observations/36829222,https://static.inaturalist.org/photos/58282837/medium.jpg?1576952886,,,,1,0,FALSE,3,"Los Angeles County, US-CA, US",San Clemente,33.09265665,-118.5306407,5,29012,,obscured,TRUE,,,,Los Angeles,California,United States,California,Los Angeles,Plain Cactus Snail,Xerarionta intercisa,Plain Cactus Snail,Mollusca,115078,Mollusca,Gastropoda,Stylommatophora,Helminthoglyptidae,,
iNaturalist,37031872,2019/12/04 12:42 PM PST,12/4/2019 0:00,12/4/2019,2019,12,4,23:42:00,300,Pacific Time (US & Canada),266196,shrike2,2019-12-28 19:03:28 +0300,2020-02-25 00:39:03 +0300,research,CC-BY-NC-ND,https://www.inaturalist.org/observations/37031872,https://static.inaturalist.org/photos/58638161/medium.jpg?1577548281,,,,2,0,FALSE,,"Los Angeles County, US-CA, US",San Clemente,32.83959745,-118.438901,31,29039,,obscured,TRUE,,,,Los Angeles,California,United States,California,Los Angeles,Plain Cactus Snail,Xerarionta intercisa,Plain Cactus Snail,Mollusca,115078,Mollusca,Gastropoda,Stylommatophora,Helminthoglyptidae,,
iNaturalist,37077059,Sun Dec 29 2019 11:03:45 GMT-0800 (PST),12/29/2019 0:00,12/29/2019,2019,12,29,22:03:45,300,Pacific Time (US & Canada),266196,shrike2,2019-12-30 00:35:40 +0300,2020-02-25 00:39:04 +0300,research,CC-BY-NC-ND,https://www.inaturalist.org/observations/37077059,https://static.inaturalist.org/photos/58717863/medium.jpg?1577655362,,,,1,0,FALSE,3,"California, US",San Clemente,32.830471,-118.414523,5,29039,,obscured,TRUE,,,,Los Angeles,California,United States,California,Los Angeles,Plain Cactus Snail,Xerarionta intercisa,Plain Cactus Snail,Mollusca,115078,Mollusca,Gastropoda,Stylommatophora,Helminthoglyptidae,,
iNaturalist,37175845,2020/01/01 11:10 AM PST,1/1/2020 0:00,1/1/2020,2020,1,1,22:10:00,300,Pacific Time (US & Canada),266196,shrike2,2020-01-02 03:11:21 +0300,2020-02-25 00:38:44 +0300,research,CC-BY-NC-ND,https://www.inaturalist.org/observations/37175845,https://static.inaturalist.org/photos/58890488/medium.jpg?1577923859,,,,1,0,FALSE,,"California, US",San Clemente,32.91766695,-118.5472391,,29039,,obscured,TRUE,,,,Los Angeles,California,United States,California,Los Angeles,Plain Cactus Snail,Xerarionta intercisa,Plain Cactus Snail,Mollusca,115078,Mollusca,Gastropoda,Stylommatophora,Helminthoglyptidae,,
iNaturalist,37177015,Wed Jan 01 2020 13:17:52 GMT-0800 (PST),1/1/2020 0:00,1/2/2020,2020,1,2,0:17:52,300,Pacific Time (US & Canada),266196,shrike2,2020-01-02 03:50:08 +0300,2020-02-25 00:38:45 +0300,research,CC-BY-NC-ND,https://www.inaturalist.org/observations/37177015,https://static.inaturalist.org/photos/58892775/medium.jpg?1577926231,,,,1,0,FALSE,3,"Los Angeles County, US-CA, US",San Clemente,33.05285594,-118.4990492,5,29012,,obscured,TRUE,,,,Los Angeles,California,United States,California,Los Angeles,Plain Cactus Snail,Xerarionta intercisa,Plain Cactus Snail,Mollusca,115078,Mollusca,Gastropoda,Stylommatophora,Helminthoglyptidae,,
iNaturalist,37442205,Thu Jan 09 2020 12:14:38 GMT-0800 (PST),1/9/2020 0:00,1/9/2020,2020,1,9,23:14:38,300,Pacific Time (US & Canada),12809,cedric_lee,2020-01-10 03:43:46 +0300,2020-07-02 06:53:17 +0300,research,CC-BY-NC,https://www.inaturalist.org/observations/37442205,https://inaturalist-open-data.s3.amazonaws.com/photos/59356995/medium.jpg?1578617081,,,,1,0,FALSE,3,"California, US",San Clemente,32.84178048,-118.5593616,9,29039,,obscured,TRUE,,,,Los Angeles,California,United States,California,Los Angeles,,Xerarionta intercisa,Plain Cactus Snail,Mollusca,115078,Mollusca,Gastropoda,Stylommatophora,Helminthoglyptidae,,
iNaturalist,37465656,Fri Jan 10 2020 09:06:33 GMT-0800 (PST),1/10/2020 0:00,1/10/2020,2020,1,10,20:06:33,300,Pacific Time (US & Canada),266196,shrike2,2020-01-11 00:23:25 +0300,2020-02-25 00:39:43 +0300,research,CC-BY-NC-ND,https://www.inaturalist.org/observations/37465656,https://static.inaturalist.org/photos/59398219/medium.jpg?1578691415,,,,1,0,FALSE,3,"California, US",San Clemente,32.88816361,-118.4372301,10,29039,,obscured,TRUE,,,,Los Angeles,California,United States,California,Los Angeles,Plain Cactus Snail,Xerarionta intercisa,Plain Cactus Snail,Mollusca,115078,Mollusca,Gastropoda,Stylommatophora,Helminthoglyptidae,,
iNaturalist,37470062,Fri Jan 10 2020 08:07:13 GMT-0800 (PST),1/10/2020 0:00,1/10/2020,2020,1,10,19:07:13,300,Pacific Time (US & Canada),12809,cedric_lee,2020-01-11 03:34:16 +0300,2020-07-02 06:53:18 +0300,research,CC-BY-NC,https://www.inaturalist.org/observations/37470062,https://inaturalist-open-data.s3.amazonaws.com/photos/59406366/medium.jpg?1578702893,,,,1,0,FALSE,3,"California, US",San Clemente,32.89271102,-118.4654154,9,29039,,obscured,TRUE,,,,Los Angeles,California,United States,California,Los Angeles,,Xerarionta intercisa,Plain Cactus Snail,Mollusca,115078,Mollusca,Gastropoda,Stylommatophora,Helminthoglyptidae,,
iNaturalist,37470092,Fri Jan 10 2020 08:28:43 GMT-0800 (PST),1/10/2020 0:00,1/10/2020,2020,1,10,19:28:43,300,Pacific Time (US & Canada),12809,cedric_lee,2020-01-11 03:37:26 +0300,2020-07-02 06:53:18 +0300,research,CC-BY-NC,https://www.inaturalist.org/observations/37470092,https://inaturalist-open-data.s3.amazonaws.com/photos/59406467/medium.jpg?1578703074,,,,1,0,FALSE,3,"California, US",San Clemente,32.80806011,-118.4385434,26,29039,,obscured,TRUE,,,,Los Angeles,California,United States,California,Los Angeles,,Xerarionta intercisa,Plain Cactus Snail,Mollusca,115078,Mollusca,Gastropoda,Stylommatophora,Helminthoglyptidae,,
iNaturalist,37470110,Fri Jan 10 2020 08:34:29 GMT-0800 (PST),1/10/2020 0:00,1/10/2020,2020,1,10,19:34:29,300,Pacific Time (US & Canada),12809,cedric_lee,2020-01-11 03:38:01 +0300,2020-07-02 06:53:18 +0300,research,CC-BY-NC,https://www.inaturalist.org/observations/37470110,https://inaturalist-open-data.s3.amazonaws.com/photos/59406493/medium.jpg?1578703112,,,,1,0,FALSE,3,"California, US",San Clemente,32.97089614,-118.4850188,6,29039,,obscured,TRUE,,,,Los Angeles,California,United States,California,Los Angeles,,Xerarionta intercisa,Plain Cactus Snail,Mollusca,115078,Mollusca,Gastropoda,Stylommatophora,Helminthoglyptidae,,
iNaturalist,37470132,Fri Jan 10 2020 09:40:49 GMT-0800 (PST),1/10/2020 0:00,1/10/2020,2020,1,10,20:40:49,300,Pacific Time (US & Canada),12809,cedric_lee,2020-01-11 03:38:39 +0300,2020-07-02 06:53:18 +0300,research,CC-BY-NC,https://www.inaturalist.org/observations/37470132,https://inaturalist-open-data.s3.amazonaws.com/photos/59406527/medium.jpg?1578703159,,,,1,0,FALSE,3,"California, US",San Clemente,32.94117841,-118.5059981,8,29039,,obscured,TRUE,,,,Los Angeles,California,United States,California,Los Angeles,,Xerarionta intercisa,Plain Cactus Snail,Mollusca,115078,Mollusca,Gastropoda,Stylommatophora,Helminthoglyptidae,,
iNaturalist,37503439,Sat Jan 11 2020 07:50:48 GMT-0800 (PST),1/11/2020 0:00,1/11/2020,2020,1,11,18:50:48,300,Pacific Time (US & Canada),266196,shrike2,2020-01-12 03:00:53 +0300,2020-02-25 00:39:40 +0300,research,CC-BY-NC-ND,https://www.inaturalist.org/observations/37503439,https://static.inaturalist.org/photos/59464614/medium.jpg?1578787263,,,,1,0,FALSE,3,"Los Angeles County, US-CA, US",San Clemente,32.89194274,-118.5432168,5,29039,,obscured,TRUE,,,,Los Angeles,California,United States,California,Los Angeles,Plain Cactus Snail,Xerarionta intercisa,Plain Cactus Snail,Mollusca,115078,Mollusca,Gastropoda,Stylommatophora,Helminthoglyptidae,,
iNaturalist,37503882,Sat Jan 11 2020 09:55:53 GMT-0800 (PST),1/11/2020 0:00,1/11/2020,2020,1,11,20:55:53,300,Pacific Time (US & Canada),266196,shrike2,2020-01-12 03:12:37 +0300,2020-02-25 00:39:42 +0300,research,CC-BY-NC-ND,https://www.inaturalist.org/observations/37503882,https://static.inaturalist.org/photos/59467094/medium.jpg?1578789479,,,,1,0,FALSE,3,"Los Angeles County, US-CA, US",San Clemente,32.88212905,-118.5750321,5,29039,,obscured,TRUE,,,,Los Angeles,California,United States,California,Los Angeles,Plain Cactus Snail,Xerarionta intercisa,Plain Cactus Snail,Mollusca,115078,Mollusca,Gastropoda,Stylommatophora,Helminthoglyptidae,,
iNaturalist,37507341,Sat Jan 11 2020 09:32:55 GMT-0800 (PST),1/11/2020 0:00,1/11/2020,2020,1,11,20:32:55,300,Pacific Time (US & Canada),12809,cedric_lee,2020-01-12 04:56:21 +0300,2020-07-02 06:53:19 +0300,needs_id,CC-BY-NC,https://www.inaturalist.org/observations/37507341,https://inaturalist-open-data.s3.amazonaws.com/photos/59471850/medium.jpg?1578794506,,,,0,0,FALSE,3,"Los Angeles County, US-CA, US",San Clemente,32.94979886,-118.4648584,9,29039,,obscured,TRUE,,,,Los Angeles,California,United States,California,Los Angeles,,Xerarionta intercisa,Plain Cactus Snail,Mollusca,115078,Mollusca,Gastropoda,Stylommatophora,Helminthoglyptidae,,
iNaturalist,37507531,Sat Jan 11 2020 10:00:08 GMT-0800 (PST),1/11/2020 0:00,1/11/2020,2020,1,11,21:00:08,300,Pacific Time (US & Canada),12809,cedric_lee,2020-01-12 05:03:01 +0300,2020-07-02 06:53:19 +0300,needs_id,CC-BY-NC,https://www.inaturalist.org/observations/37507531,https://inaturalist-open-data.s3.amazonaws.com/photos/59471958/medium.jpg?1578794616,,,,0,0,FALSE,3,"Los Angeles County, US-CA, US",San Clemente,32.89920559,-118.4395552,8,29039,,obscured,TRUE,,,,Los Angeles,California,United States,California,Los Angeles,,Xerarionta intercisa,Plain Cactus Snail,Mollusca,115078,Mollusca,Gastropoda,Stylommatophora,Helminthoglyptidae,,
iNaturalist,37507729,Sat Jan 11 2020 13:22:04 GMT-0800 (PST),1/11/2020 0:00,1/12/2020,2020,1,12,0:22:04,300,Pacific Time (US & Canada),12809,cedric_lee,2020-01-12 05:10:37 +0300,2020-07-02 06:53:20 +0300,needs_id,CC-BY-NC,https://www.inaturalist.org/observations/37507729,https://inaturalist-open-data.s3.amazonaws.com/photos/59472369/medium.jpg?1578795073,,,,0,0,FALSE,3,"Los Angeles County, US-CA, US",San Clemente,32.87637447,-118.555422,8,29039,,obscured,TRUE,,,,Los Angeles,California,United States,California,Los Angeles,,Xerarionta intercisa,Plain Cactus Snail,Mollusca,115078,Mollusca,Gastropoda,Stylommatophora,Helminthoglyptidae,,
iNaturalist,37507815,Sat Jan 11 2020 14:12:43 GMT-0800 (PST),1/11/2020 0:00,1/12/2020,2020,1,12,1:12:43,300,Pacific Time (US & Canada),12809,cedric_lee,2020-01-12 05:12:32 +0300,2020-07-02 06:53:20 +0300,research,CC-BY-NC,https://www.inaturalist.org/observations/37507815,https://inaturalist-open-data.s3.amazonaws.com/photos/59472474/medium.jpg?1578795179,,,,1,0,FALSE,3,"Los Angeles County, US-CA, US",San Clemente,32.90306224,-118.4290752,9,29039,,obscured,TRUE,,,,Los Angeles,California,United States,California,Los Angeles,Plain Cactus Snail,Xerarionta intercisa,Plain Cactus Snail,Mollusca,115078,Mollusca,Gastropoda,Stylommatophora,Helminthoglyptidae,,
iNaturalist,37533119,Sun Jan 12 2020 08:21:05 GMT-0800 (PST),1/12/2020 0:00,1/12/2020,2020,1,12,19:21:05,300,Pacific Time (US & Canada),266196,shrike2,2020-01-12 23:16:27 +0300,2020-02-25 00:39:41 +0300,research,CC-BY-NC-ND,https://www.inaturalist.org/observations/37533119,https://static.inaturalist.org/photos/59518823/medium.jpg?1578860307,,,,1,0,FALSE,3,"California, US",San Clemente,32.83716561,-118.4953864,5,29039,,obscured,TRUE,,,,Los Angeles,California,United States,California,Los Angeles,Plain Cactus Snail,Xerarionta intercisa,Plain Cactus Snail,Mollusca,115078,Mollusca,Gastropoda,Stylommatophora,Helminthoglyptidae,,
iNaturalist,37545486,Sun Jan 12 2020 13:32:34 GMT-0800 (PST),1/12/2020 0:00,1/13/2020,2020,1,13,0:32:34,300,Pacific Time (US & Canada),12809,cedric_lee,2020-01-13 05:54:03 +0300,2020-07-02 06:53:21 +0300,research,CC-BY-NC,https://www.inaturalist.org/observations/37545486,https://inaturalist-open-data.s3.amazonaws.com/photos/59559515/medium.jpg?1578923034,,,,1,0,FALSE,3,"Los Angeles County, US-CA, US",San Clemente,32.82719637,-118.5176915,6,29039,,obscured,TRUE,,,,Los Angeles,California,United States,California,Los Angeles,,Xerarionta intercisa,Plain Cactus Snail,Mollusca,115078,Mollusca,Gastropoda,Stylommatophora,Helminthoglyptidae,,
iNaturalist,37588472,Tue Jan 14 2020 08:41:42 GMT-0800 (PST),1/14/2020 0:00,1/14/2020,2020,1,14,19:41:42,300,Pacific Time (US & Canada),266196,shrike2,2020-01-14 19:42:33 +0300,2020-02-25 00:39:30 +0300,research,CC-BY-NC-ND,https://www.inaturalist.org/observations/37588472,https://static.inaturalist.org/photos/59617201/medium.jpg?1579020168,,,Estivating in a dead cornu shell.,2,0,FALSE,3,"Los Angeles County, US-CA, US",San Clemente,33.11574427,-118.557234,10,29012,,obscured,TRUE,,,,Los Angeles,California,United States,California,Los Angeles,Plain Cactus Snail,Xerarionta intercisa,Plain Cactus Snail,Mollusca,115078,Mollusca,Gastropoda,Stylommatophora,Helminthoglyptidae,,
iNaturalist,37593522,Tue Jan 14 2020 10:04:52 GMT-0800 (PST),1/14/2020 0:00,1/14/2020,2020,1,14,21:04:52,300,Pacific Time (US & Canada),266196,shrike2,2020-01-14 22:43:22 +0300,2020-02-25 00:39:25 +0300,research,CC-BY-NC-ND,https://www.inaturalist.org/observations/37593522,https://static.inaturalist.org/photos/59625745/medium.jpg?1579031051,,,,1,0,FALSE,3,"Los Angeles County, US-CA, US",San Clemente,33.09304493,-118.5169654,5,29012,,obscured,TRUE,,,,Los Angeles,California,United States,California,Los Angeles,Plain Cactus Snail,Xerarionta intercisa,Plain Cactus Snail,Mollusca,115078,Mollusca,Gastropoda,Stylommatophora,Helminthoglyptidae,,
iNaturalist,37626223,Wed Jan 15 2020 09:37:51 GMT-0800 (PST),1/15/2020 0:00,1/15/2020,2020,1,15,20:37:51,300,Pacific Time (US & Canada),213838,vireolanius,2020-01-16 00:04:09 +0300,2020-02-27 20:32:16 +0300,research,CC-BY-NC,https://www.inaturalist.org/observations/37626223,https://inaturalist-open-data.s3.amazonaws.com/photos/59687192/medium.jpg?1579125739,,,,1,0,FALSE,3,"California, US",San Clemente,32.97608069,-118.4329209,5,29039,,obscured,TRUE,,,,Los Angeles,California,United States,California,Los Angeles,Plain Cactus Snail,Xerarionta intercisa,Plain Cactus Snail,Mollusca,115078,Mollusca,Gastropoda,Stylommatophora,Helminthoglyptidae,,
iNaturalist,37634955,Wed Jan 15 2020 07:29:57 GMT-0800 (PST),1/15/2020 0:00,1/15/2020,2020,1,15,18:29:57,300,Pacific Time (US & Canada),12809,cedric_lee,2020-01-16 04:24:35 +0300,2020-07-02 06:53:22 +0300,research,CC-BY-NC,https://www.inaturalist.org/observations/37634955,https://inaturalist-open-data.s3.amazonaws.com/photos/59698460/medium.jpg?1579137918,,,,0,0,FALSE,3,"Los Angeles County, US-CA, US",San Clemente,32.96396409,-118.4678849,8,29039,,obscured,TRUE,,,,Los Angeles,California,United States,California,Los Angeles,,Xerarionta intercisa,Plain Cactus Snail,Mollusca,115078,Mollusca,Gastropoda,Stylommatophora,Helminthoglyptidae,,
iNaturalist,37636476,Wed Jan 15 2020 09:59:08 GMT-0800 (PST),1/15/2020 0:00,1/15/2020,2020,1,15,20:59:08,300,Pacific Time (US & Canada),12809,cedric_lee,2020-01-16 05:13:37 +0300,2020-07-02 06:53:23 +0300,research,CC-BY-NC,https://www.inaturalist.org/observations/37636476,https://inaturalist-open-data.s3.amazonaws.com/photos/59701543/medium.jpg?1579140883,,,,1,0,FALSE,3,"Los Angeles County, US-CA, US",San Clemente,32.93255118,-118.5100157,6,29039,,obscured,TRUE,,,,Los Angeles,California,United States,California,Los Angeles,,Xerarionta intercisa,Plain Cactus Snail,Mollusca,115078,Mollusca,Gastropoda,Stylommatophora,Helminthoglyptidae,,
iNaturalist,37636617,Wed Jan 15 2020 10:44:05 GMT-0800 (PST),1/15/2020 0:00,1/15/2020,2020,1,15,21:44:05,300,Pacific Time (US & Canada),12809,cedric_lee,2020-01-16 05:17:23 +0300,2020-07-02 06:53:23 +0300,research,CC-BY-NC,https://www.inaturalist.org/observations/37636617,https://inaturalist-open-data.s3.amazonaws.com/photos/59701746/medium.jpg?1579141093,,,With Cornu,1,0,FALSE,3,"Los Angeles County, US-CA, US",San Clemente,32.87372508,-118.4132754,12,29039,,obscured,TRUE,,,,Los Angeles,California,United States,California,Los Angeles,,Xerarionta intercisa,Plain Cactus Snail,Mollusca,115078,Mollusca,Gastropoda,Stylommatophora,Helminthoglyptidae,,
iNaturalist,37636633,Wed Jan 15 2020 14:01:08 GMT-0800 (PST),1/15/2020 0:00,1/16/2020,2020,1,16,1:01:08,300,Pacific Time (US & Canada),12809,cedric_lee,2020-01-16 05:18:41 +0300,2020-07-02 06:53:24 +0300,research,CC-BY-NC,https://www.inaturalist.org/observations/37636633,https://inaturalist-open-data.s3.amazonaws.com/photos/59701841/medium.jpg?1579141172,,,,1,0,FALSE,3,"Los Angeles County, US-CA, US",San Clemente,32.92904998,-118.4352219,11,29039,,obscured,TRUE,,,,Los Angeles,California,United States,California,Los Angeles,,Xerarionta intercisa,Plain Cactus Snail,Mollusca,115078,Mollusca,Gastropoda,Stylommatophora,Helminthoglyptidae,,
iNaturalist,37734941,2020/01/01 11:13 AM PST,1/1/2020 0:00,1/1/2020,2020,1,1,22:13:00,300,Pacific Time (US & Canada),266196,shrike2,2020-01-19 08:12:35 +0300,2020-02-25 00:39:11 +0300,research,CC-BY-NC-ND,https://www.inaturalist.org/observations/37734941,https://static.inaturalist.org/photos/59881218/medium.jpg?1579410750,,,,1,0,FALSE,,"California, US",San Clemente,32.94544705,-118.5745921,,29039,,obscured,TRUE,,,,Los Angeles,California,United States,California,Los Angeles,Plain Cactus Snail,Xerarionta intercisa,Plain Cactus Snail,Mollusca,115078,Mollusca,Gastropoda,Stylommatophora,Helminthoglyptidae,,
iNaturalist,37914376,Thu Jan 23 2020 09:16:59 GMT-0800 (PST),1/23/2020 0:00,1/23/2020,2020,1,23,20:16:59,300,Pacific Time (US & Canada),12809,cedric_lee,2020-01-24 16:24:40 +0300,2020-07-02 06:53:25 +0300,research,CC-BY-NC,https://www.inaturalist.org/observations/37914376,https://inaturalist-open-data.s3.amazonaws.com/photos/60179336/medium.jpg?1579872354,,,,0,0,FALSE,3,"Los Angeles County, US-CA, US",San Clemente,33.06429144,-118.5285512,8,29012,,obscured,TRUE,,,,Los Angeles,California,United States,California,Los Angeles,,Xerarionta intercisa,Plain Cactus Snail,Mollusca,115078,Mollusca,Gastropoda,Stylommatophora,Helminthoglyptidae,,
iNaturalist,37935327,Fri Jan 24 2020 16:54:15 GMT-0800 (PST),1/24/2020 0:00,1/25/2020,2020,1,25,3:54:15,300,Pacific Time (US & Canada),12809,cedric_lee,2020-01-25 05:52:12 +0300,2020-07-02 06:53:25 +0300,research,CC-BY-NC,https://www.inaturalist.org/observations/37935327,https://inaturalist-open-data.s3.amazonaws.com/photos/60215454/medium.jpg?1579920830,,,,1,0,FALSE,3,"Los Angeles County, US-CA, US",San Clemente,32.98976095,-118.4883245,8,29039,,obscured,TRUE,,,,Los Angeles,California,United States,California,Los Angeles,,Xerarionta intercisa,Plain Cactus Snail,Mollusca,115078,Mollusca,Gastropoda,Stylommatophora,Helminthoglyptidae,,
iNaturalist,38194325,2020/01/29 7:42 PM PST,1/29/2020 0:00,1/30/2020,2020,1,30,6:42:00,300,Pacific Time (US & Canada),12809,cedric_lee,2020-02-02 00:33:04 +0300,2021-03-09 09:45:57 +0300,research,CC-BY-NC,https://www.inaturalist.org/observations/38194325,https://inaturalist-open-data.s3.amazonaws.com/photos/60660616/medium.jpeg?1580587251,,,with X. redimita,0,0,FALSE,,"Los Angeles County, US-CA, US",San Clemente,32.93486876,-118.4296154,,29039,,obscured,TRUE,,,,Los Angeles,California,United States,California,Los Angeles,Plain Cactus Snail,Xerarionta intercisa,Plain Cactus Snail,Mollusca,115078,Mollusca,Gastropoda,Stylommatophora,Helminthoglyptidae,,
iNaturalist,38656755,Sun Feb 09 2020 13:32:02 GMT-0800 (PST),2/9/2020 0:00,2/10/2020,2020,2,10,0:32:02,300,Pacific Time (US & Canada),12809,cedric_lee,2020-02-15 05:56:00 +0300,2021-03-09 09:45:59 +0300,research,CC-BY-NC,https://www.inaturalist.org/observations/38656755,https://inaturalist-open-data.s3.amazonaws.com/photos/61470042/medium.jpg?1581735390,,,Predation while estivating on rock under Carpobrotus ,0,0,FALSE,3,"Los Angeles County, US-CA, US",San Clemente,33.08795276,-118.5100249,22,29012,,obscured,TRUE,,,,Los Angeles,California,United States,California,Los Angeles,,Xerarionta intercisa,Plain Cactus Snail,Mollusca,115078,Mollusca,Gastropoda,Stylommatophora,Helminthoglyptidae,,
iNaturalist,38783588,Thu Feb 06 2020 10:14:21 GMT-0800 (PST),2/6/2020 0:00,2/6/2020,2020,2,6,21:14:21,300,Pacific Time (US & Canada),12809,cedric_lee,2020-02-18 06:32:14 +0300,2021-03-09 09:46:02 +0300,research,CC-BY-NC,https://www.inaturalist.org/observations/38783588,https://inaturalist-open-data.s3.amazonaws.com/photos/61693883/medium.jpg?1581996745,,,X. intercisa and X. redimita ,0,0,FALSE,3,"Los Angeles County, US-CA, US",San Clemente,33.01517969,-118.4451537,9,29012,,obscured,TRUE,,,,Los Angeles,California,United States,California,Los Angeles,,Xerarionta intercisa,Plain Cactus Snail,Mollusca,115078,Mollusca,Gastropoda,Stylommatophora,Helminthoglyptidae,,
iNaturalist,39031230,Thu Feb 20 2020 11:30:24 GMT-0800 (PST),2/20/2020 0:00,2/20/2020,2020,2,20,22:30:24,300,Pacific Time (US & Canada),12809,cedric_lee,2020-02-22 05:47:35 +0300,2021-03-09 09:46:04 +0300,research,CC-BY-NC,https://www.inaturalist.org/observations/39031230,https://inaturalist-open-data.s3.amazonaws.com/photos/61930210/medium.jpg?1582339739,,,,1,0,FALSE,3,"Los Angeles County, US-CA, US",San Clemente,33.09710697,-118.6246335,13,29012,,obscured,TRUE,,,,Los Angeles,California,United States,California,Los Angeles,,Xerarionta intercisa,Plain Cactus Snail,Mollusca,115078,Mollusca,Gastropoda,Stylommatophora,Helminthoglyptidae,,
iNaturalist,39586715,2020/03/04 7:51 AM PST,3/4/2020 0:00,3/4/2020,2020,3,4,18:51:00,300,Pacific Time (US & Canada),266196,shrike2,2020-03-06 00:55:39 +0300,2020-03-06 04:00:10 +0300,research,CC-BY-NC-ND,https://www.inaturalist.org/observations/39586715,https://static.inaturalist.org/photos/62817878/medium.jpeg?1583445242,,,,1,0,FALSE,,"California, US",San Clemente,32.92296929,-118.5478044,5,29039,,obscured,TRUE,,,,Los Angeles,California,United States,California,Los Angeles,Plain Cactus Snail,Xerarionta intercisa,Plain Cactus Snail,Mollusca,115078,Mollusca,Gastropoda,Stylommatophora,Helminthoglyptidae,,
iNaturalist,39716069,Sun Mar 08 2020 10:40:59 GMT-0700 (PDT),3/8/2020 0:00,3/8/2020,2020,3,8,20:40:59,300,Pacific Time (US & Canada),266196,shrike2,2020-03-08 22:59:55 +0300,2020-03-09 19:46:23 +0300,research,CC-BY-NC-ND,https://www.inaturalist.org/observations/39716069,https://static.inaturalist.org/photos/63038751/medium.jpg?1583698665,,,,0,0,FALSE,3,"California, US",San Clemente,32.90253265,-118.4518024,5,29039,,obscured,TRUE,,,,Los Angeles,California,United States,California,Los Angeles,Plain Cactus Snail,Xerarionta intercisa,Plain Cactus Snail,Mollusca,115078,Mollusca,Gastropoda,Stylommatophora,Helminthoglyptidae,,
iNaturalist,39775169,Mon Mar 09 2020 09:08:51 GMT-0700 (PDT),3/9/2020 0:00,3/9/2020,2020,3,9,19:08:51,300,Pacific Time (US & Canada),266196,shrike2,2020-03-10 01:59:31 +0300,2020-03-10 16:56:32 +0300,research,CC-BY-NC-ND,https://www.inaturalist.org/observations/39775169,https://static.inaturalist.org/photos/63138355/medium.jpg?1583794788,,,,0,0,FALSE,3,"California, US",San Clemente,32.84525704,-118.4074381,,29039,,obscured,TRUE,,,,Los Angeles,California,United States,California,Los Angeles,Plain Cactus Snail,Xerarionta intercisa,Plain Cactus Snail,Mollusca,115078,Mollusca,Gastropoda,Stylommatophora,Helminthoglyptidae,,
iNaturalist,39857816,Wed Mar 11 2020 09:22:50 GMT-0700 (PDT),3/11/2020 0:00,3/11/2020,2020,3,11,19:22:50,300,Pacific Time (US & Canada),266196,shrike2,2020-03-12 01:17:47 +0300,2020-03-13 00:27:24 +0300,research,CC-BY-NC-ND,https://www.inaturalist.org/observations/39857816,https://static.inaturalist.org/photos/63278176/medium.jpg?1583965093,,,,3,0,FALSE,3,"California, US",San Clemente,32.87826192,-118.5988533,,29039,,obscured,TRUE,,,,Los Angeles,California,United States,California,Los Angeles,Plain Cactus Snail,Xerarionta intercisa,Plain Cactus Snail,Mollusca,115078,Mollusca,Gastropoda,Stylommatophora,Helminthoglyptidae,,
iNaturalist,39974184,Wed Mar 11 2020 11:01:01 GMT-0700 (PDT),3/11/2020 0:00,3/11/2020,2020,3,11,21:01:01,300,Pacific Time (US & Canada),266196,shrike2,2020-03-14 19:44:57 +0300,2020-03-14 23:24:43 +0300,research,CC-BY-NC-ND,https://www.inaturalist.org/observations/39974184,https://static.inaturalist.org/photos/63477250/medium.jpg?1584204302,,,,1,0,FALSE,3,"California, US",San Clemente,32.92751532,-118.56044,,29039,,obscured,TRUE,,,,Los Angeles,California,United States,California,Los Angeles,Plain Cactus Snail,Xerarionta intercisa,Plain Cactus Snail,Mollusca,115078,Mollusca,Gastropoda,Stylommatophora,Helminthoglyptidae,,
iNaturalist,40043113,Wed Mar 11 2020 08:41:11 GMT-0700 (PDT),3/11/2020 0:00,3/11/2020,2020,3,11,18:41:11,300,Pacific Time (US & Canada),266196,shrike2,2020-03-15 23:42:47 +0300,2020-03-19 00:16:57 +0300,research,CC-BY-NC-ND,https://www.inaturalist.org/observations/40043113,https://static.inaturalist.org/photos/63594002/medium.jpg?1584304977,,,,2,0,FALSE,3,"California, US",San Clemente,32.97569543,-118.5279444,,29039,,obscured,TRUE,,,,Los Angeles,California,United States,California,Los Angeles,Plain Cactus Snail,Xerarionta intercisa,Plain Cactus Snail,Mollusca,115078,Mollusca,Gastropoda,Stylommatophora,Helminthoglyptidae,,
iNaturalist,41734140,2019/06/19 8:25 AM PDT,6/19/2019 0:00,6/19/2019,2019,6,19,18:25:00,300,Pacific Time (US & Canada),173183,serpophaga,2020-04-09 05:05:49 +0300,2020-04-25 06:59:21 +0300,research,CC-BY-NC,https://www.inaturalist.org/observations/41734140,https://inaturalist-open-data.s3.amazonaws.com/photos/66211180/medium.jpg?1586397421,,,,2,0,FALSE,,"California, US",San Clemente,32.86459162,-118.5515382,10,29039,,obscured,TRUE,,,,Los Angeles,California,United States,California,Los Angeles,Plain Cactus Snail,Xerarionta intercisa,Plain Cactus Snail,Mollusca,115078,Mollusca,Gastropoda,Stylommatophora,Helminthoglyptidae,,
iNaturalist,41740968,2019/06/21 10:24 AM PDT,6/21/2019 0:00,6/21/2019,2019,6,21,20:24:00,300,Pacific Time (US & Canada),173183,serpophaga,2020-04-09 07:33:32 +0300,2020-04-25 06:59:49 +0300,research,CC-BY-NC,https://www.inaturalist.org/observations/41740968,https://inaturalist-open-data.s3.amazonaws.com/photos/66224009/medium.jpeg?1586406428,,,,2,0,FALSE,,"Los Angeles County, US-CA, US",San Clemente,32.93664479,-118.4348808,5,29039,,obscured,TRUE,,,,Los Angeles,California,United States,California,Los Angeles,Plain Cactus Snail,Xerarionta intercisa,Plain Cactus Snail,Mollusca,115078,Mollusca,Gastropoda,Stylommatophora,Helminthoglyptidae,,
iNaturalist,41740971,2019/06/21 10:26 AM PDT,6/21/2019 0:00,6/21/2019,2019,6,21,20:26:00,300,Pacific Time (US & Canada),173183,serpophaga,2020-04-09 07:33:35 +0300,2020-04-25 06:59:50 +0300,research,CC-BY-NC,https://www.inaturalist.org/observations/41740971,https://inaturalist-open-data.s3.amazonaws.com/photos/66224034/medium.jpeg?1586406458,,,,3,0,FALSE,,"Los Angeles County, US-CA, US",San Clemente,32.98516766,-118.4104925,5,29039,,obscured,TRUE,,,,Los Angeles,California,United States,California,Los Angeles,Plain Cactus Snail,Xerarionta intercisa,Plain Cactus Snail,Mollusca,115078,Mollusca,Gastropoda,Stylommatophora,Helminthoglyptidae,,
iNaturalist,41774904,2019/06/23 12:52 PM PDT,6/23/2019 0:00,6/23/2019,2019,6,23,22:52:00,300,Pacific Time (US & Canada),173183,serpophaga,2020-04-09 21:38:08 +0300,2020-04-25 07:00:02 +0300,research,CC-BY-NC,https://www.inaturalist.org/observations/41774904,https://inaturalist-open-data.s3.amazonaws.com/photos/66280441/medium.jpeg?1586457121,,,,2,0,FALSE,,"California, US",San Clemente,32.91151323,-118.4416127,10,29039,,obscured,TRUE,,,,Los Angeles,California,United States,California,Los Angeles,Plain Cactus Snail,Xerarionta intercisa,Plain Cactus Snail,Mollusca,115078,Mollusca,Gastropoda,Stylommatophora,Helminthoglyptidae,,
iNaturalist,65967662,Tue Dec 01 2020 08:19:49 GMT-0800 (PST),12/1/2020 0:00,12/1/2020,2020,12,1,19:19:49,300,Pacific Time (US & Canada),266196,shrike2,2020-12-02 01:11:17 +0300,2020-12-02 03:49:11 +0300,research,CC-BY-NC-ND,https://www.inaturalist.org/observations/65967662,https://static.inaturalist.org/photos/106250601/medium.jpg?1606861133,,,,2,0,FALSE,3,"California, US",San Clemente,32.9217785,-118.4644682,19,29039,,obscured,TRUE,,,,Los Angeles,California,United States,California,Los Angeles,Plain Cactus Snail,Xerarionta intercisa,Plain Cactus Snail,Mollusca,115078,Mollusca,Gastropoda,Stylommatophora,Helminthoglyptidae,,
iNaturalist,68470586,Fri Jan 22 2021 13:30:20 GMT-0800 (PST),1/22/2021 0:00,1/23/2021,2021,1,23,0:30:20,300,Pacific Time (US & Canada),266196,shrike2,2021-01-23 04:16:48 +0300,2021-01-24 02:50:03 +0300,research,CC-BY-NC-ND,https://www.inaturalist.org/observations/68470586,https://static.inaturalist.org/photos/110875626/medium.jpg?1611364614,,,Possible rat predation,1,0,FALSE,3,"California, US",San Clemente,32.83038954,-118.5582984,4,29039,,obscured,TRUE,,,,Los Angeles,California,United States,California,Los Angeles,Plain Cactus Snail,Xerarionta intercisa,Plain Cactus Snail,Mollusca,115078,Mollusca,Gastropoda,Stylommatophora,Helminthoglyptidae,,
iNaturalist,68515602,Sat Jan 23 2021 07:59:48 GMT-0800 (PST),1/23/2021 0:00,1/23/2021,2021,1,23,18:59:48,300,Pacific Time (US & Canada),266196,shrike2,2021-01-24 01:53:08 +0300,2021-01-24 03:11:56 +0300,research,CC-BY-NC-ND,https://www.inaturalist.org/observations/68515602,https://static.inaturalist.org/photos/110960072/medium.jpg?1611442402,,,,2,0,FALSE,3,"California, US",San Clemente,32.82349934,-118.4060642,5,29039,,obscured,TRUE,,,,Los Angeles,California,United States,California,Los Angeles,Plain Cactus Snail,Xerarionta intercisa,Plain Cactus Snail,Mollusca,115078,Mollusca,Gastropoda,Stylommatophora,Helminthoglyptidae,,
iNaturalist,72065037,Wed Mar 17 2021 10:12:54 GMT-0700 (PDT),3/17/2021 0:00,3/17/2021,2021,3,17,20:12:54,300,Pacific Time (US & Canada),213838,vireolanius,2021-03-26 06:06:52 +0300,2021-03-26 18:54:40 +0300,research,CC-BY-NC,https://www.inaturalist.org/observations/72065037,https://inaturalist-open-data.s3.amazonaws.com/photos/117432865/medium.jpg?1616728026,,,,3,0,FALSE,3,"California, US",San Clemente,32.98712289,-118.5842144,5,29039,,obscured,TRUE,,,,Los Angeles,California,United States,California,Los Angeles,Plain Cactus Snail,Xerarionta intercisa,Plain Cactus Snail,Mollusca,115078,Mollusca,Gastropoda,Stylommatophora,Helminthoglyptidae,,
iNaturalist,20182118,Tue Feb 05 2019 16:13:28 GMT-0800 (PST),2/5/2019 0:00,2/6/2019,2019,2,6,3:13:28,300,Pacific Time (US & Canada),213838,vireolanius,2019-02-07 17:26:30 +0300,2020-02-27 20:33:21 +0300,research,CC-BY-NC,https://www.inaturalist.org/observations/20182118,https://inaturalist-open-data.s3.amazonaws.com/photos/31147287/medium.jpg?1549549600,,,,3,0,FALSE,3,"Los Angeles County, US-CA, US",,33.19431999,-118.4388212,305,29012,,obscured,TRUE,,,,Los Angeles,California,United States,California,Los Angeles,Plain Cactus Snail,Xerarionta intercisa,Plain Cactus Snail,Mollusca,115078,Mollusca,Gastropoda,Stylommatophora,Xanthonychidae,Xerarionta,Xerarionta intercisa
iNaturalist,20345394,Mon Feb 04 2019 09:20:01 GMT-0800 (PST),2/4/2019 0:00,2/4/2019,2019,2,4,20:20:01,300,Pacific Time (US & Canada),1474963,stephlbartlett,2019-02-14 19:45:39 +0300,2021-02-02 17:24:11 +0300,research,CC-BY-NC,https://www.inaturalist.org/observations/20345394,https://inaturalist-open-data.s3.amazonaws.com/photos/31415330/medium.jpg?1550162742,,,,2,0,FALSE,3,"Los Angeles County, US-CA, US",,33.0781643,-118.4027471,200,29012,,obscured,TRUE,,,,Los Angeles,California,United States,California,Los Angeles,Plain Cactus Snail,Xerarionta intercisa,Plain Cactus Snail,Mollusca,115078,Mollusca,Gastropoda,Stylommatophora,Xanthonychidae,Xerarionta,Xerarionta intercisa
iNaturalist,20368175,Fri Feb 15 2019 08:27:28 GMT-0800 (PST),2/15/2019 0:00,2/15/2019,2019,2,15,19:27:28,300,Pacific Time (US & Canada),266196,shrike2,2019-02-15 21:51:34 +0300,2020-02-25 00:38:29 +0300,research,CC-BY-NC-ND,https://www.inaturalist.org/observations/20368175,https://static.inaturalist.org/photos/31452342/medium.jpg?1550256704,,,,2,0,FALSE,3,"Los Angeles County, US-CA, US",,33.17050121,-118.5993061,5,29012,,obscured,TRUE,,,,Los Angeles,California,United States,California,Los Angeles,Plain Cactus Snail,Xerarionta intercisa,Plain Cactus Snail,Mollusca,115078,Mollusca,Gastropoda,Stylommatophora,Xanthonychidae,Xerarionta,Xerarionta intercisa
iNaturalist,21260465,2019/02/21 1:55 PM PST,2/21/2019 0:00,,,,,,,Pacific Time (US & Canada),266196,shrike2,2019-03-15 19:40:06 +0300,2020-02-25 00:37:37 +0300,research,CC-BY-NC-ND,https://www.inaturalist.org/observations/21260465,https://static.inaturalist.org/photos/32869711/medium.jpg?1552666713,,,,3,0,FALSE,,"Los Angeles County, US-CA, US",,33.16777533,-118.5287918,15,29012,,obscured,TRUE,,,,Los Angeles,California,United States,California,Los Angeles,Plain Cactus Snail,Xerarionta intercisa,Plain Cactus Snail,Mollusca,115078,Mollusca,Gastropoda,Stylommatophora,Xanthonychidae,Xerarionta,Xerarionta intercisa
iNaturalist,21350795,2019-03-06 3:44:38 PM PST,3/6/2019 0:00,3/7/2019,2019,3,7,2:44:38,300,Pacific Time (US & Canada),34488,pileated,2019-03-18 09:05:01 +0300,2020-04-23 21:20:31 +0300,research,CC-BY,https://www.inaturalist.org/observations/21350795,https://inaturalist-open-data.s3.amazonaws.com/photos/33022427/medium.jpg?1552889103,,,,4,0,FALSE,2,"Los Angeles County, US-CA, US",,33.05525645,-118.4120423,352,29012,,obscured,TRUE,gps,gps,,Los Angeles,California,United States,California,Los Angeles,Plain Cactus Snail,Xerarionta intercisa,Plain Cactus Snail,Mollusca,115078,Mollusca,Gastropoda,Stylommatophora,Xanthonychidae,Xerarionta,Xerarionta intercisa
iNaturalist,21793364,2019/03/23 1:12 PM PDT,3/23/2019 0:00,3/23/2019,2019,3,23,23:12:00,300,Pacific Time (US & Canada),12809,cedric_lee,2019-03-30 22:44:52 +0300,2020-07-02 06:54:23 +0300,research,CC-BY-NC,https://www.inaturalist.org/observations/21793364,https://inaturalist-open-data.s3.amazonaws.com/photos/33749717/medium.jpeg?1553970403,,,,1,0,FALSE,,"California, US",,32.90438293,-118.2770808,,29039,obscured,obscured,TRUE,,,,Los Angeles,California,United States,California,Los Angeles,Plain Cactus Snail,Xerarionta intercisa,Plain Cactus Snail,Mollusca,115078,Mollusca,Gastropoda,Stylommatophora,Xanthonychidae,Xerarionta,Xerarionta intercisa
iNaturalist,24086061,Mon Apr 29 2019 16:22:05 GMT-0700 (PDT),4/29/2019 0:00,4/30/2019,2019,4,30,2:22:05,300,Pacific Time (US & Canada),213838,vireolanius,2019-04-30 03:48:17 +0300,2020-02-27 20:33:19 +0300,research,CC-BY-NC,https://www.inaturalist.org/observations/24086061,https://inaturalist-open-data.s3.amazonaws.com/photos/37249427/medium.jpg?1556585458,,,,4,0,FALSE,3,"Los Angeles County, US-CA, US",,33.1413789,-118.4281166,5,29012,,obscured,TRUE,,,,Los Angeles,California,United States,California,Los Angeles,Plain Cactus Snail,Xerarionta intercisa,Plain Cactus Snail,Mollusca,115078,Mollusca,Gastropoda,Stylommatophora,Xanthonychidae,Xerarionta,Xerarionta intercisa
iNaturalist,24089958,Mon Apr 29 2019 16:25:57 GMT-0700 (PDT),4/29/2019 0:00,4/30/2019,2019,4,30,2:25:57,300,Pacific Time (US & Canada),266196,shrike2,2019-04-30 04:02:48 +0300,2020-02-25 00:39:03 +0300,research,CC-BY-NC-ND,https://www.inaturalist.org/observations/24089958,https://static.inaturalist.org/photos/37256301/medium.jpg?1556586411,,,,3,0,FALSE,3,"Los Angeles County, US-CA, US",,33.12601433,-118.5076967,10,29012,,obscured,TRUE,,,,Los Angeles,California,United States,California,Los Angeles,Plain Cactus Snail,Xerarionta intercisa,Plain Cactus Snail,Mollusca,115078,Mollusca,Gastropoda,Stylommatophora,Xanthonychidae,Xerarionta,Xerarionta intercisa
iNaturalist,24091113,Mon Apr 29 2019 16:27:26 GMT-0700 (PDT),4/29/2019 0:00,4/30/2019,2019,4,30,2:27:26,300,Pacific Time (US & Canada),266196,shrike2,2019-04-30 04:06:58 +0300,2020-02-25 00:39:01 +0300,research,CC-BY-NC-ND,https://www.inaturalist.org/observations/24091113,https://static.inaturalist.org/photos/37257797/medium.jpg?1556586653,,,,3,0,FALSE,3,"Los Angeles County, US-CA, US",,33.07227033,-118.4408199,10,29012,,obscured,TRUE,,,,Los Angeles,California,United States,California,Los Angeles,Plain Cactus Snail,Xerarionta intercisa,Plain Cactus Snail,Mollusca,115078,Mollusca,Gastropoda,Stylommatophora,Xanthonychidae,Xerarionta,Xerarionta intercisa
iNaturalist,36332919,Tue Dec 03 2019 16:07:02 GMT-0800 (PST),12/3/2019 0:00,12/4/2019,2019,12,4,3:07:02,300,Pacific Time (US & Canada),266196,shrike2,2019-12-04 03:11:57 +0300,2020-02-25 00:38:18 +0300,research,CC-BY-NC-ND,https://www.inaturalist.org/observations/36332919,https://static.inaturalist.org/photos/57421652/medium.jpg?1575418331,,,,2,0,FALSE,3,"Los Angeles County, US-CA, US",,33.14805245,-118.5436151,5,29012,,obscured,TRUE,,,,Los Angeles,California,United States,California,Los Angeles,Plain Cactus Snail,Xerarionta intercisa,Plain Cactus Snail,Mollusca,115078,Mollusca,Gastropoda,Stylommatophora,Xanthonychidae,Xerarionta,Xerarionta intercisa
iNaturalist,37593362,Tue Jan 14 2020 08:58:29 GMT-0800 (PST),1/14/2020 0:00,1/14/2020,2020,1,14,19:58:29,300,Pacific Time (US & Canada),266196,shrike2,2020-01-14 22:36:49 +0300,2020-02-25 00:39:26 +0300,research,CC-BY-NC-ND,https://www.inaturalist.org/observations/37593362,https://static.inaturalist.org/photos/59625384/medium.jpg?1579030626,,,,1,0,FALSE,3,"Los Angeles County, US-CA, US",,33.142558,-118.5935495,5,29012,,obscured,TRUE,,,,Los Angeles,California,United States,California,Los Angeles,Plain Cactus Snail,Xerarionta intercisa,Plain Cactus Snail,Mollusca,115078,Mollusca,Gastropoda,Stylommatophora,Xanthonychidae,Xerarionta,Xerarionta intercisa
iNaturalist,37601162,Tue Jan 14 2020 10:21:46 GMT-0800 (PST),1/14/2020 0:00,1/14/2020,2020,1,14,21:21:46,300,Pacific Time (US & Canada),12809,cedric_lee,2020-01-15 03:49:47 +0300,2020-07-02 06:53:22 +0300,research,CC-BY-NC,https://www.inaturalist.org/observations/37601162,https://inaturalist-open-data.s3.amazonaws.com/photos/59639193/medium.jpg?1579049498,,,,1,0,FALSE,3,"Los Angeles County, US-CA, US",,33.15671567,-118.7021663,8,29012,,obscured,TRUE,,,,Los Angeles,California,United States,California,Los Angeles,,Xerarionta intercisa,Plain Cactus Snail,Mollusca,115078,Mollusca,Gastropoda,Stylommatophora,Xanthonychidae,Xerarionta,Xerarionta intercisa
iNaturalist,37672189,Thu Jan 16 2020 13:43:51 GMT-0800 (PST),1/16/2020 0:00,1/17/2020,2020,1,17,0:43:51,300,Pacific Time (US & Canada),12809,cedric_lee,2020-01-17 07:32:15 +0300,2020-07-02 06:53:24 +0300,research,CC-BY-NC,https://www.inaturalist.org/observations/37672189,https://inaturalist-open-data.s3.amazonaws.com/photos/59770877/medium.jpg?1579235541,,,,0,0,FALSE,3,"Los Angeles County, US-CA, US",,33.17395997,-118.5476188,20,29012,,obscured,TRUE,,,,Los Angeles,California,United States,California,Los Angeles,,Xerarionta intercisa,Plain Cactus Snail,Mollusca,115078,Mollusca,Gastropoda,Stylommatophora,Xanthonychidae,Xerarionta,Xerarionta intercisa
iNaturalist,38009407,Sun Jan 26 2020 09:25:10 GMT-0800 (PST),1/26/2020 0:00,1/26/2020,2020,1,26,20:25:10,300,Pacific Time (US & Canada),12809,cedric_lee,2020-01-27 04:06:43 +0300,2020-07-02 06:53:27 +0300,research,CC-BY-NC,https://www.inaturalist.org/observations/38009407,https://inaturalist-open-data.s3.amazonaws.com/photos/60345227/medium.jpg?1580088706,,,,1,0,FALSE,3,"Los Angeles County, US-CA, US",,33.10778301,-118.476066,9,29012,,obscured,TRUE,,,,Los Angeles,California,United States,California,Los Angeles,,Xerarionta intercisa,Plain Cactus Snail,Mollusca,115078,Mollusca,Gastropoda,Stylommatophora,Xanthonychidae,Xerarionta,Xerarionta intercisa
iNaturalist,38010527,Sun Jan 26 2020 08:24:02 GMT-0800 (PST),1/26/2020 0:00,1/26/2020,2020,1,26,19:24:02,300,Pacific Time (US & Canada),12809,cedric_lee,2020-01-27 04:43:52 +0300,2020-07-02 06:53:27 +0300,research,CC-BY-NC,https://www.inaturalist.org/observations/38010527,https://inaturalist-open-data.s3.amazonaws.com/photos/60347328/medium.jpg?1580089486,,,,1,0,FALSE,3,"Los Angeles County, US-CA, US",,33.06882172,-118.4317223,10,29012,,obscured,TRUE,,,,Los Angeles,California,United States,California,Los Angeles,,Xerarionta intercisa,Plain Cactus Snail,Mollusca,115078,Mollusca,Gastropoda,Stylommatophora,Xanthonychidae,Xerarionta,Xerarionta intercisa
iNaturalist,38025449,Sun Jan 26 2020 08:16:05 GMT-0800 (PST),1/26/2020 0:00,1/26/2020,2020,1,26,19:16:05,300,Pacific Time (US & Canada),12809,cedric_lee,2020-01-27 16:45:55 +0300,2020-07-02 06:53:27 +0300,research,CC-BY-NC,https://www.inaturalist.org/observations/38025449,https://inaturalist-open-data.s3.amazonaws.com/photos/60374312/medium.jpg?1580132810,,,,0,0,FALSE,3,"Los Angeles County, US-CA, US",,33.11235058,-118.4822828,8,29012,,obscured,TRUE,,,,Los Angeles,California,United States,California,Los Angeles,,Xerarionta intercisa,Plain Cactus Snail,Mollusca,115078,Mollusca,Gastropoda,Stylommatophora,Xanthonychidae,Xerarionta,Xerarionta intercisa
iNaturalist,38026063,Sun Jan 26 2020 09:07:58 GMT-0800 (PST),1/26/2020 0:00,1/26/2020,2020,1,26,20:07:58,300,Pacific Time (US & Canada),12809,cedric_lee,2020-01-27 17:13:44 +0300,2020-07-02 06:53:28 +0300,research,CC-BY-NC,https://www.inaturalist.org/observations/38026063,https://inaturalist-open-data.s3.amazonaws.com/photos/60375447/medium.jpg?1580134505,,,,0,0,FALSE,3,"Los Angeles County, US-CA, US",,33.19491548,-118.5343125,9,29012,,obscured,TRUE,,,,Los Angeles,California,United States,California,Los Angeles,,Xerarionta intercisa,Plain Cactus Snail,Mollusca,115078,Mollusca,Gastropoda,Stylommatophora,Xanthonychidae,Xerarionta,Xerarionta intercisa
iNaturalist,38491923,Thu Feb 06 2020 09:53:03 GMT-0800 (PST),2/6/2020 0:00,2/6/2020,2020,2,6,20:53:03,300,Pacific Time (US & Canada),12809,cedric_lee,2020-02-10 05:43:58 +0300,2021-03-09 09:45:58 +0300,research,CC-BY-NC,https://www.inaturalist.org/observations/38491923,https://inaturalist-open-data.s3.amazonaws.com/photos/61183452/medium.jpg?1581302687,,,,1,0,FALSE,3,"Los Angeles County, US-CA, US",,33.09084791,-118.4079981,8,29012,,obscured,TRUE,,,,Los Angeles,California,United States,California,Los Angeles,,Xerarionta intercisa,Plain Cactus Snail,Mollusca,115078,Mollusca,Gastropoda,Stylommatophora,Xanthonychidae,Xerarionta,Xerarionta intercisa
iNaturalist,38781238,Thu Feb 06 2020 09:38:56 GMT-0800 (PST),2/6/2020 0:00,2/6/2020,2020,2,6,20:38:56,300,Pacific Time (US & Canada),12809,cedric_lee,2020-02-18 05:32:57 +0300,2021-03-09 09:46:01 +0300,research,CC-BY-NC,https://www.inaturalist.org/observations/38781238,https://inaturalist-open-data.s3.amazonaws.com/photos/61689987/medium.jpg?1581993186,,,,0,0,FALSE,3,"Los Angeles County, US-CA, US",,33.18185758,-118.5586269,9,29012,,obscured,TRUE,,,,Los Angeles,California,United States,California,Los Angeles,,Xerarionta intercisa,Plain Cactus Snail,Mollusca,115078,Mollusca,Gastropoda,Stylommatophora,Xanthonychidae,Xerarionta,Xerarionta intercisa
iNaturalist,38781261,Thu Feb 06 2020 09:59:07 GMT-0800 (PST),2/6/2020 0:00,2/6/2020,2020,2,6,20:59:07,300,Pacific Time (US & Canada),12809,cedric_lee,2020-02-18 05:33:19 +0300,2021-03-09 09:46:01 +0300,research,CC-BY-NC,https://www.inaturalist.org/observations/38781261,https://inaturalist-open-data.s3.amazonaws.com/photos/61690061/medium.jpg?1581993245,,,With X. redimita ,0,0,FALSE,3,"Los Angeles County, US-CA, US",,33.12420066,-118.4266845,11,29012,,obscured,TRUE,,,,Los Angeles,California,United States,California,Los Angeles,,Xerarionta intercisa,Plain Cactus Snail,Mollusca,115078,Mollusca,Gastropoda,Stylommatophora,Xanthonychidae,Xerarionta,Xerarionta intercisa
iNaturalist,38783617,Thu Feb 06 2020 10:01:54 GMT-0800 (PST),2/6/2020 0:00,2/6/2020,2020,2,6,21:01:54,300,Pacific Time (US & Canada),12809,cedric_lee,2020-02-18 06:32:50 +0300,2021-03-09 09:46:02 +0300,research,CC-BY-NC,https://www.inaturalist.org/observations/38783617,https://inaturalist-open-data.s3.amazonaws.com/photos/61693913/medium.jpg?1581996781,,,With X. redimita ,0,0,FALSE,3,"Los Angeles County, US-CA, US",,33.14358007,-118.4651985,7,29012,,obscured,TRUE,,,,Los Angeles,California,United States,California,Los Angeles,,Xerarionta intercisa,Plain Cactus Snail,Mollusca,115078,Mollusca,Gastropoda,Stylommatophora,Xanthonychidae,Xerarionta,Xerarionta intercisa
iNaturalist,38869324,Wed Feb 19 2020 13:11:13 GMT-0800 (PST),2/19/2020 0:00,2/20/2020,2020,2,20,0:11:13,300,Pacific Time (US & Canada),12809,cedric_lee,2020-02-20 04:40:04 +0300,2021-03-09 09:46:02 +0300,research,CC-BY-NC,https://www.inaturalist.org/observations/38869324,https://inaturalist-open-data.s3.amazonaws.com/photos/61810362/medium.jpg?1582162889,,,,0,0,FALSE,3,"Los Angeles County, US-CA, US",,33.17813232,-118.4047479,10,29012,,obscured,TRUE,,,,Los Angeles,California,United States,California,Los Angeles,,Xerarionta intercisa,Plain Cactus Snail,Mollusca,115078,Mollusca,Gastropoda,Stylommatophora,Xanthonychidae,Xerarionta,Xerarionta intercisa
iNaturalist,38869636,Wed Feb 19 2020 10:30:02 GMT-0800 (PST),2/19/2020 0:00,2/19/2020,2020,2,19,21:30:02,300,Pacific Time (US & Canada),12809,cedric_lee,2020-02-20 04:53:13 +0300,2021-03-09 09:46:02 +0300,needs_id,CC-BY-NC,https://www.inaturalist.org/observations/38869636,https://inaturalist-open-data.s3.amazonaws.com/photos/61810949/medium.jpg?1582163652,,,With Cornu aspersum,0,0,FALSE,3,"Los Angeles County, US-CA, US",,33.16921045,-118.4204891,11,29012,,obscured,TRUE,,,,Los Angeles,California,United States,California,Los Angeles,,Xerarionta intercisa,Plain Cactus Snail,Mollusca,115078,Mollusca,Gastropoda,Stylommatophora,Xanthonychidae,Xerarionta,Xerarionta intercisa
iNaturalist,38870057,Wed Feb 19 2020 11:58:32 GMT-0800 (PST),2/19/2020 0:00,2/19/2020,2020,2,19,22:58:32,300,Pacific Time (US & Canada),12809,cedric_lee,2020-02-20 05:10:43 +0300,2021-03-09 09:46:02 +0300,research,CC-BY-NC,https://www.inaturalist.org/observations/38870057,https://inaturalist-open-data.s3.amazonaws.com/photos/62145612/medium.jpg?1582600310,,,,2,0,FALSE,3,"Los Angeles County, US-CA, US",,33.04396275,-118.4425695,23,29012,,obscured,TRUE,,,,Los Angeles,California,United States,California,Los Angeles,,Xerarionta intercisa,Plain Cactus Snail,Mollusca,115078,Mollusca,Gastropoda,Stylommatophora,Xanthonychidae,Xerarionta,Xerarionta intercisa
iNaturalist,38942362,Thu Feb 20 2020 11:08:27 GMT-0800 (PST),2/20/2020 0:00,2/20/2020,2020,2,20,22:08:27,300,Pacific Time (US & Canada),12809,cedric_lee,2020-02-21 03:56:24 +0300,2021-03-09 09:46:03 +0300,research,CC-BY-NC,https://www.inaturalist.org/observations/38942362,https://inaturalist-open-data.s3.amazonaws.com/photos/61866153/medium.jpg?1582247269,,,Over 150 individuals,2,0,FALSE,3,"Los Angeles County, US-CA, US",,33.02128898,-118.7975197,5,29012,,obscured,TRUE,,,,Los Angeles,California,United States,California,Los Angeles,,Xerarionta intercisa,Plain Cactus Snail,Mollusca,115078,Mollusca,Gastropoda,Stylommatophora,Xanthonychidae,Xerarionta,Xerarionta intercisa
iNaturalist,38947305,Thu Feb 20 2020 11:20:19 GMT-0800 (PST),2/20/2020 0:00,2/20/2020,2020,2,20,22:20:19,300,Pacific Time (US & Canada),12809,cedric_lee,2020-02-21 06:35:52 +0300,2021-03-09 09:46:03 +0300,research,CC-BY-NC,https://www.inaturalist.org/observations/38947305,https://inaturalist-open-data.s3.amazonaws.com/photos/61874088/medium.jpg?1582256200,,,,0,0,FALSE,3,"Los Angeles County, US-CA, US",,33.12881357,-118.6741225,8,29012,,obscured,TRUE,,,,Los Angeles,California,United States,California,Los Angeles,,Xerarionta intercisa,Plain Cactus Snail,Mollusca,115078,Mollusca,Gastropoda,Stylommatophora,Xanthonychidae,Xerarionta,Xerarionta intercisa
iNaturalist,39468970,Mon Mar 02 2020 11:26:46 GMT-0800 (PST),3/2/2020 0:00,3/2/2020,2020,3,2,22:26:46,300,Pacific Time (US & Canada),213838,vireolanius,2020-03-03 01:49:31 +0300,2020-03-03 23:17:15 +0300,research,CC-BY-NC,https://www.inaturalist.org/observations/39468970,https://inaturalist-open-data.s3.amazonaws.com/photos/62624091/medium.jpg?1583189377,,,,1,0,FALSE,3,"California, US",,32.93084043,-118.3182519,5,29039,,obscured,TRUE,,,,Los Angeles,California,United States,California,Los Angeles,Plain Cactus Snail,Xerarionta intercisa,Plain Cactus Snail,Mollusca,115078,Mollusca,Gastropoda,Stylommatophora,Xanthonychidae,Xerarionta,Xerarionta intercisa
iNaturalist,41735260,2019/06/19 6:53 PM PDT,6/19/2019 0:00,6/20/2019,2019,6,20,4:53:00,300,Pacific Time (US & Canada),173183,serpophaga,2020-04-09 05:28:29 +0300,2020-04-25 06:59:37 +0300,research,CC-BY-NC,https://www.inaturalist.org/observations/41735260,https://inaturalist-open-data.s3.amazonaws.com/photos/66213903/medium.jpeg?1586399031,,,,3,0,FALSE,,"Los Angeles County, US-CA, US",,33.11245746,-118.4541474,5,29012,,obscured,TRUE,,,,Los Angeles,California,United States,California,Los Angeles,Plain Cactus Snail,Xerarionta intercisa,Plain Cactus Snail,Mollusca,115078,Mollusca,Gastropoda,Stylommatophora,Xanthonychidae,Xerarionta,Xerarionta intercisa
iNaturalist,76956848,Mon May 03 2021 07:50:31 GMT-0700 (PDT),5/3/2021 0:00,5/3/2021,2021,5,3,17:50:31,300,Pacific Time (US & Canada),266196,shrike2,2021-05-03 18:00:39 +0300,2021-05-05 01:29:05 +0300,research,CC-BY-NC-ND,https://www.inaturalist.org/observations/76956848,https://inaturalist-open-data.s3.amazonaws.com/photos/125855210/medium.jpg?1620054048,,,,1,0,FALSE,3,"Los Angeles County, US-CA, US",,33.11959711,-118.4700787,53,29012,,obscured,TRUE,,,,Los Angeles,California,United States,California,Los Angeles,Plain Cactus Snail,Xerarionta intercisa,Plain Cactus Snail,Mollusca,115078,Mollusca,Gastropoda,Stylommatophora,Xanthonychidae,Xerarionta,Xerarionta intercisa
iNaturalist,2675353,2/25/2012,2/25/2012 0:00,,,,,,,Pacific Time (US & Canada),84767,tlawson,2016-02-13 01:14:25 +0300,2017-09-16 21:35:32 +0300,research,,http://www.inaturalist.org/observations/2675353,https://static.inaturalist.org/photos/3005451/medium.jpg?1455315278,,,,3,0,FALSE,3,"Los Angeles County, US-CA, US",Santa Catalina,33.32235286,-118.3646827,49,28971,,obscured,TRUE,,,,Los Angeles,California,United States,California,Los Angeles,Xerarionta kellettii,Xerarionta kellettii,Catalina Cactussnail,Mollusca,233776,Mollusca,Gastropoda,Stylommatophora,Helminthoglyptidae,,
iNaturalist,3752253,7/7/2014,7/7/2014 0:00,,,,,,,Pacific Time (US & Canada),275891,psyllidhipster,2016-07-27 06:10:27 +0300,2018-08-02 21:39:26 +0300,research,CC-BY-NC,http://www.inaturalist.org/observations/3752253,https://inaturalist-open-data.s3.amazonaws.com/photos/4367163/medium.jpg?1469589031,,,"One of the reasons I signed up for this site was to help learn more about groups I don't understand, such as terrestrial gastropods. I'm guessing this is a shoulderband snail, and on the mainland I would guess Helminthoglypta, but given the location I am wondering if it might instead be the Catalina Cactus Snail, Xerarionta kelletii? The two look very similar to me.",4,0,FALSE,,"Los Angeles County, US-CA, US",Santa Catalina,33.34775872,-118.2566726,,28984,,obscured,TRUE,,,,Los Angeles,California,United States,California,Los Angeles,Catalina Cactussnail,Xerarionta kellettii,Catalina Cactussnail,Mollusca,233776,Mollusca,Gastropoda,Stylommatophora,Helminthoglyptidae,,
iNaturalist,3819927,2016/08/06 2:52 PM PDT,8/6/2016 0:00,8/7/2016,2016,8,7,0:52:00,300,Pacific Time (US & Canada),12809,cedric_lee,2016-08-07 09:16:50 +0300,2017-07-14 07:57:52 +0300,research,CC-BY-NC,http://www.inaturalist.org/observations/3819927,https://static.inaturalist.org/photos/4466670/medium.jpg?1470550613,,,,3,0,FALSE,,"Los Angeles County, US-CA, US",Santa Catalina,33.28141687,-118.2590981,17,28971,,obscured,TRUE,,,,Los Angeles,California,United States,California,Los Angeles,Xerarionta kellettii,Xerarionta kellettii,Catalina Cactussnail,Mollusca,233776,Mollusca,Gastropoda,Stylommatophora,Helminthoglyptidae,,
iNaturalist,6632680,2017-06-13 9:12:05 AM PDT,6/13/2017 0:00,6/13/2017,2017,6,13,19:12:05,300,Pacific Time (US & Canada),392423,bjdion,2017-06-14 02:37:18 +0300,2017-10-16 01:42:34 +0300,research,CC-BY-NC-SA,https://www.inaturalist.org/observations/6632680,https://inaturalist-open-data.s3.amazonaws.com/photos/8420654/medium.jpeg?1497397123,,,,2,0,FALSE,2,"Los Angeles County, US-CA, US",Santa Catalina,33.35020757,-118.2461699,9,28971,,obscured,TRUE,,,,Los Angeles,California,United States,California,Los Angeles,Catalina Cactussnail,Xerarionta kellettii,Catalina Cactussnail,Mollusca,233776,Mollusca,Gastropoda,Stylommatophora,Helminthoglyptidae,,
iNaturalist,9085318,2017-12-07 12:08:10 PM PST,12/7/2017 0:00,12/7/2017,2017,12,7,23:08:10,300,Pacific Time (US & Canada),392423,bjdion,2017-12-08 07:03:02 +0300,2019-02-22 02:15:02 +0300,research,CC-BY-NC-SA,https://www.inaturalist.org/observations/9085318,https://inaturalist-open-data.s3.amazonaws.com/photos/12269723/medium.jpeg?1512705791,,,,3,0,FALSE,2,"Los Angeles County, US-CA, US",Santa Catalina,33.36720266,-118.4692945,10,28984,,obscured,TRUE,,,,Los Angeles,California,United States,California,Los Angeles,Catalina Cactussnail,Xerarionta kellettii,Catalina Cactussnail,Mollusca,233776,Mollusca,Gastropoda,Stylommatophora,Helminthoglyptidae,,
iNaturalist,9089623,2017-12-08 9:22:05 AM PST,12/8/2017 0:00,12/8/2017,2017,12,8,20:22:05,300,Pacific Time (US & Canada),392423,bjdion,2017-12-08 21:34:25 +0300,2019-02-22 00:22:33 +0300,research,CC-BY-NC-SA,https://www.inaturalist.org/observations/9089623,https://inaturalist-open-data.s3.amazonaws.com/photos/12276825/medium.jpeg?1512758075,,,,2,0,FALSE,2,"Los Angeles County, US-CA, US",Santa Catalina,33.46153643,-118.5728599,12,28957,,obscured,TRUE,,,,Los Angeles,California,United States,California,Los Angeles,Catalina Cactussnail,Xerarionta kellettii,Catalina Cactussnail,Mollusca,233776,Mollusca,Gastropoda,Stylommatophora,Helminthoglyptidae,,
iNaturalist,9160223,2017-12-14 8:27:08 AM PST,12/14/2017 0:00,12/14/2017,2017,12,14,19:27:08,300,Pacific Time (US & Canada),392423,bjdion,2017-12-15 06:24:43 +0300,2019-02-22 00:11:47 +0300,research,CC-BY-NC-SA,https://www.inaturalist.org/observations/9160223,https://inaturalist-open-data.s3.amazonaws.com/photos/12388233/medium.jpeg?1513308290,,,,1,0,FALSE,2,"Los Angeles County, US-CA, US",Santa Catalina,33.36082799,-118.5390845,16,28984,,obscured,TRUE,,,,Los Angeles,California,United States,California,Los Angeles,Catalina Cactussnail,Xerarionta kellettii,Catalina Cactussnail,Mollusca,233776,Mollusca,Gastropoda,Stylommatophora,Helminthoglyptidae,,
iNaturalist,9160233,2017-12-14 8:51:52 AM PST,12/14/2017 0:00,12/14/2017,2017,12,14,19:51:52,300,Pacific Time (US & Canada),392423,bjdion,2017-12-15 06:25:55 +0300,2019-02-22 00:11:46 +0300,research,CC-BY-NC-SA,https://www.inaturalist.org/observations/9160233,https://inaturalist-open-data.s3.amazonaws.com/photos/12388259/medium.jpeg?1513308360,,,,1,0,FALSE,2,"Los Angeles County, US-CA, US",Santa Catalina,33.36378411,-118.5844848,18,28984,,obscured,TRUE,,,,Los Angeles,California,United States,California,Los Angeles,Catalina Cactussnail,Xerarionta kellettii,Catalina Cactussnail,Mollusca,233776,Mollusca,Gastropoda,Stylommatophora,Helminthoglyptidae,,
iNaturalist,10374703,Fri Mar 23 2018 07:16:54 GMT-0700 (PDT),3/23/2018 0:00,3/23/2018,2018,3,23,17:16:54,300,Pacific Time (US & Canada),77126,lchilton,2018-03-23 17:46:52 +0300,2018-04-03 19:40:01 +0300,research,CC-BY-NC,https://www.inaturalist.org/observations/10374703,https://inaturalist-open-data.s3.amazonaws.com/photos/14397042/medium.jpg?1521816449,,,,4,0,FALSE,3,"Los Angeles County, US-CA, US",Santa Catalina,33.53471755,-118.4645587,5,28957,,obscured,TRUE,,,,Los Angeles,California,United States,California,Los Angeles,Catalina Cactussnail,Xerarionta kellettii,Catalina Cactussnail,Mollusca,233776,Mollusca,Gastropoda,Stylommatophora,Helminthoglyptidae,,
iNaturalist,10424774,2018/03/24 11:54 AM PDT,3/24/2018 0:00,3/24/2018,2018,3,24,21:54:00,300,Pacific Time (US & Canada),220795,neontetraploid,2018-03-26 04:53:11 +0300,2019-02-08 09:00:29 +0300,research,CC-BY-NC,https://www.inaturalist.org/observations/10424774,https://inaturalist-open-data.s3.amazonaws.com/photos/14482339/medium.jpeg?1522028489,,,,3,0,FALSE,,"Los Angeles County, US-CA, US",Santa Catalina,33.31008735,-118.4168697,284,28984,,obscured,TRUE,,,,Los Angeles,California,United States,California,Los Angeles,Catalina Cactussnail,Xerarionta kellettii,Catalina Cactussnail,Mollusca,233776,Mollusca,Gastropoda,Stylommatophora,Helminthoglyptidae,,
iNaturalist,11843013,2018/04/29 1:48 PM PDT,4/29/2018 0:00,4/29/2018,2018,4,29,23:48:00,300,Pacific Time (US & Canada),6971,silversea_starsong,2018-04-30 06:47:49 +0300,2019-12-31 21:46:04 +0300,research,CC-BY-NC,https://www.inaturalist.org/observations/11843013,https://inaturalist-open-data.s3.amazonaws.com/photos/16948321/medium.jpeg?1525060044,,,,3,0,FALSE,,"Los Angeles County, US-CA, US",Santa Catalina,33.24738468,-118.4748945,,28984,,obscured,TRUE,,,,Los Angeles,California,United States,California,Los Angeles,Catalina Cactussnail,Xerarionta kellettii,Catalina Cactussnail,Mollusca,233776,Mollusca,Gastropoda,Stylommatophora,Helminthoglyptidae,,
iNaturalist,12004418,2018/04/28 6:28 PM PDT,4/28/2018 0:00,4/29/2018,2018,4,29,4:28:00,300,Pacific Time (US & Canada),6971,silversea_starsong,2018-05-01 22:20:47 +0300,2019-12-31 12:02:06 +0300,research,CC-BY-NC,https://www.inaturalist.org/observations/12004418,https://inaturalist-open-data.s3.amazonaws.com/photos/17200106/medium.jpeg?1525201973,,,,2,0,FALSE,,"Los Angeles County, US-CA, US",Santa Catalina,33.35439195,-118.4040254,,28984,,obscured,TRUE,,,,Los Angeles,California,United States,California,Los Angeles,Catalina Cactussnail,Xerarionta kellettii,Catalina Cactussnail,Mollusca,233776,Mollusca,Gastropoda,Stylommatophora,Helminthoglyptidae,,
iNaturalist,12011153,2018/04/29 10:13 AM PDT,4/29/2018 0:00,4/29/2018,2018,4,29,20:13:00,300,Pacific Time (US & Canada),6971,silversea_starsong,2018-05-02 00:25:35 +0300,2019-12-31 12:01:59 +0300,research,CC-BY-NC,https://www.inaturalist.org/observations/12011153,https://inaturalist-open-data.s3.amazonaws.com/photos/17211821/medium.jpeg?1525209782,,,,2,0,FALSE,,"Los Angeles County, US-CA, US",Santa Catalina,33.26886177,-118.4834437,,28984,,obscured,TRUE,,,,Los Angeles,California,United States,California,Los Angeles,Catalina Cactussnail,Xerarionta kellettii,Catalina Cactussnail,Mollusca,233776,Mollusca,Gastropoda,Stylommatophora,Helminthoglyptidae,,
iNaturalist,12402979,2018-05-12 4:18:19 PM PDT,5/12/2018 0:00,5/13/2018,2018,5,13,2:18:19,300,Pacific Time (US & Canada),392423,bjdion,2018-05-13 05:16:38 +0300,2018-06-12 07:30:52 +0300,research,CC-BY-NC-SA,https://www.inaturalist.org/observations/12402979,https://inaturalist-open-data.s3.amazonaws.com/photos/17877706/medium.jpeg?1526177806,,,,2,0,FALSE,2,"Los Angeles County, US-CA, US",Santa Catalina,33.23901554,-118.2557289,21,28984,,obscured,TRUE,,,,Los Angeles,California,United States,California,Los Angeles,Catalina Cactussnail,Xerarionta kellettii,Catalina Cactussnail,Mollusca,233776,Mollusca,Gastropoda,Stylommatophora,Helminthoglyptidae,,
iNaturalist,13692761,Fri Jun 22 2018 10:06:55 GMT-0700 (PDT),6/22/2018 0:00,6/22/2018,2018,6,22,20:06:55,300,Pacific Time (US & Canada),280979,emshaph,2018-06-23 09:25:06 +0300,2018-07-12 07:20:15 +0300,research,CC-BY-NC,https://www.inaturalist.org/observations/13692761,https://inaturalist-open-data.s3.amazonaws.com/photos/20169982/medium.jpg?1529735383,,,,3,0,FALSE,3,"Los Angeles County, US-CA, US",Santa Catalina,33.40691295,-118.4784064,22,28957,,obscured,TRUE,,,,Los Angeles,California,United States,California,Los Angeles,Catalina Cactussnail,Xerarionta kellettii,Catalina Cactussnail,Mollusca,233776,Mollusca,Gastropoda,Stylommatophora,Helminthoglyptidae,,
iNaturalist,16142704,2018-09-02 10:40:46 AM PDT,9/2/2018 0:00,9/2/2018,2018,9,2,20:40:46,300,Pacific Time (US & Canada),392423,bjdion,2018-09-02 22:33:20 +0300,2019-09-22 21:41:15 +0300,research,CC-BY-NC-SA,https://www.inaturalist.org/observations/16142704,https://inaturalist-open-data.s3.amazonaws.com/photos/24195132/medium.jpeg?1535916823,,,,1,0,FALSE,2,"Los Angeles County, US-CA, US",Santa Catalina,33.34103638,-118.3630939,9,28984,,obscured,TRUE,,,,Los Angeles,California,United States,California,Los Angeles,Catalina Cactussnail,Xerarionta kellettii,Catalina Cactussnail,Mollusca,233776,Mollusca,Gastropoda,Stylommatophora,Helminthoglyptidae,,
iNaturalist,17681370,2018-10-17 2:40:29 PM PDT,10/17/2018 0:00,10/18/2018,2018,10,18,0:40:29,300,Pacific Time (US & Canada),392423,bjdion,2018-10-20 20:08:19 +0300,2018-10-20 21:55:22 +0300,research,CC-BY-NC-SA,https://www.inaturalist.org/observations/17681370,https://inaturalist-open-data.s3.amazonaws.com/photos/26945255/medium.jpeg?1540055355,,,,1,0,FALSE,2,"Los Angeles County, US-CA, US",Santa Catalina,33.4466086,-118.5403492,9,28957,,obscured,TRUE,,,,Los Angeles,California,United States,California,Los Angeles,Catalina Cactussnail,Xerarionta kellettii,Catalina Cactussnail,Mollusca,233776,Mollusca,Gastropoda,Stylommatophora,Helminthoglyptidae,,
iNaturalist,19042515,Sat Dec 15 2018 10:41:43 GMT-0800 (PST),12/15/2018 0:00,12/15/2018,2018,12,15,21:41:43,300,Pacific Time (US & Canada),521220,drbh2o,2018-12-16 07:46:37 +0300,2018-12-16 17:47:34 +0300,research,CC-BY-NC,https://www.inaturalist.org/observations/19042515,https://static.inaturalist.org/photos/29208783/medium.jpg?1544935632,,,,1,0,FALSE,3,"Los Angeles County, US-CA, US",Santa Catalina,33.33612196,-118.2052575,5,28984,,obscured,TRUE,,,,Los Angeles,California,United States,California,Los Angeles,Catalina Cactussnail,Xerarionta kellettii,Catalina Cactussnail,Mollusca,233776,Mollusca,Gastropoda,Stylommatophora,Helminthoglyptidae,,
iNaturalist,20929729,2019-03-03 2:51:52 PM PST,3/3/2019 0:00,3/4/2019,2019,3,4,1:51:52,300,Pacific Time (US & Canada),1335917,grehanburns,2019-03-04 04:10:59 +0300,2019-03-06 06:33:52 +0300,research,CC-BY-NC,https://www.inaturalist.org/observations/20929729,https://inaturalist-open-data.s3.amazonaws.com/photos/32304701/medium.jpeg?1551661887,,,laying eggs!,3,0,FALSE,2,"Los Angeles County, US-CA, US",Santa Catalina,33.42283055,-118.5347918,6,28957,obscured,obscured,TRUE,gps,gps,,Los Angeles,California,United States,California,Los Angeles,Catalina Cactussnail,Xerarionta kellettii,Catalina Cactussnail,Mollusca,233776,Mollusca,Gastropoda,Stylommatophora,Helminthoglyptidae,,
iNaturalist,22999191,Wed Apr 24 2019 08:22:34 GMT-0700 (PDT),4/24/2019 0:00,4/24/2019,2019,4,24,18:22:34,300,Pacific Time (US & Canada),1511317,matalina,2019-04-24 18:22:42 +0300,2020-01-01 10:07:53 +0300,research,CC-BY-NC,https://www.inaturalist.org/observations/22999191,https://inaturalist-open-data.s3.amazonaws.com/photos/35654723/medium.jpg?1556119364,,,,3,0,FALSE,3,"Los Angeles County, US-CA, US",Santa Catalina,33.54631652,-118.5880264,10,28957,,obscured,TRUE,,,,Los Angeles,California,United States,California,Los Angeles,Catalina Cactussnail,Xerarionta kellettii,Catalina Cactussnail,Mollusca,233776,Mollusca,Gastropoda,Stylommatophora,Helminthoglyptidae,,
iNaturalist,28536943,2019-07-08 9:17:32 AM PDT,7/8/2019 0:00,7/8/2019,2019,7,8,19:17:32,300,Pacific Time (US & Canada),392423,bjdion,2019-07-10 06:15:48 +0300,2019-12-31 21:16:24 +0300,research,CC-BY-NC-SA,https://www.inaturalist.org/observations/28536943,https://inaturalist-open-data.s3.amazonaws.com/photos/44491938/medium.jpeg?1562728575,,,,3,0,FALSE,2,"Los Angeles County, US-CA, US",Santa Catalina,33.29186975,-118.4633411,6,28984,,obscured,TRUE,,,,Los Angeles,California,United States,California,Los Angeles,Catalina Cactussnail,Xerarionta kellettii,Catalina Cactussnail,Mollusca,233776,Mollusca,Gastropoda,Stylommatophora,Helminthoglyptidae,,
iNaturalist,32280738,2019-09-07 8:26:40 AM PDT,9/7/2019 0:00,9/7/2019,2019,9,7,18:26:40,300,Pacific Time (US & Canada),392423,bjdion,2019-09-07 20:31:35 +0300,2019-09-22 21:37:26 +0300,needs_id,CC-BY-NC-SA,https://www.inaturalist.org/observations/32280738,https://inaturalist-open-data.s3.amazonaws.com/photos/50615530/medium.jpeg?1567877501,,,,1,0,FALSE,2,"Los Angeles County, US-CA, US",Santa Catalina,33.24310583,-118.4398985,9,28984,,obscured,TRUE,,,,Los Angeles,California,United States,California,Los Angeles,Catalina Cactussnail,Xerarionta kellettii,Catalina Cactussnail,Mollusca,233776,Mollusca,Gastropoda,Stylommatophora,Helminthoglyptidae,,
iNaturalist,34992660,2019-10-27 8:08:00 AM PDT,10/27/2019 0:00,10/27/2019,2019,10,27,18:08:00,300,Pacific Time (US & Canada),392423,bjdion,2019-10-28 05:18:27 +0300,2020-01-01 09:03:34 +0300,research,CC-BY-NC-SA,https://www.inaturalist.org/observations/34992660,https://inaturalist-open-data.s3.amazonaws.com/photos/55144376/medium.jpeg?1572229116,,,In riparian area on west end of parsons landing beach,4,0,FALSE,2,"Los Angeles County, US-CA, US",Santa Catalina,33.5159935,-118.547905,4,28957,,obscured,TRUE,,,,Los Angeles,California,United States,California,Los Angeles,Catalina Cactussnail,Xerarionta kellettii,Catalina Cactussnail,Mollusca,233776,Mollusca,Gastropoda,Stylommatophora,Helminthoglyptidae,,
iNaturalist,35035047,2019-10-28 11:57:29 AM PDT,10/28/2019 0:00,10/28/2019,2019,10,28,21:57:29,300,Pacific Time (US & Canada),392423,bjdion,2019-10-29 06:01:21 +0300,2020-01-01 09:03:47 +0300,research,CC-BY-NC-SA,https://www.inaturalist.org/observations/35035047,https://inaturalist-open-data.s3.amazonaws.com/photos/55218194/medium.jpeg?1572318087,,,,2,0,FALSE,2,"Los Angeles County, US-CA, US",Santa Catalina,33.30543956,-118.2707193,9,28984,,obscured,TRUE,,,,Los Angeles,California,United States,California,Los Angeles,Catalina Cactussnail,Xerarionta kellettii,Catalina Cactussnail,Mollusca,233776,Mollusca,Gastropoda,Stylommatophora,Helminthoglyptidae,,
iNaturalist,40058096,7/22/2001,7/22/2001 0:00,,,,,,,Pacific Time (US & Canada),94012,pliffgrieff,2020-03-16 03:55:51 +0300,2020-03-16 05:18:46 +0300,research,CC-BY-NC-SA,https://www.inaturalist.org/observations/40058096,https://inaturalist-open-data.s3.amazonaws.com/photos/63618955/medium.jpg?1584319989,,,at the base of the rock outcrop facing the the boat harbor (getting caught up on old observations),1,0,FALSE,,"Los Angeles County, US-CA, US",Santa Catalina,33.22496666,-118.3000637,69,28984,,obscured,TRUE,,,,Los Angeles,California,United States,California,Los Angeles,Catalina Cactussnail,Xerarionta kellettii,Catalina Cactussnail,Mollusca,233776,Mollusca,Gastropoda,Stylommatophora,Helminthoglyptidae,,
iNaturalist,74931906,2021-04-20 6:09:52 PM PDT,4/20/2021 0:00,4/21/2021,2021,4,21,4:09:52,300,Pacific Time (US & Canada),305051,kylegunther,2021-04-23 17:44:03 +0300,2021-04-28 19:24:34 +0300,needs_id,,https://www.inaturalist.org/observations/74931906,https://static.inaturalist.org/photos/122529413/medium.jpeg?1619189056,,,,1,0,FALSE,2,"Los Angeles County, US-CA, US",Santa Catalina,33.30928196,-118.5615275,,28984,,obscured,TRUE,gps,gps,,Los Angeles,California,United States,California,Los Angeles,Catalina Cactussnail,Xerarionta kellettii,Catalina Cactussnail,Mollusca,233776,Mollusca,Gastropoda,Stylommatophora,Helminthoglyptidae,,
iNaturalist,1830815,Sun Aug 02 2015 06:32:05 GMT-0700 (PDT),8/2/2015 0:00,8/2/2015,2015,8,2,16:32:05,300,Pacific Time (US & Canada),3494,damontighe,2015-08-04 08:34:16 +0300,2019-02-22 08:41:10 +0300,research,CC-BY-NC,http://www.inaturalist.org/observations/1830815,https://inaturalist-open-data.s3.amazonaws.com/photos/2222823/medium.jpg?1438666574,,,,3,0,FALSE,3,"Los Angeles County, US-CA, US",,33.59176463,-118.5151983,,28957,,obscured,TRUE,,,,Los Angeles,California,United States,California,Los Angeles,Xerarionta kellettii,Xerarionta kellettii,Catalina Cactussnail,Mollusca,233776,Mollusca,Gastropoda,Stylommatophora,Xanthonychidae,Xerarionta,Xerarionta kellettii
iNaturalist,9005313,Wed Nov 29 2017 07:02:55 GMT-0800 (PST),11/29/2017 0:00,11/29/2017,2017,11,29,18:02:55,300,Pacific Time (US & Canada),280979,emshaph,2017-12-01 09:32:10 +0300,2019-02-22 02:38:01 +0300,research,CC-BY-NC,https://www.inaturalist.org/observations/9005313,https://inaturalist-open-data.s3.amazonaws.com/photos/12139387/medium.jpg?1512110120,,,,2,0,FALSE,3,"Los Angeles County, US-CA, US",,33.55634367,-118.4712259,22,28957,,obscured,TRUE,,,,Los Angeles,California,United States,California,Los Angeles,Catalina Cactussnail,Xerarionta kellettii,Catalina Cactussnail,Mollusca,233776,Mollusca,Gastropoda,Stylommatophora,Xanthonychidae,Xerarionta,Xerarionta kellettii
iNaturalist,9464643,2018-01-13 1:38:34 PM PST,1/13/2018 0:00,1/14/2018,2018,1,14,0:38:34,300,Pacific Time (US & Canada),392423,bjdion,2018-01-14 05:18:28 +0300,2018-02-22 04:29:28 +0300,research,CC-BY-NC-SA,https://www.inaturalist.org/observations/9464643,https://inaturalist-open-data.s3.amazonaws.com/photos/12877378/medium.jpeg?1515896314,,,,3,0,FALSE,2,"Los Angeles County, US-CA, US",,33.58552227,-118.280539,9,28957,,obscured,TRUE,,,,Los Angeles,California,United States,California,Los Angeles,Catalina Cactussnail,Xerarionta kellettii,Catalina Cactussnail,Mollusca,233776,Mollusca,Gastropoda,Stylommatophora,Xanthonychidae,Xerarionta,Xerarionta kellettii
iNaturalist,10265231,Thu Mar 15 2018 15:19:37 GMT-0700 (PDT),3/15/2018 0:00,3/16/2018,2018,3,16,1:19:37,300,Pacific Time (US & Canada),819,rebeccafay,2018-03-17 02:14:49 +0300,2020-03-16 02:38:40 +0300,research,CC0,https://www.inaturalist.org/observations/10265231,https://inaturalist-open-data.s3.amazonaws.com/photos/14205925/medium.jpg?1521242092,,,,3,1,FALSE,3,"Los Angeles County, US-CA, US",,33.52084229,-118.4086785,5,28957,,obscured,TRUE,,,,Los Angeles,California,United States,California,Los Angeles,Catalina Cactussnail,Xerarionta kellettii,Catalina Cactussnail,Mollusca,233776,Mollusca,Gastropoda,Stylommatophora,Xanthonychidae,Xerarionta,Xerarionta kellettii
iNaturalist,12000973,2018/04/28 3:25 PM PDT,4/28/2018 0:00,4/29/2018,2018,4,29,1:25:00,300,Pacific Time (US & Canada),6971,silversea_starsong,2018-05-01 21:12:45 +0300,2019-12-31 12:02:11 +0300,research,CC-BY-NC,https://www.inaturalist.org/observations/12000973,https://inaturalist-open-data.s3.amazonaws.com/photos/17194197/medium.jpeg?1525197894,,,#NAME?,2,0,FALSE,,"Los Angeles County, US-CA, US",,33.25862875,-118.2195304,,28984,,obscured,TRUE,,,,Los Angeles,California,United States,California,Los Angeles,Catalina Cactussnail,Xerarionta kellettii,Catalina Cactussnail,Mollusca,233776,Mollusca,Gastropoda,Stylommatophora,Xanthonychidae,Xerarionta,Xerarionta kellettii
iNaturalist,30854631,2019-08-14 11:22:22 AM PDT,8/14/2019 0:00,8/14/2019,2019,8,14,21:22:22,300,Pacific Time (US & Canada),392423,bjdion,2019-08-15 07:24:27 +0300,2019-12-31 05:21:26 +0300,research,CC-BY-NC-SA,https://www.inaturalist.org/observations/30854631,https://inaturalist-open-data.s3.amazonaws.com/photos/48232337/medium.jpeg?1565843071,,,,2,0,FALSE,2,"Los Angeles County, US-CA, US",,33.59233017,-118.4313741,6,28957,,obscured,TRUE,,,,Los Angeles,California,United States,California,Los Angeles,Catalina Cactussnail,Xerarionta kellettii,Catalina Cactussnail,Mollusca,233776,Mollusca,Gastropoda,Stylommatophora,Xanthonychidae,Xerarionta,Xerarionta kellettii
iNaturalist,32776539,2019-09-14 5:37:03 PM PDT,9/14/2019 0:00,9/15/2019,2019,9,15,3:37:03,300,Pacific Time (US & Canada),392423,bjdion,2019-09-15 20:32:04 +0300,2019-09-19 17:58:06 +0300,research,CC-BY-NC-SA,https://www.inaturalist.org/observations/32776539,https://inaturalist-open-data.s3.amazonaws.com/photos/51431362/medium.jpeg?1568568729,,,Juvenile,1,0,FALSE,2,"Los Angeles County, US-CA, US",,33.56605022,-118.5616221,9,28957,,obscured,TRUE,,,,Los Angeles,California,United States,California,Los Angeles,Catalina Cactussnail,Xerarionta kellettii,Catalina Cactussnail,Mollusca,233776,Mollusca,Gastropoda,Stylommatophora,Xanthonychidae,Xerarionta,Xerarionta kellettii
iNaturalist,34992986,2019-10-27 1:49:22 PM PDT,10/27/2019 0:00,10/27/2019,2019,10,27,23:49:22,300,Pacific Time (US & Canada),392423,bjdion,2019-10-28 05:27:55 +0300,2020-01-01 09:03:32 +0300,research,CC-BY-NC-SA,https://www.inaturalist.org/observations/34992986,https://inaturalist-open-data.s3.amazonaws.com/photos/55145064/medium.jpeg?1572229679,,,"Adjust coordinates, was further west next to last batch of obs ",2,0,FALSE,2,"Los Angeles County, US-CA, US",,33.56585747,-118.4522987,7,28957,,obscured,TRUE,,,,Los Angeles,California,United States,California,Los Angeles,Catalina Cactussnail,Xerarionta kellettii,Catalina Cactussnail,Mollusca,233776,Mollusca,Gastropoda,Stylommatophora,Xanthonychidae,Xerarionta,Xerarionta kellettii
iNaturalist,74907429,2021-04-20 3:22:35 PM PDT,4/20/2021 0:00,4/21/2021,2021,4,21,1:22:35,300,Pacific Time (US & Canada),305051,kylegunther,2021-04-23 09:17:42 +0300,2021-05-02 07:01:15 +0300,needs_id,,https://www.inaturalist.org/observations/74907429,https://static.inaturalist.org/photos/122487401/medium.jpeg?1619158665,,,,1,0,FALSE,2,"Los Angeles County, US-CA, US",,33.59897643,-118.493025,14,28957,obscured,obscured,TRUE,gps,gps,,Los Angeles,California,United States,California,Los Angeles,Catalina Cactussnail,Xerarionta kellettii,Catalina Cactussnail,Mollusca,233776,Mollusca,Gastropoda,Stylommatophora,Xanthonychidae,Xerarionta,Xerarionta kellettii
iNaturalist,4885778,2016/12/12 10:29 AM PST,12/12/2016 0:00,12/12/2016,2016,12,12,21:29:00,300,Pacific Time (US & Canada),266196,shrike2,2017-01-03 05:17:10 +0300,2020-02-25 00:39:20 +0300,research,CC-BY-NC-ND,https://www.inaturalist.org/observations/4885778,https://inaturalist-open-data.s3.amazonaws.com/photos/5940931/medium.jpeg?1483409751,,,,1,0,FALSE,,"California, US",San Clemente,32.84249539,-118.4549798,222,29039,,obscured,TRUE,,manual,,Los Angeles,California,United States,California,Los Angeles,Wreathed Cactussnail,Xerarionta redimita,Wreathed Cactussnail,Mollusca,115079,Mollusca,Gastropoda,Stylommatophora,Helminthoglyptidae,,
iNaturalist,7670540,4/12/1988,4/12/1988 0:00,,,,,,,Pacific Time (US & Canada),12809,cedric_lee,2017-08-27 10:53:28 +0300,2020-02-25 00:31:44 +0300,research,CC-BY-NC,https://www.inaturalist.org/observations/7670540,https://static.inaturalist.org/photos/10044255/medium.jpg?1503820127,,,"This shell is from NHMLA's malacology collection.
",2,0,FALSE,,"Los Angeles County, US-CA, US",San Clemente,33.04191632,-118.4985624,157,28998,,obscured,TRUE,,,,Los Angeles,California,United States,California,Los Angeles,Wreathed Cactussnail,Xerarionta redimita,Wreathed Cactussnail,Mollusca,115079,Mollusca,Gastropoda,Stylommatophora,Helminthoglyptidae,,
iNaturalist,7674614,8/27/2017,8/27/2017 0:00,,,,,,,Pacific Time (US & Canada),12809,cedric_lee,2017-08-27 20:11:43 +0300,2017-11-15 08:30:32 +0300,research,CC-BY-NC,https://www.inaturalist.org/observations/7674614,https://static.inaturalist.org/photos/10050804/medium.jpg?1503853860,,,"No date of collection was given for this shell from NHMLA's malacology collection.
",3,0,FALSE,,"California, US",San Clemente,32.96519429,-118.5303679,19327,29025,,obscured,TRUE,,,,Los Angeles,California,United States,California,Los Angeles,Wreathed Cactussnail,Xerarionta redimita,Wreathed Cactussnail,Mollusca,115079,Mollusca,Gastropoda,Stylommatophora,Helminthoglyptidae,,
iNaturalist,7834887,12/10/1935,12/10/1935 0:00,,,,,,,Pacific Time (US & Canada),84767,tlawson,2017-09-08 20:53:21 +0300,2021-03-11 22:49:50 +0300,research,,https://www.inaturalist.org/observations/7834887,https://static.inaturalist.org/photos/11312395/medium.jpg?1508539587,,,Xerarionta redimita collected on San Clemente Island by C. &C. Martin in December 1935.,2,0,FALSE,3,"California, US",San Clemente,32.89083351,-118.5168693,805,29039,,obscured,TRUE,,,,Los Angeles,California,United States,California,Los Angeles,Wreathed Cactussnail,Xerarionta redimita,Wreathed Cactussnail,Mollusca,115079,Mollusca,Gastropoda,Stylommatophora,Helminthoglyptidae,,
iNaturalist,7835073,Fri Sep 08 2017 10:02:50 GMT-0700 (PDT),9/8/2017 0:00,9/8/2017,2017,9,8,20:02:50,300,Pacific Time (US & Canada),84767,tlawson,2017-09-08 21:10:12 +0300,2019-01-11 23:51:53 +0300,research,,https://www.inaturalist.org/observations/7835073,https://static.inaturalist.org/photos/11513822/medium.jpg?1509326834,,,From an old collection. Xerarionta redimita form inconstans collected by Henry Hemphill on San Clemente Island.,1,0,FALSE,3,"California, US",San Clemente,32.8352764,-118.5716673,476,29025,,obscured,TRUE,,,,Los Angeles,California,United States,California,Los Angeles,Wreathed Cactussnail,Xerarionta redimita,Wreathed Cactussnail,Mollusca,115079,Mollusca,Gastropoda,Stylommatophora,Helminthoglyptidae,,
iNaturalist,10231507,Tue Mar 13 2018 11:22:34 GMT-0700 (PDT),3/13/2018 0:00,3/13/2018,2018,3,13,21:22:34,300,Pacific Time (US & Canada),266196,shrike2,2018-03-14 17:30:47 +0300,2020-02-25 00:38:54 +0300,research,CC-BY-NC-ND,https://www.inaturalist.org/observations/10231507,https://inaturalist-open-data.s3.amazonaws.com/photos/14144743/medium.jpg?1521037916,,,,2,0,FALSE,3,"California, US",San Clemente,32.96819807,-118.5454652,5,29039,,obscured,TRUE,,,,Los Angeles,California,United States,California,Los Angeles,Wreathed Cactussnail,Xerarionta redimita,Wreathed Cactussnail,Mollusca,115079,Mollusca,Gastropoda,Stylommatophora,Helminthoglyptidae,,
iNaturalist,12395638,Sat May 12 2018 09:27:54 GMT-0700 (PDT),5/12/2018 0:00,5/12/2018,2018,5,12,19:27:54,300,Pacific Time (US & Canada),213838,vireolanius,2018-05-13 01:26:23 +0300,2020-02-27 20:33:14 +0300,research,CC-BY-NC,https://www.inaturalist.org/observations/12395638,https://inaturalist-open-data.s3.amazonaws.com/photos/17865511/medium.jpg?1526164007,,,,2,0,FALSE,3,"California, US",San Clemente,32.91319726,-118.5964694,5,29039,,obscured,TRUE,,,,Los Angeles,California,United States,California,Los Angeles,Wreathed Cactussnail,Xerarionta redimita,Wreathed Cactussnail,Mollusca,115079,Mollusca,Gastropoda,Stylommatophora,Helminthoglyptidae,,
iNaturalist,19497734,2019/01/06 1:43 PM PST,1/6/2019 0:00,1/7/2019,2019,1,7,0:43:00,300,Pacific Time (US & Canada),213838,vireolanius,2019-01-08 00:20:25 +0300,2020-03-08 11:12:19 +0300,research,CC-BY-NC,https://www.inaturalist.org/observations/19497734,https://inaturalist-open-data.s3.amazonaws.com/photos/30002388/medium.jpg?1546895754,,,,2,0,FALSE,,"Los Angeles County, US-CA, US",San Clemente,32.94395699,-118.5322463,34,29039,,obscured,TRUE,,manual,,Los Angeles,California,United States,California,Los Angeles,Wreathed Cactussnail,Xerarionta redimita,Wreathed Cactussnail,Mollusca,115079,Mollusca,Gastropoda,Stylommatophora,Helminthoglyptidae,,
iNaturalist,19560508,2019/01/10 10:20 AM PST,1/10/2019 0:00,1/10/2019,2019,1,10,21:20:00,300,Pacific Time (US & Canada),23091,sue_meiman,2019-01-11 02:35:23 +0300,2020-02-27 21:09:18 +0300,research,CC-BY-NC,https://www.inaturalist.org/observations/19560508,https://inaturalist-open-data.s3.amazonaws.com/photos/30107717/medium.jpg?1547163236,,,,2,0,FALSE,,"California, US",San Clemente,32.89898048,-118.5234485,181,29039,,obscured,TRUE,,,,Los Angeles,California,United States,California,Los Angeles,Wreathed Cactussnail,Xerarionta redimita,Wreathed Cactussnail,Mollusca,115079,Mollusca,Gastropoda,Stylommatophora,Helminthoglyptidae,,
iNaturalist,20158454,Sat Jan 26 2019 08:49:56 GMT-0800 (PST),1/26/2019 0:00,1/26/2019,2019,1,26,19:49:56,300,Pacific Time (US & Canada),266196,shrike2,2019-02-06 20:57:48 +0300,2020-02-25 00:39:18 +0300,research,CC-BY-NC-ND,https://www.inaturalist.org/observations/20158454,https://static.inaturalist.org/photos/31096877/medium.jpg?1549475903,,,,1,0,FALSE,3,"California, US",San Clemente,32.95734528,-118.5811241,142,29039,,obscured,TRUE,,,,Los Angeles,California,United States,California,Los Angeles,Wreathed Cactussnail,Xerarionta redimita,Wreathed Cactussnail,Mollusca,115079,Mollusca,Gastropoda,Stylommatophora,Helminthoglyptidae,,
iNaturalist,20216919,Fri Feb 08 2019 11:57:04 GMT-0800 (PST),2/8/2019 0:00,2/8/2019,2019,2,8,22:57:04,300,Pacific Time (US & Canada),266196,shrike2,2019-02-09 06:22:36 +0300,2020-02-25 00:38:34 +0300,research,CC-BY-NC-ND,https://www.inaturalist.org/observations/20216919,https://static.inaturalist.org/photos/31206733/medium.jpg?1549682611,,,,2,1,FALSE,3,"California, US",San Clemente,32.87121424,-118.4250767,10,29039,,obscured,TRUE,,,,Los Angeles,California,United States,California,Los Angeles,Wreathed Cactussnail,Xerarionta redimita,Wreathed Cactussnail,Mollusca,115079,Mollusca,Gastropoda,Stylommatophora,Helminthoglyptidae,,
iNaturalist,20239047,Sat Feb 09 2019 10:08:06 GMT-0800 (PST),2/9/2019 0:00,2/9/2019,2019,2,9,21:08:06,300,Pacific Time (US & Canada),266196,shrike2,2019-02-10 01:27:31 +0300,2020-02-25 00:38:30 +0300,research,CC-BY-NC-ND,https://www.inaturalist.org/observations/20239047,https://static.inaturalist.org/photos/31236327/medium.jpg?1549751292,,,,3,0,FALSE,3,"California, US",San Clemente,32.81935289,-118.5094866,10,29039,,obscured,TRUE,,,,Los Angeles,California,United States,California,Los Angeles,Wreathed Cactussnail,Xerarionta redimita,Wreathed Cactussnail,Mollusca,115079,Mollusca,Gastropoda,Stylommatophora,Helminthoglyptidae,,
iNaturalist,20280903,Sun Feb 10 2019 09:43:19 GMT-0800 (PST),2/10/2019 0:00,2/10/2019,2019,2,10,20:43:19,300,Pacific Time (US & Canada),266196,shrike2,2019-02-11 18:44:47 +0300,2020-02-25 00:37:34 +0300,research,CC-BY-NC-ND,https://www.inaturalist.org/observations/20280903,https://static.inaturalist.org/photos/31308184/medium.jpg?1549899899,,,Looks like Helminthoglypta tudiculata but that species is not known to be on the island.,3,0,FALSE,3,"California, US",San Clemente,32.89809433,-118.596593,5,29039,,obscured,TRUE,,,,Los Angeles,California,United States,California,Los Angeles,Wreathed Cactussnail,Xerarionta redimita,Wreathed Cactussnail,Mollusca,115079,Mollusca,Gastropoda,Stylommatophora,Helminthoglyptidae,,
iNaturalist,20345428,Tue Feb 05 2019 11:00:22 GMT-0800 (PST),2/5/2019 0:00,2/5/2019,2019,2,5,22:00:22,300,Pacific Time (US & Canada),1474963,stephlbartlett,2019-02-14 19:49:12 +0300,2019-04-20 05:55:56 +0300,needs_id,CC-BY-NC,https://www.inaturalist.org/observations/20345428,https://inaturalist-open-data.s3.amazonaws.com/photos/31415400/medium.jpg?1550162955,,,,1,0,FALSE,3,"California, US",San Clemente,32.97189908,-118.4174319,14991,29039,,obscured,TRUE,,,,Los Angeles,California,United States,California,Los Angeles,Wreathed Cactussnail,Xerarionta redimita,Wreathed Cactussnail,Mollusca,115079,Mollusca,Gastropoda,Stylommatophora,Helminthoglyptidae,,
iNaturalist,20373915,Fri Feb 15 2019 08:16:11 GMT-0800 (PST),2/15/2019 0:00,2/15/2019,2019,2,15,19:16:11,300,Pacific Time (US & Canada),266196,shrike2,2019-02-16 02:31:14 +0300,2020-02-25 00:38:57 +0300,research,CC-BY-NC-ND,https://www.inaturalist.org/observations/20373915,https://static.inaturalist.org/photos/31462583/medium.jpg?1550273655,,,,2,1,FALSE,3,"Los Angeles County, US-CA, US",San Clemente,33.01583055,-118.4574805,33,29012,,obscured,TRUE,,,,Los Angeles,California,United States,California,Los Angeles,Wreathed Cactussnail,Xerarionta redimita,Wreathed Cactussnail,Mollusca,115079,Mollusca,Gastropoda,Stylommatophora,Helminthoglyptidae,,
iNaturalist,20469362,Mon Feb 18 2019 11:58:40 GMT-0800 (PST),2/18/2019 0:00,2/18/2019,2019,2,18,22:58:40,300,Pacific Time (US & Canada),213838,vireolanius,2019-02-19 03:43:51 +0300,2020-02-27 20:33:18 +0300,research,CC-BY-NC,https://www.inaturalist.org/observations/20469362,https://inaturalist-open-data.s3.amazonaws.com/photos/31597256/medium.jpg?1550537035,,,,3,0,FALSE,3,"California, US",San Clemente,32.89190748,-118.4101967,,29039,,obscured,TRUE,,,,Los Angeles,California,United States,California,Los Angeles,Wreathed Cactussnail,Xerarionta redimita,Wreathed Cactussnail,Mollusca,115079,Mollusca,Gastropoda,Stylommatophora,Helminthoglyptidae,,
iNaturalist,20509316,Tue Feb 19 2019 17:09:15 GMT-0800 (PST),2/19/2019 0:00,2/20/2019,2019,2,20,4:09:15,300,Pacific Time (US & Canada),213838,vireolanius,2019-02-20 17:30:19 +0300,2020-02-27 20:33:15 +0300,research,CC-BY-NC,https://www.inaturalist.org/observations/20509316,https://inaturalist-open-data.s3.amazonaws.com/photos/31655898/medium.jpg?1550673027,,,,4,0,FALSE,3,"Los Angeles County, US-CA, US",San Clemente,32.9418838,-118.5889522,5,29039,,obscured,TRUE,,,,Los Angeles,California,United States,California,Los Angeles,Wreathed Cactussnail,Xerarionta redimita,Wreathed Cactussnail,Mollusca,115079,Mollusca,Gastropoda,Stylommatophora,Helminthoglyptidae,,
iNaturalist,20509317,Tue Feb 19 2019 17:09:41 GMT-0800 (PST),2/19/2019 0:00,2/20/2019,2019,2,20,4:09:41,300,Pacific Time (US & Canada),213838,vireolanius,2019-02-20 17:30:34 +0300,2020-02-27 20:33:17 +0300,research,CC-BY-NC,https://www.inaturalist.org/observations/20509317,https://inaturalist-open-data.s3.amazonaws.com/photos/31655902/medium.jpg?1550673043,,,,2,0,FALSE,3,"Los Angeles County, US-CA, US",San Clemente,32.97120427,-118.5827883,5,29039,,obscured,TRUE,,,,Los Angeles,California,United States,California,Los Angeles,Wreathed Cactussnail,Xerarionta redimita,Wreathed Cactussnail,Mollusca,115079,Mollusca,Gastropoda,Stylommatophora,Helminthoglyptidae,,
iNaturalist,20877750,Fri Mar 01 2019 07:53:20 GMT-0800 (PST),3/1/2019 0:00,3/1/2019,2019,3,1,18:53:20,300,Pacific Time (US & Canada),1474963,stephlbartlett,2019-03-02 17:38:13 +0300,2019-03-05 01:17:02 +0300,research,CC-BY-NC,https://www.inaturalist.org/observations/20877750,https://inaturalist-open-data.s3.amazonaws.com/photos/32212777/medium.jpg?1551537501,,,,2,0,FALSE,3,"California, US",San Clemente,32.95590426,-118.526903,5,29039,,obscured,TRUE,,,,Los Angeles,California,United States,California,Los Angeles,Wreathed Cactussnail,Xerarionta redimita,Wreathed Cactussnail,Mollusca,115079,Mollusca,Gastropoda,Stylommatophora,Helminthoglyptidae,,
iNaturalist,20877754,Fri Mar 01 2019 07:59:38 GMT-0800 (PST),3/1/2019 0:00,3/1/2019,2019,3,1,18:59:38,300,Pacific Time (US & Canada),1474963,stephlbartlett,2019-03-02 17:38:37 +0300,2019-04-20 05:55:07 +0300,needs_id,CC-BY-NC,https://www.inaturalist.org/observations/20877754,https://inaturalist-open-data.s3.amazonaws.com/photos/32212790/medium.jpg?1551537530,,,,1,0,FALSE,3,"California, US",San Clemente,32.91965233,-118.48296,5,29039,,obscured,TRUE,,,,Los Angeles,California,United States,California,Los Angeles,Xerarionta,Xerarionta redimita,Wreathed Cactussnail,Mollusca,115079,Mollusca,Gastropoda,Stylommatophora,Helminthoglyptidae,,
iNaturalist,20904584,Wed Feb 20 2019 12:46:23 GMT-0800 (PST),2/20/2019 0:00,2/20/2019,2019,2,20,23:46:23,300,Pacific Time (US & Canada),688240,empid,2019-03-03 10:01:03 +0300,2019-03-05 01:14:57 +0300,research,CC-BY-NC,https://www.inaturalist.org/observations/20904584,https://inaturalist-open-data.s3.amazonaws.com/photos/32260618/medium.jpg?1551596466,,,,3,0,FALSE,3,"California, US",San Clemente,32.97465636,-118.5528018,5,29039,,obscured,TRUE,,,,Los Angeles,California,United States,California,Los Angeles,Wreathed Cactussnail,Xerarionta redimita,Wreathed Cactussnail,Mollusca,115079,Mollusca,Gastropoda,Stylommatophora,Helminthoglyptidae,,
iNaturalist,20953880,Mon Mar 04 2019 09:34:58 GMT-0800 (PST),3/4/2019 0:00,3/4/2019,2019,3,4,20:34:58,300,Pacific Time (US & Canada),213838,vireolanius,2019-03-05 01:08:46 +0300,2020-02-27 20:33:20 +0300,research,CC-BY-NC,https://www.inaturalist.org/observations/20953880,https://inaturalist-open-data.s3.amazonaws.com/photos/32349315/medium.jpg?1551737344,,,,3,0,FALSE,3,"California, US",San Clemente,32.92890849,-118.5745705,5,29039,,obscured,TRUE,,,,Los Angeles,California,United States,California,Los Angeles,Wreathed Cactussnail,Xerarionta redimita,Wreathed Cactussnail,Mollusca,115079,Mollusca,Gastropoda,Stylommatophora,Helminthoglyptidae,,
iNaturalist,20953901,Mon Mar 04 2019 09:44:57 GMT-0800 (PST),3/4/2019 0:00,3/4/2019,2019,3,4,20:44:57,300,Pacific Time (US & Canada),213838,vireolanius,2019-03-05 01:10:02 +0300,2020-02-27 20:33:20 +0300,research,CC-BY-NC,https://www.inaturalist.org/observations/20953901,https://inaturalist-open-data.s3.amazonaws.com/photos/32349383/medium.jpg?1551737415,,,,3,0,FALSE,3,"California, US",San Clemente,32.97475502,-118.5836837,10,29039,,obscured,TRUE,,,,Los Angeles,California,United States,California,Los Angeles,Wreathed Cactussnail,Xerarionta redimita,Wreathed Cactussnail,Mollusca,115079,Mollusca,Gastropoda,Stylommatophora,Helminthoglyptidae,,
iNaturalist,20953915,Mon Mar 04 2019 09:45:29 GMT-0800 (PST),3/4/2019 0:00,3/4/2019,2019,3,4,20:45:29,300,Pacific Time (US & Canada),213838,vireolanius,2019-03-05 01:10:22 +0300,2020-02-27 20:33:20 +0300,research,CC-BY-NC,https://www.inaturalist.org/observations/20953915,https://inaturalist-open-data.s3.amazonaws.com/photos/32349398/medium.jpg?1551737429,,,,3,0,FALSE,3,"California, US",San Clemente,32.88558301,-118.4901052,5,29039,,obscured,TRUE,,,,Los Angeles,California,United States,California,Los Angeles,Wreathed Cactussnail,Xerarionta redimita,Wreathed Cactussnail,Mollusca,115079,Mollusca,Gastropoda,Stylommatophora,Helminthoglyptidae,,
iNaturalist,20953944,Mon Mar 04 2019 09:54:32 GMT-0800 (PST),3/4/2019 0:00,3/4/2019,2019,3,4,20:54:32,300,Pacific Time (US & Canada),213838,vireolanius,2019-03-05 01:11:58 +0300,2020-02-27 20:33:14 +0300,research,CC-BY-NC,https://www.inaturalist.org/observations/20953944,https://inaturalist-open-data.s3.amazonaws.com/photos/32349485/medium.jpg?1551737546,,,,3,0,FALSE,3,"California, US",San Clemente,32.94167976,-118.5417298,10,29039,,obscured,TRUE,,,,Los Angeles,California,United States,California,Los Angeles,Wreathed Cactussnail,Xerarionta redimita,Wreathed Cactussnail,Mollusca,115079,Mollusca,Gastropoda,Stylommatophora,Helminthoglyptidae,,
iNaturalist,21067960,Tue Mar 05 2019 11:27:39 GMT-0800 (PST),3/5/2019 0:00,3/5/2019,2019,3,5,22:27:39,300,Pacific Time (US & Canada),266196,shrike2,2019-03-09 03:59:11 +0300,2020-02-25 00:38:50 +0300,research,CC-BY-NC-ND,https://www.inaturalist.org/observations/21067960,https://static.inaturalist.org/photos/32551360/medium.jpg?1552093209,,,,3,0,FALSE,3,"California, US",San Clemente,32.81103703,-118.5922723,5,29039,,obscured,TRUE,,,,Los Angeles,California,United States,California,Los Angeles,Wreathed Cactussnail,Xerarionta redimita,Wreathed Cactussnail,Mollusca,115079,Mollusca,Gastropoda,Stylommatophora,Helminthoglyptidae,,
iNaturalist,21068072,Tue Mar 05 2019 11:53:18 GMT-0800 (PST),3/5/2019 0:00,3/5/2019,2019,3,5,22:53:18,300,Pacific Time (US & Canada),266196,shrike2,2019-03-09 04:05:27 +0300,2020-02-25 00:38:37 +0300,research,CC-BY-NC-ND,https://www.inaturalist.org/observations/21068072,https://static.inaturalist.org/photos/32551620/medium.jpg?1552093606,,,Maxima?,2,0,FALSE,3,"California, US",San Clemente,32.87111276,-118.4959086,5,29039,,obscured,TRUE,,,,Los Angeles,California,United States,California,Los Angeles,Wreathed Cactussnail,Xerarionta redimita,Wreathed Cactussnail,Mollusca,115079,Mollusca,Gastropoda,Stylommatophora,Helminthoglyptidae,,
iNaturalist,21068115,Tue Mar 05 2019 11:56:14 GMT-0800 (PST),3/5/2019 0:00,3/5/2019,2019,3,5,22:56:14,300,Pacific Time (US & Canada),266196,shrike2,2019-03-09 04:07:45 +0300,2020-02-25 00:38:16 +0300,research,CC-BY-NC-ND,https://www.inaturalist.org/observations/21068115,https://static.inaturalist.org/photos/32551671/medium.jpg?1552093686,,,,3,0,FALSE,3,"California, US",San Clemente,32.93317392,-118.4895323,30,29039,,obscured,TRUE,,,,Los Angeles,California,United States,California,Los Angeles,Wreathed Cactussnail,Xerarionta redimita,Wreathed Cactussnail,Mollusca,115079,Mollusca,Gastropoda,Stylommatophora,Helminthoglyptidae,,
iNaturalist,21069401,Fri Mar 08 2019 13:23:30 GMT-0800 (PST),3/8/2019 0:00,3/9/2019,2019,3,9,0:23:30,300,Pacific Time (US & Canada),266196,shrike2,2019-03-09 05:12:27 +0300,2020-02-25 00:38:14 +0300,research,CC-BY-NC-ND,https://www.inaturalist.org/observations/21069401,https://static.inaturalist.org/photos/32554584/medium.jpg?1552097599,,,,3,0,FALSE,3,"California, US",San Clemente,32.87133699,-118.4389707,5,29039,,obscured,TRUE,,,,Los Angeles,California,United States,California,Los Angeles,Wreathed Cactussnail,Xerarionta redimita,Wreathed Cactussnail,Mollusca,115079,Mollusca,Gastropoda,Stylommatophora,Helminthoglyptidae,,
iNaturalist,21094363,Sat Mar 09 2019 13:20:44 GMT-0800 (PST),3/9/2019 0:00,3/10/2019,2019,3,10,0:20:44,300,Pacific Time (US & Canada),266196,shrike2,2019-03-10 02:15:53 +0300,2020-02-25 00:39:28 +0300,research,CC-BY-NC-ND,https://www.inaturalist.org/observations/21094363,https://static.inaturalist.org/photos/32598702/medium.jpg?1552173368,,,,2,0,FALSE,3,"California, US",San Clemente,32.9274311,-118.5477251,5,29039,,obscured,TRUE,,,,Los Angeles,California,United States,California,Los Angeles,Wreathed Cactussnail,Xerarionta redimita,Wreathed Cactussnail,Mollusca,115079,Mollusca,Gastropoda,Stylommatophora,Helminthoglyptidae,,
iNaturalist,21230917,2019-03-05 1:18:08 PM PST,3/5/2019 0:00,3/6/2019,2019,3,6,0:18:08,300,Pacific Time (US & Canada),34488,pileated,2019-03-14 18:26:19 +0300,2020-04-23 21:20:53 +0300,research,CC-BY,https://www.inaturalist.org/observations/21230917,https://inaturalist-open-data.s3.amazonaws.com/photos/32820633/medium.jpeg?1552577181,,,,3,0,FALSE,2,"Los Angeles County, US-CA, US",San Clemente,32.94222315,-118.5671296,28,29039,,obscured,TRUE,,,,Los Angeles,California,United States,California,Los Angeles,Wreathed Cactussnail,Xerarionta redimita,Wreathed Cactussnail,Mollusca,115079,Mollusca,Gastropoda,Stylommatophora,Helminthoglyptidae,,
iNaturalist,21230960,2019-03-06 3:31:19 PM PST,3/6/2019 0:00,3/7/2019,2019,3,7,2:31:19,300,Pacific Time (US & Canada),34488,pileated,2019-03-14 18:28:32 +0300,2020-04-23 21:20:32 +0300,research,CC-BY,https://www.inaturalist.org/observations/21230960,https://inaturalist-open-data.s3.amazonaws.com/photos/32820719/medium.jpeg?1552577315,,,,3,0,FALSE,2,"Los Angeles County, US-CA, US",San Clemente,32.90432355,-118.5145555,,29039,,obscured,TRUE,gps,gps,,Los Angeles,California,United States,California,Los Angeles,Wreathed Cactussnail,Xerarionta redimita,Wreathed Cactussnail,Mollusca,115079,Mollusca,Gastropoda,Stylommatophora,Helminthoglyptidae,,
iNaturalist,21260444,2019/02/19 4:55 PM PST,2/19/2019 0:00,2/20/2019,2019,2,20,3:55:00,300,Pacific Time (US & Canada),266196,shrike2,2019-03-15 19:39:48 +0300,2020-02-25 00:39:35 +0300,research,CC-BY-NC-ND,https://www.inaturalist.org/observations/21260444,https://static.inaturalist.org/photos/32869469/medium.jpg?1552666330,,,,2,0,FALSE,,"Los Angeles County, US-CA, US",San Clemente,32.93573736,-118.5977235,67,29039,,obscured,TRUE,,,,Los Angeles,California,United States,California,Los Angeles,Wreathed Cactussnail,Xerarionta redimita,Wreathed Cactussnail,Mollusca,115079,Mollusca,Gastropoda,Stylommatophora,Helminthoglyptidae,,
iNaturalist,21260445,2019/02/19 4:58 PM PST,2/19/2019 0:00,,,,,,,Pacific Time (US & Canada),266196,shrike2,2019-03-15 19:39:48 +0300,2020-02-25 00:38:27 +0300,research,CC-BY-NC-ND,https://www.inaturalist.org/observations/21260445,https://static.inaturalist.org/photos/32869499/medium.jpg?1552666385,,,,3,0,FALSE,,"Los Angeles County, US-CA, US",San Clemente,32.91323711,-118.506691,67,29039,,obscured,TRUE,,,,Los Angeles,California,United States,California,Los Angeles,Wreathed Cactussnail,Xerarionta redimita,Wreathed Cactussnail,Mollusca,115079,Mollusca,Gastropoda,Stylommatophora,Helminthoglyptidae,,
iNaturalist,21263479,2019/01/06 2:28 PM PST,1/6/2019 0:00,1/7/2019,2019,1,7,1:28:00,300,Pacific Time (US & Canada),266196,shrike2,2019-03-15 21:34:00 +0300,2020-02-25 00:38:43 +0300,needs_id,CC-BY-NC-ND,https://www.inaturalist.org/observations/21263479,https://static.inaturalist.org/photos/32875030/medium.jpg?1552674344,,,,1,0,FALSE,,"Los Angeles County, US-CA, US",San Clemente,32.94237267,-118.4168234,,29039,,obscured,TRUE,,,,Los Angeles,California,United States,California,Los Angeles,Xerarionta,Xerarionta redimita,Wreathed Cactussnail,Mollusca,115079,Mollusca,Gastropoda,Stylommatophora,Helminthoglyptidae,,
iNaturalist,21263486,2019/01/06 2:41 PM PST,1/6/2019 0:00,,,,,,,Pacific Time (US & Canada),266196,shrike2,2019-03-15 21:34:08 +0300,2020-02-25 00:38:24 +0300,research,CC-BY-NC-ND,https://www.inaturalist.org/observations/21263486,https://static.inaturalist.org/photos/32875144/medium.jpg?1552674479,,,,2,0,FALSE,,"Los Angeles County, US-CA, US",San Clemente,32.83532015,-118.4027157,,29039,,obscured,TRUE,,,,Los Angeles,California,United States,California,Los Angeles,Wreathed Cactussnail,Xerarionta redimita,Wreathed Cactussnail,Mollusca,115079,Mollusca,Gastropoda,Stylommatophora,Helminthoglyptidae,,
iNaturalist,21263494,2019/01/06 2:51 PM PST,1/6/2019 0:00,1/7/2019,2019,1,7,1:51:00,300,Pacific Time (US & Canada),266196,shrike2,2019-03-15 21:34:16 +0300,2020-02-25 00:38:24 +0300,research,CC-BY-NC-ND,https://www.inaturalist.org/observations/21263494,https://static.inaturalist.org/photos/32875187/medium.jpg?1552674540,,,,3,0,FALSE,,"Los Angeles County, US-CA, US",San Clemente,32.9138963,-118.5690068,,29039,,obscured,TRUE,,,,Los Angeles,California,United States,California,Los Angeles,Wreathed Cactussnail,Xerarionta redimita,Wreathed Cactussnail,Mollusca,115079,Mollusca,Gastropoda,Stylommatophora,Helminthoglyptidae,,
iNaturalist,21278990,2019-03-02 8:49:06 AM PST,3/2/2019 0:00,,,,,,,Pacific Time (US & Canada),34488,pileated,2019-03-16 09:39:52 +0300,2020-04-23 21:20:50 +0300,research,CC-BY,https://www.inaturalist.org/observations/21278990,https://inaturalist-open-data.s3.amazonaws.com/photos/32901887/medium.jpeg?1552718396,,,,2,0,FALSE,2,"Los Angeles County, US-CA, US",San Clemente,32.85660175,-118.5536877,704,29039,,obscured,TRUE,gps,gps,,Los Angeles,California,United States,California,Los Angeles,Wreathed Cactussnail,Xerarionta redimita,Wreathed Cactussnail,Mollusca,115079,Mollusca,Gastropoda,Stylommatophora,Helminthoglyptidae,,
iNaturalist,21427295,Wed Mar 20 2019 07:32:57 GMT-0700 (PDT),3/20/2019 0:00,3/20/2019,2019,3,20,17:32:57,300,Pacific Time (US & Canada),213838,vireolanius,2019-03-20 22:21:33 +0300,2020-02-27 20:33:14 +0300,research,CC-BY-NC,https://www.inaturalist.org/observations/21427295,https://inaturalist-open-data.s3.amazonaws.com/photos/33150386/medium.jpg?1553109716,,,,4,0,FALSE,3,"California, US",San Clemente,32.98164345,-118.4133114,5,29039,,obscured,TRUE,,,,Los Angeles,California,United States,California,Los Angeles,Wreathed Cactussnail,Xerarionta redimita,Wreathed Cactussnail,Mollusca,115079,Mollusca,Gastropoda,Stylommatophora,Helminthoglyptidae,,
iNaturalist,21427333,Wed Mar 20 2019 07:40:41 GMT-0700 (PDT),3/20/2019 0:00,3/20/2019,2019,3,20,17:40:41,300,Pacific Time (US & Canada),213838,vireolanius,2019-03-20 22:22:02 +0300,2020-02-27 20:33:16 +0300,research,CC-BY-NC,https://www.inaturalist.org/observations/21427333,https://inaturalist-open-data.s3.amazonaws.com/photos/33150396/medium.jpg?1553109734,,,,5,0,FALSE,3,"California, US",San Clemente,32.9474298,-118.5405887,5,29039,,obscured,TRUE,,,,Los Angeles,California,United States,California,Los Angeles,Wreathed Cactussnail,Xerarionta redimita,Wreathed Cactussnail,Mollusca,115079,Mollusca,Gastropoda,Stylommatophora,Helminthoglyptidae,,
iNaturalist,21427420,Wed Mar 20 2019 10:11:44 GMT-0700 (PDT),3/20/2019 0:00,3/20/2019,2019,3,20,20:11:44,300,Pacific Time (US & Canada),213838,vireolanius,2019-03-20 22:24:24 +0300,2020-02-27 21:28:45 +0300,needs_id,CC-BY-NC,https://www.inaturalist.org/observations/21427420,https://inaturalist-open-data.s3.amazonaws.com/photos/33150513/medium.jpg?1553109877,,,,1,0,FALSE,3,"California, US",San Clemente,32.80848086,-118.5717172,10,29039,,obscured,TRUE,,,,Los Angeles,California,United States,California,Los Angeles,Xerarionta,Xerarionta redimita,Wreathed Cactussnail,Mollusca,115079,Mollusca,Gastropoda,Stylommatophora,Helminthoglyptidae,,
iNaturalist,21689913,Wed Mar 27 2019 08:13:44 GMT-0700 (PDT),3/27/2019 0:00,3/27/2019,2019,3,27,18:13:44,300,Pacific Time (US & Canada),1474963,stephlbartlett,2019-03-28 07:29:06 +0300,2020-01-01 05:51:13 +0300,research,CC-BY-NC,https://www.inaturalist.org/observations/21689913,https://inaturalist-open-data.s3.amazonaws.com/photos/33585360/medium.jpg?1553747349,,,,4,0,FALSE,3,"California, US",San Clemente,32.80931181,-118.505763,5,29039,,obscured,TRUE,,,,Los Angeles,California,United States,California,Los Angeles,Wreathed Cactussnail,Xerarionta redimita,Wreathed Cactussnail,Mollusca,115079,Mollusca,Gastropoda,Stylommatophora,Helminthoglyptidae,,
iNaturalist,21759653,3/21/2019,3/21/2019 0:00,,,,,,,Pacific Time (US & Canada),12809,cedric_lee,2019-03-30 03:55:01 +0300,2020-07-02 06:54:14 +0300,research,CC-BY-NC,https://www.inaturalist.org/observations/21759653,https://inaturalist-open-data.s3.amazonaws.com/photos/33689639/medium.jpeg?1553895621,,,,1,0,FALSE,,"Los Angeles County, US-CA, US",San Clemente,32.92802247,-118.5303401,,29039,obscured,obscured,TRUE,,,,Los Angeles,California,United States,California,Los Angeles,Wreathed Cactussnail,Xerarionta redimita,Wreathed Cactussnail,Mollusca,115079,Mollusca,Gastropoda,Stylommatophora,Helminthoglyptidae,,
iNaturalist,21769746,3/22/2019,3/22/2019 0:00,,,,,,,Pacific Time (US & Canada),12809,cedric_lee,2019-03-30 10:37:24 +0300,2020-07-02 06:54:18 +0300,research,CC-BY-NC,https://www.inaturalist.org/observations/21769746,https://inaturalist-open-data.s3.amazonaws.com/photos/33713850/medium.jpeg?1553921376,,,,2,0,FALSE,,"Los Angeles County, US-CA, US",San Clemente,32.82323792,-118.4613689,,29039,obscured,obscured,TRUE,,,,Los Angeles,California,United States,California,Los Angeles,Wreathed Cactussnail,Xerarionta redimita,Wreathed Cactussnail,Mollusca,115079,Mollusca,Gastropoda,Stylommatophora,Helminthoglyptidae,,
iNaturalist,21802991,2019/03/24 1:45 PM PDT,3/24/2019 0:00,3/24/2019,2019,3,24,23:45:00,300,Pacific Time (US & Canada),12809,cedric_lee,2019-03-31 02:11:30 +0300,2020-07-02 06:54:26 +0300,research,CC-BY-NC,https://www.inaturalist.org/observations/21802991,https://inaturalist-open-data.s3.amazonaws.com/photos/33767365/medium.jpeg?1553982727,,,,2,0,FALSE,,"California, US",San Clemente,32.88516889,-118.3811846,,29039,obscured,obscured,TRUE,,,,Los Angeles,California,United States,California,Los Angeles,Wreathed Cactussnail,Xerarionta redimita,Wreathed Cactussnail,Mollusca,115079,Mollusca,Gastropoda,Stylommatophora,Helminthoglyptidae,,
iNaturalist,21817620,2019/03/26 12:12 PM PDT,3/26/2019 0:00,3/26/2019,2019,3,26,22:12:00,300,Pacific Time (US & Canada),12809,cedric_lee,2019-03-31 09:24:21 +0300,2020-07-02 06:54:35 +0300,research,CC-BY-NC,https://www.inaturalist.org/observations/21817620,https://inaturalist-open-data.s3.amazonaws.com/photos/33797828/medium.jpeg?1554012564,,,,3,0,FALSE,,"California, US",San Clemente,32.99461795,-118.4891293,,29039,obscured,obscured,TRUE,,,,Los Angeles,California,United States,California,Los Angeles,Wreathed Cactussnail,Xerarionta redimita,Wreathed Cactussnail,Mollusca,115079,Mollusca,Gastropoda,Stylommatophora,Helminthoglyptidae,,
iNaturalist,21822888,2019/03/26 3:51 PM PDT,3/26/2019 0:00,3/27/2019,2019,3,27,1:51:00,300,Pacific Time (US & Canada),12809,cedric_lee,2019-03-31 15:33:37 +0300,2020-07-02 06:54:38 +0300,research,CC-BY-NC,https://www.inaturalist.org/observations/21822888,https://inaturalist-open-data.s3.amazonaws.com/photos/33806151/medium.jpeg?1554032905,,,,4,0,FALSE,,"Los Angeles County, US-CA, US",San Clemente,32.99641313,-118.4278649,,29039,obscured,obscured,TRUE,,,,Los Angeles,California,United States,California,Los Angeles,Wreathed Cactussnail,Xerarionta redimita,Wreathed Cactussnail,Mollusca,115079,Mollusca,Gastropoda,Stylommatophora,Helminthoglyptidae,,
iNaturalist,21825516,2019/03/27 11:06 AM PDT,3/27/2019 0:00,3/27/2019,2019,3,27,21:06:00,300,Pacific Time (US & Canada),12809,cedric_lee,2019-03-31 17:16:51 +0300,2020-07-02 06:54:45 +0300,research,CC-BY-NC,https://www.inaturalist.org/observations/21825516,https://inaturalist-open-data.s3.amazonaws.com/photos/33810917/medium.jpeg?1554040122,,,,2,0,FALSE,,"California, US",San Clemente,32.93581931,-118.5846424,,29039,obscured,obscured,TRUE,,,,Los Angeles,California,United States,California,Los Angeles,Wreathed Cactussnail,Xerarionta redimita,Wreathed Cactussnail,Mollusca,115079,Mollusca,Gastropoda,Stylommatophora,Helminthoglyptidae,,
iNaturalist,21825529,2019/03/27 11:26 AM PDT,3/27/2019 0:00,3/27/2019,2019,3,27,21:26:00,300,Pacific Time (US & Canada),12809,cedric_lee,2019-03-31 17:17:02 +0300,2020-07-02 06:54:47 +0300,research,CC-BY-NC,https://www.inaturalist.org/observations/21825529,https://inaturalist-open-data.s3.amazonaws.com/photos/33810991/medium.jpeg?1554040200,,,,4,0,FALSE,,"California, US",San Clemente,32.95323954,-118.5763291,,29039,obscured,obscured,TRUE,,,,Los Angeles,California,United States,California,Los Angeles,Wreathed Cactussnail,Xerarionta redimita,Wreathed Cactussnail,Mollusca,115079,Mollusca,Gastropoda,Stylommatophora,Helminthoglyptidae,,
iNaturalist,21825549,2019/03/27 12:26 PM PDT,3/27/2019 0:00,3/27/2019,2019,3,27,22:26:00,300,Pacific Time (US & Canada),12809,cedric_lee,2019-03-31 17:17:17 +0300,2020-07-02 06:54:49 +0300,research,CC-BY-NC,https://www.inaturalist.org/observations/21825549,https://inaturalist-open-data.s3.amazonaws.com/photos/33811324/medium.jpeg?1554040637,,,,3,0,FALSE,,"California, US",San Clemente,32.90781677,-118.4570506,,29039,obscured,obscured,TRUE,,,,Los Angeles,California,United States,California,Los Angeles,Wreathed Cactussnail,Xerarionta redimita,Wreathed Cactussnail,Mollusca,115079,Mollusca,Gastropoda,Stylommatophora,Helminthoglyptidae,,
iNaturalist,21833117,2019-03-28 8:06:53 AM PDT,3/28/2019 0:00,3/28/2019,2019,3,28,18:06:53,300,Pacific Time (US & Canada),34488,pileated,2019-03-31 20:16:39 +0300,2020-04-23 21:20:46 +0300,research,CC-BY,https://www.inaturalist.org/observations/21833117,https://inaturalist-open-data.s3.amazonaws.com/photos/33822866/medium.jpg?1554052602,,,,4,0,FALSE,2,"California, US",San Clemente,32.92498094,-118.4359612,11,29039,,obscured,TRUE,gps,gps,,Los Angeles,California,United States,California,Los Angeles,Wreathed Cactussnail,Xerarionta redimita,Wreathed Cactussnail,Mollusca,115079,Mollusca,Gastropoda,Stylommatophora,Helminthoglyptidae,,
iNaturalist,21835031,2019-03-27 8:54:46 AM PDT,3/27/2019 0:00,3/27/2019,2019,3,27,18:54:46,300,Pacific Time (US & Canada),34488,pileated,2019-03-31 20:43:21 +0300,2020-04-23 21:20:51 +0300,research,CC-BY,https://www.inaturalist.org/observations/21835031,https://inaturalist-open-data.s3.amazonaws.com/photos/33824918/medium.jpeg?1554054205,,,,4,0,FALSE,2,"California, US",San Clemente,32.96873711,-118.5004493,,29039,,obscured,TRUE,gps,gps,,Los Angeles,California,United States,California,Los Angeles,Wreathed Cactussnail,Xerarionta redimita,Wreathed Cactussnail,Mollusca,115079,Mollusca,Gastropoda,Stylommatophora,Helminthoglyptidae,,
iNaturalist,21907537,2019/03/27 1:48 PM PDT,3/27/2019 0:00,3/27/2019,2019,3,27,23:48:00,300,Pacific Time (US & Canada),12809,cedric_lee,2019-04-02 16:39:36 +0300,2020-07-02 06:54:50 +0300,research,CC-BY-NC,https://www.inaturalist.org/observations/21907537,https://inaturalist-open-data.s3.amazonaws.com/photos/33937008/medium.jpeg?1554185588,,,,3,0,FALSE,,"California, US",San Clemente,32.93924125,-118.4972286,,29039,obscured,obscured,TRUE,,,,Los Angeles,California,United States,California,Los Angeles,Wreathed Cactussnail,Xerarionta redimita,Wreathed Cactussnail,Mollusca,115079,Mollusca,Gastropoda,Stylommatophora,Helminthoglyptidae,,
iNaturalist,21908433,2019/03/28 10:33 AM PDT,3/28/2019 0:00,3/28/2019,2019,3,28,20:33:00,300,Pacific Time (US & Canada),12809,cedric_lee,2019-04-02 17:08:49 +0300,2020-07-02 06:54:53 +0300,research,CC-BY-NC,https://www.inaturalist.org/observations/21908433,https://inaturalist-open-data.s3.amazonaws.com/photos/33947241/medium.jpeg?1554212778,,,,3,0,FALSE,,"California, US",San Clemente,32.89536829,-118.4676712,,29039,obscured,obscured,TRUE,,,,Los Angeles,California,United States,California,Los Angeles,Wreathed Cactussnail,Xerarionta redimita,Wreathed Cactussnail,Mollusca,115079,Mollusca,Gastropoda,Stylommatophora,Helminthoglyptidae,,
iNaturalist,21908469,2019/03/28 12:06 PM PDT,3/28/2019 0:00,3/28/2019,2019,3,28,22:06:00,300,Pacific Time (US & Canada),12809,cedric_lee,2019-04-02 17:09:06 +0300,2020-07-02 06:54:54 +0300,research,CC-BY-NC,https://www.inaturalist.org/observations/21908469,https://inaturalist-open-data.s3.amazonaws.com/photos/33947401/medium.jpeg?1554212947,,,,3,0,FALSE,,"California, US",San Clemente,32.91332115,-118.5322151,,29039,obscured,obscured,TRUE,,,,Los Angeles,California,United States,California,Los Angeles,Wreathed Cactussnail,Xerarionta redimita,Wreathed Cactussnail,Mollusca,115079,Mollusca,Gastropoda,Stylommatophora,Helminthoglyptidae,,
iNaturalist,21908478,2019/03/28 12:14 PM PDT,3/28/2019 0:00,3/28/2019,2019,3,28,22:14:00,300,Pacific Time (US & Canada),12809,cedric_lee,2019-04-02 17:09:10 +0300,2020-07-02 06:54:55 +0300,research,CC-BY-NC,https://www.inaturalist.org/observations/21908478,https://inaturalist-open-data.s3.amazonaws.com/photos/33947441/medium.jpeg?1554212989,,,,3,0,FALSE,,"California, US",San Clemente,32.90169522,-118.4991402,,29039,obscured,obscured,TRUE,,,,Los Angeles,California,United States,California,Los Angeles,Wreathed Cactussnail,Xerarionta redimita,Wreathed Cactussnail,Mollusca,115079,Mollusca,Gastropoda,Stylommatophora,Helminthoglyptidae,,
iNaturalist,22045844,Fri Apr 05 2019 07:35:05 GMT-0700 (PDT),4/5/2019 0:00,4/5/2019,2019,4,5,17:35:05,300,Pacific Time (US & Canada),266196,shrike2,2019-04-05 23:53:02 +0300,2020-02-25 00:38:20 +0300,research,CC-BY-NC-ND,https://www.inaturalist.org/observations/22045844,https://static.inaturalist.org/photos/34154060/medium.jpg?1554497620,,,,2,0,FALSE,3,"California, US",San Clemente,32.92813609,-118.4141586,10,29039,,obscured,TRUE,,,,Los Angeles,California,United States,California,Los Angeles,Wreathed Cactussnail,Xerarionta redimita,Wreathed Cactussnail,Mollusca,115079,Mollusca,Gastropoda,Stylommatophora,Helminthoglyptidae,,
iNaturalist,22046029,Fri Apr 05 2019 07:37:59 GMT-0700 (PDT),4/5/2019 0:00,4/5/2019,2019,4,5,17:37:59,300,Pacific Time (US & Canada),266196,shrike2,2019-04-05 23:53:49 +0300,2020-02-25 00:39:34 +0300,research,CC-BY-NC-ND,https://www.inaturalist.org/observations/22046029,https://static.inaturalist.org/photos/34154079/medium.jpg?1554497641,,,,1,0,FALSE,3,"California, US",San Clemente,32.93711693,-118.460602,5,29039,,obscured,TRUE,,,,Los Angeles,California,United States,California,Los Angeles,Wreathed Cactussnail,Xerarionta redimita,Wreathed Cactussnail,Mollusca,115079,Mollusca,Gastropoda,Stylommatophora,Helminthoglyptidae,,
iNaturalist,22046164,Fri Apr 05 2019 07:42:29 GMT-0700 (PDT),4/5/2019 0:00,4/5/2019,2019,4,5,17:42:29,300,Pacific Time (US & Canada),266196,shrike2,2019-04-05 23:54:25 +0300,2020-02-25 00:38:51 +0300,research,CC-BY-NC-ND,https://www.inaturalist.org/observations/22046164,https://static.inaturalist.org/photos/34154106/medium.jpg?1554497674,,,,1,0,FALSE,3,"California, US",San Clemente,32.82408602,-118.4015211,10,29039,,obscured,TRUE,,,,Los Angeles,California,United States,California,Los Angeles,Wreathed Cactussnail,Xerarionta redimita,Wreathed Cactussnail,Mollusca,115079,Mollusca,Gastropoda,Stylommatophora,Helminthoglyptidae,,
iNaturalist,22046489,Fri Apr 05 2019 08:57:07 GMT-0700 (PDT),4/5/2019 0:00,4/5/2019,2019,4,5,18:57:07,300,Pacific Time (US & Canada),266196,shrike2,2019-04-05 23:55:55 +0300,2020-02-25 00:39:33 +0300,research,CC-BY-NC-ND,https://www.inaturalist.org/observations/22046489,https://static.inaturalist.org/photos/34154212/medium.jpg?1554497789,,,,1,0,FALSE,3,"California, US",San Clemente,32.97424334,-118.4013589,10,29039,,obscured,TRUE,,,,Los Angeles,California,United States,California,Los Angeles,Wreathed Cactussnail,Xerarionta redimita,Wreathed Cactussnail,Mollusca,115079,Mollusca,Gastropoda,Stylommatophora,Helminthoglyptidae,,
iNaturalist,22047053,Fri Apr 05 2019 09:03:38 GMT-0700 (PDT),4/5/2019 0:00,4/5/2019,2019,4,5,19:03:38,300,Pacific Time (US & Canada),266196,shrike2,2019-04-05 23:58:16 +0300,2020-02-25 00:38:09 +0300,research,CC-BY-NC-ND,https://www.inaturalist.org/observations/22047053,https://static.inaturalist.org/photos/34154315/medium.jpg?1554497905,,,,2,0,FALSE,3,"California, US",San Clemente,32.91387266,-118.5622527,5,29039,,obscured,TRUE,,,,Los Angeles,California,United States,California,Los Angeles,Wreathed Cactussnail,Xerarionta redimita,Wreathed Cactussnail,Mollusca,115079,Mollusca,Gastropoda,Stylommatophora,Helminthoglyptidae,,
iNaturalist,22047188,Fri Apr 05 2019 09:05:22 GMT-0700 (PDT),4/5/2019 0:00,4/5/2019,2019,4,5,19:05:22,300,Pacific Time (US & Canada),266196,shrike2,2019-04-05 23:58:51 +0300,2020-02-25 00:39:21 +0300,research,CC-BY-NC-ND,https://www.inaturalist.org/observations/22047188,https://static.inaturalist.org/photos/34154343/medium.jpg?1554497939,,,,1,0,FALSE,3,"California, US",San Clemente,32.98418477,-118.4202104,10,29039,,obscured,TRUE,,,,Los Angeles,California,United States,California,Los Angeles,Wreathed Cactussnail,Xerarionta redimita,Wreathed Cactussnail,Mollusca,115079,Mollusca,Gastropoda,Stylommatophora,Helminthoglyptidae,,
iNaturalist,22047325,Fri Apr 05 2019 09:08:26 GMT-0700 (PDT),4/5/2019 0:00,4/5/2019,2019,4,5,19:08:26,300,Pacific Time (US & Canada),266196,shrike2,2019-04-05 23:59:10 +0300,2020-02-25 00:39:32 +0300,research,CC-BY-NC-ND,https://www.inaturalist.org/observations/22047325,https://static.inaturalist.org/photos/34154361/medium.jpg?1554497958,,,,1,0,FALSE,3,"California, US",San Clemente,32.84590907,-118.4557079,10,29039,,obscured,TRUE,,,,Los Angeles,California,United States,California,Los Angeles,Wreathed Cactussnail,Xerarionta redimita,Wreathed Cactussnail,Mollusca,115079,Mollusca,Gastropoda,Stylommatophora,Helminthoglyptidae,,
iNaturalist,22047559,Fri Apr 05 2019 09:12:05 GMT-0700 (PDT),4/5/2019 0:00,4/5/2019,2019,4,5,19:12:05,300,Pacific Time (US & Canada),266196,shrike2,2019-04-05 23:59:39 +0300,2020-02-25 00:38:46 +0300,research,CC-BY-NC-ND,https://www.inaturalist.org/observations/22047559,https://static.inaturalist.org/photos/34154401/medium.jpg?1554498004,,,,1,0,FALSE,3,"California, US",San Clemente,32.99702325,-118.5686593,10,29039,,obscured,TRUE,,,,Los Angeles,California,United States,California,Los Angeles,Wreathed Cactussnail,Xerarionta redimita,Wreathed Cactussnail,Mollusca,115079,Mollusca,Gastropoda,Stylommatophora,Helminthoglyptidae,,
iNaturalist,22240223,Sat Apr 06 2019 07:54:50 GMT-0700 (PDT),4/6/2019 0:00,4/6/2019,2019,4,6,17:54:50,300,Pacific Time (US & Canada),266196,shrike2,2019-04-09 18:53:37 +0300,2020-02-25 00:39:22 +0300,research,CC-BY-NC-ND,https://www.inaturalist.org/observations/22240223,https://static.inaturalist.org/photos/34439480/medium.jpg?1554825230,,,,1,0,FALSE,3,"California, US",San Clemente,32.97447643,-118.5782972,10,29039,,obscured,TRUE,,,,Los Angeles,California,United States,California,Los Angeles,Wreathed Cactussnail,Xerarionta redimita,Wreathed Cactussnail,Mollusca,115079,Mollusca,Gastropoda,Stylommatophora,Helminthoglyptidae,,
