record,source,place_guess,island,latitude,longitude,positional_accuracy,public_positional_accuracy,geoprivacy,taxon_geoprivacy,coordinates_obscured,positioning_method,positioning_device,species_guess,scientific_name,acceptedName,common_name,iconic_taxon_name,taxon_id,taxon_order_name,taxon_family_name,acceptedFamily,taxon_genus_name,acceptedGenus,taxon_species_name,taxon_subspecies_name,id,month,year,time_observed_at_date,time_observed_at_time,time_obs_3,time_zone,user_login,created_at,updated_at,quality_grade,license,url,image_url,num_identification_agreements,num_identification_disagreements,captive_cultivated,oauth_application_id
occurrence,iNaturalist,"Channel Islands National Park, CA, US",Santa Cruz,34.00894063,-119.7567505,1598,1598,,,FALSE,,,Three-striped Longhorn,Adela trigrapha,Adela trigrapha,Three-striped Longhorn,Insecta,57722,Lepidoptera,Adelidae,Adelidae,Adela,Adela,Adela trigrapha,,42203706,4,2020,4/14/20,23:43:17,300,Pacific Time (US & Canada),zccas,2020-04-15 03:07:26 +0300,2020-05-04 00:22:12 +0300,research,CC-BY-NC,https://www.inaturalist.org/observations/42203706,https://inaturalist-open-data.s3.amazonaws.com/photos/66997217/medium.jpg?1586909251,2,0,FALSE,3
occurrence,iNaturalist,"Santa Barbara County, CA, USA",Santa Cruz,34.030275,-119.7898583,,,,,FALSE,,,Three-striped Longhorn,Adela trigrapha,Adela trigrapha,Three-striped Longhorn,Insecta,57722,Lepidoptera,Adelidae,Adelidae,Adela,Adela,Adela trigrapha,,13136045,4,2018,4/20/18,22:56:00,300,Pacific Time (US & Canada),silversea_starsong,2018-06-05 08:53:51 +0300,2018-06-05 09:14:49 +0300,research,CC-BY-NC,https://www.inaturalist.org/observations/13136045,https://inaturalist-open-data.s3.amazonaws.com/photos/19156182/medium.jpeg?1528178023,1,0,FALSE,
occurrence,iNaturalist,"Santa Barbara County, CA, USA",Santa Cruz,34.029235,-119.7885817,,,,,FALSE,,,Three-striped Longhorn,Adela trigrapha,Adela trigrapha,Three-striped Longhorn,Insecta,57722,Lepidoptera,Adelidae,Adelidae,Adela,Adela,Adela trigrapha,,15021941,4,2018,4/20/18,23:15:00,300,Pacific Time (US & Canada),silversea_starsong,2018-08-01 21:04:53 +0300,2018-08-06 18:41:07 +0300,research,CC-BY-NC,https://www.inaturalist.org/observations/15021941,https://inaturalist-open-data.s3.amazonaws.com/photos/22416988/medium.jpeg?1533146604,2,0,FALSE,
occurrence,iNaturalist,"Santa Cruz Island Reserve, Channel Islands National Park, Channel Islands, Santa Barbara, UC Natural Reserve System, California, United States",Santa Cruz,34.00534167,-119.759525,,,,,FALSE,,,Three-striped Longhorn,Adela trigrapha,Adela trigrapha,Three-striped Longhorn,Insecta,57722,Lepidoptera,Adelidae,Adelidae,Adela,Adela,Adela trigrapha,,70183811,4,2019,4/11/19,23:45:00,300,Pacific Time (US & Canada),silversea_starsong,2021-02-26 07:43:22 +0300,2021-03-02 12:22:11 +0300,research,CC-BY-NC,https://www.inaturalist.org/observations/70183811,https://inaturalist-open-data.s3.amazonaws.com/photos/114039071/medium.jpeg?1614311473,1,0,FALSE,
occurrence,iNaturalist,"Avalon, CA 90704, USA",Santa Catalina,33.3428193,-118.3282279,2403,2403,,,FALSE,,,Montana Six-plume Moth,Alucita montana,Alucita montana,Montana Six-plume Moth,Insecta,213109,Lepidoptera,Alucitidae,Alucitidae,Alucita,Alucita,Alucita montana,,5255015,,,,,,Pacific Time (US & Canada),psyllidhipster,2017-03-09 06:35:00 +0300,2020-09-25 02:27:32 +0300,research,CC-BY-NC,https://www.inaturalist.org/observations/5255015,https://inaturalist-open-data.s3.amazonaws.com/photos/6502449/medium.jpg?1489028708,1,0,FALSE,
occurrence,iNaturalist,"Avalon, CA 90704, USA",Santa Catalina,33.34583075,-118.3347511,1589,1589,,,FALSE,,,Glyphidocera septentrionella,Glyphidocera septentrionella,Glyphidocera septentrionella,,Insecta,220440,Lepidoptera,Autostichidae,Autostichidae,Glyphidocera,Glyphidocera,Glyphidocera septentrionella,,5253052,7,2014,7/5/14,4:33:00,400,Pacific Time (US & Canada),psyllidhipster,2017-03-09 02:26:04 +0300,2017-05-02 21:58:40 +0300,needs_id,CC-BY-NC,https://www.inaturalist.org/observations/5253052,https://inaturalist-open-data.s3.amazonaws.com/photos/6498957/medium.jpg?1489009084,0,0,FALSE,
occurrence,iNaturalist,"Avalon, CA 90704, USA",Santa Catalina,33.34583075,-118.3347511,1589,1589,,,FALSE,,,Glyphidocera septentrionella,Glyphidocera septentrionella,Glyphidocera septentrionella,,Insecta,220440,Lepidoptera,Autostichidae,Autostichidae,Glyphidocera,Glyphidocera,Glyphidocera septentrionella,,5253139,7,2014,7/10/14,5:53:00,400,Pacific Time (US & Canada),psyllidhipster,2017-03-09 02:27:14 +0300,2017-05-02 21:58:48 +0300,needs_id,CC-BY-NC,https://www.inaturalist.org/observations/5253139,https://inaturalist-open-data.s3.amazonaws.com/photos/6499066/medium.jpg?1489009253,0,0,FALSE,
occurrence,iNaturalist,"Avalon, CA 90704, USA",Santa Catalina,33.34583075,-118.3347511,1589,1589,,,FALSE,,,Symmoca signatella,Symmoca signatella,Symmoca signatella,,Insecta,363635,Lepidoptera,Autostichidae,Autostichidae,Symmoca,Symmoca,Symmoca signatella,,5253073,7,2014,7/7/14,5:17:00,400,Pacific Time (US & Canada),psyllidhipster,2017-03-09 02:26:28 +0300,2019-09-17 13:19:30 +0300,research,CC-BY-NC,https://www.inaturalist.org/observations/5253073,https://inaturalist-open-data.s3.amazonaws.com/photos/6498997/medium.jpg?1489009150,1,0,FALSE,
occurrence,iNaturalist,"Avalon, CA 90704, USA",Santa Catalina,33.3428193,-118.3282279,2403,2403,,,FALSE,,,Scavenger Moths,Blastobasidae,,Blastobasid Moths,Insecta,173093,Lepidoptera,Blastobasidae,Blastobasidae,,,,,5255024,,,,,,Pacific Time (US & Canada),psyllidhipster,2017-03-09 06:35:03 +0300,2020-06-03 23:09:07 +0300,needs_id,CC-BY-NC,https://www.inaturalist.org/observations/5255024,https://inaturalist-open-data.s3.amazonaws.com/photos/6502458/medium.jpg?1489028723,0,0,FALSE,
occurrence,iNaturalist,"Avalon, CA 90704, USA",Santa Catalina,33.3428193,-118.3282279,2403,2403,,,FALSE,,,Blastobasinae,Blastobasinae,,,Insecta,336937,Lepidoptera,Blastobasidae,Blastobasidae,,,,,5255075,,,,,,Pacific Time (US & Canada),psyllidhipster,2017-03-09 06:35:23 +0300,2017-05-02 21:59:00 +0300,needs_id,CC-BY-NC,https://www.inaturalist.org/observations/5255075,https://inaturalist-open-data.s3.amazonaws.com/photos/6502514/medium.jpg?1489028809,0,0,FALSE,
occurrence,iNaturalist,"Los Angeles County, CA, USA",Santa Catalina,33.44450604,-118.4818039,100,100,,,FALSE,,,Blastobasinae,Blastobasinae,,,Insecta,336937,Lepidoptera,Blastobasidae,Blastobasidae,,,,,10420533,3,2018,3/24/18,7:59:00,300,Pacific Time (US & Canada),neontetraploid,2018-03-26 01:16:27 +0300,2019-04-13 19:57:23 +0300,needs_id,CC-BY-NC,https://www.inaturalist.org/observations/10420533,https://inaturalist-open-data.s3.amazonaws.com/photos/14475398/medium.jpeg?1522015973,1,0,FALSE,
occurrence,iNaturalist,"Los Angeles County, CA, USA",Santa Catalina,33.4445858,-118.4824262,150,150,,,FALSE,,,Blastobasinae,Blastobasinae,,,Insecta,336937,Lepidoptera,Blastobasidae,Blastobasidae,,,,,10421237,3,2018,3/25/18,0:01:00,300,Pacific Time (US & Canada),neontetraploid,2018-03-26 01:53:53 +0300,2020-06-03 23:08:00 +0300,needs_id,CC-BY-NC,https://www.inaturalist.org/observations/10421237,https://inaturalist-open-data.s3.amazonaws.com/photos/14475775/medium.jpeg?1522016751,1,0,FALSE,
occurrence,iNaturalist,"Santa Cruz Island Reserve, Channel Islands, Channel Islands National Park, Santa Barbara, UC Natural Reserve System, California, United States",Santa Cruz,33.997195,-119.72506,,28902,,,FALSE,,,Bucculatrix,Bucculatrix,,,Insecta,173276,Lepidoptera,Bucculatricidae,Bucculatricidae,Bucculatrix,Bucculatrix,,,1790004,7,2015,7/21/15,8:45:04,300,Pacific Time (US & Canada),kueda,2015-07-22 20:00:51 +0300,2021-07-20 21:13:06 +0300,needs_id,CC0,http://www.inaturalist.org/observations/1790004,https://inaturalist-open-data.s3.amazonaws.com/photos/2167996/medium.jpg?1437584465,0,0,FALSE,
occurrence,iNaturalist,"Avalon, CA 90704, USA",Santa Catalina,33.3428193,-118.3282279,2403,2403,,,FALSE,,,Bucculatrix quadrigemina,Bucculatrix quadrigemina,Bucculatrix quadrigemina,,Insecta,344219,Lepidoptera,Bucculatricidae,Bucculatricidae,Bucculatrix,Bucculatrix,Bucculatrix quadrigemina,,5254599,,,,,,Pacific Time (US & Canada),psyllidhipster,2017-03-09 05:19:31 +0300,2017-10-15 19:12:30 +0300,research,CC-BY-NC,https://www.inaturalist.org/observations/5254599,https://inaturalist-open-data.s3.amazonaws.com/photos/6501920/medium.jpg?1489025084,1,0,FALSE,
occurrence,iNaturalist,"Santa Barbara County, CA, USA",Santa Cruz,33.99689833,-119.7257917,,,,,FALSE,,,Bondia comonana,Bondia comonana,Bondia comonana,,Insecta,453193,Lepidoptera,Carposinidae,Carposinidae,Bondia,Bondia,Bondia comonana,,15008995,4,2018,4/21/18,8:30:00,300,Pacific Time (US & Canada),silversea_starsong,2018-08-01 08:26:38 +0300,2018-08-02 18:54:22 +0300,research,CC-BY-NC,https://www.inaturalist.org/observations/15008995,https://inaturalist-open-data.s3.amazonaws.com/photos/22394555/medium.jpeg?1533100692,1,0,FALSE,
occurrence,iNaturalist,"Santa Cruz Island Reserve, Channel Islands, Channel Islands National Park, Santa Barbara, UC Natural Reserve System, California, United States",Santa Cruz,34.00031,-119.7341417,,28874,,,FALSE,,,Bondia comonana,Bondia comonana,Bondia comonana,,Insecta,453193,Lepidoptera,Carposinidae,Carposinidae,Bondia,Bondia,Bondia comonana,,1791944,7,2015,7/22/15,7:42:52,300,Pacific Time (US & Canada),kueda,2015-07-23 09:16:18 +0300,2019-03-26 04:40:02 +0300,research,CC0,http://www.inaturalist.org/observations/1791944,https://inaturalist-open-data.s3.amazonaws.com/photos/2170850/medium.jpg?1437632184,1,0,FALSE,
occurrence,iNaturalist,"Santa Barbara County, CA, USA",Santa Cruz,34.04672704,-119.5654278,193,193,,,FALSE,,,Everlasting Tebenna Moth,Tebenna gnaphaliella,Tebenna gnaphaliella,Everlasting Tebenna Moth,Insecta,326040,Lepidoptera,Choreutidae,Choreutidae,Tebenna,Tebenna,Tebenna gnaphaliella,,13459319,6,2018,6/15/18,0:56:00,300,Pacific Time (US & Canada),dlbowls,2018-06-15 23:13:22 +0300,2019-05-23 10:25:33 +0300,research,CC-BY-NC,https://www.inaturalist.org/observations/13459319,https://inaturalist-open-data.s3.amazonaws.com/photos/19757000/medium.jpg?1529092186,1,0,FALSE,
occurrence,iNaturalist,"Avalon, CA 90704, USA",Santa Catalina,33.34583075,-118.3347511,1589,1589,,,FALSE,,,Coleophora,Coleophora,,Casebearers,Insecta,87566,Lepidoptera,Coleophoridae,Coleophoridae,Coleophora,Coleophora,,,5253125,7,2014,7/8/14,20:54:00,400,Pacific Time (US & Canada),psyllidhipster,2017-03-09 02:27:00 +0300,2020-06-03 23:10:20 +0300,needs_id,CC-BY-NC,https://www.inaturalist.org/observations/5253125,https://inaturalist-open-data.s3.amazonaws.com/photos/6499035/medium.jpg?1489009211,0,0,FALSE,
occurrence,iNaturalist,"Santa Cruz Island Reserve, Channel Islands, Channel Islands National Park, Santa Barbara, UC Natural Reserve System, California, United States",Santa Cruz,33.99725667,-119.72507,,28902,,,FALSE,,,Casebearers,Coleophora,,Casebearers,Insecta,87566,Lepidoptera,Coleophoridae,Coleophoridae,Coleophora,Coleophora,,,1790006,7,2015,7/21/15,8:52:10,300,Pacific Time (US & Canada),kueda,2015-07-22 20:00:54 +0300,2021-07-20 21:13:05 +0300,needs_id,CC0,http://www.inaturalist.org/observations/1790006,https://inaturalist-open-data.s3.amazonaws.com/photos/2167998/medium.jpg?1437584472,1,0,FALSE,
occurrence,iNaturalist,"Avalon, CA 90704, USA",Santa Catalina,33.3428193,-118.3282279,2403,2403,,,FALSE,,,Coleophora accordella,Coleophora accordella,Coleophora accordella,,Insecta,347053,Lepidoptera,Coleophoridae,Coleophoridae,Coleophora,Coleophora,Coleophora accordella,,5254815,,,,,,Pacific Time (US & Canada),psyllidhipster,2017-03-09 05:49:42 +0300,2020-06-03 23:09:21 +0300,needs_id,CC-BY-NC,https://www.inaturalist.org/observations/5254815,https://inaturalist-open-data.s3.amazonaws.com/photos/6502202/medium.jpg?1489026508,0,0,FALSE,
occurrence,iNaturalist,"Santa Cruz Island Reserve, Channel Islands, Channel Islands National Park, Santa Barbara, UC Natural Reserve System, California, United States",Santa Cruz,34.00036,-119.7341083,,28874,,,FALSE,,,Coleophora nigrostriata,Coleophora nigrostriata,Coleophora nigrostriata,,Insecta,470110,Lepidoptera,Coleophoridae,Coleophoridae,Coleophora,Coleophora,Coleophora nigrostriata,,1791914,7,2015,7/22/15,6:33:14,300,Pacific Time (US & Canada),kueda,2015-07-23 09:14:48 +0300,2019-03-26 04:39:32 +0300,research,CC0,http://www.inaturalist.org/observations/1791914,https://inaturalist-open-data.s3.amazonaws.com/photos/2170820/medium.jpg?1437632091,1,0,FALSE,
occurrence,iNaturalist,"Avalon, CA 90704, USA",Santa Catalina,33.34197208,-118.3228426,20,20,,,FALSE,,,Florida Pink Scavenger Moth,Anatrachyntis badia,Pyroderces badia,Florida Pink Scavenger,Insecta,319532,Lepidoptera,Cosmopterigidae,Cosmopterigidae,Anatrachyntis,Pyroderces,Anatrachyntis badia,,34125489,10,2019,10/5/19,8:30:00,300,Pacific Time (US & Canada),psyllidhipster,2019-10-09 21:27:49 +0300,2020-08-20 01:21:25 +0300,needs_id,CC-BY-NC,https://www.inaturalist.org/observations/34125489,https://inaturalist-open-data.s3.amazonaws.com/photos/53667011/medium.jpeg?1570644811,0,0,FALSE,
occurrence,iNaturalist,"Avalon, CA 90704, USA",Santa Catalina,33.3428193,-118.3282279,2403,2403,,,FALSE,,,Sweet Clover Root Borer Moth,Walshia miscecolorella,Walshia miscecolorella,Sweet Clover Root Borer Moth,Insecta,233646,Lepidoptera,Cosmopterigidae,Cosmopterigidae,Walshia,Walshia,Walshia miscecolorella,,5254772,,,,,,Pacific Time (US & Canada),psyllidhipster,2017-03-09 05:49:33 +0300,2019-05-23 22:25:16 +0300,research,CC-BY-NC,https://www.inaturalist.org/observations/5254772,https://inaturalist-open-data.s3.amazonaws.com/photos/6502162/medium.jpg?1489026449,1,0,FALSE,
occurrence,iNaturalist,"Channel Islands, Channel Islands National Park, Santa Barbara, California, United States",Santa Cruz,34.019195,-119.6828483,,28874,,,FALSE,,,Sweet Clover Root Borer Moth,Walshia miscecolorella,Walshia miscecolorella,Sweet Clover Root Borer Moth,Insecta,233646,Lepidoptera,Cosmopterigidae,Cosmopterigidae,Walshia,Walshia,Walshia miscecolorella,,1805767,7,2015,7/24/15,6:57:35,300,Pacific Time (US & Canada),kueda,2015-07-27 07:42:13 +0300,2019-04-11 09:22:44 +0300,research,CC0,http://www.inaturalist.org/observations/1805767,https://inaturalist-open-data.s3.amazonaws.com/photos/2188228/medium.jpg?1437972137,1,0,FALSE,
occurrence,iNaturalist,"Channel Islands National Park, Channel Islands National Pk, CA, US",Santa Cruz,33.997142,-119.7256,500,500,,,FALSE,,,Givira marga,Givira marga,Givira marga,,Insecta,469972,Lepidoptera,Cossidae,Cossidae,Givira,Givira,Givira marga,,1786369,7,2015,7/21/15,7:29:03,300,Pacific Time (US & Canada),robberfly,2015-07-21 18:05:03 +0300,2017-05-02 21:37:46 +0300,research,CC-BY-NC,http://www.inaturalist.org/observations/1786369,https://inaturalist-open-data.s3.amazonaws.com/photos/2162814/medium.jpg?1437491139,3,0,FALSE,3
occurrence,iNaturalist,"Santa Cruz Island Fieldstation, Santa Barbara County, CA, USA",Santa Cruz,33.997084,-119.725669,7,28902,,,FALSE,,,Givira marga,Givira marga,Givira marga,,Insecta,469972,Lepidoptera,Cossidae,Cossidae,Givira,Givira,Givira marga,,1857662,7,2015,7/21/15,7:23:37,300,Pacific Time (US & Canada),kueda,2015-08-13 07:08:57 +0300,2019-04-16 20:34:50 +0300,research,CC0,http://www.inaturalist.org/observations/1857662,https://inaturalist-open-data.s3.amazonaws.com/photos/2259307/medium.jpg?1439439009,1,0,FALSE,
occurrence,iNaturalist,,Santa Catalina,33.43903667,-118.4917217,,,,,FALSE,,,Abegesta reluctalis,Abegesta reluctalis,Abegesta reluctalis,,Insecta,212186,Lepidoptera,Crambidae,Crambidae,Abegesta,Abegesta,Abegesta reluctalis,,1829570,8,2015,8/1/15,7:53:11,300,Pacific Time (US & Canada),damontighe,2015-08-04 03:18:15 +0300,2020-08-24 08:26:16 +0300,research,CC-BY-NC,http://www.inaturalist.org/observations/1829570,https://inaturalist-open-data.s3.amazonaws.com/photos/2221034/medium.jpg?1438647526,1,0,FALSE,3
occurrence,iNaturalist,"Avalon, CA 90704, USA",Santa Catalina,33.34583075,-118.3347511,1589,1589,,,FALSE,,,White-trimmed Abegesta,Abegesta remellalis,Abegesta remellalis,White-trimmed Abegesta,Insecta,363292,Lepidoptera,Crambidae,Crambidae,Abegesta,Abegesta,Abegesta remellalis,,5253087,,,,,,Pacific Time (US & Canada),psyllidhipster,2017-03-09 02:26:40 +0300,2020-06-03 23:10:42 +0300,research,CC-BY-NC,https://www.inaturalist.org/observations/5253087,https://inaturalist-open-data.s3.amazonaws.com/photos/6499011/medium.jpg?1489009171,1,0,FALSE,
occurrence,iNaturalist,"Avalon, CA 90704, USA",Santa Catalina,33.3428193,-118.3282279,2403,2403,,,FALSE,,,White-trimmed Abegesta,Abegesta remellalis,Abegesta remellalis,White-trimmed Abegesta,Insecta,363292,Lepidoptera,Crambidae,Crambidae,Abegesta,Abegesta,Abegesta remellalis,,5254808,,,,,,Pacific Time (US & Canada),psyllidhipster,2017-03-09 05:49:41 +0300,2020-06-03 23:09:27 +0300,research,CC-BY-NC,https://www.inaturalist.org/observations/5254808,https://inaturalist-open-data.s3.amazonaws.com/photos/6502197/medium.jpg?1489026501,1,0,FALSE,
occurrence,iNaturalist,"Santa Barbara County, CA, USA",Santa Cruz,33.99701833,-119.7259333,,,,,FALSE,,,Choristostigma elegantalis,Choristostigma elegantalis,Choristostigma elegantalis,,Insecta,347118,Lepidoptera,Crambidae,Crambidae,Choristostigma,Choristostigma,Choristostigma elegantalis,,15009001,4,2018,4/21/18,8:25:00,300,Pacific Time (US & Canada),silversea_starsong,2018-08-01 08:26:42 +0300,2018-08-01 08:32:28 +0300,needs_id,CC-BY-NC,https://www.inaturalist.org/observations/15009001,https://inaturalist-open-data.s3.amazonaws.com/photos/22394678/medium.jpeg?1533100997,0,0,FALSE,
occurrence,iNaturalist,"1 Banning Harbor Rd, Avalon, CA, US",Santa Catalina,33.439975,-118.4994583,,,,,FALSE,,,Crambid Snout Moths,Crambidae,,Crambid Snout Moths,Insecta,52002,Lepidoptera,Crambidae,Crambidae,,,,,1829541,8,2015,8/1/15,4:42:26,300,Pacific Time (US & Canada),damontighe,2015-08-04 03:14:36 +0300,2017-05-02 21:38:14 +0300,needs_id,CC-BY-NC,http://www.inaturalist.org/observations/1829541,https://inaturalist-open-data.s3.amazonaws.com/photos/2220963/medium.jpg?1438647287,0,0,FALSE,3
occurrence,iNaturalist,"Avalon, CA 90704, USA",Santa Catalina,33.44431441,-118.4816198,88,88,,,FALSE,gps,gps,Crambid Snout Moths,Crambidae,,Crambid Snout Moths,Insecta,52002,Lepidoptera,Crambidae,Crambidae,,,,,14987780,6,2018,6/30/18,21:09:45,300,Pacific Time (US & Canada),magvero,2018-07-31 18:55:14 +0300,2020-02-29 23:19:19 +0300,needs_id,CC-BY-NC,https://www.inaturalist.org/observations/14987780,https://inaturalist-open-data.s3.amazonaws.com/photos/22357937/medium.jpeg?1533052534,2,0,FALSE,2
occurrence,iNaturalist,"Los Angeles County, CA, USA",San Clemente,32.99599075,-118.5523453,,,,,FALSE,gps,gps,Crambid Snout Moths,Crambidae,,Crambid Snout Moths,Insecta,52002,Lepidoptera,Crambidae,Crambidae,,,,,28241587,6,2019,6/27/19,8:02:56,300,Pacific Time (US & Canada),pileated,2019-07-05 20:48:51 +0300,2021-01-27 06:26:51 +0300,needs_id,CC-BY,https://www.inaturalist.org/observations/28241587,https://inaturalist-open-data.s3.amazonaws.com/photos/44010349/medium.jpg?1562348934,0,0,FALSE,2
occurrence,iNaturalist,"Los Angeles County, CA, USA",San Clemente,32.99597931,-118.5523529,,,,,FALSE,gps,gps,Crambid Snout Moths,Crambidae,,Crambid Snout Moths,Insecta,52002,Lepidoptera,Crambidae,Crambidae,,,,,28241642,6,2019,6/27/19,9:49:07,300,Pacific Time (US & Canada),pileated,2019-07-05 20:49:48 +0300,2020-04-23 21:00:05 +0300,needs_id,CC-BY,https://www.inaturalist.org/observations/28241642,https://inaturalist-open-data.s3.amazonaws.com/photos/44010444/medium.jpg?1562348990,0,0,FALSE,2
occurrence,iNaturalist,"Los Angeles County, US-CA, US",Santa Catalina,33.416205,-118.4806533,,,,,FALSE,,,Crambid Snout Moths,Crambidae,,Crambid Snout Moths,Insecta,52002,Lepidoptera,Crambidae,Crambidae,,,,,1830813,8,2015,8/2/15,16:25:31,300,Pacific Time (US & Canada),damontighe,2015-08-04 08:34:15 +0300,2017-05-02 21:38:15 +0300,needs_id,CC-BY-NC,http://www.inaturalist.org/observations/1830813,https://inaturalist-open-data.s3.amazonaws.com/photos/2222817/medium.jpg?1438666559,2,0,FALSE,3
occurrence,iNaturalist,"Santa Cruz Island Reserve, Channel Islands, Channel Islands National Park, Santa Barbara, UC Natural Reserve System, California, United States",Santa Cruz,33.99709167,-119.7256983,,28902,,,FALSE,,,Crambid Snout Moths,Crambidae,,Crambid Snout Moths,Insecta,52002,Lepidoptera,Crambidae,Crambidae,,,,,1805048,7,2015,7/23/15,8:28:11,300,Pacific Time (US & Canada),kueda,2015-07-27 02:17:14 +0300,2021-07-20 21:03:37 +0300,needs_id,CC0,http://www.inaturalist.org/observations/1805048,https://inaturalist-open-data.s3.amazonaws.com/photos/2187069/medium.jpg?1437952660,1,0,FALSE,
occurrence,iNaturalist,"Los Angeles County, CA, USA",Santa Catalina,33.44443279,-118.4822116,198,198,,,FALSE,,,Grass-veneers and Allies,Crambinae,,Grass-veneers and Allies,Insecta,122538,Lepidoptera,Crambidae,Crambidae,,,,,10420500,3,2018,3/24/18,1:21:00,300,Pacific Time (US & Canada),neontetraploid,2018-03-26 01:15:58 +0300,2018-03-29 07:46:11 +0300,needs_id,CC-BY-NC,https://www.inaturalist.org/observations/10420500,https://inaturalist-open-data.s3.amazonaws.com/photos/14473516/medium.jpeg?1522012488,0,0,FALSE,
occurrence,iNaturalist,"Los Angeles County, CA, USA",Santa Catalina,33.44450604,-118.4818039,100,100,,,FALSE,,,Grass-veneers and Allies,Crambinae,,Grass-veneers and Allies,Insecta,122538,Lepidoptera,Crambidae,Crambidae,,,,,10420534,3,2018,3/24/18,8:00:00,300,Pacific Time (US & Canada),neontetraploid,2018-03-26 01:16:28 +0300,2018-03-29 07:46:11 +0300,needs_id,CC-BY-NC,https://www.inaturalist.org/observations/10420534,https://inaturalist-open-data.s3.amazonaws.com/photos/14475407/medium.jpeg?1522015992,0,0,FALSE,
occurrence,iNaturalist,"Los Angeles County, CA, USA",Santa Catalina,33.4445858,-118.4824262,150,150,,,FALSE,,,Grass-veneers and Allies,Crambinae,,Grass-veneers and Allies,Insecta,122538,Lepidoptera,Crambidae,Crambidae,,,,,10421235,3,2018,3/24/18,18:10:00,300,Pacific Time (US & Canada),neontetraploid,2018-03-26 01:53:52 +0300,2018-03-29 07:46:12 +0300,needs_id,CC-BY-NC,https://www.inaturalist.org/observations/10421235,https://inaturalist-open-data.s3.amazonaws.com/photos/14475734/medium.jpeg?1522016708,0,0,FALSE,
occurrence,iNaturalist,"San Clemente Island, California, USA",San Clemente,32.885584,-118.517472,,,,,FALSE,,,Crambus,Crambus,,,Insecta,82269,Lepidoptera,Crambidae,Crambidae,Crambus,Crambus,,,17977901,10,2018,10/28/18,6:45:00,300,Pacific Time (US & Canada),jim_carretta,2018-10-31 05:06:27 +0300,2019-09-07 19:06:23 +0300,needs_id,CC-BY-NC,https://www.inaturalist.org/observations/17977901,https://inaturalist-open-data.s3.amazonaws.com/photos/27478308/medium.jpeg?1540951510,0,0,FALSE,
occurrence,iNaturalist,"Santa Cruz Island Reserve, Channel Islands, Channel Islands National Park, Santa Barbara, UC Natural Reserve System, California, United States",Santa Cruz,33.99711333,-119.72564,,28902,,,FALSE,,,Diastictis fracturalis,Diastictis fracturalis,Diastictis fracturalis,Fractured Western Snout,Insecta,210607,Lepidoptera,Crambidae,Crambidae,Diastictis,Diastictis,Diastictis fracturalis,,1790012,7,2015,7/21/15,9:02:57,300,Pacific Time (US & Canada),kueda,2015-07-22 20:01:36 +0300,2019-04-16 20:35:28 +0300,research,CC0,http://www.inaturalist.org/observations/1790012,https://inaturalist-open-data.s3.amazonaws.com/photos/2168004/medium.jpg?1437584499,2,0,FALSE,
occurrence,iNaturalist,"Avalon, CA 90704, USA",Santa Catalina,33.34583075,-118.3347511,1589,1589,,,FALSE,,,Diastictis sperryorum,Diastictis sperryorum,Diastictis sperryorum,,Insecta,477205,Lepidoptera,Crambidae,Crambidae,Diastictis,Diastictis,Diastictis sperryorum,,5253093,7,2014,7/8/14,5:32:00,400,Pacific Time (US & Canada),psyllidhipster,2017-03-09 02:26:47 +0300,2020-06-03 23:10:34 +0300,research,CC-BY-NC,https://www.inaturalist.org/observations/5253093,https://inaturalist-open-data.s3.amazonaws.com/photos/6499017/medium.jpg?1489009184,1,0,FALSE,
occurrence,iNaturalist,"Los Angeles County, CA, USA",San Clemente,32.82617569,-118.3611298,,,,,FALSE,gps,gps,Dicymolomia,Dicymolomia,,,Insecta,173878,Lepidoptera,Crambidae,Crambidae,Dicymolomia,Dicymolomia,,,26536477,5,2019,5/31/19,20:59:41,300,Pacific Time (US & Canada),pileated,2019-06-07 08:30:56 +0300,2020-04-23 20:59:55 +0300,needs_id,CC-BY,https://www.inaturalist.org/observations/26536477,https://inaturalist-open-data.s3.amazonaws.com/photos/41214016/medium.jpg?1559885459,1,0,FALSE,2
occurrence,iNaturalist,"Santa Cruz Island Reserve, Channel Islands, Channel Islands National Park, Santa Barbara, UC Natural Reserve System, California, United States",Santa Cruz,34.00033667,-119.73416,,28874,,,FALSE,,,Dicymolomia,Dicymolomia,,,Insecta,173878,Lepidoptera,Crambidae,Crambidae,Dicymolomia,Dicymolomia,,,1791940,7,2015,7/22/15,7:36:11,300,Pacific Time (US & Canada),kueda,2015-07-23 09:15:47 +0300,2021-07-20 21:11:13 +0300,needs_id,CC0,http://www.inaturalist.org/observations/1791940,https://inaturalist-open-data.s3.amazonaws.com/photos/2170846/medium.jpg?1437632168,0,0,FALSE,
occurrence,iNaturalist,"Avalon, CA 90704, USA",Santa Catalina,33.3428193,-118.3282279,2403,2403,,,FALSE,,,Dicymolomia metalliferalis,Dicymolomia metalliferalis,Dicymolomia metalliferalis,,Insecta,321699,Lepidoptera,Crambidae,Crambidae,Dicymolomia,Dicymolomia,Dicymolomia metalliferalis,,5254762,,,,,,Pacific Time (US & Canada),psyllidhipster,2017-03-09 05:49:29 +0300,2018-07-08 08:22:05 +0300,research,CC-BY-NC,https://www.inaturalist.org/observations/5254762,https://inaturalist-open-data.s3.amazonaws.com/photos/6502142/medium.jpg?1489026419,1,0,FALSE,
occurrence,iNaturalist,"Avalon, CA 90704, USA",Santa Catalina,33.3428193,-118.3282279,2403,2403,,,FALSE,,,Dicymolomia metalliferalis,Dicymolomia metalliferalis,Dicymolomia metalliferalis,,Insecta,321699,Lepidoptera,Crambidae,Crambidae,Dicymolomia,Dicymolomia,Dicymolomia metalliferalis,,5254780,,,,,,Pacific Time (US & Canada),psyllidhipster,2017-03-09 05:49:35 +0300,2020-06-03 23:10:06 +0300,research,CC-BY-NC,https://www.inaturalist.org/observations/5254780,https://inaturalist-open-data.s3.amazonaws.com/photos/6502180/medium.jpg?1489026473,1,0,FALSE,
occurrence,iNaturalist,"Los Angeles County, CA, USA",San Clemente,32.99599075,-118.5523453,,,,,FALSE,gps,gps,Dicymolomia metalliferalis,Dicymolomia metalliferalis,Dicymolomia metalliferalis,,Insecta,321699,Lepidoptera,Crambidae,Crambidae,Dicymolomia,Dicymolomia,Dicymolomia metalliferalis,,28241610,6,2019,6/27/19,8:04:36,300,Pacific Time (US & Canada),pileated,2019-07-05 20:49:11 +0300,2020-04-23 20:59:55 +0300,needs_id,CC-BY,https://www.inaturalist.org/observations/28241610,https://inaturalist-open-data.s3.amazonaws.com/photos/44010387/medium.jpg?1562348953,1,0,FALSE,2
occurrence,iNaturalist,"Santa Cruz Island Fieldstation, Santa Barbara County, CA, USA",Santa Cruz,33.997218,-119.725555,26,28902,,,FALSE,,manual,Dicymolomia metalliferalis,Dicymolomia metalliferalis,Dicymolomia metalliferalis,,Insecta,321699,Lepidoptera,Crambidae,Crambidae,Dicymolomia,Dicymolomia,Dicymolomia metalliferalis,,1787823,7,2015,7/21/15,7:03:36,300,Pacific Time (US & Canada),kueda,2015-07-22 01:31:12 +0300,2019-04-16 20:34:36 +0300,research,CC0,http://www.inaturalist.org/observations/1787823,https://inaturalist-open-data.s3.amazonaws.com/photos/2165098/medium.jpg?1437517893,1,0,FALSE,
occurrence,iNaturalist,"Santa Cruz Island Fieldstation, Santa Barbara County, CA, USA",Santa Cruz,33.997218,-119.725555,26,28902,,,FALSE,,manual,Dicymolomia metalliferalis,Dicymolomia metalliferalis,Dicymolomia metalliferalis,,Insecta,321699,Lepidoptera,Crambidae,Crambidae,Dicymolomia,Dicymolomia,Dicymolomia metalliferalis,,1787839,7,2015,7/21/15,7:10:21,300,Pacific Time (US & Canada),kueda,2015-07-22 01:32:41 +0300,2019-04-16 20:34:41 +0300,research,CC0,http://www.inaturalist.org/observations/1787839,https://inaturalist-open-data.s3.amazonaws.com/photos/2165112/medium.jpg?1437517962,1,0,FALSE,
occurrence,iNaturalist,"Santa Cruz Island Reserve, Channel Islands, Channel Islands National Park, Santa Barbara, UC Natural Reserve System, California, United States",Santa Cruz,34.00030333,-119.7341367,,28874,,,FALSE,,,Dicymolomia metalliferalis,Dicymolomia metalliferalis,Dicymolomia metalliferalis,,Insecta,321699,Lepidoptera,Crambidae,Crambidae,Dicymolomia,Dicymolomia,Dicymolomia metalliferalis,,1791949,7,2015,7/22/15,8:20:25,300,Pacific Time (US & Canada),kueda,2015-07-23 09:16:33 +0300,2019-03-26 04:40:07 +0300,research,CC0,http://www.inaturalist.org/observations/1791949,https://inaturalist-open-data.s3.amazonaws.com/photos/2170855/medium.jpg?1437632199,1,0,FALSE,
occurrence,iNaturalist,"Avalon, CA 90704, USA",Santa Catalina,33.34583075,-118.3347511,1589,1589,,,FALSE,,,Dicymolomia opuntialis,Dicymolomia opuntialis,Dicymolomia opuntialis,,Insecta,355569,Lepidoptera,Crambidae,Crambidae,Dicymolomia,Dicymolomia,Dicymolomia opuntialis,,5253053,7,2014,7/4/14,5:35:00,400,Pacific Time (US & Canada),psyllidhipster,2017-03-09 02:26:05 +0300,2019-08-04 08:06:49 +0300,research,CC-BY-NC,https://www.inaturalist.org/observations/5253053,https://inaturalist-open-data.s3.amazonaws.com/photos/6498958/medium.jpg?1489009086,1,0,FALSE,
occurrence,iNaturalist,"Avalon, CA 90704, USA",Santa Catalina,33.3428193,-118.3282279,2403,2403,,,FALSE,,,Dicymolomia opuntialis,Dicymolomia opuntialis,Dicymolomia opuntialis,,Insecta,355569,Lepidoptera,Crambidae,Crambidae,Dicymolomia,Dicymolomia,Dicymolomia opuntialis,,5255026,,,,,,Pacific Time (US & Canada),psyllidhipster,2017-03-09 06:35:04 +0300,2020-06-03 23:09:06 +0300,research,CC-BY-NC,https://www.inaturalist.org/observations/5255026,https://inaturalist-open-data.s3.amazonaws.com/photos/6502460/medium.jpg?1489028728,1,0,FALSE,
occurrence,iNaturalist,"Avalon, CA 90704, USA",Santa Catalina,33.34197208,-118.3228426,20,20,,,FALSE,,,Dicymolomia opuntialis,Dicymolomia opuntialis,Dicymolomia opuntialis,,Insecta,355569,Lepidoptera,Crambidae,Crambidae,Dicymolomia,Dicymolomia,Dicymolomia opuntialis,,34125491,10,2019,10/5/19,9:24:00,300,Pacific Time (US & Canada),psyllidhipster,2019-10-09 21:27:50 +0300,2020-06-03 23:05:41 +0300,needs_id,CC-BY-NC,https://www.inaturalist.org/observations/34125491,https://inaturalist-open-data.s3.amazonaws.com/photos/53667027/medium.jpeg?1570644822,0,0,FALSE,
occurrence,iNaturalist,"Avalon, CA 90704, USA",Santa Catalina,33.34583075,-118.3347511,1589,1589,,,FALSE,,,Euchromius ocellea,Euchromius ocellea,Euchromius ocellea,Belted Grass-veneer,Insecta,789601,Lepidoptera,Crambidae,Crambidae,Euchromius,Euchromius,Euchromius ocellea,,5253066,,,,,,Pacific Time (US & Canada),psyllidhipster,2017-03-09 02:26:19 +0300,2018-10-24 19:24:56 +0300,research,CC-BY-NC,https://www.inaturalist.org/observations/5253066,https://inaturalist-open-data.s3.amazonaws.com/photos/6498981/medium.jpg?1489009120,1,0,FALSE,
occurrence,iNaturalist,"Avalon, CA 90704, USA",Santa Catalina,33.3428193,-118.3282279,2403,2403,,,FALSE,,,Euchromius ocellea,Euchromius ocellea,Euchromius ocellea,Belted Grass-veneer,Insecta,789601,Lepidoptera,Crambidae,Crambidae,Euchromius,Euchromius,Euchromius ocellea,,5275508,,,,,,Pacific Time (US & Canada),psyllidhipster,2017-03-10 23:49:59 +0300,2019-10-20 21:18:20 +0300,research,CC-BY-NC,https://www.inaturalist.org/observations/5275508,https://inaturalist-open-data.s3.amazonaws.com/photos/6520435/medium.jpg?1489175822,1,0,FALSE,
occurrence,iNaturalist,"Los Angeles County, CA, USA",San Clemente,32.99599075,-118.5523453,,,,,FALSE,gps,gps,Euchromius ocellea,Euchromius ocellea,Euchromius ocellea,Belted Grass-veneer,Insecta,789601,Lepidoptera,Crambidae,Crambidae,Euchromius,Euchromius,Euchromius ocellea,,28241689,6,2019,6/27/19,9:51:28,300,Pacific Time (US & Canada),pileated,2019-07-05 20:50:34 +0300,2020-04-23 20:59:53 +0300,research,CC-BY,https://www.inaturalist.org/observations/28241689,https://inaturalist-open-data.s3.amazonaws.com/photos/44010528/medium.jpg?1562349036,2,0,FALSE,2
occurrence,iNaturalist,"Santa Cruz Island Reserve, Channel Islands, Channel Islands National Park, Santa Barbara, UC Natural Reserve System, California, United States",Santa Cruz,33.99705667,-119.7257,,,,,FALSE,,,Euchromius ocellea,Euchromius ocellea,Euchromius ocellea,Belted Grass-veneer,Insecta,789601,Lepidoptera,Crambidae,Crambidae,Euchromius,Euchromius,Euchromius ocellea,,1789995,7,2015,7/21/15,8:31:03,300,Pacific Time (US & Canada),kueda,2015-07-22 20:00:12 +0300,2019-10-20 21:18:09 +0300,research,CC0,http://www.inaturalist.org/observations/1789995,https://inaturalist-open-data.s3.amazonaws.com/photos/2167987/medium.jpg?1437584433,1,0,FALSE,
occurrence,iNaturalist,"Avalon, CA 90704, USA",Santa Catalina,33.34583075,-118.3347511,1589,1589,,,FALSE,,,Eudonia rectilinea,Eudonia rectilinea,Eudonia rectilinea,,Insecta,219716,Lepidoptera,Crambidae,Crambidae,Eudonia,Eudonia,Eudonia rectilinea,,5253088,,,,,,Pacific Time (US & Canada),psyllidhipster,2017-03-09 02:26:41 +0300,2020-06-03 23:10:41 +0300,needs_id,CC-BY-NC,https://www.inaturalist.org/observations/5253088,https://inaturalist-open-data.s3.amazonaws.com/photos/6499012/medium.jpg?1489009172,0,0,FALSE,
occurrence,iNaturalist,"Avalon, CA 90704, USA",Santa Catalina,33.34583075,-118.3347511,1589,1589,,,FALSE,,,Eudonia rectilinea,Eudonia rectilinea,Eudonia rectilinea,,Insecta,219716,Lepidoptera,Crambidae,Crambidae,Eudonia,Eudonia,Eudonia rectilinea,,5253089,,,,,,Pacific Time (US & Canada),psyllidhipster,2017-03-09 02:26:42 +0300,2020-06-03 23:10:40 +0300,needs_id,CC-BY-NC,https://www.inaturalist.org/observations/5253089,https://inaturalist-open-data.s3.amazonaws.com/photos/6499013/medium.jpg?1489009176,0,0,FALSE,
occurrence,iNaturalist,"Avalon, CA 90704, USA",Santa Catalina,33.3428193,-118.3282279,2403,2403,,,FALSE,,,Eudonia rectilinea,Eudonia rectilinea,Eudonia rectilinea,,Insecta,219716,Lepidoptera,Crambidae,Crambidae,Eudonia,Eudonia,Eudonia rectilinea,,5255016,,,,,,Pacific Time (US & Canada),psyllidhipster,2017-03-09 06:35:01 +0300,2020-06-03 23:09:16 +0300,needs_id,CC-BY-NC,https://www.inaturalist.org/observations/5255016,https://inaturalist-open-data.s3.amazonaws.com/photos/6502450/medium.jpg?1489028710,0,0,FALSE,
occurrence,iNaturalist,"Santa Cruz Island Reserve, Channel Islands, Channel Islands National Park, Santa Barbara, UC Natural Reserve System, California, United States",Santa Cruz,33.99708167,-119.725695,,28902,,,FALSE,,,Eudonia torniplagalis,Eudonia torniplagalis,Eudonia torniplagalis,,Insecta,219718,Lepidoptera,Crambidae,Crambidae,Eudonia,Eudonia,Eudonia torniplagalis,,1805046,7,2015,7/23/15,8:28:33,300,Pacific Time (US & Canada),kueda,2015-07-27 02:17:07 +0300,2021-07-20 21:03:38 +0300,needs_id,CC0,http://www.inaturalist.org/observations/1805046,https://inaturalist-open-data.s3.amazonaws.com/photos/2187067/medium.jpg?1437952657,0,0,FALSE,
occurrence,iNaturalist,"San Clemente Island Underwater Range, CA, US",San Clemente,33.00147222,-118.5542367,5,5,,,FALSE,,,Cabbage Webworm Moth,Hellula rogatalis,Hellula rogatalis,Cabbage Webworm Moth,Insecta,210616,Lepidoptera,Crambidae,Crambidae,Hellula,Hellula,Hellula rogatalis,,65720984,11,2020,11/28/20,3:02:04,300,Pacific Time (US & Canada),vireolanius,2020-11-28 03:03:34 +0300,2020-12-21 20:52:47 +0300,research,CC-BY-NC,https://www.inaturalist.org/observations/65720984,https://inaturalist-open-data.s3.amazonaws.com/photos/105825558/medium.jpg?1606521817,2,0,FALSE,3
occurrence,iNaturalist,"San Clemente Island, California, USA",San Clemente,32.88789087,-118.5227936,3770,3770,,,FALSE,,,Cabbage Webworm Moth,Hellula rogatalis,Hellula rogatalis,Cabbage Webworm Moth,Insecta,210616,Lepidoptera,Crambidae,Crambidae,Hellula,Hellula,Hellula rogatalis,,17980500,10,2018,10/28/18,6:26:00,300,Pacific Time (US & Canada),jim_carretta,2018-10-31 07:58:02 +0300,2018-11-04 07:37:21 +0300,research,CC-BY-NC,https://www.inaturalist.org/observations/17980500,https://inaturalist-open-data.s3.amazonaws.com/photos/27482619/medium.jpeg?1540961792,1,0,FALSE,
occurrence,iNaturalist,"Ventura County, CA, USA",San Nicolas,33.22149578,-119.4394875,122,122,,,FALSE,,,Cabbage Webworm Moth,Hellula rogatalis,Hellula rogatalis,Cabbage Webworm Moth,Insecta,210616,Lepidoptera,Crambidae,Crambidae,Hellula,Hellula,Hellula rogatalis,,57096582,8,2020,8/18/20,22:14:00,300,Pacific Time (US & Canada),ruanemartin,2020-08-21 07:38:02 +0300,2020-11-17 18:39:26 +0300,research,CC-BY-NC,https://www.inaturalist.org/observations/57096582,https://inaturalist-open-data.s3.amazonaws.com/photos/91047060/medium.jpeg?1597984635,2,0,FALSE,
occurrence,iNaturalist,"Channel Islands, Channel Islands National Park, Santa Barbara, California, United States",Santa Cruz,34.01916333,-119.682915,,28874,,,FALSE,,,Hemiplatytes epia,Hemiplatytes epia,Hemiplatytes epia,,Insecta,367788,Lepidoptera,Crambidae,Crambidae,Hemiplatytes,Hemiplatytes,Hemiplatytes epia,,1805809,7,2015,7/24/15,6:59:57,300,Pacific Time (US & Canada),kueda,2015-07-27 07:48:53 +0300,2021-07-20 20:58:26 +0300,needs_id,CC0,http://www.inaturalist.org/observations/1805809,https://inaturalist-open-data.s3.amazonaws.com/photos/2188288/medium.jpg?1437972562,0,0,FALSE,
occurrence,iNaturalist,"Los Angeles County, US-CA, US",Santa Catalina,33.41577167,-118.4809583,,,,,FALSE,,,Hemiplatytes epia,Hemiplatytes epia,Hemiplatytes epia,,Insecta,367788,Lepidoptera,Crambidae,Crambidae,Hemiplatytes,Hemiplatytes,Hemiplatytes epia,,1830814,8,2015,8/2/15,16:28:58,300,Pacific Time (US & Canada),damontighe,2015-08-04 08:34:15 +0300,2020-06-03 23:11:53 +0300,research,CC-BY-NC,http://www.inaturalist.org/observations/1830814,https://inaturalist-open-data.s3.amazonaws.com/photos/2222821/medium.jpg?1438666521,1,0,FALSE,3
occurrence,iNaturalist,"Santa Barbara County, CA, USA",Santa Cruz,34.03971886,-119.5692984,92,92,,,FALSE,,,Hemiplatytes epia,Hemiplatytes epia,Hemiplatytes epia,,Insecta,367788,Lepidoptera,Crambidae,Crambidae,Hemiplatytes,Hemiplatytes,Hemiplatytes epia,,30333906,8,2019,8/5/19,1:00:00,300,Pacific Time (US & Canada),dlbowls,2019-08-07 01:18:58 +0300,2019-08-26 01:38:30 +0300,needs_id,CC-BY-NC,https://www.inaturalist.org/observations/30333906,https://inaturalist-open-data.s3.amazonaws.com/photos/47374368/medium.jpeg?1565123916,0,0,FALSE,
occurrence,iNaturalist,"Santa Cruz Island Fieldstation, Santa Barbara County, CA, USA",Santa Cruz,33.997173,-119.72586,146,28902,,,FALSE,,manual,Hemiplatytes epia,Hemiplatytes epia,Hemiplatytes epia,,Insecta,367788,Lepidoptera,Crambidae,Crambidae,Hemiplatytes,Hemiplatytes,Hemiplatytes epia,,1789971,7,2015,7/21/15,7:27:02,300,Pacific Time (US & Canada),kueda,2015-07-22 19:58:20 +0300,2021-07-20 21:14:05 +0300,needs_id,CC0,http://www.inaturalist.org/observations/1789971,https://inaturalist-open-data.s3.amazonaws.com/photos/2167952/medium.jpg?1437584318,0,0,FALSE,
occurrence,iNaturalist,"Santa Cruz Island Reserve, Channel Islands, Channel Islands National Park, Santa Barbara, UC Natural Reserve System, California, United States",Santa Cruz,34.00031167,-119.7341283,,28874,,,FALSE,,,Hemiplatytes epia,Hemiplatytes epia,Hemiplatytes epia,,Insecta,367788,Lepidoptera,Crambidae,Crambidae,Hemiplatytes,Hemiplatytes,Hemiplatytes epia,,1791943,7,2015,7/22/15,7:37:46,300,Pacific Time (US & Canada),kueda,2015-07-23 09:16:15 +0300,2021-07-20 21:10:59 +0300,needs_id,CC0,http://www.inaturalist.org/observations/1791943,https://inaturalist-open-data.s3.amazonaws.com/photos/2170849/medium.jpg?1437632184,0,0,FALSE,
occurrence,iNaturalist,"Channel Islands National Park, Channel Islands National Pk, CA, US",Santa Cruz,33.997005,-119.7294,500,500,,,FALSE,,,Eggplant Leafroller,Lineodes integra,Lineodes integra,Eggplant Leafroller Moth,Insecta,143037,Lepidoptera,Crambidae,Crambidae,Lineodes,Lineodes,Lineodes integra,,1790037,7,2015,7/22/15,8:53:20,300,Pacific Time (US & Canada),robberfly,2015-07-22 20:15:59 +0300,2017-05-02 21:37:51 +0300,research,CC-BY-NC,http://www.inaturalist.org/observations/1790037,https://inaturalist-open-data.s3.amazonaws.com/photos/2168050/medium.jpg?1437585441,1,0,FALSE,3
occurrence,iNaturalist,"Channel Islands National Park, Channel Islands, Santa Barbara, California, United States",Santa Rosa,34.00789167,-120.05079,,,,,FALSE,,,Eggplant Leafroller Moth,Lineodes integra,Lineodes integra,Eggplant Leafroller Moth,Insecta,143037,Lepidoptera,Crambidae,Crambidae,Lineodes,Lineodes,Lineodes integra,,25223240,5,2019,5/10/19,22:42:00,300,Pacific Time (US & Canada),silversea_starsong,2019-05-16 21:03:30 +0300,2019-05-27 04:24:40 +0300,research,CC-BY-NC,https://www.inaturalist.org/observations/25223240,https://inaturalist-open-data.s3.amazonaws.com/photos/39044590/medium.jpeg?1558028540,1,0,FALSE,
occurrence,iNaturalist,"Santa Cruz Island Reserve, Channel Islands, Channel Islands National Park, Santa Barbara, UC Natural Reserve System, California, United States",Santa Cruz,33.99692167,-119.7293783,54,28902,,,FALSE,,,Lineodes integra,Lineodes integra,Lineodes integra,Eggplant Leafroller Moth,Insecta,143037,Lepidoptera,Crambidae,Crambidae,Lineodes,Lineodes,Lineodes integra,,1791954,7,2015,7/22/15,8:52:09,300,Pacific Time (US & Canada),kueda,2015-07-23 09:16:56 +0300,2019-03-26 04:40:11 +0300,research,CC0,http://www.inaturalist.org/observations/1791954,https://inaturalist-open-data.s3.amazonaws.com/photos/2170860/medium.jpg?1437632221,1,0,FALSE,
occurrence,iNaturalist,"Avalon, CA 90704, USA",Santa Catalina,33.3428193,-118.3282279,2403,2403,,,FALSE,,,Mimorista subcostalis,Mimorista subcostalis,Mimorista subcostalis,,Insecta,325924,Lepidoptera,Crambidae,Crambidae,Mimorista,Mimorista,Mimorista subcostalis,,5255025,,,,,,Pacific Time (US & Canada),psyllidhipster,2017-03-09 06:35:03 +0300,2019-05-19 22:09:25 +0300,needs_id,CC-BY-NC,https://www.inaturalist.org/observations/5255025,https://inaturalist-open-data.s3.amazonaws.com/photos/6502459/medium.jpg?1489028725,0,0,FALSE,
occurrence,iNaturalist,"Los Angeles County, CA, USA",San Clemente,32.8013,-118.42545,,,,,FALSE,,,Lucerne Moth,Nomophila nearctica,Nomophila nearctica,Lucerne Moth,Insecta,58750,Lepidoptera,Crambidae,Crambidae,Nomophila,Nomophila,Nomophila nearctica,,35647519,6,2019,6/21/19,19:29:00,300,Pacific Time (US & Canada),stephanomeria,2019-11-13 21:02:50 +0300,2020-04-28 20:03:12 +0300,research,CC-BY-NC,https://www.inaturalist.org/observations/35647519,https://inaturalist-open-data.s3.amazonaws.com/photos/56231962/medium.jpg?1573667446,2,0,FALSE,
occurrence,iNaturalist,"Santa Cruz Island, CA",Santa Cruz,34.01913648,-119.6813196,8,8,,,FALSE,,,Lucerne Moth,Nomophila nearctica,Nomophila nearctica,Lucerne Moth,Insecta,58750,Lepidoptera,Crambidae,Crambidae,Nomophila,Nomophila,Nomophila nearctica,,8409267,10,2017,10/14/17,23:45:00,300,Pacific Time (US & Canada),gyrrlfalcon,2017-10-15 07:35:46 +0300,2017-10-15 09:12:08 +0300,research,CC-BY-NC,https://www.inaturalist.org/observations/8409267,https://inaturalist-open-data.s3.amazonaws.com/photos/11191242/medium.jpg?1508041728,1,0,FALSE,
occurrence,iNaturalist,"Unnamed Road, California, USA",San Clemente,32.99590472,-118.5521787,11,11,,,FALSE,gps,gps,Lucerne Moth,Nomophila nearctica,Nomophila nearctica,Lucerne Moth,Insecta,58750,Lepidoptera,Crambidae,Crambidae,Nomophila,Nomophila,Nomophila nearctica,,23039263,4,2019,4/18/19,6:28:12,300,Pacific Time (US & Canada),pileated,2019-04-25 09:37:30 +0300,2019-04-26 17:24:51 +0300,needs_id,CC-BY,https://www.inaturalist.org/observations/23039263,https://inaturalist-open-data.s3.amazonaws.com/photos/35716965/medium.jpg?1556174252,0,0,FALSE,2
occurrence,iNaturalist,"Ventura County, CA, USA",San Nicolas,33.25502778,-119.4846333,,,,,FALSE,,,Lucerne Moth,Nomophila nearctica,Nomophila nearctica,Lucerne Moth,Insecta,58750,Lepidoptera,Crambidae,Crambidae,Nomophila,Nomophila,Nomophila nearctica,,5445061,4,2016,4/23/16,22:54:00,300,Pacific Time (US & Canada),ezeemonee,2017-03-24 23:21:45 +0300,2018-01-24 03:38:38 +0300,research,CC-BY-NC,https://www.inaturalist.org/observations/5445061,https://inaturalist-open-data.s3.amazonaws.com/photos/6701352/medium.jpeg?1490386798,1,0,FALSE,
occurrence,iNaturalist,"Los Angeles, California, United States",San Clemente,32.98376167,-118.572625,,,,,FALSE,,,Odontiinae,Odontiinae,,,Insecta,122942,Lepidoptera,Crambidae,Crambidae,,,,,21759683,,,,,,Pacific Time (US & Canada),cedric_lee,2019-03-30 03:55:20 +0300,2021-01-27 06:06:32 +0300,needs_id,CC-BY-NC,https://www.inaturalist.org/observations/21759683,https://inaturalist-open-data.s3.amazonaws.com/photos/33690163/medium.jpeg?1553896008,2,0,FALSE,
occurrence,iNaturalist,"Santa Barbara County, CA, USA",Santa Cruz,33.99749167,-119.731455,,,,,FALSE,,,Mint Moths,Pyrausta,,Mint Moths,Insecta,55659,Lepidoptera,Crambidae,Crambidae,Pyrausta,Pyrausta,,,37862150,10,2019,10/16/19,2:01:00,300,Eastern Time (US & Canada),aegolius,2020-01-23 05:14:41 +0300,2020-01-23 07:42:55 +0300,needs_id,CC-BY-NC-SA,https://www.inaturalist.org/observations/37862150,https://inaturalist-open-data.s3.amazonaws.com/photos/60105260/medium.jpeg?1579745609,0,0,FALSE,
occurrence,iNaturalist,"Prisoner's Harbor, Santa Cruz Island",Santa Cruz,34.018831,-119.681972,,,,,FALSE,,,Pyrausta insequalis,Pyrausta insequalis,Pyrausta insequalis,Mottled Pyrausta Moth,Insecta,491839,Lepidoptera,Crambidae,Crambidae,Pyrausta,Pyrausta,Pyrausta insequalis,,1794388,,,,,,Pacific Time (US & Canada),robberfly,2015-07-24 05:28:22 +0300,2017-05-02 21:37:57 +0300,research,CC-BY-NC,http://www.inaturalist.org/observations/1794388,https://inaturalist-open-data.s3.amazonaws.com/photos/2174300/medium.JPG?1437704919,1,0,FALSE,
occurrence,iNaturalist,"Santa Barbara County, CA, USA",Santa Cruz,33.99774667,-119.73095,,,,,FALSE,,,Mottled Pyrausta Moth,Pyrausta insequalis,Pyrausta insequalis,Mottled Pyrausta Moth,Insecta,491839,Lepidoptera,Crambidae,Crambidae,Pyrausta,Pyrausta,Pyrausta insequalis,,35266116,10,2019,10/15/19,22:45:00,300,Eastern Time (US & Canada),timbir5,2019-11-04 04:45:26 +0300,2020-06-13 06:47:47 +0300,research,CC-BY-NC,https://www.inaturalist.org/observations/35266116,https://inaturalist-open-data.s3.amazonaws.com/photos/55592180/medium.jpeg?1572831813,1,0,FALSE,
occurrence,iNaturalist,"Santa Barbara County, CA, USA",Santa Cruz,33.99812667,-119.7256667,,,,,FALSE,,,Mottled Pyrausta Moth,Pyrausta insequalis,Pyrausta insequalis,Mottled Pyrausta Moth,Insecta,491839,Lepidoptera,Crambidae,Crambidae,Pyrausta,Pyrausta,Pyrausta insequalis,,38045307,10,2019,10/25/19,18:27:00,300,Eastern Time (US & Canada),aegolius,2020-01-28 04:13:22 +0300,2020-01-28 04:44:32 +0300,needs_id,CC-BY-NC-SA,https://www.inaturalist.org/observations/38045307,https://inaturalist-open-data.s3.amazonaws.com/photos/60408429/medium.jpeg?1580173461,1,0,FALSE,
occurrence,iNaturalist,"Santa Cruz Island Fieldstation, Santa Barbara County, CA, USA",Santa Cruz,33.997218,-119.725555,26,28902,,,FALSE,,manual,Pyrausta insequalis,Pyrausta insequalis,Pyrausta insequalis,Mottled Pyrausta Moth,Insecta,491839,Lepidoptera,Crambidae,Crambidae,Pyrausta,Pyrausta,Pyrausta insequalis,,1787797,7,2015,7/21/15,6:42:12,300,Pacific Time (US & Canada),kueda,2015-07-22 01:28:46 +0300,2019-04-16 20:34:27 +0300,research,CC0,http://www.inaturalist.org/observations/1787797,https://inaturalist-open-data.s3.amazonaws.com/photos/2165072/medium.jpg?1437517739,1,0,FALSE,
occurrence,iNaturalist,"Santa Cruz Island, California 93001, USA",Santa Cruz,33.99602358,-119.7169819,,,,,FALSE,gps,gps,Mottled Pyrausta Moth,Pyrausta insequalis,Pyrausta insequalis,Mottled Pyrausta Moth,Insecta,491839,Lepidoptera,Crambidae,Crambidae,Pyrausta,Pyrausta,Pyrausta insequalis,,60560340,9,2020,9/19/20,6:40:59,300,Pacific Time (US & Canada),pileated,2020-09-24 01:17:01 +0300,2020-12-22 02:33:58 +0300,needs_id,CC-BY,https://www.inaturalist.org/observations/60560340,https://inaturalist-open-data.s3.amazonaws.com/photos/96847670/medium.jpeg?1600899439,1,0,FALSE,2
occurrence,iNaturalist,Santa Cruz Island--Prisoners Cove,Santa Cruz,34.018866,-119.683553,280,280,,,FALSE,,,Pyrausta subsequalis,Pyrausta insequalis,Pyrausta insequalis,Mottled Pyrausta Moth,Insecta,491839,Lepidoptera,Crambidae,Crambidae,Pyrausta,Pyrausta,Pyrausta insequalis,,1932992,2,2015,2/21/15,23:24:01,300,Pacific Time (US & Canada),finatic,2015-09-10 19:15:27 +0300,2017-05-02 21:39:03 +0300,needs_id,CC-BY-NC,http://www.inaturalist.org/observations/1932992,https://static.inaturalist.org/photos/2364982/medium.jpg?1444562582,0,0,FALSE,
occurrence,iNaturalist,"Avalon, CA 90704, USA",Santa Catalina,33.3428193,-118.3282279,2403,2403,,,FALSE,,,Southern Purple Mint Moth,Pyrausta laticlavia,Pyrausta laticlavia,Southern Purple Mint Moth,Insecta,204081,Lepidoptera,Crambidae,Crambidae,Pyrausta,Pyrausta,Pyrausta laticlavia,,5275504,,,,,,Pacific Time (US & Canada),psyllidhipster,2017-03-10 23:49:58 +0300,2017-07-04 16:01:39 +0300,research,CC-BY-NC,https://www.inaturalist.org/observations/5275504,https://inaturalist-open-data.s3.amazonaws.com/photos/6520429/medium.jpg?1489175815,1,0,FALSE,
occurrence,iNaturalist,"Prisoners Harbor, Santa Cruz Island, CA",Santa Cruz,34.019201,-119.684136,67,67,,,FALSE,,manual,Pyraustinae,Pyraustinae,,,Insecta,122491,Lepidoptera,Crambidae,Crambidae,,,,,1251913,2,2015,2/21/15,23:20:56,300,Pacific Time (US & Canada),jaykeller,2015-02-23 00:05:12 +0300,2017-05-22 07:15:09 +0300,needs_id,,http://www.inaturalist.org/observations/1251913,https://static.inaturalist.org/photos/1571851/medium.jpg?1444310202,1,0,FALSE,
occurrence,iNaturalist,"Santa Cruz Island Fieldstation, Santa Barbara County, CA, USA",Santa Cruz,33.997173,-119.72586,146,28902,,,FALSE,,manual,Pyraustinae,Pyraustinae,,,Insecta,122491,Lepidoptera,Crambidae,Crambidae,,,,,1789966,7,2015,7/21/15,7:21:34,300,Pacific Time (US & Canada),kueda,2015-07-22 19:58:29 +0300,2021-07-20 21:14:03 +0300,needs_id,CC0,http://www.inaturalist.org/observations/1789966,https://inaturalist-open-data.s3.amazonaws.com/photos/2167942/medium.jpg?1437584323,0,0,FALSE,
occurrence,iNaturalist,"Avalon, CA 90704, USA",Santa Catalina,33.3428193,-118.3282279,2403,2403,,,FALSE,,,Scoparia,Scoparia,,,Insecta,133320,Lepidoptera,Crambidae,Crambidae,Scoparia,Scoparia,,,5275542,,,,,,Pacific Time (US & Canada),psyllidhipster,2017-03-10 23:50:13 +0300,2020-06-03 23:08:19 +0300,needs_id,CC-BY-NC,https://www.inaturalist.org/observations/5275542,https://inaturalist-open-data.s3.amazonaws.com/photos/6520475/medium.jpg?1489175858,0,0,FALSE,
occurrence,iNaturalist,"Channel Islands, Channel Islands National Park, Santa Barbara, California, United States",Santa Cruz,34.019125,-119.6829317,,28874,,,FALSE,,,Scoparia palloralis,Scoparia palloralis,Scoparia palloralis,,Insecta,471494,Lepidoptera,Crambidae,Crambidae,Scoparia,Scoparia,Scoparia palloralis,,1805817,7,2015,7/24/15,7:30:06,300,Pacific Time (US & Canada),kueda,2015-07-27 07:49:39 +0300,2021-07-20 20:58:17 +0300,needs_id,CC0,http://www.inaturalist.org/observations/1805817,https://inaturalist-open-data.s3.amazonaws.com/photos/2188296/medium.jpg?1437972607,0,0,FALSE,
occurrence,iNaturalist,"Santa Cruz Island Reserve, Channel Islands, Channel Islands National Park, Santa Barbara, UC Natural Reserve System, California, United States",Santa Cruz,34.000325,-119.7341533,,28874,,,FALSE,,,Scoparia palloralis,Scoparia palloralis,Scoparia palloralis,,Insecta,471494,Lepidoptera,Crambidae,Crambidae,Scoparia,Scoparia,Scoparia palloralis,,1791935,7,2015,7/22/15,7:22:36,300,Pacific Time (US & Canada),kueda,2015-07-23 09:15:27 +0300,2021-07-20 21:11:14 +0300,needs_id,CC0,http://www.inaturalist.org/observations/1791935,https://inaturalist-open-data.s3.amazonaws.com/photos/2170841/medium.jpg?1437632142,0,0,FALSE,
occurrence,iNaturalist,"Channel Islands National Park, CA, US",Anacapa,34.01580555,-119.362205,5,5,,,FALSE,,,Crambid Snout Moths,Stegea,,,Insecta,211431,Lepidoptera,Crambidae,Crambidae,Stegea,Stegea,,,58123317,8,2020,8/30/20,21:04:33,300,Pacific Time (US & Canada),serpophaga,2020-08-31 08:23:29 +0300,2020-12-27 00:58:09 +0300,needs_id,CC-BY-NC,https://www.inaturalist.org/observations/58123317,https://inaturalist-open-data.s3.amazonaws.com/photos/92769308/medium.jpg?1598851415,1,0,FALSE,3
occurrence,iNaturalist,"Santa Barbara County, CA, USA",Santa Cruz,34.02182645,-119.8705977,15,15,,,FALSE,,,Udea,Udea,,,Insecta,126764,Lepidoptera,Crambidae,Crambidae,Udea,Udea,,,6381928,5,2017,5/19/17,8:59:00,300,Pacific Time (US & Canada),silversea_starsong,2017-05-27 20:49:02 +0300,2019-08-21 22:09:22 +0300,needs_id,CC-BY-NC,https://www.inaturalist.org/observations/6381928,https://inaturalist-open-data.s3.amazonaws.com/photos/8055721/medium.jpeg?1495906333,1,0,FALSE,
occurrence,iNaturalist,"Avalon, CA 90704, USA",Santa Catalina,33.3428193,-118.3282279,2403,2403,,,FALSE,,,Udea berberalis,Udea berberalis,Udea berberalis,,Insecta,472572,Lepidoptera,Crambidae,Crambidae,Udea,Udea,Udea berberalis,,5255045,,,,,,Pacific Time (US & Canada),psyllidhipster,2017-03-09 06:35:10 +0300,2017-05-02 21:58:57 +0300,needs_id,CC-BY-NC,https://www.inaturalist.org/observations/5255045,https://inaturalist-open-data.s3.amazonaws.com/photos/6502475/medium.jpg?1489028751,0,0,FALSE,
occurrence,iNaturalist,"Avalon, CA 90704, USA",Santa Catalina,33.3428193,-118.3282279,2403,2403,,,FALSE,,,Udea berberalis,Udea berberalis,Udea berberalis,,Insecta,472572,Lepidoptera,Crambidae,Crambidae,Udea,Udea,Udea berberalis,,5275526,,,,,,Pacific Time (US & Canada),psyllidhipster,2017-03-10 23:50:07 +0300,2020-06-03 23:08:34 +0300,needs_id,CC-BY-NC,https://www.inaturalist.org/observations/5275526,https://inaturalist-open-data.s3.amazonaws.com/photos/6520459/medium.jpg?1489175841,0,0,FALSE,
occurrence,iNaturalist,"Avalon, CA 90704, USA",Santa Catalina,33.3428193,-118.3282279,2403,2403,,,FALSE,,,Genista Broom Moth,Uresiphita reversalis,Uresiphita reversalis,Genista Broom Moth,Insecta,121716,Lepidoptera,Crambidae,Crambidae,Uresiphita,Udea,Uresiphita reversalis,,5254783,,,,,,Pacific Time (US & Canada),psyllidhipster,2017-03-09 05:49:36 +0300,2017-05-02 21:58:52 +0300,research,CC-BY-NC,https://www.inaturalist.org/observations/5254783,https://inaturalist-open-data.s3.amazonaws.com/photos/6502183/medium.jpg?1489026477,1,0,FALSE,
occurrence,iNaturalist,"Avalon, CA 90704, USA",Santa Catalina,33.3428193,-118.3282279,2403,2403,,,FALSE,,,Genista Broom Moth,Uresiphita reversalis,Uresiphita reversalis,Genista Broom Moth,Insecta,121716,Lepidoptera,Crambidae,Crambidae,Uresiphita,Udea,Uresiphita reversalis,,5275499,,,,,,Pacific Time (US & Canada),psyllidhipster,2017-03-10 23:49:56 +0300,2017-05-02 21:59:02 +0300,research,CC-BY-NC,https://www.inaturalist.org/observations/5275499,https://inaturalist-open-data.s3.amazonaws.com/photos/6520426/medium.jpg?1489175815,1,0,FALSE,
occurrence,iNaturalist,"Avalon, CA 90704, USA",Santa Catalina,33.33694839,-118.3141632,,,,,FALSE,gps,gps,Genista Broom Moth,Uresiphita reversalis,Uresiphita reversalis,Genista Broom Moth,Insecta,121716,Lepidoptera,Crambidae,Crambidae,Uresiphita,Udea,Uresiphita reversalis,,26481252,6,2019,6/6/19,1:00:30,300,Pacific Time (US & Canada),jeanshelton,2019-06-06 09:36:08 +0300,2020-06-24 06:52:22 +0300,research,,https://www.inaturalist.org/observations/26481252,https://static.inaturalist.org/photos/41125694/medium.jpeg?1559803004,1,0,FALSE,2
occurrence,iNaturalist,"Avalon, CA 90704, USA",Santa Catalina,33.33560278,-118.3131639,24,24,,,FALSE,,,Pyralid and Crambid Snout Moths,Uresiphita reversalis,Uresiphita reversalis,Genista Broom Moth,Insecta,121716,Lepidoptera,Crambidae,Crambidae,Uresiphita,Udea,Uresiphita reversalis,,27180678,6,2019,6/17/19,2:21:00,300,Pacific Time (US & Canada),sessilefielder,2019-06-18 02:01:27 +0300,2019-06-29 21:24:28 +0300,needs_id,CC-BY-NC,https://www.inaturalist.org/observations/27180678,https://static.inaturalist.org/photos/42263085/medium.jpg?1560812212,1,0,FALSE,
occurrence,iNaturalist,"Santa Cruz Island Reserve, Channel Islands National Park, Channel Islands, Santa Barbara, UC Natural Reserve System, California, United States",Santa Cruz,34.02235667,-119.870845,,,,,FALSE,,,Agonopterix sabulella,Agonopterix sabulella,Agonopterix sabulella,,Insecta,325660,Lepidoptera,Depressariidae,Depressariidae,Agonopterix,Agonopterix,Agonopterix sabulella,,6437899,5,2017,5/20/17,8:58:00,300,Pacific Time (US & Canada),silversea_starsong,2017-05-31 03:43:42 +0300,2017-07-04 08:01:46 +0300,needs_id,CC-BY-NC,https://www.inaturalist.org/observations/6437899,https://inaturalist-open-data.s3.amazonaws.com/photos/8131003/medium.jpeg?1496188634,0,0,FALSE,
occurrence,iNaturalist,"Santa Cruz Island Fieldstation, Santa Barbara County, CA, USA",Santa Cruz,33.997218,-119.725555,26,28902,,,FALSE,,manual,Ethmia,Ethmia,,,Insecta,173500,Lepidoptera,Depressariidae,Depressariidae,Ethmia,Ethmia,,,1787842,7,2015,7/21/15,7:12:13,300,Pacific Time (US & Canada),kueda,2015-07-22 01:33:01 +0300,2021-07-20 21:15:10 +0300,needs_id,CC0,http://www.inaturalist.org/observations/1787842,https://inaturalist-open-data.s3.amazonaws.com/photos/2165115/medium.jpg?1437517989,0,0,FALSE,
occurrence,iNaturalist,"Santa Cruz Island Fieldstation, Santa Barbara County, CA, USA",Santa Cruz,33.997173,-119.72586,146,28902,,,FALSE,,manual,Ethmia,Ethmia,,,Insecta,173500,Lepidoptera,Depressariidae,Depressariidae,Ethmia,Ethmia,,,1789975,7,2015,7/21/15,7:37:50,300,Pacific Time (US & Canada),kueda,2015-07-22 19:58:40 +0300,2021-07-20 21:14:01 +0300,needs_id,CC0,http://www.inaturalist.org/observations/1789975,https://inaturalist-open-data.s3.amazonaws.com/photos/2167965/medium.jpg?1437584344,0,0,FALSE,
occurrence,iNaturalist,"Santa Cruz Island Reserve, Channel Islands National Park, Channel Islands, Santa Barbara, UC Natural Reserve System, California, United States",Santa Cruz,34.006105,-119.75856,,,,,FALSE,,,Ethmia,Ethmia,,,Insecta,173500,Lepidoptera,Depressariidae,Depressariidae,Ethmia,Ethmia,,,70183797,4,2019,4/11/19,23:33:00,300,Pacific Time (US & Canada),silversea_starsong,2021-02-26 07:42:44 +0300,2021-02-26 07:42:44 +0300,needs_id,CC-BY-NC,https://www.inaturalist.org/observations/70183797,https://inaturalist-open-data.s3.amazonaws.com/photos/114039027/medium.jpeg?1614311423,0,0,FALSE,
occurrence,iNaturalist,"Avalon, CA 90704, USA",Santa Catalina,33.34583075,-118.3347511,1589,1589,,,FALSE,,,Mountain-mahogany Moth,Ethmia discostrigella,Ethmia discostrigella,Mountain-mahogany Moth,Insecta,219583,Lepidoptera,Depressariidae,Depressariidae,Ethmia,Ethmia,Ethmia discostrigella,,5253070,7,2014,7/6/14,5:10:00,400,Pacific Time (US & Canada),psyllidhipster,2017-03-09 02:26:24 +0300,2017-05-02 21:58:42 +0300,research,CC-BY-NC,https://www.inaturalist.org/observations/5253070,https://inaturalist-open-data.s3.amazonaws.com/photos/6498986/medium.jpg?1489009129,1,0,FALSE,
occurrence,iNaturalist,"Avalon, CA 90704, USA",Santa Catalina,33.34583075,-118.3347511,1589,1589,,,FALSE,,,Mountain-mahogany Moth,Ethmia discostrigella,Ethmia discostrigella,Mountain-mahogany Moth,Insecta,219583,Lepidoptera,Depressariidae,Depressariidae,Ethmia,Ethmia,Ethmia discostrigella,,5253082,,,,,,Pacific Time (US & Canada),psyllidhipster,2017-03-09 02:26:36 +0300,2020-06-03 23:10:46 +0300,needs_id,CC-BY-NC,https://www.inaturalist.org/observations/5253082,https://inaturalist-open-data.s3.amazonaws.com/photos/6499007/medium.jpg?1489009165,0,0,FALSE,
occurrence,iNaturalist,"Santa Barbara County, CA, USA",Santa Cruz,33.99701833,-119.7259333,,,,,FALSE,,,Mountain-mahogany Moth,Ethmia discostrigella,Ethmia discostrigella,Mountain-mahogany Moth,Insecta,219583,Lepidoptera,Depressariidae,Depressariidae,Ethmia,Ethmia,Ethmia discostrigella,,15009000,4,2018,4/21/18,8:25:00,300,Pacific Time (US & Canada),silversea_starsong,2018-08-01 08:26:41 +0300,2020-07-21 07:46:31 +0300,research,CC-BY-NC,https://www.inaturalist.org/observations/15009000,https://inaturalist-open-data.s3.amazonaws.com/photos/22394674/medium.jpeg?1533100993,1,0,FALSE,
occurrence,iNaturalist,"Santa Cruz Island, Channel Islands National Pk, CA, US",Santa Cruz,33.994042,-119.71364,440,440,,,FALSE,,,Ethmia discostrigella,Ethmia discostrigella,Ethmia discostrigella,Mountain-mahogany Moth,Insecta,219583,Lepidoptera,Depressariidae,Depressariidae,Ethmia,Ethmia,Ethmia discostrigella,,1792782,,,,,,Pacific Time (US & Canada),robberfly,2015-07-23 19:52:49 +0300,2021-07-20 21:10:04 +0300,needs_id,CC-BY-NC,http://www.inaturalist.org/observations/1792782,https://inaturalist-open-data.s3.amazonaws.com/photos/2172042/medium.jpg?1437670372,0,0,FALSE,
occurrence,iNaturalist,"Channel Islands National Park, Channel Islands, Santa Barbara, California, United States",Santa Cruz,34.04935,-119.5870889,4,4,,,FALSE,,,Elachista,Elachista,,Typical Grass Miner Moths,Insecta,173675,Lepidoptera,Elachistidae,Elachistidae,Elachista,Elachista,,,71931989,3,2021,3/21/21,23:27:00,300,Pacific Time (US & Canada),damontighe,2021-03-24 10:09:33 +0300,2021-03-24 10:09:33 +0300,needs_id,CC-BY-NC,https://www.inaturalist.org/observations/71931989,https://inaturalist-open-data.s3.amazonaws.com/photos/117192456/medium.jpeg?1616568158,0,0,FALSE,
occurrence,iNaturalist,"200 Middle Ranch Rd, Avalon, CA 90704, USA",Santa Catalina,33.35423255,-118.4369091,88,88,,,FALSE,gps,gps,Apantesis,Apantesis,,,Insecta,119861,Lepidoptera,Erebidae,Erebidae,Apantesis,Apantesis,,,20544055,2,2019,2/21/19,7:38:53,300,Pacific Time (US & Canada),ljbrenner,2019-02-22 04:21:57 +0300,2019-02-22 04:28:17 +0300,needs_id,CC-BY-NC,https://www.inaturalist.org/observations/20544055,https://inaturalist-open-data.s3.amazonaws.com/photos/31714235/medium.jpeg?1550798521,0,0,FALSE,2
occurrence,iNaturalist,"Channel Islands National Park, , CA, US",Santa Cruz,34.02685833,-119.5465383,5,5,,,FALSE,,,Apantesis,Apantesis,,,Insecta,119861,Lepidoptera,Erebidae,Erebidae,Apantesis,Apantesis,,,22884691,4,2019,4/19/19,1:26:04,300,Pacific Time (US & Canada),mdpurdy,2019-04-22 18:22:50 +0300,2019-04-24 06:34:17 +0300,needs_id,CC-BY,https://www.inaturalist.org/observations/22884691,https://inaturalist-open-data.s3.amazonaws.com/photos/35472632/medium.jpg?1555946585,2,0,FALSE,3
occurrence,iNaturalist,"Los Angeles County, US-CA, US",San Clemente,32.8690567,-118.4959869,,,,,FALSE,gps,gps,Apantesis,Apantesis,,,Insecta,119861,Lepidoptera,Erebidae,Erebidae,Apantesis,Apantesis,,,21832591,3,2019,3/28/19,0:38:45,300,Pacific Time (US & Canada),pileated,2019-03-31 20:04:13 +0300,2020-04-23 21:20:30 +0300,needs_id,CC-BY,https://www.inaturalist.org/observations/21832591,https://inaturalist-open-data.s3.amazonaws.com/photos/33822028/medium.jpg?1554051857,1,0,FALSE,2
occurrence,iNaturalist,"Santa Barbara County, CA, USA",Santa Cruz,34.05265093,-119.5658795,15,15,,,FALSE,,,Apantesis,Apantesis,,,Insecta,119861,Lepidoptera,Erebidae,Erebidae,Apantesis,Apantesis,,,24980309,5,2019,5/11/19,22:32:00,300,Pacific Time (US & Canada),tothemax,2019-05-12 07:50:44 +0300,2019-05-14 04:16:49 +0300,needs_id,CC-BY-NC,https://www.inaturalist.org/observations/24980309,https://inaturalist-open-data.s3.amazonaws.com/photos/38649371/medium.jpeg?1557636571,1,0,FALSE,
occurrence,iNaturalist,"Santa Barbara County, CA, USA",Santa Cruz,34.05376684,-119.5628913,15,15,,,FALSE,,,Apantesis,Apantesis,,,Insecta,119861,Lepidoptera,Erebidae,Erebidae,Apantesis,Apantesis,,,24980545,5,2019,5/11/19,22:53:00,300,Pacific Time (US & Canada),tothemax,2019-05-12 07:56:54 +0300,2019-05-14 04:16:39 +0300,needs_id,CC-BY-NC,https://www.inaturalist.org/observations/24980545,https://inaturalist-open-data.s3.amazonaws.com/photos/38649534/medium.jpeg?1557636737,1,0,FALSE,
occurrence,iNaturalist,"Santa Barbara County, CA, USA",San Miguel,34.037211,-120.406773,300,300,,,FALSE,,,Apantesis,Apantesis,,,Insecta,119861,Lepidoptera,Erebidae,Erebidae,Apantesis,Apantesis,,,84120626,6,2021,6/2/21,19:16:00,300,UTC,dunebug,2021-06-23 03:01:20 +0300,2021-06-23 03:01:20 +0300,needs_id,,https://www.inaturalist.org/observations/84120626,https://static.inaturalist.org/photos/138224684/medium.jpg?1624406444,0,0,FALSE,
occurrence,iNaturalist,"Santa Catalina Island, , CA, US",Santa Catalina,33.44511883,-118.4813057,10,10,,,FALSE,,,,Apantesis,,,Insecta,119861,Lepidoptera,Erebidae,Erebidae,Apantesis,Apantesis,,,24814916,5,2019,5/9/19,4:07:25,300,Pacific Time (US & Canada),ctclark,2019-05-09 04:08:18 +0300,2020-06-03 23:06:40 +0300,needs_id,,https://www.inaturalist.org/observations/24814916,https://static.inaturalist.org/photos/38379078/medium.jpg?1557364113,0,0,FALSE,3
occurrence,iNaturalist,"Santa Catalina Island, California 90704, USA",Santa Catalina,33.3564558,-118.4360934,20,20,,,FALSE,,,Apantesis,Apantesis,,,Insecta,119861,Lepidoptera,Erebidae,Erebidae,Apantesis,Apantesis,,,27710490,6,2019,6/25/19,23:09:30,300,Pacific Time (US & Canada),bjdion,2019-06-26 22:06:49 +0300,2020-03-16 03:26:49 +0300,needs_id,CC-BY-NC-SA,https://www.inaturalist.org/observations/27710490,https://inaturalist-open-data.s3.amazonaws.com/photos/43143105/medium.jpeg?1561576013,1,0,FALSE,2
occurrence,iNaturalist,"22 Middle Ranch Rd, Avalon, CA 90704, USA",Santa Catalina,33.3564093,-118.4359565,20,20,,,FALSE,,,Polilla tigre mexicana,Apantesis proxima,Notarctia proxima,Mexican Tiger Moth,Insecta,321459,Lepidoptera,Erebidae,Erebidae,Apantesis,Notarctia,Apantesis proxima,,21726131,3,2019,3/28/19,23:32:11,300,Pacific Time (US & Canada),bjdion,2019-03-29 07:24:04 +0300,2020-11-29 09:39:37 +0300,needs_id,CC-BY-NC-SA,https://www.inaturalist.org/observations/21726131,https://inaturalist-open-data.s3.amazonaws.com/photos/33644721/medium.jpeg?1553833449,0,0,FALSE,2
occurrence,iNaturalist,"Avalon, CA 90704, USA",Santa Catalina,33.35435829,-118.3307727,17,17,,,FALSE,gps,gps,Mexican Tiger Moth,Apantesis proxima,Notarctia proxima,Mexican Tiger Moth,Insecta,321459,Lepidoptera,Erebidae,Erebidae,Apantesis,Notarctia,Apantesis proxima,,48931905,6,2020,6/8/20,19:41:31,300,Mountain Time (US & Canada),lilgmeissner,2020-06-08 20:47:37 +0300,2020-06-15 18:09:10 +0300,research,CC-BY-NC,https://www.inaturalist.org/observations/48931905,https://inaturalist-open-data.s3.amazonaws.com/photos/77662018/medium.jpeg?1591638465,1,0,FALSE,2
occurrence,iNaturalist,"Banning House Lodge, , CA, US",Santa Catalina,33.43837851,-118.4978736,19,19,,,FALSE,,,Mexican Tiger Moth,Apantesis proxima,Notarctia proxima,Mexican Tiger Moth,Insecta,321459,Lepidoptera,Erebidae,Erebidae,Apantesis,Notarctia,Apantesis proxima,,26707891,6,2019,6/7/19,21:08:00,300,Pacific Time (US & Canada),renee5e,2019-06-10 01:20:35 +0300,2019-06-10 07:05:11 +0300,research,,https://www.inaturalist.org/observations/26707891,https://static.inaturalist.org/photos/41485705/medium.jpg?1560118841,1,0,FALSE,3
occurrence,iNaturalist,"Camp Ground (across the street from campground), Avalon, CA 90704, USA",Santa Catalina,33.33019602,-118.3371715,66,66,,,FALSE,gps,gps,Mexican Tiger Moth,Apantesis proxima,Notarctia proxima,Mexican Tiger Moth,Insecta,321459,Lepidoptera,Erebidae,Erebidae,Apantesis,Notarctia,Apantesis proxima,,30655437,3,2019,3/30/19,2:11:00,300,Pacific Time (US & Canada),alexislandon,2019-08-12 03:36:22 +0300,2019-08-12 19:46:49 +0300,research,,https://www.inaturalist.org/observations/30655437,https://static.inaturalist.org/photos/47903946/medium.jpeg?1565570185,1,0,FALSE,2
occurrence,iNaturalist,"Channel Islands National Park, Channel Islands National Pk, CA, US",Santa Cruz,33.997147,-119.725625,500,500,,,FALSE,,,Mexican Tiger Moth,Apantesis proxima,Notarctia proxima,Mexican Tiger Moth,Insecta,321459,Lepidoptera,Erebidae,Erebidae,Apantesis,Notarctia,Apantesis proxima,,1790123,7,2015,7/22/15,9:09:41,300,Pacific Time (US & Canada),robberfly,2015-07-22 20:48:51 +0300,2017-12-15 18:06:37 +0300,research,CC-BY-NC,http://www.inaturalist.org/observations/1790123,https://inaturalist-open-data.s3.amazonaws.com/photos/2168126/medium.jpg?1437587357,1,0,FALSE,3
occurrence,iNaturalist,"Channel Islands National Park, Channel Islands National Pk, CA, US",Santa Cruz,34.04902171,-119.562654,37,37,,,FALSE,,,Mexican Tiger Moth,Apantesis proxima,Notarctia proxima,Mexican Tiger Moth,Insecta,321459,Lepidoptera,Erebidae,Erebidae,Apantesis,Notarctia,Apantesis proxima,,2854539,3,2016,3/28/16,6:25:06,300,Pacific Time (US & Canada),lhiggins,2016-03-31 02:00:58 +0300,2017-12-15 18:06:44 +0300,research,CC-BY,http://www.inaturalist.org/observations/2854539,https://static.inaturalist.org/photos/3256522/medium.jpg?1459378957,1,0,FALSE,3
occurrence,iNaturalist,"Los Angeles County, CA, USA",San Clemente,32.99859627,-118.5528112,15,15,,,FALSE,,,Mexican Tiger Moth,Apantesis proxima,Notarctia proxima,Mexican Tiger Moth,Insecta,321459,Lepidoptera,Erebidae,Erebidae,Apantesis,Notarctia,Apantesis proxima,,21810193,3,2019,3/25/19,15:24:00,300,Pacific Time (US & Canada),cedric_lee,2019-03-31 05:10:12 +0300,2020-04-24 01:45:43 +0300,research,CC-BY-NC,https://www.inaturalist.org/observations/21810193,https://inaturalist-open-data.s3.amazonaws.com/photos/34125312/medium.jpg?1554455345,1,0,FALSE,
occurrence,iNaturalist,"Los Angeles County, CA, USA",San Clemente,32.99604,-118.55226,,,,,FALSE,,,Mexican Tiger Moth,Apantesis proxima,Notarctia proxima,Mexican Tiger Moth,Insecta,321459,Lepidoptera,Erebidae,Erebidae,Apantesis,Notarctia,Apantesis proxima,,35627308,4,2019,4/11/19,2:35:00,300,Pacific Time (US & Canada),stephanomeria,2019-11-13 03:57:57 +0300,2020-04-28 20:02:36 +0300,research,CC-BY-NC,https://www.inaturalist.org/observations/35627308,https://inaturalist-open-data.s3.amazonaws.com/photos/56197734/medium.jpg?1573606256,2,0,FALSE,
occurrence,iNaturalist,"Los Angeles County, CA, USA",San Clemente,32.99851,-118.55289,,,,,FALSE,,,Mexican Tiger Moth,Apantesis proxima,Notarctia proxima,Mexican Tiger Moth,Insecta,321459,Lepidoptera,Erebidae,Erebidae,Apantesis,Notarctia,Apantesis proxima,,35627312,3,2019,3/26/19,2:31:00,300,Pacific Time (US & Canada),stephanomeria,2019-11-13 03:58:01 +0300,2020-12-04 23:10:08 +0300,research,CC-BY-NC,https://www.inaturalist.org/observations/35627312,https://inaturalist-open-data.s3.amazonaws.com/photos/56197870/medium.jpg?1573606441,2,0,FALSE,
occurrence,iNaturalist,"Los Angeles County, US-CA, US",Santa Catalina,33.344125,-118.3215783,6,6,,,FALSE,,,Mexican Tiger Moth,Apantesis proxima,Notarctia proxima,Mexican Tiger Moth,Insecta,321459,Lepidoptera,Erebidae,Erebidae,Apantesis,Notarctia,Apantesis proxima,,10780600,4,2018,4/11/18,17:16:08,300,Pacific Time (US & Canada),jayleen,2018-04-11 22:46:23 +0300,2020-06-03 23:07:51 +0300,research,CC-BY-NC,https://www.inaturalist.org/observations/10780600,https://inaturalist-open-data.s3.amazonaws.com/photos/15083324/medium.jpg?1523477856,1,0,FALSE,3
occurrence,iNaturalist,"Los Angeles, California, United States",Santa Catalina,33.34449667,-118.3265217,,,,,FALSE,,,Mexican Tiger Moth,Apantesis proxima,Notarctia proxima,Mexican Tiger Moth,Insecta,321459,Lepidoptera,Erebidae,Erebidae,Apantesis,Notarctia,Apantesis proxima,,65463800,8,2020,8/26/20,0:36:00,300,Pacific Time (US & Canada),silversea_starsong,2020-11-23 11:54:38 +0300,2020-11-23 12:11:10 +0300,research,CC-BY-NC,https://www.inaturalist.org/observations/65463800,https://inaturalist-open-data.s3.amazonaws.com/photos/105371976/medium.jpeg?1606120808,1,0,FALSE,
occurrence,iNaturalist,"Naval Outlying Field San Nicolas Island, , CA, US",San Nicolas,33.24192964,-119.4660045,44,44,,,FALSE,,,Mexican Tiger Moth,Apantesis proxima,Notarctia proxima,Mexican Tiger Moth,Insecta,321459,Lepidoptera,Erebidae,Erebidae,Apantesis,Notarctia,Apantesis proxima,,20952190,10,2018,10/23/18,20:01:05,300,Pacific Time (US & Canada),jeremiahlucas,2019-03-04 23:50:39 +0300,2019-08-03 05:25:34 +0300,research,CC-BY-NC,https://www.inaturalist.org/observations/20952190,https://inaturalist-open-data.s3.amazonaws.com/photos/32346038/medium.jpg?1551732644,2,0,FALSE,3
occurrence,iNaturalist,"Pacific Ocean, CA, US",San Nicolas,33.27937438,-119.5040955,8866,8866,,,FALSE,,,Mexican Tiger Moth,Apantesis proxima,Notarctia proxima,Mexican Tiger Moth,Insecta,321459,Lepidoptera,Erebidae,Erebidae,Apantesis,Notarctia,Apantesis proxima,,38578955,2,2020,2/11/20,18:08:29,300,Pacific Time (US & Canada),gbentall,2020-02-12 22:41:57 +0300,2020-02-20 07:34:11 +0300,research,CC-BY-NC,https://www.inaturalist.org/observations/38578955,https://inaturalist-open-data.s3.amazonaws.com/photos/61332719/medium.jpg?1581536532,0,0,FALSE,3
occurrence,iNaturalist,"San Clemente Island Underwater Range, , CA, US",San Clemente,32.99641192,-118.5522413,10,10,,,FALSE,,,Mexican Tiger Moth,Apantesis proxima,Notarctia proxima,Mexican Tiger Moth,Insecta,321459,Lepidoptera,Erebidae,Erebidae,Apantesis,Notarctia,Apantesis proxima,,21814375,3,2019,3/31/19,7:03:37,300,Pacific Time (US & Canada),empid,2019-03-31 07:06:28 +0300,2019-04-01 03:49:40 +0300,research,CC-BY-NC,https://www.inaturalist.org/observations/21814375,https://inaturalist-open-data.s3.amazonaws.com/photos/33793021/medium.jpg?1554005191,1,0,FALSE,3
occurrence,iNaturalist,"San Clemente Island Underwater Range, , CA, US",San Clemente,32.99635833,-118.5521783,9,9,,,FALSE,,,Mexican Tiger Moth,Apantesis proxima,Notarctia proxima,Mexican Tiger Moth,Insecta,321459,Lepidoptera,Erebidae,Erebidae,Apantesis,Notarctia,Apantesis proxima,,22492753,4,2019,4/14/19,15:44:43,300,Pacific Time (US & Canada),stephlbartlett,2019-04-15 03:19:55 +0300,2019-05-12 19:19:59 +0300,research,CC-BY-NC,https://www.inaturalist.org/observations/22492753,https://inaturalist-open-data.s3.amazonaws.com/photos/34844946/medium.jpg?1555287597,2,0,FALSE,3
occurrence,iNaturalist,"San Clemente Island Underwater Range, , CA, US",San Clemente,32.99616386,-118.5516002,50,50,,,FALSE,,,Mexican Tiger Moth,Apantesis proxima,Notarctia proxima,Mexican Tiger Moth,Insecta,321459,Lepidoptera,Erebidae,Erebidae,Apantesis,Notarctia,Apantesis proxima,,29637557,7,2019,7/27/19,17:24:37,300,Pacific Time (US & Canada),shrike2,2019-07-27 17:32:06 +0300,2019-07-27 19:50:47 +0300,research,CC-BY-NC-ND,https://www.inaturalist.org/observations/29637557,https://static.inaturalist.org/photos/46263936/medium.jpg?1564237933,2,0,FALSE,3
occurrence,iNaturalist,"San Clemente Island Underwater Range, , CA, US",San Clemente,32.99679167,-118.556725,10,10,,,FALSE,,,Mexican Tiger Moth,Apantesis proxima,Notarctia proxima,Mexican Tiger Moth,Insecta,321459,Lepidoptera,Erebidae,Erebidae,Apantesis,Notarctia,Apantesis proxima,,30335899,8,2019,8/7/19,1:53:21,300,Pacific Time (US & Canada),vireolanius,2019-08-07 01:55:59 +0300,2019-10-26 00:17:17 +0300,research,CC-BY-NC,https://www.inaturalist.org/observations/30335899,https://inaturalist-open-data.s3.amazonaws.com/photos/47388380/medium.jpg?1565132171,1,0,FALSE,3
occurrence,iNaturalist,"San Clemente Island Underwater Range, CA, US",San Clemente,32.99606667,-118.5522383,4,4,,,FALSE,,,Mexican Tiger Moth,Apantesis proxima,Notarctia proxima,Mexican Tiger Moth,Insecta,321459,Lepidoptera,Erebidae,Erebidae,Apantesis,Notarctia,Apantesis proxima,,60236106,9,2020,9/20/20,23:17:26,300,Pacific Time (US & Canada),shrike2,2020-09-20 23:19:57 +0300,2020-09-21 00:23:01 +0300,research,CC-BY-NC-ND,https://www.inaturalist.org/observations/60236106,https://static.inaturalist.org/photos/96298366/medium.jpg?1600633211,1,0,FALSE,3
occurrence,iNaturalist,"San Clemente Island Underwater Range, CA, US",San Clemente,32.99672,-118.5566467,10,10,,,FALSE,,,Mexican Tiger Moth,Apantesis proxima,Notarctia proxima,Mexican Tiger Moth,Insecta,321459,Lepidoptera,Erebidae,Erebidae,Apantesis,Notarctia,Apantesis proxima,,71505508,3,2021,3/18/21,1:28:50,300,Pacific Time (US & Canada),vireolanius,2021-03-18 22:52:14 +0300,2021-03-20 06:22:18 +0300,research,CC-BY-NC,https://www.inaturalist.org/observations/71505508,https://inaturalist-open-data.s3.amazonaws.com/photos/116430901/medium.jpg?1616097150,2,0,FALSE,3
occurrence,iNaturalist,"San Clemente Island Underwater Range, CA, US",San Clemente,32.99712,-118.5561917,165,165,,,FALSE,,,Mexican Tiger Moth,Apantesis proxima,Notarctia proxima,Mexican Tiger Moth,Insecta,321459,Lepidoptera,Erebidae,Erebidae,Apantesis,Notarctia,Apantesis proxima,,78586386,5,2021,5/11/21,23:12:28,300,Pacific Time (US & Canada),vireolanius,2021-05-13 18:50:41 +0300,2021-05-13 19:19:50 +0300,research,CC-BY-NC,https://www.inaturalist.org/observations/78586386,https://inaturalist-open-data.s3.amazonaws.com/photos/128629534/medium.jpg?1620921048,1,0,FALSE,3
occurrence,iNaturalist,"san clemente island, ca",San Clemente,32.996074,-118.552362,34,34,,,FALSE,,manual,Mexican Tiger Moth,Apantesis proxima,Notarctia proxima,Mexican Tiger Moth,Insecta,321459,Lepidoptera,Erebidae,Erebidae,Apantesis,Notarctia,Apantesis proxima,,23128897,4,2019,4/26/19,16:29:05,300,Pacific Time (US & Canada),vireolanius,2019-04-26 16:36:31 +0300,2019-10-26 00:17:50 +0300,research,CC-BY-NC,https://www.inaturalist.org/observations/23128897,https://inaturalist-open-data.s3.amazonaws.com/photos/35853016/medium.jpg?1556285795,2,0,FALSE,3
occurrence,iNaturalist,"San Clemente Island, Los Angeles County, CA, USA",San Clemente,32.99619589,-118.5521666,,,,,FALSE,,,Mexican Tiger Moth,Apantesis proxima,Notarctia proxima,Mexican Tiger Moth,Insecta,321459,Lepidoptera,Erebidae,Erebidae,Apantesis,Notarctia,Apantesis proxima,,33350728,9,2019,9/14/19,23:09:00,300,Pacific Time (US & Canada),thomasabenson,2019-09-25 05:04:18 +0300,2019-10-26 00:17:00 +0300,research,CC-BY-NC,https://www.inaturalist.org/observations/33350728,https://inaturalist-open-data.s3.amazonaws.com/photos/52376628/medium.jpg?1569377007,1,0,FALSE,
occurrence,iNaturalist,"Santa Barbara County, CA, USA",Santa Cruz,34.053418,-119.5609673,195,195,,,FALSE,,,Mexican Tiger Moth,Apantesis proxima,Notarctia proxima,Mexican Tiger Moth,Insecta,321459,Lepidoptera,Erebidae,Erebidae,Apantesis,Notarctia,Apantesis proxima,,13451466,6,2018,6/14/18,21:45:00,300,Pacific Time (US & Canada),dlbowls,2018-06-15 18:12:38 +0300,2018-09-28 23:14:04 +0300,research,CC-BY-NC,https://www.inaturalist.org/observations/13451466,https://inaturalist-open-data.s3.amazonaws.com/photos/19743957/medium.jpg?1529074846,1,0,FALSE,
occurrence,iNaturalist,"Santa Catalina Island, , CA, US",Santa Catalina,33.44494551,-118.4802543,65,65,,,FALSE,,,Mexican Tiger Moth,Apantesis proxima,Notarctia proxima,Mexican Tiger Moth,Insecta,321459,Lepidoptera,Erebidae,Erebidae,Apantesis,Notarctia,Apantesis proxima,,21350651,3,2019,3/18/19,8:48:19,300,Pacific Time (US & Canada),erica49,2019-03-18 08:53:23 +0300,2019-03-18 09:06:06 +0300,research,,https://www.inaturalist.org/observations/21350651,https://static.inaturalist.org/photos/33022118/medium.jpg?1552888406,1,0,FALSE,3
occurrence,iNaturalist,"Santa Catalina Island, , CA, US",Santa Catalina,33.4695597,-118.5324455,19,19,,,FALSE,,,Mexican Tiger Moth,Apantesis proxima,Notarctia proxima,Mexican Tiger Moth,Insecta,321459,Lepidoptera,Erebidae,Erebidae,Apantesis,Notarctia,Apantesis proxima,,32031793,9,2019,9/2/19,0:42:18,300,Pacific Time (US & Canada),michellevanegas,2019-09-03 05:46:24 +0300,2019-12-17 16:45:19 +0300,research,,https://www.inaturalist.org/observations/32031793,https://static.inaturalist.org/photos/50198468/medium.jpg?1567478808,1,0,FALSE,3
occurrence,iNaturalist,"Santa Catalina Island, Avalon, CA, US",Santa Catalina,33.44484,-118.482088,19,19,,,FALSE,,,Mexican Tiger Moth,Apantesis proxima,Notarctia proxima,Mexican Tiger Moth,Insecta,321459,Lepidoptera,Erebidae,Erebidae,Apantesis,Notarctia,Apantesis proxima,,711840,5,2014,5/30/14,21:27:13,400,Pacific Time (US & Canada),msmith218,2014-06-02 06:31:29 +0400,2017-12-15 18:06:27 +0300,research,CC-BY-ND,http://www.inaturalist.org/observations/711840,https://inaturalist-open-data.s3.amazonaws.com/photos/894358/medium.jpg?1401676330,3,0,FALSE,3
occurrence,iNaturalist,"Santa Catalina Island, Avalon, CA, US",Santa Catalina,33.339925,-118.332245,65,65,,,FALSE,,,Mexican Tiger Moth,Apantesis proxima,Notarctia proxima,Mexican Tiger Moth,Insecta,321459,Lepidoptera,Erebidae,Erebidae,Apantesis,Notarctia,Apantesis proxima,,63357853,5,2019,5/19/19,8:35:28,300,Pacific Time (US & Canada),pootishedj,2020-10-24 03:56:11 +0300,2020-10-24 11:01:15 +0300,research,CC-BY-NC,https://www.inaturalist.org/observations/63357853,https://inaturalist-open-data.s3.amazonaws.com/photos/101667196/medium.jpg?1603500976,1,0,FALSE,3
occurrence,iNaturalist,"Santa Catalina Island, CA, US",Santa Catalina,33.39118643,-118.3702827,16,16,,,FALSE,,,Mexican Tiger Moth,Apantesis proxima,Notarctia proxima,Mexican Tiger Moth,Insecta,321459,Lepidoptera,Erebidae,Erebidae,Apantesis,Notarctia,Apantesis proxima,,33051563,9,2019,9/20/19,8:33:25,300,Pacific Time (US & Canada),gloriaharwood,2019-09-20 08:33:53 +0300,2019-12-22 18:50:42 +0300,research,,https://www.inaturalist.org/observations/33051563,https://static.inaturalist.org/photos/51880455/medium.jpg?1568957697,1,0,FALSE,3
occurrence,iNaturalist,"Santa Catalina Island, California 90704, USA",Santa Catalina,33.44479091,-118.4804697,5,5,,,FALSE,,,Mexican Tiger Moth,Apantesis proxima,Notarctia proxima,Mexican Tiger Moth,Insecta,321459,Lepidoptera,Erebidae,Erebidae,Apantesis,Notarctia,Apantesis proxima,,31887887,8,2019,8/31/19,2:44:24,300,Pacific Time (US & Canada),magvero,2019-09-01 04:01:21 +0300,2019-12-22 18:51:01 +0300,research,CC-BY-NC,https://www.inaturalist.org/observations/31887887,https://inaturalist-open-data.s3.amazonaws.com/photos/49955932/medium.jpeg?1567299685,1,0,FALSE,2
occurrence,iNaturalist,"Santa Cruz Island Reserve, Channel Islands, Channel Islands National Park, Santa Barbara, UC Natural Reserve System, California, United States",Santa Cruz,33.99723,-119.725045,,28902,,,FALSE,,,Mexican Tiger Moth,Apantesis proxima,Notarctia proxima,Mexican Tiger Moth,Insecta,321459,Lepidoptera,Erebidae,Erebidae,Apantesis,Notarctia,Apantesis proxima,,1790003,7,2015,7/21/15,8:43:20,300,Pacific Time (US & Canada),kueda,2015-07-22 20:00:54 +0300,2019-04-16 20:35:20 +0300,research,CC0,http://www.inaturalist.org/observations/1790003,https://inaturalist-open-data.s3.amazonaws.com/photos/2167995/medium.jpg?1437584460,1,0,FALSE,
occurrence,iNaturalist,"Unnamed Road, California, USA",San Clemente,32.998474,-118.5528764,44,44,,,FALSE,gps,gps,Mexican Tiger Moth,Apantesis proxima,Notarctia proxima,Mexican Tiger Moth,Insecta,321459,Lepidoptera,Erebidae,Erebidae,Apantesis,Notarctia,Apantesis proxima,,21230527,3,2019,3/1/19,8:08:21,300,Pacific Time (US & Canada),pileated,2019-03-14 18:09:12 +0300,2020-04-23 21:20:43 +0300,research,CC-BY,https://www.inaturalist.org/observations/21230527,https://inaturalist-open-data.s3.amazonaws.com/photos/32820006/medium.jpeg?1552576155,3,0,FALSE,2
occurrence,iNaturalist,"Unnamed Road, California, USA",San Clemente,32.99596152,-118.5521917,11,11,,,FALSE,gps,gps,Mexican Tiger Moth,Apantesis proxima,Notarctia proxima,Mexican Tiger Moth,Insecta,321459,Lepidoptera,Erebidae,Erebidae,Apantesis,Notarctia,Apantesis proxima,,23051385,4,2019,4/18/19,8:12:42,300,Pacific Time (US & Canada),pileated,2019-04-25 17:46:20 +0300,2020-04-23 21:06:52 +0300,research,CC-BY,https://www.inaturalist.org/observations/23051385,https://inaturalist-open-data.s3.amazonaws.com/photos/35737087/medium.jpg?1556203584,1,0,FALSE,2
occurrence,iNaturalist,"Unnamed Road, California, USA",San Clemente,32.99596012,-118.5522347,6,6,,,FALSE,gps,gps,Mexican Tiger Moth,Apantesis proxima,Notarctia proxima,Mexican Tiger Moth,Insecta,321459,Lepidoptera,Erebidae,Erebidae,Apantesis,Notarctia,Apantesis proxima,,25089261,5,2019,5/3/19,7:27:16,300,Pacific Time (US & Canada),pileated,2019-05-14 04:59:59 +0300,2020-04-23 21:06:58 +0300,research,CC-BY,https://www.inaturalist.org/observations/25089261,https://inaturalist-open-data.s3.amazonaws.com/photos/38828572/medium.jpg?1557799201,1,0,FALSE,2
occurrence,iNaturalist,"USC Wrigley Marine Science Center, CA, US",Santa Catalina,33.44493667,-118.4820717,96,96,,,FALSE,,,Mexican Tiger Moth,Apantesis proxima,Notarctia proxima,Mexican Tiger Moth,Insecta,321459,Lepidoptera,Erebidae,Erebidae,Apantesis,Notarctia,Apantesis proxima,,33240403,9,2019,9/23/19,3:25:02,300,Pacific Time (US & Canada),lchilton,2019-09-23 06:33:01 +0300,2019-10-27 19:26:55 +0300,research,CC-BY-NC,https://www.inaturalist.org/observations/33240403,https://inaturalist-open-data.s3.amazonaws.com/photos/52193853/medium.jpg?1569209590,1,0,FALSE,3
occurrence,iNaturalist,"Ventura County, CA, USA",San Nicolas,33.27984,-119.5223583,,,,,FALSE,,,Mexican Tiger Moth,Apantesis proxima,Notarctia proxima,Mexican Tiger Moth,Insecta,321459,Lepidoptera,Erebidae,Erebidae,Apantesis,Notarctia,Apantesis proxima,,19684320,10,2012,10/14/12,0:00:00,400,Mountain Time (US & Canada),tsirtalis,2019-01-17 03:49:32 +0300,2019-01-30 04:05:12 +0300,research,CC-BY-NC-ND,https://www.inaturalist.org/observations/19684320,https://static.inaturalist.org/photos/30318432/medium.jpeg?1547684115,2,0,FALSE,
occurrence,iNaturalist,"Ventura County, CA, USA",San Nicolas,33.25497385,-119.4856597,32,32,,,FALSE,,,Mexican Tiger Moth,Apantesis proxima,Notarctia proxima,Mexican Tiger Moth,Insecta,321459,Lepidoptera,Erebidae,Erebidae,Apantesis,Notarctia,Apantesis proxima,,34270077,7,2019,7/31/19,6:31:00,300,Pacific Time (US & Canada),acurtis,2019-10-13 00:27:28 +0300,2019-10-13 07:38:16 +0300,research,CC-BY-NC,https://www.inaturalist.org/observations/34270077,https://inaturalist-open-data.s3.amazonaws.com/photos/53912007/medium.jpeg?1570915455,1,0,FALSE,
occurrence,iNaturalist,"W End Rd, Avalon, CA, US",Santa Catalina,33.46864648,-118.5319398,24,24,,,FALSE,,,Mexican Tiger Moth,Apantesis proxima,Notarctia proxima,Mexican Tiger Moth,Insecta,321459,Lepidoptera,Erebidae,Erebidae,Apantesis,Notarctia,Apantesis proxima,,3995573,4,2016,4/5/16,17:19:26,300,Pacific Time (US & Canada),emshaph,2016-08-30 19:44:50 +0300,2020-06-03 23:11:41 +0300,research,CC-BY-NC,http://www.inaturalist.org/observations/3995573,https://inaturalist-open-data.s3.amazonaws.com/photos/4718078/medium.jpg?1472575650,3,1,FALSE,3
occurrence,iNaturalist,"Los Angeles County, CA, USA",Santa Catalina,33.4385536,-118.4978616,43,43,,,FALSE,,,Apantesis ursina,Apantesis ursina,Apantesis ursina,,Insecta,606556,Lepidoptera,Erebidae,Erebidae,Apantesis,Apantesis,Apantesis ursina,,34285432,10,2019,10/10/19,22:56:00,300,Pacific Time (US & Canada),kimssight,2019-10-13 06:27:01 +0300,2020-06-03 23:05:28 +0300,needs_id,,https://www.inaturalist.org/observations/34285432,https://static.inaturalist.org/photos/53938842/medium.jpg?1570936637,0,0,FALSE,
occurrence,iNaturalist,", California, United States",Santa Cruz,33.996505,-119.716719,,,,,FALSE,,,Arachnis picta,Arachnis picta,Arachnis picta,Painted Tiger Moth,Insecta,68163,Lepidoptera,Erebidae,Erebidae,Arachnis,Arachnis,Arachnis picta,,38110279,10,2012,10/7/12,4:38:18,400,Pacific Time (US & Canada),alice_abela,2020-01-30 07:20:08 +0300,2020-01-30 07:20:11 +0300,needs_id,,https://www.inaturalist.org/observations/38110279,https://static.inaturalist.org/photos/60522672/medium.jpg?1580358003,0,0,FALSE,
occurrence,iNaturalist,"Ventura County, CA, USA",San Nicolas,33.27984,-119.5223583,,,,,FALSE,,,Painted Tiger Moth,Arachnis picta,Arachnis picta,Painted Tiger Moth,Insecta,68163,Lepidoptera,Erebidae,Erebidae,Arachnis,Arachnis,Arachnis picta,,19684321,10,2012,10/14/12,0:01:00,400,Mountain Time (US & Canada),tsirtalis,2019-01-17 03:49:32 +0300,2019-02-04 21:03:41 +0300,research,CC-BY-NC-ND,https://www.inaturalist.org/observations/19684321,https://static.inaturalist.org/photos/30318414/medium.jpeg?1547684070,1,0,FALSE,
occurrence,iNaturalist,"1 W Banning House Rd, , CA, US",Santa Catalina,33.44155862,-118.4982435,10,10,,,FALSE,,,Tiger Moths and Allies,Arctiinae,,Tiger Moths and Allies,Insecta,47606,Lepidoptera,Erebidae,Erebidae,,,,,21561284,3,2019,3/24/19,20:47:32,300,Pacific Time (US & Canada),ehamblen,2019-03-24 20:48:10 +0300,2019-11-24 21:51:06 +0300,needs_id,CC-BY-NC,https://www.inaturalist.org/observations/21561284,https://inaturalist-open-data.s3.amazonaws.com/photos/33371540/medium.jpg?1553449692,1,0,FALSE,3
occurrence,iNaturalist,"100 Avalon Cyn Rd, Avalon, CA 90704, USA",Santa Catalina,33.32988045,-118.3372396,9,9,,,FALSE,,,Tiger Moths and Allies,Arctiinae,,Tiger Moths and Allies,Insecta,47606,Lepidoptera,Erebidae,Erebidae,,,,,12803034,5,2018,5/25/18,4:36:10,300,Pacific Time (US & Canada),bjdion,2018-05-25 20:15:02 +0300,2020-06-03 23:07:41 +0300,needs_id,CC-BY-NC-SA,https://www.inaturalist.org/observations/12803034,https://inaturalist-open-data.s3.amazonaws.com/photos/18564289/medium.jpeg?1527268508,2,0,FALSE,2
occurrence,iNaturalist,"199 Big Fishermans Cv, Avalon, CA, US",Santa Catalina,33.44478326,-118.4832326,5,5,,,FALSE,,,Tiger Moths and Allies,Arctiinae,,Tiger Moths and Allies,Insecta,47606,Lepidoptera,Erebidae,Erebidae,,,,,5488775,3,2017,3/28/17,18:52:37,300,Pacific Time (US & Canada),seavivs,2017-03-28 18:52:53 +0300,2020-06-03 23:08:13 +0300,needs_id,CC-BY-NC,https://www.inaturalist.org/observations/5488775,https://inaturalist-open-data.s3.amazonaws.com/photos/6761517/medium.jpg?1490716392,3,0,FALSE,3
occurrence,iNaturalist,"Avalon Cayon Rd, Avalon, CA, US",Santa Catalina,33.33055825,-118.3372569,5,5,,,FALSE,,,Tiger Moths and Allies,Arctiinae,,Tiger Moths and Allies,Insecta,47606,Lepidoptera,Erebidae,Erebidae,,,,,24114861,4,2019,4/30/19,5:31:11,300,Pacific Time (US & Canada),parisrebl,2019-04-30 05:36:47 +0300,2020-06-03 23:06:53 +0300,needs_id,CC-BY-NC,https://www.inaturalist.org/observations/24114861,https://inaturalist-open-data.s3.amazonaws.com/photos/37293715/medium.jpg?1556591816,2,0,FALSE,3
occurrence,iNaturalist,"Avalon, Ca",Santa Catalina,33.342819,-118.328228,3273,3273,,,FALSE,,,Butterflies and Moths,Arctiinae,,Tiger Moths and Allies,Insecta,47606,Lepidoptera,Erebidae,Erebidae,,,,,1472738,4,2012,4/29/12,23:08:18,400,Pacific Time (US & Canada),kiloueka,2015-05-10 12:13:06 +0300,2018-11-15 10:03:49 +0300,needs_id,CC-BY-NC,http://www.inaturalist.org/observations/1472738,https://inaturalist-open-data.s3.amazonaws.com/photos/1825844/medium.JPG?1431249199,1,0,FALSE,
occurrence,iNaturalist,"Avalon, CA 90704",Santa Catalina,33.33196025,-118.3237423,2752,2752,,,FALSE,gps,gps,Tiger Moths and Allies,Arctiinae,,Tiger Moths and Allies,Insecta,47606,Lepidoptera,Erebidae,Erebidae,,,,,5139663,2,2017,2/20/17,6:26:30,300,Pacific Time (US & Canada),bjdion,2017-02-20 06:28:24 +0300,2020-06-03 23:11:30 +0300,needs_id,CC-BY-NC-SA,https://www.inaturalist.org/observations/5139663,https://inaturalist-open-data.s3.amazonaws.com/photos/6327870/medium.jpeg?1487561313,1,0,FALSE,2
occurrence,iNaturalist,"Avalon, CA 90704",Santa Catalina,33.35192871,-118.3589325,,,,,FALSE,gps,gps,Tiger Moths and Allies,Arctiinae,,Tiger Moths and Allies,Insecta,47606,Lepidoptera,Erebidae,Erebidae,,,,,5421555,3,2017,3/22/17,3:51:04,300,Pacific Time (US & Canada),bjdion,2017-03-22 03:52:00 +0300,2020-06-03 23:08:15 +0300,needs_id,CC-BY-NC-SA,https://www.inaturalist.org/observations/5421555,https://inaturalist-open-data.s3.amazonaws.com/photos/6666468/medium.jpeg?1490143929,1,0,FALSE,2
occurrence,iNaturalist,"Avalon, CA 90704",Santa Catalina,33.34988015,-118.3601228,2752,2752,,,FALSE,gps,gps,Tiger Moths and Allies,Arctiinae,,Tiger Moths and Allies,Insecta,47606,Lepidoptera,Erebidae,Erebidae,,,,,5513029,3,2017,3/31/17,3:30:56,300,Pacific Time (US & Canada),bjdion,2017-03-31 03:32:23 +0300,2017-10-16 01:56:03 +0300,needs_id,CC-BY-NC-SA,https://www.inaturalist.org/observations/5513029,https://inaturalist-open-data.s3.amazonaws.com/photos/6798407/medium.jpeg?1490920353,1,0,FALSE,2
occurrence,iNaturalist,catalina ISland CA,Santa Catalina,33.367936,-118.47682,318,318,,,FALSE,,,Tiger Moths and Allies,Arctiinae,,Tiger Moths and Allies,Insecta,47606,Lepidoptera,Erebidae,Erebidae,,,,,1635829,4,2010,4/23/10,1:17:26,400,Central Time (US & Canada),shaunmichael,2015-06-15 21:56:19 +0300,2021-07-07 01:46:27 +0300,needs_id,CC-BY-NC,http://www.inaturalist.org/observations/1635829,https://static.inaturalist.org/photos/2006560/medium.jpg?1434394609,2,0,FALSE,
occurrence,iNaturalist,"Channel Islands National Park, CA, US",Santa Barbara,33.47928667,-119.0285112,5,5,,,FALSE,,,,Arctiinae,,Tiger Moths and Allies,Insecta,47606,Lepidoptera,Erebidae,Erebidae,,,,,69650379,2,2021,2/16/21,2:43:35,300,Pacific Time (US & Canada),serpophaga,2021-02-16 05:24:55 +0300,2021-02-16 05:25:58 +0300,needs_id,CC-BY-NC,https://www.inaturalist.org/observations/69650379,https://inaturalist-open-data.s3.amazonaws.com/photos/113060508/medium.jpg?1613442355,0,0,FALSE,3
occurrence,iNaturalist,"Channel Islands National Park, Channel Islands National Pk, CA, US",Santa Rosa,34.01323263,-120.0971259,373,373,,,FALSE,,,Butterflies and Moths,Arctiinae,,Tiger Moths and Allies,Insecta,47606,Lepidoptera,Erebidae,Erebidae,,,,,3144338,5,2016,5/7/16,19:51:44,300,Pacific Time (US & Canada),faerthen,2016-05-11 01:39:52 +0300,2018-11-15 10:05:31 +0300,needs_id,CC-BY-NC,http://www.inaturalist.org/observations/3144338,https://inaturalist-open-data.s3.amazonaws.com/photos/3636078/medium.jpg?1462919997,1,0,FALSE,3
occurrence,iNaturalist,"Channel Islands National Park, Channel Islands National Pk, CA, US",Santa Rosa,33.98015023,-120.0496101,9826,9826,,,FALSE,,,Tiger Moths and Allies,Arctiinae,,Tiger Moths and Allies,Insecta,47606,Lepidoptera,Erebidae,Erebidae,,,,,5604551,4,2017,4/4/17,1:25:19,300,Pacific Time (US & Canada),songforthesoil,2017-04-08 01:31:34 +0300,2018-09-20 04:09:48 +0300,needs_id,CC-BY-NC,https://www.inaturalist.org/observations/5604551,https://inaturalist-open-data.s3.amazonaws.com/photos/6925381/medium.jpg?1491604308,1,0,FALSE,3
occurrence,iNaturalist,"Channel Islands National Park, Channel Islands, Santa Barbara, California, United States",Santa Rosa,33.98710167,-120.031225,,,,,FALSE,,,Tiger Moths and Allies,Arctiinae,,Tiger Moths and Allies,Insecta,47606,Lepidoptera,Erebidae,Erebidae,,,,,25271497,5,2019,5/11/19,16:25:00,300,Pacific Time (US & Canada),silversea_starsong,2019-05-17 21:02:47 +0300,2019-05-17 21:02:47 +0300,needs_id,CC-BY-NC,https://www.inaturalist.org/observations/25271497,https://inaturalist-open-data.s3.amazonaws.com/photos/39119350/medium.jpeg?1558111905,0,0,FALSE,
occurrence,iNaturalist,"Channel Islands National Park, Channel Islands, Santa Barbara, California, United States",Santa Rosa,34.01368667,-120.0538167,,,,,FALSE,,,Tiger Moths and Allies,Arctiinae,,Tiger Moths and Allies,Insecta,47606,Lepidoptera,Erebidae,Erebidae,,,,,25354905,5,2019,5/12/19,4:54:00,300,Pacific Time (US & Canada),silversea_starsong,2019-05-19 04:00:19 +0300,2019-05-20 05:02:11 +0300,needs_id,CC-BY-NC,https://www.inaturalist.org/observations/25354905,https://inaturalist-open-data.s3.amazonaws.com/photos/39256146/medium.jpeg?1558225894,1,0,FALSE,
occurrence,iNaturalist,"Los Angeles County, CA, USA",Santa Catalina,33.44159304,-118.4944153,977,977,,,FALSE,,,Tiger Moths and Allies,Arctiinae,,Tiger Moths and Allies,Insecta,47606,Lepidoptera,Erebidae,Erebidae,,,,,3803707,7,2016,7/31/16,16:10:00,300,Pacific Time (US & Canada),yetikat,2016-08-04 22:33:21 +0300,2020-06-03 23:11:46 +0300,needs_id,CC-BY-NC,http://www.inaturalist.org/observations/3803707,https://inaturalist-open-data.s3.amazonaws.com/photos/4442832/medium.jpeg?1470334695,0,0,FALSE,
occurrence,iNaturalist,"Los Angeles County, US-CA, US",San Clemente,32.9958873,-118.5537211,5,5,,,FALSE,,,Tiger Moths and Allies,Arctiinae,,Tiger Moths and Allies,Insecta,47606,Lepidoptera,Erebidae,Erebidae,,,,,5720963,4,2017,4/15/17,18:07:02,300,Pacific Time (US & Canada),vireolanius,2017-04-15 18:26:00 +0300,2018-03-17 20:34:13 +0300,needs_id,CC-BY-NC,https://www.inaturalist.org/observations/5720963,https://inaturalist-open-data.s3.amazonaws.com/photos/7094577/medium.jpg?1492269984,2,0,FALSE,3
occurrence,iNaturalist,"Los Angeles County, US-CA, US",Santa Catalina,33.441445,-118.4981383,5005,5005,,,FALSE,,,Tiger Moths and Allies,Arctiinae,,Tiger Moths and Allies,Insecta,47606,Lepidoptera,Erebidae,Erebidae,,,,,21266067,3,2019,3/12/19,21:56:28,300,Pacific Time (US & Canada),cnicholson12,2019-03-15 23:23:12 +0300,2019-11-24 20:58:21 +0300,needs_id,,https://www.inaturalist.org/observations/21266067,https://static.inaturalist.org/photos/34367376/medium.jpg?1554738389,1,0,FALSE,3
occurrence,iNaturalist,"Los Angeles, California, United States",San Clemente,32.99510833,-118.5575483,,,,,FALSE,,,Tiger Moths and Allies,Arctiinae,,Tiger Moths and Allies,Insecta,47606,Lepidoptera,Erebidae,Erebidae,,,,,38194342,1,2020,1/30/20,7:22:00,300,Pacific Time (US & Canada),cedric_lee,2020-02-02 00:33:19 +0300,2020-02-05 01:51:31 +0300,needs_id,CC-BY-NC,https://www.inaturalist.org/observations/38194342,https://inaturalist-open-data.s3.amazonaws.com/photos/60661584/medium.jpeg?1580588264,0,0,FALSE,
occurrence,iNaturalist,"Los Angeles, California, United States",San Clemente,32.82585278,-118.3603444,5,5,,,FALSE,,,Tiger Moths and Allies,Arctiinae,,Tiger Moths and Allies,Insecta,47606,Lepidoptera,Erebidae,Erebidae,,,,,41736404,6,2019,6/20/19,20:00:00,300,Pacific Time (US & Canada),serpophaga,2020-04-09 05:50:32 +0300,2020-04-25 06:59:43 +0300,needs_id,CC-BY-NC,https://www.inaturalist.org/observations/41736404,https://inaturalist-open-data.s3.amazonaws.com/photos/66215647/medium.jpeg?1586400102,2,0,FALSE,
occurrence,iNaturalist,"Malo Canyon, San Clemente Island, California",San Clemente,32.859525,-118.406986,55,55,,,FALSE,,,Tiger Moths and Allies,Arctiinae,,Tiger Moths and Allies,Insecta,47606,Lepidoptera,Erebidae,Erebidae,,,,,2933419,,,,,,Pacific Time (US & Canada),vireolanius,2016-04-14 19:46:09 +0300,2017-05-02 21:44:25 +0300,needs_id,CC-BY-NC,http://www.inaturalist.org/observations/2933419,https://inaturalist-open-data.s3.amazonaws.com/photos/3361914/medium.JPG?1460652373,0,0,FALSE,
occurrence,iNaturalist,"Middle Ranch Rd, Avalon, CA 90704, USA",Santa Catalina,33.35595271,-118.4453561,4,4,,,FALSE,,,Tiger Moths and Allies,Arctiinae,,Tiger Moths and Allies,Insecta,47606,Lepidoptera,Erebidae,Erebidae,,,,,25073065,5,2019,5/13/19,22:49:19,300,Pacific Time (US & Canada),ljbrenner,2019-05-13 22:50:54 +0300,2020-06-03 23:06:12 +0300,needs_id,CC-BY-NC,https://www.inaturalist.org/observations/25073065,https://inaturalist-open-data.s3.amazonaws.com/photos/38801498/medium.jpeg?1557777061,0,0,FALSE,2
occurrence,iNaturalist,"San Clemente Island Underwater Range, , CA, US",San Clemente,32.91623667,-118.4860217,5,5,,,FALSE,,,Tiger Moths and Allies,Arctiinae,,Tiger Moths and Allies,Insecta,47606,Lepidoptera,Erebidae,Erebidae,,,,,21298369,3,2019,3/8/19,19:00:15,300,Pacific Time (US & Canada),autumnturnip,2019-03-17 00:52:36 +0300,2019-03-27 07:24:24 +0300,needs_id,,https://www.inaturalist.org/observations/21298369,https://static.inaturalist.org/photos/32934229/medium.jpg?1552773166,2,0,FALSE,3
occurrence,iNaturalist,"San Clemente Island Underwater Range, , CA, US",San Clemente,32.882555,-118.450255,10,10,,,FALSE,,,Tiger Moths and Allies,Arctiinae,,Tiger Moths and Allies,Insecta,47606,Lepidoptera,Erebidae,Erebidae,,,,,21408592,3,2019,3/20/19,1:24:33,300,Pacific Time (US & Canada),sulavanderplank,2019-03-20 05:53:39 +0300,2019-03-22 19:21:46 +0300,needs_id,CC-BY,https://www.inaturalist.org/observations/21408592,https://static.inaturalist.org/photos/33120069/medium.jpg?1553050439,1,0,FALSE,3
occurrence,iNaturalist,"San Clemente Island Underwater Range, , CA, US",San Clemente,32.86555302,-118.4556989,5,5,,,FALSE,,,Tiger Moths and Allies,Arctiinae,,Tiger Moths and Allies,Insecta,47606,Lepidoptera,Erebidae,Erebidae,,,,,21814576,3,2019,3/29/19,23:18:01,300,Pacific Time (US & Canada),empid,2019-03-31 07:12:38 +0300,2019-04-02 06:32:07 +0300,needs_id,CC-BY-NC,https://www.inaturalist.org/observations/21814576,https://inaturalist-open-data.s3.amazonaws.com/photos/33793449/medium.jpg?1554005560,1,0,FALSE,3
occurrence,iNaturalist,"San Clemente Island Underwater Range, , CA, US",San Clemente,32.860225,-118.461205,2644,2644,,,FALSE,,,,Arctiinae,,Tiger Moths and Allies,Insecta,47606,Lepidoptera,Erebidae,Erebidae,,,,,23222170,4,2019,4/26/19,20:45:12,300,Pacific Time (US & Canada),stephlbartlett,2019-04-27 00:03:22 +0300,2019-04-27 00:03:34 +0300,needs_id,CC-BY-NC,https://www.inaturalist.org/observations/23222170,https://inaturalist-open-data.s3.amazonaws.com/photos/35983390/medium.jpg?1556312608,0,0,FALSE,3
